Review Title,Negative Reviews,Positive Reviews,Rating,Stay Date,Review Date,Room Type,Number of Nights,Traveler Type,Overall Average Rating,Room amenities - positive,Room amenities - negative,Hotel amenities - positive,Hotel amenities - negative,Staff - positive,Staff - negative,Food and beverages - positive,Food and beverages - negative,Location - positive,Location - negative,PageRank Score
"Excellent price for a tiny, clean room in a friendly central hotel opposite Kings Cross Station.",Damaged shower room door.,"Excellent location, friendly, helpful staff, very clean room, very reasonable price for a central London room.
Bed linen was very clean and the window opened to let fresh air into the room.",7.0,November 2023,"November 23, 2023",Single Room,1,Solo traveler,5.9,1,1,0,0,1,0,0,0,1,0,0.001142284329777617
I wouldn't stay here for a long stay. It is necessities only.,"The room was tiny, with some many tiny rooms crammed in, the walls were paper thin so I could hear the person over the corridor in their room and also the person next door. The shower was too small for me and there was a huge hole in the floor sort of under the bed. The bed was also tiny and when you opened the bathroom door, it was so tight the door opened and hit the bed.",It was in a really good location. A stones throw away from Kings Cross. The rooms were clean and the staff were polite.,5.0,March 2023,"April 8, 2023",Double Room,2,Family,5.9,1,1,0,0,1,0,0,0,1,0,0.001142284329777617
My single room was tiny but it served its purpose.,Bad smell in shower,"Convenient location, staff was nice, room cleaned everyday",5.0,December 2023,"December 27, 2023",Double Room,4,Family,5.9,1,1,0,0,1,0,0,0,1,0,0.001142284329777617
2nd time and still great value hotel,Nothing. We knew what to expect and we got it. We had the same room as last time and was great.,2nd time we stayed here. We love the location. Ideal if you come with the eurostar and you arrive late or leave early. It is on 1 zone so  you can walk everywhere or using the tube you are in  few minutes in piccadilly. The hotel is old-fashion but very clean and the staff is very friendly. It feels home to us. Price is ideal for us which travel on budget.,10.0,January 2024,"January 6, 2024",Double Room with Shared Bathroom,7,Family,5.9,1,1,0,0,1,0,0,0,1,0,0.001142284329777617
"Basic but clean, and really lovely staff!",Some of the stairs on the way up to the room were slightly uneven and creaky. It didn't negatively impact our stay but it made me cautious of disturbing other guests while going to and from the room.,"First and foremost, the location is incredible! Which made the already reasonable price even better! My mum was nervous of going down the stairs from reception to our initial room (where the staircase wasn't as well lit as the room upstairs) and the staff immediately and without any hassle allowed us to switch to a room upstairs which was more manageable. All the staff were incredibly friendly and helpful. The room was basic and but very clean.",10.0,December 2022,"December 11, 2022",Twin Room with Shared Bathroom,2,Family,5.9,1,1,0,0,1,0,0,0,1,0,0.001142284329777617
"Bare bones room but if you are only looking for a place to shower and sleep, this is good.","The stairs!!! Also, do not opt for rooms with a shared external bathroom. Its a mess and too many people sharing and cleanliness is iffy (covid). These rooms are on the 4th floor and its all stairs if you have heavy bags.",The location and the staff were excellent. I booked months in advance so I got a good rate. Good hot showers! Staff will let you leave your bags there with no problem.,5.0,July 2022,"July 23, 2022",Twin Room with Shared Bathroom,4,Family,5.9,1,1,0,0,1,0,0,0,1,0,0.001142284329777617
The hotel was comfortable as it was in a central location and very close to the underground and train station. Regardles,"The rooms were very small. This was the third time I stayed in this hotel, previously having had a room for two people as well. This is the smallest the room has ever been. In one particular room the bathroom door opened into the bed leaving literally no room to walk around. Since we only used the room at the end of the day to sleep for the night, this didn’t prove to be a problem but it could be an issue for anyone needing a bedroom to use for the majority of the day. 

The room I had in also had a particular issue with the bathroom light. The light worked with a sensor that would turn on when it feels your presence in the room. The problem was that the sensor did not sense us when in the shower so we’d end up using the shower in the dark or having to continuously move our hand out of the shower to wave for the light to turn back on.",The hotel is less than 2 minutes walk away from the entrance to the king’s cross underground station so the location was optimal for easy traveling around central London. The staff were very welcoming and accommodating (they provided 2 extra pillows when requested). The rooms/bathroom were clean.,8.0,December 2023,"December 13, 2023",Double Room,5,Group,5.9,1,1,0,0,1,0,0,0,1,0,0.001142284329777617
Good value for money for a short stay with super nice staff!,"We were put in one of the downstairs rooms and there was constantly a smell of cigarettes. At night, it can be a little bit noisy.",The staff were super friendly and helped us out as much as possible. It was also a convenient location. The bathroom and room were clean.,7.0,May 2024,"May 23, 2024",Double Room,2,Family,5.9,1,1,0,0,1,0,0,0,1,0,0.001142284329777617
Wonderful,"No lift with narrow stairs, and bed divided in 2 (uncomfortable for couples)",Good location. Clean and nice staff,9.0,January 2024,"February 6, 2024",Double Room,2,Couple,5.9,1,1,0,0,1,0,0,0,1,0,0.001142284329777617
Good hotel for a city trip,"Room, and in-room bathroom were a bit small, which is to be expected at the price range. As a tall person, the bathroom was almost too small though. Directly in front of my window was a quite loud heater/air conditioning system, which for people with light sleep may be an issue. The buzzer at the front door makes an electric sound that was still quite loud in my room.","The room was cozy, and the staff was really nice. The location was amazing, with Kings Cross St Pancras entrance right at the front giving you a quick route to all major sight-seeing locations via the tube and bus. For the price the hotel was decent, but it depends on what you are expecting. My room was about 5 sqm bathroom not included, enough for the single bed, a small closet and a make-shift desk on top of the radiator. Bathroom was about 2-3 sqm, enough for toilet, sink and small shower. The room and bathroom was serviced everyday, and was clean. As a budget city-trip, this is a good place to stay.",7.0,October 2023,"November 2, 2023",Single Room,4,Solo traveler,5.9,1,1,0,0,1,0,0,0,1,0,0.001142284329777617
Pleasant,"Rooms are very utilitarian and small (especially the shower).  You wouldn't want to book here if you planned to spend a lot of time in your hotel, but as a place to sleep, store luggage and take a shower in central London, its great.",The location is excellent for London and the staff were very helpful.  Beds were comfortable and plenty of hot water and water pressure in the shower.,6.0,September 2022,"September 29, 2022",Quadruple Room,2,Family,5.9,1,1,0,0,1,0,0,0,1,0,0.001142284329777617
An affordable crash-pad convenient to King's Cross.,Very small. The shower is tiny and the tiles and grout were in poor repair.,"The staff were friendly and accommodating. It was reasonably clean, and located very close to King's Cross Station. Great price for this location and this time of year.",7.0,July 2023,"July 8, 2023",Single Room,1,Solo traveler,5.9,1,1,0,0,1,0,0,0,1,0,0.001142284329777617
Great location and good pied-a-terre for a short trip to London.,"Very small, bad smell in bathroom, thin walls - could hear flushing in other rooms","Location, staff, room cleaned daily",5.0,December 2023,"December 28, 2023",Single Room,4,Family,5.9,1,1,0,0,1,0,0,0,1,0,0.001142284329777617
Fair,"Very small amount of hangers And cupboards. The room Is small, never mind but there Is  almost no place where tu put the small things like mobiles, books, deodorants etc. Even in the bathroom. That Is the ONLY thing that was annoying.","The Location And Staff was super, thé Hotel Is Simple but clean and tidy",5.0,July 2023,"July 11, 2023",Triple Room,4,Family,5.9,1,1,0,0,1,0,0,0,1,0,0.001142284329777617
"Pleasant, but could do with some attention to make it more comfortable.",Curtains could be longer and lined to keep out the sunlight and insulate the room. Net curtains would provide privacy when the curtains were open. The plug hole in the shower could do with some attention to make it look more hygienic eg filler.,"Excellent location and transport links eg buses. Off the main road. I liked that there was 24 hour shift cover. Staff very friendly and helpful. Nice, thick, white towels. A fan in the room, if needed. Room quiet and cool.",7.0,June 2024,"July 21, 2024",Twin Room,2,Family,5.9,1,1,0,0,1,0,0,0,1,0,0.001142284329777617
"attended an event so just needed a bed for one night, close to Kings X. great location. Lovely ladies on reception. clea","Bathroom quite dated, but everything worked.","Extremely lovely and helpful ladies on reception.
Room was clean, and quiet. 
location couldn’t be better - literally 100 yards from Kings Cross / St. Pancras…",8.0,April 2023,"April 21, 2023",Single Room,1,Solo traveler,5.9,1,1,0,0,1,0,0,0,1,0,0.001142284329777617
"great location, comfy beds, clean. my room was quite small for 3 persons",room was small and with too many doors that cannot be open simultaneously,"location, staff and beds are the best of this property",8.0,June 2024,"July 1, 2024",Triple Room,2,Group,5.9,1,1,0,0,1,0,0,0,1,0,0.001142284329777617
Handy stopover near to stations.,Stairs down to room weren't well lit until already part way down. Window was difficult to open and couldn't secure it part way down for security. Needed it open as room was hot,Location opposite St Pancras was perfect. Price was good. Ideal for one night  Very helpful staff member in evening helped us to alter the room temperature,7.0,March 2022,"March 26, 2022",Double Room,1,Couple,5.9,1,1,0,0,1,0,0,0,1,0,0.001142284329777617
It was a lovely stay and will definitely be staying at this hotel again when I’m next in London.,The bathroom was very small - the shower didn’t offer a lot of room for movement and everything was squeezed into a very small room. There are only stairs in this property - we were on the second floor so it wasn’t that big of a problem but be mindful if you’ll be having a lot of luggage.,The location is superb - only a 2 minute walk away from King’s Cross/St Pancras which means you’re well connected to all of London. The staff were all lovely and very friendly and the bed was super comfortable!,8.0,December 2022,"December 17, 2022",Double Room,5,Group,5.9,1,1,0,0,1,0,0,0,1,0,0.001142284329777617
Adequate to crash for one night after a gig,"No bathroom mat.
Windows were very stiff - only managed to crack them open slightly to allow for some airflow.
Room was very small and very hot in the summer heat which made for a rather uncomfortable stay.","Great location - only a 5 minute walk from St Pancras station and another 5 minutes or so from the venue I attended.
Friendly staff - check in/out was quick and painless.
No temperamental keycard - provided with a key instead.
Room very quick to find.",5.0,August 2022,"August 17, 2022",Single Room,1,Solo traveler,5.9,1,1,0,0,1,0,0,0,1,0,0.001142284329777617
"Honest, basic and well located for a relatively inexpensive stay for a couple of nights.","Very basic, room in the basement, quite hot and stuffy. A few details of light concern, the apparent lack of security from the outside, though I could be wrong.","Was probably a good deal considering the location, and due to the out of the way situation of our basement room it was fairly quiet except for some continuous pump or fan noise. 
Quite clean, beds very comfortable, friendly staff, 30 seconds from the Kings cross underground very handy.

Would consider staying again but ask for an upstairs room.",7.0,July 2023,"July 21, 2023",Twin Room,2,Family,5.9,1,1,0,0,1,0,0,0,1,0,0.001142284329777617
Good budget option,Bed not that comfy but totally managable,Location really handy for kings cross and getting about london. Room very basic but had everything we needed. Reception staff were friendly.,7.0,August 2024,"August 13, 2024",Double Room,4,Couple,5.9,1,1,0,0,1,0,0,0,1,0,0.001142284329777617
Fair,Hair in the shower and worn bedding. Electricity was off for part of the night with no lights in the toilet,Lovely and friendly staff and easy check in. Great location and a goof price for central london for onsuite room,5.0,December 2021,"December 20, 2021",Double Room,1,Group,5.9,1,1,0,0,1,0,0,0,1,0,0.001142284329777617
Small but clean,Room extremely small with limited storage.  Bathroom so small there was not even room to put up a toilet roll holder!,"Room clean and maid service every day.  Bed comfortable and shower good.
Easy access to central London within 10 minutes via picadilly line which was yards away.",7.0,April 2024,"April 15, 2024",Single Room,4,Solo traveler,5.9,1,1,0,0,1,0,0,0,1,0,0.001142284329777617
Good,The place needs a major renovation. There was a bad smell in the bathroom. Plenty of white stains on the red curtains. Cardboard thin doors.,Friendly staff. Clean bedsheets. Great location.,7.0,May 2023,"May 28, 2023",Single Room,1,Solo traveler,5.9,1,1,0,0,1,0,0,0,1,0,0.001142284329777617
"Reasonable for its price, at a great location. But don’t expect nothing crazy.","Had to walk through some narrow stairways to get to the room. Felt like a maze in a dungeon. 

Toilets and showers are shared, but feels rather outdated.","As long as you’re nice, staff will be too. We even got an early check in. 

Location is conveniently situated by Kings Cross Station. 

Price was cheap and rooms were quiet. 

Perfect for a one night sleep during a layover or if you intend on leaving at St Pancras Int.",5.0,July 2024,"July 29, 2024",Twin Room with Shared Bathroom,1,Couple,5.9,1,1,0,0,1,0,0,0,1,0,0.001142284329777617
basic but great location for tube,our room was in the basement the stairs leading down were dangerous no light until half way down and no hand rail,location was great staff were friendly and room was ready early,7.0,April 2023,"April 24, 2023",Double Room,2,Couple,5.9,1,1,0,0,1,0,0,0,1,0,0.001142284329777617
"another great stay at this great hotel, lovely staff and clean affordable rooms in amazing location","decor is a bit tired, doesnt bother me at all (and room rates reflect this), but others might be bothered","friendly helpful staff, brilliant location, clean safe accommodation highly recommended",9.0,May 2023,"May 17, 2023",Triple Room,1,Solo traveler,5.9,1,1,0,0,1,0,0,0,1,0,0.001142284329777617
great value for the location and everything you need,small bathroom. thin walls.,very good location. clean and convenient.,7.0,April 2023,"May 1, 2023",Double Room,1,Solo traveler,5.9,1,1,0,0,0,0,0,0,1,0,0.00112858766221151
Good,"Very basic room, no desk/table.",Very good value for money given excellent location right by Kings Cross/St Pancras. Reasonably clean and comfortable,7.0,April 2023,"April 20, 2023",Double Room with Shared Bathroom,1,Solo traveler,5.9,1,1,0,0,0,0,0,0,1,0,0.00112858766221151
"low budget, don’t expect anything fancy.   was a very basic room but kept clean.  we only slept there, didn’t plan (or w",shared bathroom.  there wasn’t toilet paper and the toilet was always left “messy”.  washrooms did not smell good.,"location.  easy to find, safe street, close to train.  room was clean",6.0,October 2022,"November 22, 2022",Twin Room with Shared Bathroom,2,Family,5.9,1,1,0,0,0,0,0,0,1,0,0.00112858766221151
Good location for St Pancras,"Double bed was very small indeed, not suitable for a tall or even average sized couple. I'd call it a large single rather than a double. Not accessible. Also, rather thin walls and the area and other residents were quite noisy, ear plugs recommended.","Good location for getting the Eurostar, across the road and a 5 minute walk. Cheap for the area. Clean with private bathroom. Mattress, though very small, was comfortable.",5.0,April 2023,"May 1, 2023",Double Room,1,Couple,5.9,1,1,0,0,0,0,0,0,1,0,0.00112858766221151
great location and friendly staff,very small bathroom,location to train station and tube was great -  the not great point was the very small bathroom,6.0,July 2022,"July 4, 2022",Single Room,6,Group,5.9,1,1,0,0,0,0,0,0,1,0,0.00112858766221151
"Fine for 1 night, nothing more","Lukewarm shower
Noisy from the road (its single paned windows)
No deadbolt on inside of the door
No hairdryer","24 hour check in - simple and quick
Clean ensuite room 
Comfortable bed
Easy location",5.0,February 2024,"February 29, 2024",Double Room,1,Solo traveler,5.9,1,1,0,0,0,0,0,0,1,0,0.00112858766221151
adequate for what I paid. excellent location. Staff were very helpful and friendly,"toilet could have been modernised and better finished, ditto shower.","great location, clean room but toilet in a poor state (old, a bit ""bodged"", appeared not looked after) Shower was there, but looked too small to be comfortable or bother using.",5.0,April 2022,"May 23, 2022",Single Room,1,Solo traveler,5.9,1,1,0,0,0,0,0,0,1,0,0.00112858766221151
"Excellent value for money for the location. If you just need a place to sleep in this location, would recommend",Rooms were tiny but for the price I don’t think you can expect much more. The double was smaller than a standard double and more like a 3/4 sized double. Comfortable still.,"The location is excellent, we were travelling from St Pancras Intl the next day and I don’t think you could get any closer! It was very clean.",7.0,April 2024,"May 6, 2024",Double Room,1,Family,5.9,1,1,0,0,0,0,0,0,1,0,0.00112858766221151
Good if the windows are not in the courtyard,"It is very difficult to fall asleep in a room with windows overlooking the courtyard, because the ventilation is noisy all day long.","Great location and very clean rooms, towels. 
Coffee, tea, milk, a kettle, cups, teaspoon in a room.",7.0,August 2023,"August 26, 2023",Twin Room,2,Family,5.9,1,1,0,0,0,0,0,0,1,0,0.00112858766221151
"Incredibly pleasant, would stay again","- It was incredibly loud outside during the night BUT I understand that this isn’t the fault of the hotel 
- No plug for the sink so was difficult to wash my face 
- Bed was a little squeaky but this didn’t disturb my sleep at all","- The location was absolutely perfect, so central and close to Kings Cross 
- My room was ready for me at 11am so was able to check in early 
- Had everything I need in the room: cupboard with hangers, TV, sink with mirror and soap, desk/vanity, small light, small table. 
- Toilet and shower were right next to the room 
- Nice and clean
- Bedsheets and pillows were just the right thickness",9.0,May 2024,"June 16, 2024",Single Room with Shared Bathroom,1,Solo traveler,5.9,1,1,0,0,0,0,0,0,1,0,0.00112858766221151
"Veey nasic, but gave a good night sleep, in great location at reasonable price.","Smellof smoke in entrance
Bathroom tiny and only partitioned off bedroom","Comfortable bed
Great location",6.0,May 2022,"May 12, 2022",Quadruple Room,1,Group,5.9,1,1,0,0,0,0,0,0,1,0,0.00112858766221151
You're paying for a clean hotel in a perfect location. Don't expect more than that.,"No frills, tiny room, separate shower rooms and tired decor.","Location is great, room comfortable. 24hr front desk.",7.0,November 2022,"November 27, 2022",Single Room with Shared Bathroom,1,Solo traveler,5.9,1,1,0,0,0,0,0,0,1,0,0.00112858766221151
"Great location, ok facilities","The bed was kind of hard, and the shower was pretty small, but both were ok. Between other people coming up the stairs and London right outside the window, it was a bit loud, but sound isolation between the rooms seemed good.","The location is unbeatable - it's a few meters from an entrance to St. Pancreas that runs below a busy road. The room included a shower, towel, bed, kettle, etc. It's ideal for catching an early train.",7.0,February 2024,"February 7, 2024",Single Room,1,Solo traveler,5.9,1,1,0,0,0,0,0,0,1,0,0.00112858766221151
decent place to stay for those on a budget,room a little hot but opened the window,"there are some pretty scathing reviews about this place and it’s absolutely fine for the price

good location - nice to have my own bathroom for the price",6.0,February 2022,"February 16, 2022",Single Room,1,Solo traveler,5.9,1,1,0,0,0,0,0,0,1,0,0.00112858766221151
Perfect location - ok rooms,Shower was very small. They should provide more hooks or shelves to put your clothing on.,"Perfect location. Small room but the room was clean, so I don't get all the bad reviews.",8.0,June 2024,"June 13, 2024",Single Room with Shared Bathroom,2,Solo traveler,5.9,1,1,0,0,0,0,0,0,1,0,0.00112858766221151
Loved it.,Lots of stairs. No outlet in the bathroom.,Location and price are fantastic. Room was good.,8.0,April 2024,"April 28, 2024",Triple Room,7,Group,5.9,1,1,0,0,0,0,0,0,1,0,0.00112858766221151
Pleasant,"Uncomfortable bed. 
Poor shower pressure","Location 
Room was a comfortable temperature. 
Bedding was clean.",6.0,March 2022,"March 15, 2022",Double Room,2,Couple,5.9,1,1,0,0,0,0,0,0,1,0,0.00112858766221151
it served its purpose as the location was very convenient.,the communal shower and toilet wasn’t great.,the location was perfect and the bed was comfortable.,7.0,July 2023,"July 22, 2023",Single Room with Shared Bathroom,1,Solo traveler,5.9,1,1,0,0,0,0,0,0,1,0,0.00112858766221151
OK for a one night stopover,The twin bedroom found after following the assistant down a labyrinth of narrow corridors was tiny just about fitting the two beds and a sink. The bathroom was not clean. The whole place needs renovation.,The location was excellent so close to Kings Cross station. Bed linen was clean and bed comfortable. Price low compared to other hotels in the area.,6.0,July 2023,"July 22, 2023",Twin Room with Shared Bathroom,1,Family,5.9,1,1,0,0,0,0,0,0,1,0,0.00112858766221151
"For what we need the room for it was fine, just a few hours to get our heads down.","Our room was lower level, that was ok unless you had large cases etc, door only secured by. Night latch, could do with a freshen up in the corridors.","Location was excellent, we were only in the room for a few hours as had an early departure from King’s Cross station. It was warm in the room. Beds were basic but comfortable, if we were staying longer then a bigger room would of been more suitable but for us it was fine.",5.0,January 2023,"January 29, 2023",Twin Room,1,Family,5.9,1,1,0,0,0,0,0,0,1,0,0.00112858766221151
I really enjoyed my stay at the Belgrove Hotel. The location was what made the stay so much better.,"The rooms are nothing special, of average/poor quality, but all in all it was a good stay.","The location was what made my vacations so much better. I stayed in a room without a bathroom, but we were staying right next door, which was no problem for us.",7.0,March 2024,"March 11, 2024",Twin Room with Shared Bathroom,3,Couple,5.9,1,1,0,0,0,0,0,0,1,0,0.00112858766221151
Fair,"It needs better cleaning, I work in a hotel and if I left the bathroom so stained they would make me clean it again
and the number of doors between hallways is worrying, especially since they only open in one direction.","The location, it was near to the train station and other place to see and eat. 
The room had everything essential and the best thing is that I didn't have to share it with anyone.",5.0,March 2024,"March 16, 2024",Single Room with Shared Bathroom,3,Solo traveler,5.9,1,1,0,0,0,0,0,0,1,0,0.00112858766221151
Value for the money if you only need a place to sleep.,Room was very small and a bit noisy.,Location is perfect and property is clean.,5.0,March 2024,"March 25, 2024",Single Room,2,Solo traveler,5.9,1,1,0,0,0,0,0,0,1,0,0.00112858766221151
"Excelent for a night or 2, value for money","The shower was very smelly, smelled of sewage","Location is superb, my room had everything I needed. Excellent value for money. It wasn’t noisy being so close to train station.",7.0,December 2023,"December 28, 2023",Single Room,1,Solo traveler,5.9,1,1,0,0,0,0,0,0,1,0,0.00112858766221151
"No frills, but just fine!","I prefer white bedspread and duvet rather than printed, as printed could be hiding some secrets.","Great location, clean room. Just what I needed for 1 night. Shower pressure was also fine. Even had coffee and kettle.",6.0,June 2023,"July 4, 2023",Double Room,1,Solo traveler,5.9,1,1,0,0,0,0,0,0,1,0,0.00112858766221151
Good,Small room. Old furniture. Small bed,Clean room. Realy good location,7.0,March 2024,"March 30, 2024",Double Room,2,Family,5.9,1,1,0,0,0,0,0,0,1,0,0.00112858766221151
Pleasant,"The room was very small, all the hotel is very basic, but for the value of money it was ok. Actually it was much better than it looked from the first glance. 
The actual room does not look as good as in the photos :)","Taking into account the overall prices of hotels in London, this was a really good value of money. Our room had a garden view, therefore it was very silent and we had a great night sleep. We did not hear other guests as well. It was good to have the sink and tea kettle in the room.",6.0,July 2022,"July 4, 2022",Double Room with Shared Bathroom,2,Couple,5.9,1,1,0,0,0,0,0,0,1,0,0.00112858766221151
