Review Title,Negative Reviews,Positive Reviews,Rating,Stay Date,Review Date,Room Type,Number of Nights,Traveler Type,Overall Average Rating,Room amenities - positive,Room amenities - negative,Hotel amenities - positive,Hotel amenities - negative,Staff - positive,Staff - negative,Food and beverages - positive,Food and beverages - negative,Location - positive,Location - negative,PageRank Score
very poor and fraustrating experience. I wrote an email and no response for weeks.,"I booked 2 nights at your hotel. Unfortunately I had the worst experience ever.  

 

The first night 4am, I woke up by a vibration noise of the wall and my bed and couldn’t go back to sleep as I need to wake up at 6am that day. I didn’t put too much thought on it and thought maybe a heavy truck drive by and caused the noise.  

The second night, after a full day of busy work, I was looking forward to a good night sleep. I went to bed around 10pm and the same vibration noise appears again. It sounds like a motor vibration in the room wall and my bed. The noise appears several times randomly with no pattern but I was sure it’s from the hotel not by the vehicles driving by. I tried to ignore it and put my ear plugs in but keep getting woke up by this random vibrating noise. Eventually I decided to call the reception for help. The receptionist came to the room to tried to find out where the noise came from. When he was in the room, the noise didn’t appear at that time, so he was accusing me of lying and made me feel like I’m crazy. I was so frustrated I decided to pack my things and left the hotel in tears around 10.30pm that night.  

After a night of good sleep, I was able to think better. I remember the noise always appears twice and went quiet until the next time. Hence I believe the vibrating noise is from the hotel garage door opening and closing. My room number is 17 and the room must be above of or very close to the garage door on the ground floor.   

I don’t think this is acceptable. I don’t need much from a hotel. A working shower and a good night sleep is all I need. Unfortunately I didn’t get my good sleep with you and make things worse, I was not heard and belittled by you when there is an issue.  

I expect you to hear my complaint, investigate the issue and get back to me in due course.",location is the only good thing.,1.0,November 2023,"December 4, 2023",Budget Queen Room,2,Solo traveler,8,0,1,0,1,0,0,0,0,1,0,0.0005578841224500832
Pleasant,"Cost of parking
No window in room",Location,6.0,September 2023,"October 17, 2023",Superior Queen Room with Solar Skylight,1,Couple,8,0,1,0,1,0,0,0,0,1,0,0.0005578841224500832
Fair,"Tiny room on ground floor that was near car park.  Was not worth what i paid for, and was verry noisey",Location,5.0,October 2023,"October 28, 2023",Budget Queen Room,1,Couple,8,0,1,0,1,0,0,0,0,1,0,0.0005578841224500832
Grear value for money,"-small amount of dirt on the bed linen blanket 
-elevator on the right closest to reception desk seemed not to work properly and we got stuck for a short amount of time",The location and pricing was good value for money,8.0,August 2022,"August 7, 2022",Standard Queen Room,1,Couple,8,0,1,0,1,0,0,0,0,1,0,0.0005578841224500831
Not bad after all,"Room no windows, small space , no single use sleepers","Location , inside view.",8.0,September 2023,"September 5, 2023",Budget Queen Room,1,Solo traveler,8,0,1,0,1,0,0,0,0,1,0,0.0005578841224500831
Wonderful,"parking 
fake windows 
strong paint smell in our rooms",great location,9.0,November 2022,"November 10, 2022",Budget Queen Room,2,Group,8,0,1,0,1,0,0,0,0,1,0,0.0005578841224500831
OK. Good value.,Noise from the street. We believe there was some maintenance work going on outside the building (outside our room window) on the morning we were there.,Location close to lots of great places for a meal.,7.0,September 2022,"September 28, 2022",Standard Twin Room,1,Group,8,0,1,0,1,0,0,0,0,1,0,0.0005578841224500831
good value,cleaner didn’t clean and make the bed daily I r supply is with fresh towel. no soy milk options,location,7.0,February 2023,"February 15, 2023",Budget Queen Room,3,Couple,8,0,1,0,1,0,0,0,0,1,0,0.0005578841224500831
Good,,"Excellent location, nice staff and
Great valie for money.",7.0,May 2022,"June 28, 2022",Superior Queen Room,1,Solo traveler,8,0,0,0,0,1,0,0,0,1,0,0.0005578465277652393
I enjoy staying there that’s why I always choose to stay there every time I go to Perth.,,"The property was build elegant and very accommodating. The Staffs are all welcoming , nice and approachable .
The location of the hotel was accessible to different stores nearby and close to the city.",10.0,October 2022,"October 25, 2022",Standard Queen Room,5,Couple,8,0,0,0,0,1,0,0,0,1,0,0.0005578465277652393
"great location, affordable pricing, great customer service!",doona covers,"small, central and great service",10.0,April 2023,"April 24, 2023",Standard Twin Room,1,Solo traveler,8,0,0,0,0,1,0,0,0,1,0,0.0005578465277652393
Very Good,Cheap,Convenient and friendly staff,8.0,August 2023,"September 8, 2023",Budget Queen Room,1,Couple,8,0,0,0,0,1,0,0,0,1,0,0.0005578465277652393
Fabulous budget hotel,Not much! A vending machine or more snack options would be good,"Great location in quiet street, great value for money, the staff organised a cot last minute  with no issues and there was a big bath for my toddler",8.0,January 2023,"January 17, 2023",Standard Queen Room,1,Family,8,0,0,0,0,1,0,0,0,1,0,0.0005578465277652393
"Everything was perfect,just that little cleaning problem 😊","We have stayed many times and loved it,but unfortunately the walls on the front n side of the toilet had several marks on it,just a bit yucky 🤢","Location,very friendly staff😊",10.0,June 2024,"June 20, 2024",Superior Queen Room with Solar Skylight,1,Couple,8,0,0,0,0,1,0,0,0,1,0,0.0005578465277652393
again and again,,great location & friendly staff.,8.0,January 2022,"March 2, 2022",Standard Queen Room,2,Couple,8,0,0,0,0,1,0,0,0,1,0,0.0005578465277652393
Exceptional,,Staff like always are amazing great value for money and great location,10.0,August 2023,"August 25, 2023",Superior Queen Room with Solar Skylight,1,Couple,8,0,0,0,0,1,0,0,0,1,0,0.0005578465277652393
Exceptional,,"Great friendly and helpful staff, great service and location",10.0,November 2022,"November 23, 2022",Superior Queen Room with Solar Skylight (Unserviced),7,Solo traveler,8,0,0,0,0,1,0,0,0,1,0,0.0005578465277652393
Would highly recommend for short stays in the city.,,"great value for price, location was really good, staff were lovely and the ammount of places to eat near by was a nice bonus",7.0,June 2022,"June 29, 2022",Budget Queen Room,3,Solo traveler,8,0,0,0,0,1,0,0,0,1,0,0.0005578465277652393
Exceptional,,"Very reasonable price, lovely staff, 24h reception, great location in town, good kitchen",10.0,August 2022,"September 12, 2022",Superior Queen Room with Solar Skylight,1,Couple,8,0,0,0,0,1,0,0,0,1,0,0.0005578465277652393
Beat expectations,All good,"Good location, friendly staff",9.0,March 2022,"March 24, 2022",Standard Twin Room (Unserviced),4,Solo traveler,8,0,0,0,0,1,0,0,0,1,0,0.0005578465277652393
Pleasant,,Location and staff,6.0,May 2024,"June 12, 2024",Superior Queen Room with Solar Skylight (Unserviced),4,Couple,8,0,0,0,0,1,0,0,0,1,0,0.0005578465277652393
I would stay here again.,,"Friendly staff, nice meal, good location.",8.0,July 2023,"August 18, 2023",Budget Queen Room,1,Solo traveler,8,0,0,0,0,1,0,0,0,1,0,0.0005578465277652393
Great value for money and convenient location,,"Very convenient location, excellent and friendly staff.",9.0,January 2024,"February 26, 2024",Budget Queen Room,2,Couple,8,0,0,0,0,1,0,0,0,1,0,0.0005578465277652393
Would stay there again if going back to Perth,,Location & staff,9.0,September 2022,"September 10, 2022",Budget Queen Room,5,Family,8,0,0,0,0,1,0,0,0,1,0,0.0005578465277652393
Would certainly recommend this hotel,,Location was good and the staff excellent,9.0,May 2024,"May 10, 2024",Superior Queen Room with Solar Skylight (Unserviced),2,Group,8,0,0,0,0,1,0,0,0,1,0,0.0005578465277652393
Very Good,d,"Location, Nice staff, fast checkin checkout",8.0,March 2022,"April 3, 2022",Budget Queen Room,3,Solo traveler,8,0,0,0,0,1,0,0,0,1,0,0.0005578465277652393
wonderful,"Overall it was a pleasant stay, nothing bad really.","Great location, very friendly staff, easy checkin and checkout. no fussy. Highly recommended!",10.0,February 2023,"February 20, 2023",Standard Queen Room,1,Couple,8,0,0,0,0,1,0,0,0,1,0,0.0005578465277652393
usually very clean but the last few rooms were dirty and very disappointing,the toilet was dirty,location and staff,2.0,December 2021,"December 18, 2021",Superior Twin Room with Solar Skylight,1,Couple,8,0,0,0,0,1,0,0,0,1,0,0.0005578465277652393
I really enjoyed my holidays,Couldn’t find,"Very good staff,very good location.",10.0,April 2024,"April 18, 2024",Superior Queen Room with Solar Skylight (Unserviced),4,Couple,8,0,0,0,0,1,0,0,0,1,0,0.0005578465277652393
Exceptional,,"Amazing staff, good location great",10.0,September 2023,"September 20, 2023",Budget Queen Room,1,Solo traveler,8,0,0,0,0,1,0,0,0,1,0,0.0005578465277652393
Fair,"too many cockroaches, poor sound insulation","good location, staffs are nice",5.0,January 2023,"January 9, 2023",Standard Twin Room (Unserviced),6,Couple,8,0,0,0,0,1,0,0,0,1,0,0.0005578465277652393
Very Good,,Friendly staffs and good location,8.0,May 2023,"May 27, 2023",Budget Queen Room,2,Couple,8,0,0,0,0,1,0,0,0,1,0,0.0005578465277652393
Good,"quite noisy, thin walls could hear the neighbours talking","central location, friendly staff",7.0,October 2022,"October 21, 2022",Budget Queen Room,4,Couple,8,0,0,0,0,1,0,0,0,1,0,0.0005578465277652393
Great service from the staff.,It was a little noisy when people were talking in the hall way.,"Convenient location
Good value
Excellent service",8.0,May 2024,"May 13, 2024",Budget Queen Room,1,Solo traveler,8,0,0,0,0,1,0,0,0,1,0,0.0005578465277652393
Exceptional,All was good,"Great location and very friendly staff, always happy to help .",10.0,November 2023,"November 10, 2023",Budget Queen Room,1,Couple,8,0,0,0,0,1,0,0,0,1,0,0.0005578465277652393
Excellent coming back,,Staff v friendly .v conveniently,10.0,April 2024,"April 26, 2024",Budget Queen Room,5,Family,8,0,0,0,0,1,0,0,0,1,0,0.0005578465277652393
Wonderful,,"Great location, great staff",9.0,April 2024,"April 13, 2024",Budget Queen Room,2,Solo traveler,8,0,0,0,0,1,0,0,0,1,0,0.0005578465277652393
Wonderful,,"Central location
Helpful staff",9.0,April 2024,"April 5, 2024",Budget Queen Room,1,Couple,8,0,0,0,0,1,0,0,0,1,0,0.0005578465277652393
"great service, location central to everything you need. functional accomodation at a reasonable price!",,"great service, central location",10.0,January 2022,"January 10, 2022",Budget Queen Room,2,Couple,8,0,0,0,0,1,0,0,0,1,0,0.0005578465277652393
easy stay,paper thin walls and I could hear every thing happening next door. Playing loud music and yelling.,central easy location and staff were incredible,7.0,March 2022,"June 5, 2022",Standard Twin Room (Unserviced),2,Solo traveler,8,0,0,0,0,1,0,0,0,1,0,0.0005578465277652393
great place to stay,,location and staff were exceptionally helpful and nothing was a problem   Reception staff are exceptional and really enhanced our stay,10.0,April 2023,"April 27, 2023",Superior Queen Room with Solar Skylight,3,Couple,8,0,0,0,0,1,0,0,0,1,0,0.0005578465277652393
"Easy access to restaurants, pubs and nightlife!","The condition of the room and bathroom was a bit disappointing. However relative to other hotels, it is great value and in a great location. Don't book here if you want a 5 star, luxurious hotel room.","Great Southern Hotel is in a great location, close enough to walk to restaurants, pubs and nightlife. This isn't a 5 star hotel, but it is awesome value for money. I loved it because we were able to go to a restaurant or bar every night knowing I could walk back to the hotel. I would highly recommend it!",8.0,June 2022,"July 9, 2022",Standard Twin Room (Unserviced),3,Family,8,0,1,1,0,0,0,1,0,1,1,0.0005569462355246997
Wonderful,I got a bit cold during the night and there was no spare blankets only 1 thin one on the bed. Please change the coffee sachets to Nescafe. International roast does not go well with UHT milk.,"We only needed a comfortable clean room as we were going out to see a band so chose the budget queen. Great value, clean and comfy",9.0,May 2022,"May 16, 2022",Budget Queen Room,1,Couple,8,1,1,0,1,0,0,0,0,0,0,0.0005540962860886971
Good cheap choice,"""Upgraded"" to a room with a microwave that was impossible to use and room directly outside the lobby so quite noisy in the morning.",Comfy bed and nice bathroom,7.0,September 2022,"September 4, 2022",Superior Queen Room with Solar Skylight (Unserviced),3,Solo traveler,8,1,1,0,1,0,0,0,0,0,0,0.0005540962860886971
Pleasant,"As a return guess, I wasn’t offered a better room. I appreciated the early checkin, but they should have taken into consideration that I’m staying for another week rather than one night. I can hear the guy next door as clearly as we were living in the same room and his language sounds too familiar to believe, I hope that’s only a coincidence! Noise is just one issue among others, including cleanliness, blocked sink, etc.",Some rooms are better than the others,6.0,August 2023,"August 27, 2023",Budget Queen Room,4,Solo traveler,8,1,1,0,1,0,0,0,0,0,0,0.0005540962860886971
probably won’t book again as I didn’t find it value for money paid,"parking was terrible , not enough available at the hotel so had to park on the street which was very expensive.
wifi did not work in my room
paid extra money for a window that you could not see out of unless you stood on a chair",it was clean,5.0,November 2021,"November 21, 2021",Superior Queen Room,1,Solo traveler,8,1,1,0,1,0,0,0,0,0,0,0.0005540962860886971
Close to Northbridge and secure parking.,There was a lot of empty space in the room.,The room and especially the bathroom was HUGE!,8.0,August 2021,"September 24, 2021",Family Room with Solar Skylight,1,Family,8,1,1,0,1,0,0,0,0,0,0,0.0005540962860886971
"in general I liked the property and the rooms were fair for the price we paid, but not sure if we would stay again","no towels were supplied I had to go get them myself from reception, the blanket on the bed was really thin and we were still cold with the extra rug. the people in the rooms next to us were very loud too from 3-6am we had a terrible sleep","the shower was good temperature and pressure, bathroom was good size too",3.0,June 2023,"June 4, 2023",Budget Queen Room,1,Couple,8,1,1,0,1,0,0,0,0,0,0,0.0005540962860886971
absolute joke,"A double bed was actually two single mattresses push together, which was really uncomfortable. The electric line didn’t work so we couldn’t have any sunlight in our room. The couple next door to us made a lot of personal noise all through the night. RM was not the only room that phone reception to complain. The room next door to us had the electricians in tradies start at eight in the morning, which, after a night of no sleep, was not the greatest start to the day. And on top of that because the electricians were working, we also had no power in our room. We did phone reception and all I got told was that this was scheduled work and I was to experience a power outage join this time. For the amount of money we paid this hotel was an absolute joke. We did complain to the manager who try to focus off with just an ‘ I’m sorry’ I said this wasn’t quite good enough and he said he would have to speak to his boss and get back to me. Five days later I still haven’t heard anything so I rang the hotel to ask when I was gonna happen the manager. As it turns out no one got back to me I didn’t get a message or anything I just got that one night refunded. I am obviously pleased that I got the night refunded as it wasn’t worth the money we paid, but I do feel that the manager copped out and didn’t have the confidence or the professionalism to give me a courtesy call.",it had a kettle in the room,1.0,February 2023,"February 20, 2023",Standard Twin Room,1,Couple,8,1,1,0,1,0,0,0,0,0,0,0.0005540962860886971
Wonderful,Not much,"Easy access to everywhere, clean and always helpful and gracious ☺️",9.0,August 2024,"August 11, 2024",Budget Queen Room,1,Solo traveler,8,1,0,0,0,1,0,0,0,0,0,0.0005532075194387357
Perfect,,Excellent staff. Lovely rooms.,9.0,June 2024,"July 3, 2024",Standard Queen Room,1,Couple,8,1,0,0,0,1,0,0,0,0,0,0.0005532075194387357
All good,All good,All good. Clean and Tidy and happy staff,8.0,March 2022,"March 28, 2022",Budget Queen Room,3,Solo traveler,8,1,0,0,0,1,0,0,0,0,0,0.0005532075194387356
Very Good,,Staff was friendly and rooms were comfy,8.0,June 2022,"June 26, 2022",Standard Twin Room,1,Solo traveler,8,1,0,0,0,1,0,0,0,0,0,0.0005532075194387356
very convenient and comfortable stay for our concert at the RAC arena.,the outlook.,"clean, comfortable, very helpful staff.",8.0,March 2023,"March 13, 2023",Standard Queen Room,1,Couple,8,1,0,0,0,1,0,0,0,0,0,0.0005532075194387356
"Very pleasant to stay, would probably stay again",Nothing really to complain about,"Room was clean and comfortable, staff were friendly and kind enough to upgrade our room on arrival",8.0,October 2023,"November 1, 2023",Standard Queen Room,1,Couple,8,1,0,0,0,1,0,0,0,0,0,0.0005532075194387356
"Would recommend, location was better than we thought and room exceeded our expectations.",No.,"Liked everything about the hotel. The foyer is large and very welcoming, the staff are friendly, happy and very obliging. They are easy to talk to and wanting to meet our needs.  The room was nice and big and the cleanliness was spotless.",8.0,October 2021,"October 16, 2021",Budget Queen Room,1,Couple,8,1,0,0,0,1,0,0,0,0,0,0.0005532075194387356
Exceptional,Nothing,"Freindly staff, very clean and great value",10.0,May 2024,"May 12, 2024",Budget Queen Room,1,Couple,8,1,0,0,0,1,0,0,0,0,0,0.0005532075194387356
Very Good,,Very Clean Good Value nice staff,8.0,June 2023,"June 6, 2023",Budget Queen Room,1,Couple,8,1,0,0,0,1,0,0,0,0,0,0.0005532075194387356
Exceptional,,Everything was to be how I imagine the staff are awesome   bed comfortable    atmosphere is great,10.0,August 2024,"August 10, 2024",Superior Queen Room with Solar Skylight (Unserviced),2,Couple,8,1,0,0,0,1,0,0,0,0,0,0.0005532075194387356
Wonderful,,Comfortable bed clean room great service,9.0,April 2022,"April 14, 2022",Standard Queen Room,1,Solo traveler,8,1,0,0,0,1,0,0,0,0,0,0.0005532075194387356
Exceptional,Everything was ideal see,Beautiful comfortable room great customer service very friendly,10.0,July 2022,"July 31, 2022",Superior Queen Room with Solar Skylight,1,Couple,8,1,0,0,0,1,0,0,0,0,0,0.0005532075194387356
Decent,,This hotel is honestly pretty good. good vibes from the hotel staff and the rooms are pretty decent,8.0,November 2022,"November 10, 2022",Superior Queen Room with Solar Skylight (Unserviced),2,Solo traveler,8,1,0,0,0,1,0,0,0,0,0,0.0005532075194387356
great staff,nil,"it great, always clean, good value, staff are always amazing people. Thats what makes this property great 🙏",10.0,March 2023,"March 20, 2023",Budget Queen Room,1,Solo traveler,8,1,0,0,0,1,0,0,0,0,0,0.0005532075194387356
Exceptional,Nothing was good there.,"Price is good staff very friendly and helpful, 
Always very clean there",10.0,September 2021,"September 26, 2021",Superior Queen Room with Solar Skylight,2,Solo traveler,8,1,0,0,0,1,0,0,0,0,0,0.0005532075194387356
I am a return guest because I feel comfortable at this hotel.,,It’s quiet.  It’s clean.  The staff are very friendly and helpful.,10.0,August 2023,"August 4, 2023",Budget Queen Room,2,Solo traveler,8,1,0,0,0,1,0,0,0,0,0,0.0005532075194387356
Very Good,,The place was ideally located.  Close to the city and bus services. Very neat and clean. Would recommend it to Friends and family.,8.0,June 2024,"June 10, 2024",Superior Queen Room with Solar Skylight (Unserviced),4,Couple,8,1,0,0,0,1,0,0,0,0,0,0.0005532075194387356
Always a pleasure staying at The Great Southern Hotel,,"Clean comfortable, friendly staff",10.0,December 2023,"December 16, 2023",Superior Twin Room with Solar Sky Light (Unserviced),1,Couple,8,1,0,0,0,1,0,0,0,0,0,0.0005532075194387356
Pleasant,Walls are way too thin... we could hear all that was said next door. They have gone cheap on all amenties right down toi the single sheet toilet paper.,"Clean, good staff.",6.0,April 2022,"April 26, 2022",Budget Queen Room,3,Couple,8,1,0,0,0,1,0,0,0,0,0,0.0005532075194387356
A very comfortable room without a street/other view but not an issue for me.  Would stay again.,"Like so many hotels, Internet connection on offer was not secure.",The property was well located at Northbridge.  Staff were very helpful.  Room had a desk I could work from.,8.0,July 2024,"July 23, 2024",Budget Queen Room,2,Solo traveler,8,1,0,0,0,1,0,0,0,0,0,0.0005532075194387356
Exceptional,,"The room was nice, friendly staff and simple check in and out",10.0,March 2023,"April 21, 2023",Standard Twin Room,1,Solo traveler,8,1,0,0,0,1,0,0,0,0,0,0.0005532075194387356
great experience,nothing could be better,The staff were wonderful at helping me. the room was great.,10.0,April 2023,"April 5, 2023",Standard Queen Room,1,Solo traveler,8,1,0,0,0,1,0,0,0,0,0,0.0005532075194387356
Exceptional,,"Free storage room, nice staff and beautiful hotel.",10.0,March 2023,"March 24, 2023",Budget Queen Room,2,Group,8,1,0,0,0,1,0,0,0,0,0,0.0005532075194387356
Exceptional,,"Excellent Reception Staff👍, Very Clean Hotel.",10.0,March 2022,"March 8, 2022",Superior Queen Room with Solar Skylight (Unserviced),7,Solo traveler,8,1,0,0,0,1,0,0,0,0,0,0.0005532075194387356
Happy,,"Excellent staff,always helpful. Clean and tidy.",10.0,July 2024,"August 15, 2024",Superior Queen Room with Solar Skylight (Unserviced),2,Solo traveler,8,1,0,0,0,1,0,0,0,0,0,0.0005532075194387356
Exceptional,,Clean and great staff,10.0,November 2023,"November 28, 2023",Superior Queen Room with Solar Skylight (Unserviced),3,Solo traveler,8,1,0,0,0,1,0,0,0,0,0,0.0005532075194387356
very comfortable,Nothing,"Clean, close to CBD and excellent customer service.",10.0,October 2022,"October 31, 2022",Budget Queen Room,1,Couple,8,1,0,0,0,1,0,0,0,0,0,0.0005532075194387356
very happy,,great service clean,8.0,July 2023,"July 25, 2023",Budget Queen Room,1,Solo traveler,8,1,0,0,0,1,0,0,0,0,0,0.0005532075194387356
Very Good,,"Was very clean, staff we’re lovely",8.0,July 2022,"July 25, 2022",Standard Queen Room,2,Group,8,1,0,0,0,1,0,0,0,0,0,0.0005532075194387356
Exceptional,,"Clean, classy, employee polite, comfortable",10.0,September 2022,"September 23, 2022",Superior Queen Room (Unserviced),2,Solo traveler,8,1,0,0,0,1,0,0,0,0,0,0.0005532075194387356
"Great location, convenient to Perth CBD (walking distance), helpful and friendly staff",,"When we advised staff that we were not happy with our room, as it was noisy, the reception staff listened to our concerns and moved us to an alternative room. Thank you Katrina!",10.0,September 2022,"September 20, 2022",Budget Queen Room,3,Couple,8,1,0,0,0,1,0,0,0,0,0,0.0005532075194387356
Wonderful,The entrance to the car park is narrow. It is a recipe for an accident,The rooms where clean. The staff were friendly and civil,9.0,August 2023,"August 23, 2023",Budget Queen Room,3,Couple,8,1,0,0,0,1,0,0,0,0,0,0.0005532075194387356
Nice hotel for a short stay very handy to Northbridge shops & restaurants staff were all lovely,Nothing,"Clean staff very nice, helpful & efficient",9.0,August 2023,"August 26, 2023",Budget Queen Room,1,Family,8,1,0,0,0,1,0,0,0,0,0,0.0005532075194387356
Wonderful,,"Friendly, professional staff
Clean, comfortable room",9.0,December 2021,"December 6, 2021",Standard Queen Room,1,Couple,8,1,0,0,0,1,0,0,0,0,0,0.0005532075194387356
Exceptional,,"Nice, clean and inviting. the reception provided us with all the information we needed. very friendly",10.0,July 2022,"July 24, 2022",Family Room with Solar Skylight,1,Family,8,1,0,0,0,1,0,0,0,0,0,0.0005532075194387356
Wonderful,,Friendly stuff and a lovely clean room much appreciated,9.0,February 2022,"February 11, 2022",Budget Queen Room,3,Couple,8,1,0,0,0,1,0,0,0,0,0,0.0005532075194387356
Exceptional,Nothing,I love the room bathroom was nice the staff was nice,10.0,October 2023,"October 31, 2023",Budget Queen Room,1,Couple,8,1,0,0,0,1,0,0,0,0,0,0.0005532075194387356
We stay here repeatedly as this is a great hotel.,,"Great service, accommodating with anything we would request/require, great value for $, clean and so quiet.",10.0,January 2023,"April 10, 2023",Superior Queen Room with Solar Skylight (Unserviced),2,Couple,8,1,0,0,0,1,0,0,0,0,0,0.0005532075194387356
Wonderful,,"always love our stays here, comfortable and affordable and clean! staff are friendly and happy to help",9.0,May 2022,"May 18, 2022",Superior Queen Room with Solar Skylight,1,Couple,8,1,0,0,0,1,0,0,0,0,0,0.0005532075194387356
Exceptional,Nothing not to like,Always clean friendly thats why every month I stay here,10.0,December 2023,"January 8, 2024",Budget Queen Room,1,Solo traveler,8,1,0,0,0,1,0,0,0,0,0,0.0005532075194387356
Exceptional,,Always nice and clean and great service from staff,10.0,March 2024,"April 7, 2024",Superior Queen Room,1,Couple,8,1,0,0,0,1,0,0,0,0,0,0.0005532075194387356
Wonderful,,"Staff were very friendly , very clean. Good value",9.0,May 2024,"June 23, 2024",Budget Queen Room,1,Couple,8,1,0,0,0,1,0,0,0,0,0,0.0005532075194387356
Exceptional,,They are always clean and friendly staff,10.0,January 2024,"January 6, 2024",Budget Queen Room,1,Couple,8,1,0,0,0,1,0,0,0,0,0,0.0005532075194387356
