Review Title,Negative Reviews,Positive Reviews,Rating,Stay Date,Review Date,Room Type,Number of Nights,Traveler Type,Overall Average Rating,Room amenities - positive,Room amenities - negative,Hotel amenities - positive,Hotel amenities - negative,Staff - positive,Staff - negative,Food and beverages - positive,Food and beverages - negative,Location - positive,Location - negative,PageRank Score
Great location and value for a short term solo traveller.,Floor was creaky in the bathroom and the light from the electronic room cleaning option button was intense at night. However for a solo traveller this was ignorable and the light could easily be covered by a card.,Staff were accommodating and the room was clean. Locatation was central to my requirements and near plenty of food options.,9.0,August 2024,"August 12, 2024",Budget Queen Room,1,Solo traveler,8,1,1,0,0,1,0,1,0,1,0,0.000780375777038477
Wonderful,Bathroom smelt like someone had been smoking in there and grout near toilet was not clean. Sprayed bathroon with Glen 20 twice  daily.,Great staff. Location. Northbridge has sooo many food options. Comfy room.,9.0,May 2022,"May 12, 2022",Budget Queen Room,4,Solo traveler,8,1,1,0,0,1,0,1,0,1,0,0.000780375777038477
Comfortable hotel - would stay again.,The rooms are not overly sound proof and the chatter from from adjoining room did transmit more than would be expected  (This was not helped by fact lady in adjacent room had worst laugh ever!! - not hotels fault!) That was the only downside.,"Friendly greeting at reception. Room exceptionally clean, including the bathroom. No stale hotel room smell. Bed itself was very comfortable. AC worked well and wasn't noisy. Good location for food and drink options.",8.0,February 2023,"February 21, 2023",Budget Queen Room,1,Solo traveler,8,1,1,0,0,1,0,1,0,1,0,0.000780375777038477
Excellent location close to shops and restaurants.,not applicable. every thing was excellent in the room and the hotel.,"the hotel was close to the main reason for our stay - proximity to HBF Park. The staff were very accommodating, the restaurant served an excellent breakfast and meals at night. Although room was facing the street there was very little noise in the room.",9.0,January 2024,"February 6, 2024",Standard Twin Room (Unserviced),5,Group,8,1,1,0,0,1,0,1,0,1,0,0.000780375777038477
Clean and comfortable,No hairdryer in room,Friendly staff and excellent location. Close to many restaurants and bars. Room was clean and comfortable.,9.0,October 2023,"October 20, 2023",Budget Queen Room,3,Couple,8,1,1,1,0,1,0,1,0,1,0,0.0007765204941810679
"Enjoyable, comfortable stay...but misleading description was a touch disappointing","*Even though we knew our room had no windows, the description for the 'solar skylight' was misleading, as we expected an actual skylight, not 4 x downlights set to natural daylight.
*The wall switches to operate the 'solar skylight' (downlights) didn't appear to work","*Staff were very welcoming and check in was quick and straight forward. 
*The bathroom and shower facilities were fantastic.
*Room was clean, quiet and the bed comfortable.
*Great location for access to some amazing restaurants and bars around the Northbridge area.
*Handy on-site car park which was reasonably priced ($15 per night)",8.0,July 2022,"July 18, 2022",Superior Queen Room with Solar Skylight,1,Couple,8,1,1,1,0,1,0,1,0,1,0,0.0007765204941810679
Pleasant,Beds are hard but I take my foam bed topper and my own pillow every time..,"Clean, friendly, bar and restaurant is good also. Great location.",6.0,May 2023,"May 11, 2023",Budget Queen Room,2,Solo traveler,8,1,1,1,0,1,0,1,0,1,0,0.0007765204941810678
Pleasant,"The hotel room was kind of worn with some stains.
The skylight wasn't working.
Sound insulation was quite bad. Could hear people from the neighboring rooms talking; sounds of doors slamming shut etc. but not a serious concern.","Extremely friendly staff. Location was pretty central and surrounded by lots of restaurants and cafes.
Hotel building had automatic doors which was very convenient.
Shower water pressure was strong and heater worked well. Airconditioning was totally fine as well.
Bed and sheets were clean.",6.0,May 2024,"May 17, 2024",Budget Queen Room,4,Solo traveler,8,1,1,1,0,1,0,1,0,1,0,0.0007765204941810678
We enjoyed a fantastic stay with the lovely staff in this hidden gem.,"Mattress detached from the bedhead, and washing amenities too few.","Great location close to city and Chinatown. Clean room with excellent housekeeping. Cute little bar for afrer dinner. Extremely obliging staff. Inexpensive breakfasts, and fantastic to find a place with a bath.",10.0,October 2022,"October 3, 2022",Budget Queen Room,6,Family,8,1,1,1,0,1,0,1,0,1,0,0.0007765204941810678
"Clean, comfortable, but a bit noisy","The room was a little noisy, it opened on to the mezzanine above the lobby and noise echoed up into the room. Also, some street noise from loud conversations on the footpath. Also, pipes for the next room's shower could be heard loudly in my room.","The staff at the 24 hour front desk were super helpful and friendly. The $12 breakfast was filling and tasty. The rooms were clean and spacious, with comfortable beds. The location is just around the corner from Northbridge restaurant precinct and a moderate walk ~20 min) to Perth and East Perth railway stations.",7.0,April 2022,"April 15, 2022",Standard Twin Room,5,Family,8,1,1,1,1,1,0,1,0,1,0,0.0007724535146004437
Good,Had joining room with connecting door so could hear noise from other room all the time. Had few bugs in sink and rubbish bin split and stuff in bottom when bag removed.,Location and room service. Not having to go out to have drinks or eat.,7.0,December 2021,"January 18, 2022",Budget Queen Room,7,Solo traveler,8,1,1,0,1,1,0,1,0,1,0,0.0007707256856622145
"Overall, I still enjoy my stay there.",Room is a bit small. We had to pay extra for parking. The window cannot be opened during the stay. Bed was okay but a little bit too firm.,"The location was great, lots of restaurants nearby. The room was clean, check in process was smooth, staff were friendly. the shower was nice!",8.0,August 2022,"September 26, 2022",Standard Queen Room,1,Solo traveler,8,1,1,0,1,1,0,1,0,1,0,0.0007707256856622145
Cheap but not cheerful,"Catfish photos. Images as presented, but what you see in the pic is what you get with about 20yrs worth of short term guests stays added on. The decor and colours are extremely depressing, everything here could do with a facelift. My room also wasn’t properly cleaned. I think I saw the hair of at least 4 other people in the bathroom, on the carpet and stuck to the spare blanket - which clearly hadn’t been laundered between guests. Unfortunately I had to use it or freeze to death.","Great location, and extremely friendly and personable staff. They have a licensed restaurant/cafe on site too. I was able to check in late without issue as they have a 24hr desk. I was given a late checkout at 11am which was really nice of them. Rooms easily accessible.",4.0,August 2022,"August 7, 2022",Superior Queen Room,1,Couple,8,1,1,0,1,1,0,1,0,1,0,0.0007707256856622144
"Very clean, nice stay with friendly staff and close to everything",The room we had was quite small - no room to put suitcases anywhere,central and close to so many good places. Very clean and great friendly staff,8.0,May 2023,"May 28, 2023",Budget Queen Room,1,Family,8,1,1,0,0,1,0,0,0,1,0,0.0007683512894948725
Very Good,"being in a room beside the carpark!!
  not a very restful stay at all.","i was able to check in using a Human instead of the malfunctioning auto check in machines, lol Both machines stated i had noxreservatoon, although Booking.com had confirmed my stay with a booking reciept.
   The lovely young Lady behind the desk was most helpful in assisting me as a regular customer of the Hotel.
  The room i booked was Cheap, but comfortable✓, Value for money✓ Private, well appointed W/C visavee Shower/toilet✓ Wall mounted large flat screen, intenet capalble✓  charger sockets✓
no View. ---  beside the carpark ground floor ----  considering the price increases 🤔 there'e room for improvement/ vqlue for money 🤔, But i am booked again, simply because its the convienient for me",8.0,May 2024,"May 4, 2024",Budget Queen Room,1,Couple,8,1,1,0,0,1,0,0,0,1,0,0.0007683512894948725
Overall I was happy with my stay and would consider returning in the future if required.,"I heard people talking in other close by rooms at times, but i guess this cannot be avoided entirely.
I did not have a window, and was not aware of this when I made the booking.","Room was clean, bed comfortable and had suitable appointments.
I found the staff to be pleasant and helpful.
The location was quite central to the city and public transport.
I stayed for a total of 7 nights overall.",8.0,January 2022,"February 7, 2022",Standard Twin Room,1,Solo traveler,8,1,1,0,0,1,0,0,0,1,0,0.0007683512894948725
"Perfect for what we required, stayed one night due to an event being on that we had tickets for super close by, we were","Bathroom was a little bit wet when we got there, but it wasn’t that big of a deal to me","The view from our room was so cute, worth the money 100% and staff were lovely and very helpful",8.0,June 2023,"June 29, 2023",Superior Queen Room,1,Couple,8,1,1,0,0,1,0,0,0,1,0,0.0007683512894948725
"Friendly staff, good location",Room is old and wall is thin.,"Friendly staff and good location.
I booked a budget queen room with bathtub. However, after I checked in, the room I got is twice smaller than the photos and only have a walk-in shower. After I went back to reception and notified the staff, they gave me a new room immediately.",5.0,October 2021,"October 14, 2021",Budget Queen Room,1,Solo traveler,8,1,1,0,0,1,0,0,0,1,0,0.0007683512894948725
really good,"The Room didn’t have a window.
There was just a shower curtain so the whole bathroom got wet.","The staff was really friendly & the room was spotless.
We also loved the location of the hotel.",7.0,May 2022,"May 23, 2022",Budget Queen Room,1,Couple,8,1,1,0,0,1,0,0,0,1,0,0.0007683512894948725
"Easy, clean and comfortable. This is a great stay for a work trip or weekend in the city.","I got probably their worst room, however it was very cheap, comfortable and worth the price. It is located against the carpark so you may hear tires on concrete if people are coming and going. This did not bother me for my stay but explains the price if you think it sounds too good to be true. The other rooms pricing was not that much more expensive that I would likely pay more next time.","Great Value for money, central location with Parking available at a reasonable rate.
Hotel was clean, automated check in was useful, staff pleasant, Dinning area looked good although i did not require it for my stay. 5 minute walk from Northbridge. Exactly what I needed.",9.0,August 2023,"August 10, 2023",Budget Queen Room,1,Solo traveler,8,1,1,1,0,1,0,0,0,1,0,0.0007582438295937607
"a decent stay for the cost , location wasn’t too bad either","can’t really complain , the beds were a tad bit hard and the rooms could do with a kick of paint otherwise it would be nice to get someone in to give the walls a good scrub . 
other than that and no microwave I can’t complain .","love the location , parking is good , the entrance is lovely and the staff are very welcoming .
rooms are very spacious , I could recommend a microwave in the rooms however I realise this isn’t feasible at times .",7.0,November 2021,"December 4, 2021",Budget Queen Room,1,Couple,8,1,1,1,0,1,0,0,0,1,0,0.0007582438295937607
"If above main issue hadn't been the case, it would have been a great stay.","My room was not soundproof at all. In fact, it was quite leaky. I could clearly hear  the couple in the next room talking. The worst of all, my walls were banged not once, not twice but several times several occasions night and morning during my one day stay by the couple next room having sex. I have no issue with their matter. But, pummeling my walls several times is extremely disturbing.","Cleanliness, staff, facilities and location were all great. I was even given 5 hours of parking after check-out.",3.0,March 2023,"March 9, 2023",Budget Queen Room,1,Solo traveler,8,1,1,1,0,1,0,0,0,1,0,0.0007582438295937607
Fine for a short stay,"It said my room would have a 'skylight' but it only had a 'dummy' window, i.e. you couldn't see out of it or open it. I like to open the window at night so couldn't do this. AC was difficult to operate - freezing or too warm.","Staff are helpful, good location only a short walk to the museums and the centre, room was spacious and had useful aspects like the fridge and the iron",7.0,November 2022,"November 27, 2022",Budget Queen Room,4,Solo traveler,8,1,1,1,0,1,0,0,0,1,0,0.0007582438295937607
A nice located hotel and convenient to the city areas with Elizabeth Quay and train station @15mins,The front office staff were not responsive to our request that our neighbouring room at #49 was quite noisy late into our first night. We called and went down to see them about 3 times. Each time they said they will sort it out. In the end we approached the occupants at #49 and asked them to keep the noise down. We had an early flight home the next day and the occupant was very good on the second night and didn't keep us up.,"The location was excellent and the restaurant staff were really good for our breakfast.  And the price was reasonable. The room, bed and accessories were great and clean.",5.0,April 2023,"April 11, 2023",Budget Queen Room,2,Couple,8,1,1,0,1,1,1,1,0,1,0,0.0007447408306863957
Clean convenient stay with most facilities that one would need for a 2 day stay,"Male reception Staff were not overly friendly/cheerful.  Limited breakfast options (no milk alternatives, no gluten free options). No microwave in room. Parking expensive.","Very clean, neat, well maintained room. Hotel in good convenient location to Northbridge and East Perth locales. Shutters on the windows made the room extra dark and extra quiet - great! Good dining options. The Staff lady at the restaurant during breakfast service was delightful! A real ray of sunshine :) Off street parking.",7.0,June 2024,"June 20, 2024",Standard Twin Room,1,Family,8,1,1,1,1,1,1,1,1,1,0,0.0007391450164503925
Great place to stay if you dont get an adjoining room.,"This visit only the pillows were an issue, but this is the same with most accommodation. My previous visit I had a room with adjoining access door, through which I could hear every word the next door tenants were saying. Very annoying and inconvenient.",The staff were very professional and friendly. Secure onsite parking. Good clean and comfortable rooms. The onsite bar and restaurant were very convenient and the food was exceptional. Location is perfect for accessing Northbridge.,7.0,April 2023,"April 24, 2023",Budget Queen Room,1,Solo traveler,8,1,1,1,0,1,0,1,0,1,1,0.0007383183829948857
Exceptional,Only 1 thing our room No. 4 was noisy from the outside of a supermarket and we couldn't close them but I would say to people this was a minor issue,"Everything tbh, breakfast was delicious, rooms were great but overall the staff were polite and nothing was too much trouble a great stay, location was great also nice walk into town would highly recommend this hotel.",10.0,October 2022,"October 25, 2022",Family Room with Solar Skylight (Unserviced),5,Family,8,1,1,0,0,1,0,1,0,1,1,0.0007338556203540628
"Great stay! Clean, well located, nice staff. Would recommend!","The beds needed an extra blanket, and would’ve been better if it was a double mattress rather than two singles pushed together. Breakfast was lovely but I think the addition of fruit/cake/croissants or something like that would be nice. Also payed $24pp for breakfast on booking.com but got to the hotel and it only costs $12pp.","The place looked better than the photos. The reception area was pleasant and inviting. The room was clean, staff were helpful, and it was a nice location. Automatic check in was a cool option too.",10.0,February 2023,"February 27, 2023",Standard Twin Room,1,Couple,8,1,1,0,0,1,0,0,1,1,0,0.0007306062041508931
"Overall a very good experience, nice hotel would definitely stay again.","Beds were very hard, a lot of noise coming from the main reception/ restaurant area late at night .","Location  suited our purposes, very clean, very helpful staff, nice room",8.0,March 2023,"March 15, 2023",Budget Queen Room,1,Couple,8,1,1,0,1,1,0,0,1,1,0,0.0007252918522024852
Enjoyed the stay would have no issue staying again,Bathroom needed a bit of work as was old and dated,Location was good room clean and big enough breakfast was enjoyable would stay again,8.0,August 2022,"August 13, 2022",Budget Queen Room,2,Couple,8,1,1,0,0,0,0,1,0,1,0,0.0007064246357045616
Suited our needs for a quick 1-night stay - need bigger room if staying longer,"Our room was TINY - it seriously felt like the cleaning/store room had been converted. Right next to the exit to carpark, so could hear people coming & going constantly. No windows","Great location; easy to walk to great restaurants, shopping etc; glad we got a car park as their spots are limited; bathroom immaculately clean; Great price",7.0,September 2022,"November 3, 2022",Budget Queen Room,1,Couple,8,1,1,0,0,0,0,1,0,1,0,0.0007064246357045616
Good,Unfortunately there was a smell of sewage in the room at night + the shower got flooded within seconds. There was also a weird hole in the wall. I didn't complain on spot since I had just arrived from a 2 week camping trip and literally just needed somewhere to crash for a few nights. Also bathroom/toilet doors are glass and see-through right by the bed which is good to know depending on who you're travelling with.,"The budget queen room was comfortable enough for a short stay, but as I was staying alone I'd say 2 people might feel a bit cramped. Breakfast was good and priceworthy at only 15 aud. Location is good with walking distance to a lot of restaurants, public transport and the city. It is NOT the same room as in the pictures, the actual room is TINY!! Sadly I only realised this now when looking at the pictures.",7.0,October 2023,"October 23, 2023",Budget Queen Room,1,Solo traveler,8,1,1,0,0,0,0,1,0,1,0,0.0007064246357045616
If the walls were sound proofed I would have been perfectly content even without the required bedding.,"The walls were so disturbingly paper thin I could hear my neighbours phone conversation like he was sitting beside me to the point I could hear the other person word for word. That created a lot of anxiety fearing being kept awake all night but he fortunately was a good neighbor and after I had my phone call and put my tv on to drown out his he was very quiet and considerate.  
No windows, but I knew that when booking. 
Not enough bedding. Had heater on all night to make up for it.","Location, breakfast, convenience to city and transport, good shower and bed.",6.0,July 2024,"July 6, 2024",Budget Queen Room,2,Solo traveler,8,1,1,0,0,0,0,1,0,1,0,0.0007064246357045616
I’ve stayed here many times and will always stay. It’s a great hotel,The beds aren’t super comfortable,"Clean bathrooms, clean rooms. Great value for money breakfast and central location",8.0,March 2024,"March 17, 2024",Budget Queen Room,1,Solo traveler,8,1,1,0,0,0,0,1,0,1,0,0.0007064246357045616
"Jacket and Watch ,Honesty Still Exists.","Toilet Seat up in Bath on Arrival,litter in bathroom,Carpets Grimy.The Pungent Smell of a Previous Tennant,was Overwhelming.Barely bearable.","Proximity to the Restaurants, Northbridge, Facilities in Room,Shower Head,in the Bath,lots of Milk capsules to make tea n coffee.",8.0,October 2021,"November 4, 2021",Budget Queen Room,1,Couple,8,1,1,1,0,0,0,1,0,1,0,0.000702854414438145
Recommended affordable city stay,"Nothing.  Rooms a bit dated, but clean and great value.",Location was awesome (city very walkable) and great value for money.  Breakfast and parking deals great bonus. Rooms a good size.,10.0,October 2022,"October 9, 2022",Budget Queen Room,3,Solo traveler,8,1,1,1,0,0,0,1,0,1,0,0.000702854414438145
OK,Unfortunately there was a smell of sewage in the room at night + the shower got flooded within seconds. There was also a weird hole in the wall. I didn't complain on spot since I had just arrived from a 2 week camping trip and literally just needed somewhere to crash for a few nights. Also bathroom/toilet doors are glass and see-through right by the bed which is good to know depending on who you're travelling with. No windows at all but unsure if that was advertised when booking.,"The budget queen room was comfortable enough for a short stay. I was staying alone but I'd say 2 people might feel a bit cramped with barely any space for your stuff. Breakfast was good and priceworthy at only 15 aud. Location is good with walking distance to a lot of restaurants, public transport and the city.",7.0,October 2023,"October 23, 2023",Budget Queen Room,1,Solo traveler,8,1,1,1,0,0,0,1,0,1,0,0.0007028544144381449
decent place for the price,"bed abit firm to my liking but still had a good sleep, noice from hallway you can hear in the room. overall not bad for price","secured carpark $15 for the night, location walking distance to many restaurants and shops. clean and spacious room. the whole place is clean in general",9.0,July 2022,"July 15, 2022",Family Room with Solar Skylight,1,Family,8,1,1,1,0,0,0,1,0,1,0,0.0007028544144381449
Exceptional,"Needs to have a microwave and cutlery and plates , more towels , more staff on for room service .","Location 
Cleanliness 
Nice staff",10.0,July 2023,"July 1, 2023",Standard Twin Room,1,Couple,8,1,1,0,1,1,1,0,1,1,0,0.0007026762622523238
Very Good,"The beds were comfortable, but you could feel the edge of the beds where they were joined  in the middle to make a large bed. This made it  uncomfortable in the middle. 
 There were no towels. We had to go get some from reception","Awesome location. The restaurant was amazing. The room was clean. Check-in was a breeze.  Roller shutter was great, and the parking was amazing, clean",8.0,April 2023,"April 13, 2023",Standard Twin Room,1,Family,8,1,1,1,1,0,0,1,0,1,0,0.0006999578308084116
A Great Old Hotel in Kinghtsbridge.,"No windows in rooms. On site parking is not assured and is an additional cost, which is understandable given the very competitive accommodation costs. We found plenty of parking on the street.",The facilities and the decor of the rooms are a little dated but clean and comfortable. There are no windows in the rooms which made them a little dark.. Value for money is unbeatable. Bar and restaurant is excellent and good value. Location is great to explore the Newbridge area..,8.0,January 2024,"February 19, 2024",Budget Queen Room,1,Group,8,1,1,1,1,0,0,1,0,1,0,0.0006999578308084116
Exceptional,beds a little hard for our liking!,really like this place for value for money! it’s clean and convenient,10.0,June 2022,"June 6, 2022",Superior Queen Room with Solar Skylight (Unserviced),2,Couple,8,1,1,0,0,0,0,0,0,1,0,0.0006941016817087278
Great for travelling on a budget,Rooms were a bit dated.,"Good location. The rooms were clean, and the beds were comfortable.",7.0,May 2023,"June 5, 2023",Budget Queen Room,2,Couple,8,1,1,0,0,0,0,0,0,1,0,0.0006941016817087278
Okay place to stay,"Although it was a base room, no window made it a little chlosqtraphibic  
We did not pick this up when booking that there were no windows","Value for money in a good location hotel was fairly clean
Plenty of power outlets with USB",8.0,May 2024,"May 10, 2024",Budget Queen Room,1,Couple,8,1,1,0,0,0,0,0,0,1,0,0.0006941016817087278
Very Good,Bed was quite comfortable except for being a little squeaky.,Shower had fabulous pressure. Great location.,8.0,February 2023,"February 21, 2023",Standard Queen Room,1,Group,8,1,1,0,0,0,0,0,0,1,0,0.0006941016817087278
Ok stay at great southern hotel,Room without window,"Location was ok 
Room was clean",5.0,December 2023,"January 6, 2024",Budget Queen Room,1,Couple,8,1,1,0,0,0,0,0,0,1,0,0.0006941016817087278
Ok for 1 night at a cheap rate.,"Internal room without knowledge with sunlight switch not working to window. 
Poor acoustics- could hear neighbour snoring and receiving text messages. 
No duvet and heater was too noisy to keep running.",Great location and clean.,6.0,June 2024,"June 24, 2024",Budget Queen Room,1,Solo traveler,8,1,1,0,0,0,0,0,0,1,0,0.0006941016817087278
need bigger rooms,the room was so small and noisy. very cramped and we had to sit on our bed as the room was so small,clean and great location,4.0,June 2022,"June 27, 2022",Budget Queen Room,1,Couple,8,1,1,0,0,0,0,0,0,1,0,0.0006941016817087278
Very enjoyable will stay again,No windows in the room,Location and cleanliness,7.0,September 2022,"September 3, 2022",Superior Twin Room with Solar Sky Light (Unserviced),2,Solo traveler,8,1,1,0,0,0,0,0,0,1,0,0.0006941016817087278
Wonderful,The bed are noisy while moving,"Good value, clean and location",9.0,July 2023,"July 24, 2023",Standard Twin Room,1,Couple,8,1,1,0,0,0,0,0,0,1,0,0.0006941016817087278
"Great price, good location 👍",Had an interconnecting room and the door was a little thin. Could hear the people next door talking.,It was exactly what I expected for the price and location. I liked the digital touch screen display that indicates 'do not disturb' 'make up my room' etc.,7.0,October 2022,"October 26, 2022",Budget Queen Room,1,Solo traveler,8,1,1,0,0,0,0,0,0,1,0,0.0006941016817087278
Good,Mildly hear people talking next room,"Location
Cleanliness
Safe",7.0,September 2022,"September 10, 2022",Standard Twin Room,1,Solo traveler,8,1,1,0,0,0,0,0,0,1,0,0.0006941016817087278
