Review Title,Negative Reviews,Positive Reviews,Rating,Stay Date,Review Date,Room Type,Number of Nights,Traveler Type,Overall Average Rating,Room amenities - positive,Room amenities - negative,Hotel amenities - positive,Hotel amenities - negative,Staff - positive,Staff - negative,Food and beverages - positive,Food and beverages - negative,Location - positive,Location - negative,PageRank Score
Location was probably the only positive,"Welcoming staff, small room, small towels.",Location,4.0,July 2023,"July 8, 2023",Double Room,3,Couple,5.9,0,1,0,1,0,1,0,0,1,0,0.0009320642785399842
Poor,Throughout the night guests would buzz the intercom and sometimes no staff to answer. So hearing buzz continuously and guests banging on my front window to be let in. I was in the room directly behind reception so heard all the noise and had little sleep throughout the night.,The location near to St Pancras station,3.0,July 2023,"July 23, 2023",Single Room,1,Solo traveler,5.9,0,1,0,1,0,1,0,0,1,0,0.0009320642785399842
Right where I needed to be; pleasant staff. Needs to be closer to £60 for a basement room,Cramped spaces.,The location is excellent. The staff were welcoming. But the rooms need sprucing up.,6.0,June 2024,"July 1, 2024",Single Room with Shared Bathroom,1,Solo traveler,5.9,1,0,0,1,1,0,0,0,1,0,0.0009306367426798928
Good,some noise from the street in the day time due to construction work done across the street but didn't cause any problem for me :),The hotel is in very nice location and the rooms are good sized. Staff is friendly and helpful. I will definitely stay here again!,7.0,February 2023,"February 19, 2023",Single Room,1,Solo traveler,5.9,1,0,0,1,1,0,0,0,1,0,0.0009306367426798927
Good,"Wifi needs to be improved, the facilities is very low and it should provide some tooth brush or cream for sanitising. The room has a bad view.","Great location, close to the centre",7.0,May 2022,"May 22, 2022",Double Room with Shared Bathroom,2,Group,5.9,0,1,0,1,0,0,0,0,1,1,0.000929324836145682
Okay,"You get what you pay for, and it is a cheap room for a great location for maybe one nights stay. It was a small basic room, not the most comfy, modern or immaculate. I'd probably pay more for better comfort, welcome, facilities and cleanliness next time.",The location,5.0,November 2022,"November 20, 2022",Double Room,1,Family,5.9,0,1,0,1,0,0,0,0,1,1,0.000929324836145682
Exceptional,Water is run out just a bit.,Location is the bed.,10.0,March 2024,"March 6, 2024",Double Room,2,Couple,5.9,1,0,0,0,0,0,0,0,1,0,0.0009101276333887525
Great location for St Pancras. Basic but adequate room for overnight stay.,As above,The fact that it was clear both sides of the bed which is unusual for hotels at this price in this location. Great location for St Pancras.,7.0,April 2023,"May 2, 2023",Double Room,1,Couple,5.9,1,0,0,0,0,0,0,0,1,0,0.0009101276333887525
No words,All,"The location it’s perfect but the description when you book the hotel it’s bad. The room looks completely different, the don’t specify that you need to share 1 toilet and 2 showers with 5 rooms which is bad, the hotel it’s in really bad conditions",1.0,March 2024,"March 11, 2024",Twin Room with Shared Bathroom,2,Group,5.9,1,0,0,0,0,0,0,0,1,0,0.0009101276333887525
Exceptional,,"It was good for a short stay, it was clean, safe and a great location",10.0,April 2023,"May 2, 2023",Triple Room,2,Family,5.9,1,0,0,0,0,0,0,0,1,0,0.0009101276333887525
Great short stay,"Nothing, all good 😊","The location is unbeatable, only a few minutes walk from King's Cross/St Pancras. The room was immaculately clean, the bed was comfortable. It is a no-frills hotel but done well",8.0,June 2023,"June 7, 2023",Double Room,1,Family,5.9,1,0,0,0,0,0,0,0,1,0,0.0009101276333887525
"short stays and stop overs, offering value for money",,"Stayed for one night, with the hotel offering a good location close to the station for my train in the morning. The room itself was warm and comfortable for the stop over. you would want something else for a longer stay/holiday, but for my purposes  it worked well.",5.0,March 2023,"March 20, 2023",Single Room with Shared Bathroom,1,Solo traveler,5.9,1,0,0,0,0,0,0,0,1,0,0.0009101276333887525
Very Poor,,Very dirty and incredibly small room. Window didn't close. Only good thing was the location right opposite King's Cross station.,2.0,April 2024,"April 8, 2024",Single Room with Shared Bathroom,1,Solo traveler,5.9,1,0,0,0,0,0,0,0,1,0,0.0009101276333887525
perfect bolt hole for a cheap but comfortable night,,great location and very clean,7.0,January 2023,"January 11, 2023",Single Room,1,Solo traveler,5.9,1,0,0,0,0,0,0,0,1,0,0.0009101276333887525
King cross awesome price,Nothing,"Easy to find location 
Quite un the rooms
Awesome shower room (shared with others but hot and powerful.)
Just Awesome",10.0,April 2024,"April 14, 2024",Single Room with Shared Bathroom,2,Solo traveler,5.9,1,0,0,0,0,0,0,0,1,0,0.0009101276333887525
"I would stay here again, for sure",,"Comfy bed, excellent huge window made the typical small London single room feel bigger, TV actually works(!), was in the annex down the road so had a nice park view, great location for public transportation",8.0,April 2024,"April 20, 2024",Single Room,3,Solo traveler,5.9,1,0,0,0,0,0,0,0,1,0,0.0009101276333887525
Wonderful,,"Perfect location about 5 mins from Kings cross, great room and great price for an over night stay in the city.",9.0,May 2024,"May 13, 2024",Triple Room,1,Group,5.9,1,0,0,0,0,0,0,0,1,0,0.0009101276333887525
A good option near Kings Cross on a budget,"The hotel met my expectations, at this price point in London it's very good.",The location is excellent for transport particularly and the clean rooms are very good value for Central London.,8.0,May 2024,"May 18, 2024",Single Room,1,Solo traveler,5.9,1,0,0,0,0,0,0,0,1,0,0.0009101276333887525
Very Good,It’s a bit tired and in need of renovations.,"Great location, easy access to all travel options, ideal for exploring London. This an ideal property for exploring London on a budget if you only need a room to sleep in.",8.0,June 2024,"June 7, 2024",Double Room,1,Couple,5.9,1,0,0,0,0,0,0,0,1,0,0.0009101276333887525
exceptional serve,smell in the hallway on 1st night,central and great value for money. room cleaned every day,10.0,February 2023,"February 14, 2023",Quadruple Room,3,Group,5.9,1,0,0,0,0,0,0,0,1,0,0.0009101276333887525
Good,,"You get what you pay for. 
Decent stay, especially if you plan on not spending to much time in the hotel (as we did) it's okay. 
Clean, comfortable beds, good location next to Pancras station (Eurostar).",7.0,April 2022,"April 29, 2022",Twin Room with Shared Bathroom,3,Group,5.9,1,0,0,0,0,0,0,0,1,0,0.0009101276333887525
nevermore,"very poor, very cold","the location, the cleanness, the stuff",3.0,April 2023,"April 21, 2023",Single Room with Shared Bathroom,1,Solo traveler,5.9,1,0,0,0,0,0,0,0,1,0,0.0009101276333887525
Fair,A bit grubby in places.,Location opposite the train station was good. Room as expected for a budget property.,5.0,February 2024,"March 15, 2024",Twin Room,2,Couple,5.9,1,0,0,0,0,0,0,0,1,0,0.0009101276333887525
Good value in a great location,,Great location for St Pancras. I booked a double room so the bed was big and comfy.,8.0,February 2024,"March 6, 2024",Double Room,1,Solo traveler,5.9,1,0,0,0,0,0,0,0,1,0,0.0009101276333887525
Great location. Value for money.,Nothing really.,Location was great. Room was fairly small but wasn't an issue as was just laying my head down for the night.,9.0,May 2024,"May 26, 2024",Single Room,1,Solo traveler,5.9,1,0,0,0,0,0,0,0,1,0,0.0009101276333887525
Exceptional,You get what to pay for.,"Great location, sweet people at the reception desk, rooms cleaned properly every day.",10.0,June 2023,"June 16, 2023",Twin Room with Shared Bathroom,4,Couple,5.9,1,0,0,0,0,0,0,0,1,0,0.0009101276333887525
Wonderful,,Hotel is at excelent location and clean.,9.0,November 2023,"December 20, 2023",Double Room,2,Family,5.9,1,0,0,0,0,0,0,0,1,0,0.0009101276333887525
Budget hotel in great location,TV screen broken and only one pillow but both these thngs were rectified soon as I asked,"Good checking, room clean great location",6.0,July 2022,"July 4, 2022",Single Room,2,Solo traveler,5.9,1,0,0,0,0,0,0,0,1,0,0.0009101276333887524
Small room in a great location,There was a very unpleasent smell in the toilet.,Great location. Small room with toilet and shower inside. 24 hour reception.,6.0,March 2023,"March 26, 2023",Triple Room,3,Group,5.9,1,0,0,0,0,0,0,0,1,0,0.0009101276333887524
cheap central location,really needs updating. some mould on the walls.,"location, comfortable beds.",5.0,June 2022,"June 6, 2022",Triple Room,3,Family,5.9,1,0,0,0,0,0,0,0,1,0,0.0009101276333887524
No frills hotel - no surprises. Well located for the station. Friendly staff.,,"Great location for catching early train. Clean, tidy and basic - which was expected with the price I paid.",7.0,January 2022,"January 27, 2022",Single Room,1,Solo traveler,5.9,1,0,0,0,0,0,0,0,1,0,0.0009101276333887524
Good,"Soap was provided, but it wasn't in packaging.. it is a converted house.. so  you can hear people walking about...I took ear plugs with me..  but again it is a budget hotel..","Fab location for St Pancras... budget hotel.. so you get what you pay for..Great for one or 2 nights..  small, adequate room...shower and toilet ensuite.. bed very comfortable",7.0,October 2022,"October 13, 2022",Single Room,1,Solo traveler,5.9,1,0,0,0,0,0,0,0,1,0,0.0009101276333887524
Good,,"Excellent location,  quiet room, clean.",7.0,February 2023,"February 14, 2023",Single Room,2,Solo traveler,5.9,1,0,0,0,0,0,0,0,1,0,0.0009101276333887524
Pleasant,,Very basic but served it's purpose for one night. Bed was comfortable. Excellent location regarding Kingscross /St Pancras Stations.,6.0,September 2022,"September 25, 2022",Single Room,1,Solo traveler,5.9,1,0,0,0,0,0,0,0,1,0,0.0009101276333887524
Clean but expensive,Expensive for what it was,"It was clean, adequate for one night's stay. Convenient location for early morning Eurostar train.",5.0,October 2022,"October 14, 2022",Triple Room,1,Couple,5.9,1,0,0,0,0,0,0,0,1,0,0.0009101276333887524
Fair,,"Room was fine for the price. Very convenient location. We weren’t inside too much which was a good thing. The room was very small but for two nights, it was clean and more than good enough.",5.0,October 2023,"October 22, 2023",Twin Room,2,Family,5.9,1,0,0,0,0,0,0,0,1,0,0.0009101276333887523
"Small, cute hotel super super close to both train stations. The hallways feel a bit like a maze",,"The hotel was super super close to King's Cross and Pancreas stations which was very convenient. Just across the street, about 5 minutes. There was tea and coffee in the rooms and while a little small was still comfortable.",7.0,March 2023,"May 17, 2023",Twin Room with Shared Bathroom,2,Couple,5.9,1,0,0,0,0,0,0,0,1,0,0.0009101276333887523
Satisfactory,- I would suggest bringing ear plugs with you because you can hear everything.,"- The location was great because it was right by the tube. 
- It was clean.",7.0,February 2024,"February 13, 2024",Double Room,2,Couple,5.9,1,0,0,0,0,0,0,0,1,0,0.0009101276333887523
Pleasant,Hotel is quite outdated but in its own way therefore  charming. To sleep few nights in London without having to rob  a bank is ideal.,"Hotel is  very basic but is very clean, rooms in the basement are very quite [you hear the underground but this i find a very nice London experience:)] and the location is great. Shared bathroom and toilet are cleaned regularly and reception is 24 hours. Ideal.",6.0,May 2023,"May 21, 2023",Double Room with Shared Bathroom,3,Family,5.9,1,0,0,0,0,0,0,0,1,0,0.0009101276333887523
"Good value, clean, but be aware the rooms are small.",Other guests were smoking outside our window in the courtyard.,"Great value for location. Very close to St Pancras station, easy to find. Clean, but be aware the rooms are very small.",7.0,July 2023,"August 1, 2023",Double Room,3,Group,5.9,1,0,0,0,0,0,0,0,1,0,0.0009101276333887523
Good value and excellent location,I was happy with my stay.,The location is very convenient for transport and the price was very reasonable for a clean room with a bathroom on Central London.,7.0,May 2024,"May 22, 2024",Single Room,1,Solo traveler,5.9,1,0,0,0,0,0,0,0,1,0,0.0009101276333887523
Good,"Price category about £60-70, not £90. Price too high,","Convenient, clean room",7.0,April 2024,"April 9, 2024",Single Room,1,Solo traveler,5.9,1,0,0,0,0,0,0,0,1,0,0.0009101276333887523
Fair,"stairs qhite sfeep with case no lift
corridors too dark and gloomy
Wc and sh basic and dingy need modernising","great location for Eurostar
ok price for doubke room
Shower and wc close to bedroom ( not ensuite)",5.0,June 2023,"June 23, 2023",Double Room with Shared Bathroom,1,Solo traveler,5.9,1,0,0,0,0,0,0,0,1,0,0.0009101276333887523
tolerated,in the Bath there was only one towel and they also had a very small soap without packaging to wash. the fact that it did not include breakfast while referring to the site. during the day the radiators were closed and it was cold. the single room was very small. the price was a bit expensive and i justify it just for the location,It did not include breakfast although the site stated that it would.is in a very good location because it is very close to a central and international station.also the area was quiet.the staff very kind.the mattress was good as well as the pillow,5.0,November 2021,"November 23, 2021",Single Room,3,Solo traveler,5.9,0,1,0,1,1,0,1,1,1,1,0.0008927764943311594
Good,"Noise from fan in bathroom & dripping tap. Though fan was fixed after first night.

Light stays on with fan for over 15 minutes so leaving feesback if you use bathroom in  night beware. (See lobby photo)

I would recommened earplugs as very large air con until from building next door very noisy and window in room not double glazed.","Bed was comfortable.
Reception staff and cleaners friendly.",7.0,August 2023,"August 5, 2023",Double Room,2,Family,5.9,1,1,0,1,1,0,0,0,0,0,0.0008875170874143344
Good basic hotel in great location,Kitchen area was not clean so didnt use.,"Ample shared shower and toilets on each floor.
Room cleaned everyday bin emptied and bed made. Very helpfull staff on the front desk.
1 min walk from Kings cross station",7.0,September 2021,"September 28, 2021",Single Room with Shared Bathroom,6,Solo traveler,5.9,1,1,0,1,1,0,0,0,0,0,0.0008875170874143344
Reasonable hotel for short stay,"The double bed was small.
The noise of air ventilation outside from other buildings kept me awake.
Steepness of stairs.
Luckily I had ear plugs with me.","The closeness of hotel to King's Cross was welcome.
The room and ensuite were very clean.
Plenty of towels.
A reasonable hotel for a short break.
Staff friendly.",5.0,December 2022,"December 11, 2022",Double Room,2,Family,5.9,1,1,0,1,1,0,0,0,0,0,0.0008875170874143344
"Small room, great price","Room layout was really awkward with the toilet in a  separate space, shower in separate space and beds in another. Beds were tiny.","The room and beds were incredibly small, but for the price it was definitely worth it! Staff was great!",7.0,March 2024,"March 26, 2024",Triple Room,1,Family,5.9,1,1,0,1,1,0,0,0,0,0,0.0008875170874143344
Low cost hotel opposite Kings Cross station.,"WiFi was rubbish. The building directly opposite is undergoing major renovation work and there is a lot of construction noise throughout the day, not a problem if you're out sight seeing or didn't want a lay-in. Apparently this work may be ongoing for a year or two. The rooms are not particularly silent at night either and general road noise is quite noticeable but this is central London. The noise didn't bother me but my wife who is a light sleeper did struggle.","Low cost (for London) budget hotel opposite Kings Cross station and underground. Clean but small room with a small double bed and good shower, ideal for and night or two if you don't want to pay normal London prices. Reception were helpful and friendly and allowed us to leave our bags with them until checkin. Would definitely stay again if it wasn't for the major renovation work going on across the road.",5.0,November 2022,"December 5, 2022",Double Room,2,Couple,5.9,1,1,0,1,1,0,0,0,0,0,0.0008875170874143344
clean and friendly but very very basic,"On the booking.com website it never stated that this 
was a shared facility and that the bathroom and shower 
would have to be shared. It was very basic amenities 
and we was shocked when we first went to the room 
due to the fact it wasn’t really like the pictures 
but it was in a good place and it was a clean place to 
lie our heads down so we made do.",The property was clean and the staff was friendly,5.0,August 2022,"August 30, 2022",Double Room with Shared Bathroom,2,Couple,5.9,1,1,0,1,1,0,0,0,0,0,0.0008875170874143343
Foul smell of cigarettes.,The stench of cigarette smoke that came into my room through the extractor fan and under the door.,"Room was fine, small but everything needed for a stay. Staff friendly and helpful.",6.0,December 2021,"December 8, 2021",Single Room,5,Solo traveler,5.9,1,1,0,0,1,0,0,0,0,0,0.0008875140684740683
"Nice, but it needs more space and AC for rooms.",Small room and bathroom,"Small room but clean and has great staff. I was expecting an AC room, but the weather was really nice.",6.0,July 2024,"July 26, 2024",Double Room,1,Family,5.9,1,1,0,0,1,0,0,0,0,0,0.0008875140684740683
"I'd stay again for another brief 'bed for the night' stop, but I'd look around first.",It is a pretty basic place. Our room was down stairs going down a winding corridor. Limited fresh air on a warm night and a basic shared toilet. Someone had 'missed' meaning we had to clean it or avoid it.,"It was a bed for the night near Kings Cross, we only spent an hour in the hotel actually awake. It was clean, the beds comfortable and the staff very friendly.",6.0,July 2024,"July 8, 2024",Twin Room with Shared Bathroom,1,Family,5.9,1,1,0,0,1,0,0,0,0,0,0.0008875140684740683
Overall what I expected good location friendly staff,Leek in bathroom but I didn’t want to change rooms,"Staff nice and friendly. Very helpful. 2 min walk to Eurostar which is why I chose to stay here.
Beds comfortable. 
Asked for extra towel and coffee and milk and staff got them for us right away.
Room was small for three people but I knew this before hand. 
Only staying in London one night so was exactly what we needed",6.0,January 2024,"January 9, 2024",Triple Room,1,Group,5.9,1,1,0,0,1,0,0,0,0,0,0.0008875140684740683
Good,Lot of stairs. As a heavy smoker I felt that :) if you travel with a heavy suitcase or if you are not very mobile ask for a room on a lower floor.,"Maggie was amazing ! I had some questions concerning my booking and she was the most helpful ! Even in het time off she took the time to answer me . Brilliant service from her !! The rooms were clean , warm and very good beds.",7.0,February 2023,"February 12, 2023",Double Room,1,Group,5.9,1,1,0,0,1,0,0,0,0,0,0.0008875140684740683
A very comfy place.,"The door to the room was rather thin, so there was not too much privacy.",The room was very clean and tidy and everything functioned as it should. The staff was very friendly and the hotel is only a stone's throw from King's Cross.,7.0,November 2023,"November 10, 2023",Double Room,2,Solo traveler,5.9,1,1,0,0,1,0,0,0,0,0,0.0008875140684740683
Wireless festival,"We was put in the basement room and every few minutes till 3am we could hear the underground, it felt like we was literally in the underground. 

One of the girls bed sheets was dirty

Not much room for 3 people","The staff was lovely to go above and beyond to get us in tje room earlier due to attending a festival. We was able to get ready in a different room till ours was ready. Nothing was to much bother for the staff, 24hour reception.",7.0,July 2024,"July 16, 2024",Triple Room,1,Family,5.9,1,1,0,0,1,0,0,0,0,0,0.0008875140684740683
Good,Size of d room was too small. Better to remove few things to make it little large,Cleaning and staff welcome,7.0,January 2023,"January 2, 2023",Single Room with Shared Bathroom,3,Solo traveler,5.9,1,1,0,0,1,0,0,0,0,0,0.0008875140684740683
Fair,Awkward to access the room as the stairs had no banister rail. Way too much furniture for a small room.,Very very close to King's Cross. Clean room and friendly staff.,5.0,November 2022,"November 10, 2022",Double Room,1,Family,5.9,1,1,0,0,1,0,0,0,0,0,0.0008875140684740683
Would definitely stay again 👍,Small size bed,"Over the road from King’s Cross
Staff were helpful
Room was small but clean
Tea and coffee in the room",7.0,July 2024,"July 17, 2024",Double Room,1,Couple,5.9,1,1,0,0,1,0,0,0,0,0,0.0008875140684740683
It was okay,"No soap in toilet, coffee cup in room dirty, room was not ready when I arrived on decided arrival time. Room was hard to find and I was a little concerned about fire safety.","Bed was comfortable, staff was friendly",5.0,May 2022,"May 20, 2022",Single Room with Shared Bathroom,1,Solo traveler,5.9,1,1,0,0,1,0,0,0,0,0,0.0008875140684740683
Very Good,One toilet for our room and a gentleman used it and I decided to use the local mc Donald's one lol,Close to train station and underground. Also close to plenty of places to eat. Staff were lovely and the lady cleaning the rooms made sure to check we had everything we needed. The beds are comfortable and I loved our little room it even had a sink.,8.0,February 2023,"March 2, 2023",Twin Room with Shared Bathroom,2,Family,5.9,1,1,0,0,1,0,0,0,0,0,0.000887514068474068
"Pleasant stay in clean, tidy room at friendly hotel, which is in great location for shops and transport.","Very small room. Bit of a walk to get to it, with very narrow corridors and no lift. Shared shower and toilet, though they are close by. Taps on sink did work, but water slow.","Clean, tidy, quiet room with all furniture in good, new-ish condition. Very close to all transport. Kings Cross station across the road. Shops close by. Friendly, helpful staff.",8.0,June 2024,"June 27, 2024",Single Room with Shared Bathroom,1,Solo traveler,5.9,1,1,0,0,1,0,0,0,0,0,0.000887514068474068
Fair,"Bed comfortable for me, but would not be for 2 people! Not a double that I paid extra for. The shower temp was good, pressure was minimal and it was tiny. Gaps in the laminate floor were a concern. My sister's room had an actual hole in the floor.",The bed was comfortable. The shower was nice. Staff were very friendly.,5.0,March 2023,"March 16, 2023",Double Room,2,Family,5.9,1,1,0,0,1,0,0,0,0,0,0.000887514068474068
Very good place to check in!,the heater need about 1 hour + to start heating the room. so as we arrive late at night.. it is freezing. but the water heater in bathroom is superb!,"It is a very good place which is really near the train station ! literally really close, 3 mins walk. the room is quite small but bearable. very quiet and reception open 24hours which is really helpful. 
The price is reasonable",8.0,February 2023,"March 4, 2023",Triple Room,1,Group,5.9,1,1,0,0,1,0,0,0,0,0,0.000887514068474068
Exceptional,The beds were very hard and the pillows were like bricks however this is a budget hotel so you get what you pay for and the toilet had a limescale build up,Quite close to the main transport hub staff were very helpful and informative and the rooms were very clean,10.0,August 2023,"August 15, 2023",Single Room with Shared Bathroom,2,Family,5.9,1,1,0,0,1,0,0,0,0,0,0.000887514068474068
You get what you pay for. It's ok.,"Bed was old n creaky.
Everything could do with a proper refurb.
Late at night it seems KX area has again got a bit sketchy.",The room was clean. The staff were friendly. Compared with some other budget hotels bathroom was actually a decent size.,7.0,August 2022,"August 30, 2022",Single Room,2,Solo traveler,5.9,1,1,0,0,1,0,0,0,0,0,0.000887514068474068
Very Good,Climbing three flights of stairs to get to bed !,Comfortable bed and really friendly staff,8.0,July 2023,"July 19, 2023",Single Room with Shared Bathroom,2,Solo traveler,5.9,1,1,0,0,1,0,0,0,0,0,0.000887514068474068
Very Good,Sharing toilet and shower,Lovely staff very clean,8.0,August 2023,"September 1, 2023",Twin Room with Shared Bathroom,3,Family,5.9,1,1,0,0,1,0,0,0,0,0,0.000887514068474068
Good sleep at Belgrove Hotel,Step down from shower room into bedroom.,"The bed and pillows  were vety comfortable, The room just big enough for 2 people. Reception very helpful with baggage storage all day and loan of hairdryer
Room was dlean and perfect for  short stay right opp euston stayion.",10.0,September 2023,"September 8, 2023",Double Room,1,Family,5.9,1,1,0,0,1,0,0,0,0,0,0.000887514068474068
"Small, dated, clean","Shared facilities and common spaces were very, very dated.","Cheap, good location, clean.",5.0,October 2022,"October 12, 2022",Single Room with Shared Bathroom,7,Solo traveler,5.9,1,0,0,1,0,0,0,0,1,0,0.000884196216134266
"clean, covers needs and comfortable",pretty basic and tight for space - but fine for the money for a night,central to train station . basic but all we needed. safe and clean and comfortable,5.0,March 2023,"March 14, 2023",Double Room,1,Family,5.9,1,0,0,1,0,0,0,0,1,0,0.000884196216134266
