Review Title,Negative Reviews,Positive Reviews,Rating,Stay Date,Review Date,Room Type,Number of Nights,Traveler Type,Overall Average Rating,Room amenities - positive,Room amenities - negative,Hotel amenities - positive,Hotel amenities - negative,Staff - positive,Staff - negative,Food and beverages - positive,Food and beverages - negative,Location - positive,Location - negative,PageRank Score
Exceptional,Parking price.. Significantly cheaper to park at Binz Parking Garage just one block away,"Great location, fast check in, spacious rooms, water fountains, microwave...",10.0,April 2022,"April 20, 2022",Superior Queen Room,1,Couple,7.9,1,0,1,1,0,0,0,0,1,0,0.0006424978968487492
Exceptional,I really wish they had like a rooftop smoking area🙄 there's always people walking around bumming for cigarettes and spare change makes it kind of intimidating,My room was very clean comfortable I was very close to a lot of attractions,10.0,September 2021,"September 12, 2021",Small Queen Room,3,Solo traveler,7.9,1,0,0,1,0,0,0,0,1,0,0.0006419269185109624
Exceptional,not paying so much for parking.,The room was great.  Very comfortable bed and pillows.  Bottled water provided.  Great location to Minute Maid stadium for the games.,10.0,March 2024,"April 2, 2024",Mobility Accessible Standard Room,2,Couple,7.9,1,0,0,1,0,0,0,0,1,0,0.0006419269185109624
Exceptional,The lobby was mostly deserted,"Clean rooms, great location, easy to check in and out",10.0,December 2023,"December 3, 2023",Small Queen Room,1,Family,7.9,1,0,0,1,0,0,0,0,1,0,0.0006419269185109623
"Location is great, you're within walking distance of the Minute Maid Park and the Toyota Center.","The elevators are a hit or miss, after 9PM only 1 elevator seemed to be in operation and stayed that way until 10am. There was a lot of people waiting to get on the ONE operational elevator out of the 6 that are available for use. This also caused us to be late to 2 engagement's we had reservations for due to the amount of time wasted waiting for an elevator.",Check in went smoothly with no issues. The young lady that checked us in was very resourceful and was able to get me a room with a city view.,7.0,October 2022,"December 19, 2022",King Room,1,Group,7.9,1,0,0,1,0,0,0,0,1,0,0.0006419269185109623
Comfortable stay but could use better staff communication,They were hard to reach. I called in the morning for extra towels maybe 3 times and no one responded.,The location and value of the price. The rooms were clean and equipped with neccasities. I really liked the bottled water dispensers on each floor.,7.0,July 2024,"July 12, 2024",Mobility Accessible Standard Room,1,Solo traveler,7.9,1,0,0,1,0,0,0,0,1,0,0.0006419269185109623
European style hotel.,"Not much. The smallest rooms are small for America but the hotel is affordable.
The hotel is Downtown -> At night, the area is not safe at least I do not feel safe but that is a general Downtown problem. 

There is an app, last time it didn't work. Having or using a car is inconvenient. You can find overnight parking for $8 not far away, but the hotel charges over $30 for valet parking.","I like the location a lot. It is surrounded by restaurants. So far, I stayed three times at this hotel, and each time I got a better upgrade for free.
I usually take the bus 102 from the airport (terminal C) to the hotel. The ride is only $1.25. For tourists, this is a great deal and much cheaper than an uber ($40 to $80).

There is a self-check-in machine, so there isn't a waiting line.",9.0,February 2022,"February 26, 2022",Superior Queen Room,4,Solo traveler,7.9,0,1,0,1,0,0,1,0,1,1,0.0006414678400243405
European style hotel.,"Not much. The smallest rooms are small for America but the hotel is affordable.
The hotel is Downtown -> At night, the area is not safe at least I do not feel safe but that is a general Downtown problem. 

There is an app, last time it didn't work. Having or using a car is inconvenient. You can find overnight parking for $8 not far away, but the hotel charges over $30 for valet parking.","I like the location a lot. It is surrounded by restaurants. So far, I stayed three times at this hotel, and each time I got a better upgrade for free.
I usually take the bus 102 from the airport (terminal C) to the hotel. The ride is only $1.25. For tourists, this is a great deal and much cheaper than an uber ($40 to $80).

There is a self-check-in machine, so there isn't a waiting line.",9.0,February 2022,"February 26, 2022",Superior Queen Room,4,Solo traveler,7.9,0,1,0,1,0,0,1,0,1,1,0.0006414678400243405
excellent and easy check in.,,location     and very clean,10.0,September 2022,"September 30, 2022",Mobility Accessible Standard Room,1,Couple,7.9,1,0,0,0,0,0,0,0,1,0,0.000636677269659064
amazing stay!,Nothing. it was perfect!,the property was clean and the location is AMAZING!,10.0,October 2021,"November 8, 2021",Standard Queen Room,3,Couple,7.9,1,0,0,0,0,0,0,0,1,0,0.000636677269659064
"The staff was nice, friendly and supportive, even at 5am. It’s located in the middle of Houston. So you have access to g",,Nice location. Older hotel but kept up and clean.,8.0,March 2023,"March 20, 2023",Standard Queen Room,1,Family,7.9,1,0,0,0,0,0,0,0,1,0,0.000636677269659064
Exceptional,,Great accommodation very thoughtfully designed especially access to chilled water in the hallways. Very clean and quality comfy beds. Great location close to buses and tram. Would recommend.,10.0,March 2024,"March 31, 2024",Small Queen Room,3,Couple,7.9,1,0,0,0,0,0,0,0,1,0,0.000636677269659064
Very Good,Around the hotel there were many homeless people,"•good location
•clean and comfortable room",8.0,June 2022,"June 22, 2022",Small Queen Room,2,Family,7.9,1,0,0,0,0,0,0,0,1,0,0.000636677269659064
Loved it,Small,"Great location, clean rooms, a little small, but other than that. Great!",10.0,November 2021,"November 25, 2021",Small Queen Room,1,Couple,7.9,1,0,0,0,0,0,0,0,1,0,0.000636677269659064
Very Good,Around the hotel there were many homeless people,"•good location
•clean and comfortable room",8.0,June 2022,"June 22, 2022",Small Queen Room,2,Family,7.9,1,0,0,0,0,0,0,0,1,0,0.000636677269659064
Would stay again,,"Hotel was lovely, very clean and comfortable. Would stay again! Good location",10.0,May 2024,"May 14, 2024",Small Queen Room,1,Solo traveler,7.9,1,0,0,0,0,0,0,0,1,0,0.000636677269659064
"Excellent stay & even better staff, thank you!",N/A.,"The location was perfect. Can walk many places downtown. The room  even had a little kitchenette, which was nice.",10.0,February 2022,"February 10, 2022",Small Queen Room,2,Solo traveler,7.9,1,0,0,0,0,0,0,0,1,0,0.000636677269659064
It was a great experience and I would stay again,,"Nice and clean, great location and easy to check in .",10.0,February 2024,"February 22, 2024",Small Queen Room,1,Group,7.9,1,0,0,0,0,0,0,0,1,0,0.000636677269659064
Exceptional,,"This hotel has to be the best ones I’ve ever stayed at. The location was great & the view was nice. The hotel was very clean & pretty, this will be the hotel i’ll be staying at every time I’m in houston.",10.0,March 2022,"March 7, 2022",Standard Queen Room,1,Family,7.9,1,0,0,0,0,0,0,0,1,0,0.000636677269659064
"Centrally located, updated, vintage clean property.",,Location of hotel couldn’t have been better.  I was only in for the night and was able to get good rest.  The area was quiet.  The room very clean and comfortable.  I would return to this property.,10.0,August 2022,"August 29, 2022",Small Queen Room,1,Solo traveler,7.9,1,0,0,0,0,0,0,0,1,0,0.000636677269659064
Exceptional,"No paper receipt,  no coffee,","Fast check in, clean, location",10.0,August 2022,"August 28, 2022",Small Queen Room,1,Solo traveler,7.9,1,0,0,0,0,0,0,0,1,0,0.000636677269659064
It’s a great property to share with friends,There wasn’t anything that I didn’t like,we loved the location and the room,9.0,June 2023,"June 5, 2023",King Room,2,Group,7.9,1,0,0,0,0,0,0,0,1,0,0.000636677269659064
perfect stay,,"great location, everything was so clean, and the beds are so comfortable.",10.0,June 2022,"June 21, 2022",Superior Queen Room,1,Couple,7.9,1,0,0,0,0,0,0,0,1,0,0.000636677269659064
Great location if your events are downtown. Felt safe walking around the area and great bistro!,"Water availability. The reusable water bottles were empty most nights we were looking for them. There also wasn’t a mini fridge so we could keep them cool. Not a big deal about the mini fridge, but I do wish there would of been more water bottles available","Great location, we could walk everywhere downtown. We were there for a concert and baseball game. Rooms were quiet, beds were confortable",10.0,October 2023,"November 6, 2023",Standard Twin Room,3,Group,7.9,1,0,0,0,0,0,0,0,1,0,0.000636677269659064
"My stay was relaxing and therapeutic due to the hotel, staff, and location!",The cable was in and out but it could have been due to the weather.,The hotel was within walking distance of my race. I loved the location and convenience. Also the property was clean and secure.,9.0,January 2024,"January 28, 2024",Small Queen Room,1,Solo traveler,7.9,1,0,0,0,0,0,0,0,1,0,0.000636677269659064
Comfortable,,Location / cleanliness,9.0,December 2023,"December 21, 2023",Small Queen Room,1,Couple,7.9,1,0,0,0,0,0,0,0,1,0,0.000636677269659064
We stay at this location for the Astros game .,Loud neighbors kept going in and out alot .  Alot kept on slamming doors and the yelling at each other . First time no Bottles for water in the hallway . WE could not believe coffee machine was out of order Sunday morning .,Location great that why it was our 4th stay . Room and bed nice and comfortable .,7.0,July 2024,"July 15, 2024",Small Queen Room,2,Couple,7.9,1,0,0,0,0,0,0,0,1,0,0.000636677269659064
would do again,,Location to night life was within walking distance. rooms were very well kept.,10.0,December 2023,"December 27, 2023",Small Queen Room,4,Couple,7.9,1,0,0,0,0,0,0,0,1,0,0.000636677269659064
Exceptional,The TV remote did not work at all,"Location, clean and comfortable!",10.0,June 2023,"June 29, 2023",One-Room Suite with Kitchenette,2,Family,7.9,1,0,0,0,0,0,0,0,1,0,0.000636677269659064
Wonderful,It is self check in. I suggest if reception was not busy that the receptionist does the check in instead of the machine and for the self check in to be optional.,Great location. Modern and clean rooms.,9.0,July 2024,"July 6, 2024",Small Queen Room,1,Solo traveler,7.9,1,0,0,0,0,0,0,0,1,0,0.000636677269659064
Good. Weather was terrible though.,No complaints,"Clean, safe and central",10.0,January 2024,"January 21, 2024",Small Queen Room,2,Solo traveler,7.9,1,0,0,0,0,0,0,0,1,0,0.000636677269659064
Great location and comfy bed.,Interiors give old style feeling but for this price it is expected.,"Location, price and cleanliness and the comfortable bed.",7.0,May 2024,"May 28, 2024",Small Queen Room,3,Solo traveler,7.9,1,0,0,0,0,0,0,0,1,0,0.000636677269659064
Good location and large sized well equipped room,Kiosk checkin,Location near public transport. Nice large room with small kitchenette and walk in shower in the bathroom.  Water available in corridors. Bistro 7 in the hotel was a nice place to eat.,10.0,December 2023,"December 4, 2023",Superior Queen Room,1,Couple,7.9,1,0,0,0,0,0,0,0,1,0,0.000636677269659064
Would stay here again!,There were issues with the TV.,"Great location comfortable room, and love the water bottle fill up station on the floors",9.0,May 2024,"June 16, 2024",Small Queen Room,3,Couple,7.9,1,0,0,0,0,0,0,0,1,0,0.000636677269659064
120 became 190 really quick for the night,Hidden fees,Location was great and kept very clean,7.0,January 2022,"February 2, 2022",Superior Queen Room,1,Family,7.9,1,0,0,0,0,0,0,0,1,0,0.000636677269659064
120 became 190 really quick for the night,Hidden fees,Location was great and kept very clean,7.0,January 2022,"February 2, 2022",Superior Queen Room,1,Family,7.9,1,0,0,0,0,0,0,0,1,0,0.000636677269659064
"Nice property, indifferent staff & a little pricey for my liking!","Check in & parking. My daughter & I both drive pick up trucks so using the garage wasn’t an option. We had to park 5 blocks away at an open parking lot. Not very convenient! Checked ourselves in so I found it so funny that when you did have a question for the staff who were standing/sitting around, they almost seemed annoyed to assist! Having been in Hotel Management for 20+ years, seeing the hospitality industry lose its hospitable foundation is disheartening.",Convenient location to Minute Maid Park where we were attending a concert.,7.0,September 2022,"September 25, 2022",Standard Queen Room,1,Family,7.9,0,1,0,1,0,1,0,0,1,1,0.0006364227626716206
For the money Inpaid to stay at this hotel I did not receive the type of room expected for my stay and the type of ameni,"the bathroom light was not working properly I’m my room, the light in the bathroom in room 1510 (the room I was given) did not function properly. the room was very small like a college dorm for the location and price point that I paid.  the tv channel selection was not that great and also the tv stopped working on day 3 of my stay.  room service does not occur for room clean up as I found out that you have to request room services to come by and make up your bed and clean your bathroom.  the window in my room was very old, dirty and dusty.  hotel staff was not welcoming as soon as I walked through the door on day one I did not know where everyone was when I initially walked through the door.",The bed was very comfortable and the hotel staff was accommodating for the things that they lacked such as no room refrigerator or freezer for when I had leftover ice cream. hotel security was very good it made me feel safe during my stay. the WiFi was a great strong connection for when I had to work. the bathroom was very clean and the shower was amazing.,4.0,July 2022,"July 5, 2022",Mobility Accessible Standard Room,3,Couple,7.9,1,1,1,0,1,1,0,1,0,1,0.0006349523723043644
Okay for a short stay,"No towels given daily, no room cleaning even after requesting. No rubbish collection daily.",Coffee in the lobby was better than the room.,6.0,December 2023,"January 8, 2024",Superior Queen Room,2,Couple,7.9,1,1,1,1,0,0,0,0,0,0,0.0006349346121562696
Exceptional,"The rooms are small. However,  they make great use of the space given.","It's so clean, the espresso bar is self serve 24hrs. The valet attendants are so polite.",10.0,October 2021,"October 23, 2021",Standard Queen Room,1,Couple,7.9,1,1,1,1,0,0,0,0,0,0,0.0006349346121562696
Awesome!,"The water from the shower was not going down, the drain was clogged
We werent able to use the TV, wifi didnt work and we couldnt connect our phone through the TV",That we could refill our bottles of water at anytime. the lobby room was incredible for work and I loved free coffee,9.0,March 2023,"March 31, 2023",Standard Queen Room,3,Family,7.9,1,1,1,1,0,0,0,0,0,0,0.0006349346121562696
Nice,The staff are not that nice also they didn’t clean my room for the two days I stayed in,Location and below was a great restaurant,8.0,April 2024,"April 6, 2024",Standard Queen Room,3,Solo traveler,7.9,0,1,0,0,0,1,1,0,1,0,0.0006346933041204644
Very Good,Small room and bad view,Location was great,8.0,June 2022,"June 20, 2022",One-Room Suite with Kitchenette,2,Couple,7.9,0,1,0,0,0,0,0,0,1,1,0.0006344976944911726
A good hotel with great location,"The room was fine but nothing special.  I feel like it was a slightly overpriced, but I understand that you also pay for the location",Everyone was super nice and welcoming!  The location is great - it is very easy to get around the city.,9.0,March 2024,"March 25, 2024",Small Queen Room,2,Solo traveler,7.9,0,1,0,0,0,0,0,0,1,1,0.0006344976944911726
Very Good,Small room and bad view,Location was great,8.0,June 2022,"June 20, 2022",One-Room Suite with Kitchenette,2,Couple,7.9,0,1,0,0,0,0,0,0,1,1,0.0006344976944911726
Fair,The bathrooms are old-fashioned and fell apart every time I turned the sink taps on. The room had no view atall it was like I was in some banker.,Proximity to the city centre and my conference venue.,5.0,March 2023,"March 13, 2023",One-Room Suite with Kitchenette,4,Group,7.9,0,1,0,0,0,0,0,0,1,1,0.0006344976944911726
a waste of money I will NOT be returning.,the property was very outdated for the price and location. my room was very dusty and very very very small.,the location was nice.,4.0,March 2023,"March 14, 2023",King Room,1,Couple,7.9,0,1,0,0,0,0,0,0,1,1,0.0006344976944911726
Not very relaxing,We had to move rooms twice during our stay due to having issues in each room. When we would call the front desk the phone would ring for a long while before anyone would answer. It was all very inconvenient and frustrating that we had to keep moving rooms.,The location was perfect for the Astros game,2.0,April 2023,"April 17, 2023",Small Queen Room,2,Couple,7.9,0,1,0,0,0,0,0,0,1,1,0.0006344976944911726
small room and not much amendities like pool or fridge/microwave in room.,room was small and didn’t have a fridge room I received was had a awkward window view and for being my first time in the city that was something I looked forward too. over all not a bad stay,great location,6.0,July 2022,"August 1, 2022",King Room,2,Couple,7.9,0,1,0,0,0,0,0,0,1,1,0.0006344976944911726
loved it,I couldn’t find a bathroom in the lobby,loved the rooms. front desk lady was awesome and so kind,10.0,January 2023,"January 7, 2023",Two-Room Suite,1,Group,7.9,1,1,0,1,0,0,0,0,0,0,0.0006331937570995094
We will find another hotel next time we are in Houston.,They didn’t provide sheets for the sofa bed and we had to contact them multiple times before they brought them. There were stains on the sofa bed that were nasty. We booked for 4 people and struggled to get enough towels.,The room was big.,3.0,March 2022,"March 7, 2022",Two-Room Suite,2,Family,7.9,1,1,0,1,0,0,0,0,0,0,0.0006331937570995093
Exceptional,"It didn't bother me too much but to help the hotel and staff not get future negative reviews, I'd like to point out the bathroom seemed like it wasn't cleaned for a while. Just dusty that's all!","I really liked the fact that it was a small room but had everything a big room has too. It was the perfect size room for just a small weekend getaway! It was very well kept but I think the bathroom was kind of dusty. I know it's been cleaned but some areas seemed like they haven't been touched in a while. It didn't bother me too much but did raise the question ""Did they clean at all?"". I'm just pointing it out for the sake of future travelers and to help the hotel staff! But overall it was great! the staff was super helpful and had great attitudes. The valet guys always opened the door for us. Thanks!",10.0,August 2022,"August 19, 2022",Small Queen Room,3,Couple,7.9,1,1,0,0,1,1,0,0,0,1,0.0006330547228433087
Weekend stay,Paying for parking every time you to go out. $12+ or more per day.,The location was amazing. Room was small but still awesome. Restaurant down in the lobby was excellent as well.,10.0,May 2023,"June 13, 2023",Small Queen Room,2,Family,7.9,1,0,1,1,0,0,1,0,1,0,0.000631969349138753
The dirty hotel,"-the some valet parking does not know how to drive manual
-very dirty carpet
-TV remote didn't work
-one day we had no hot water","-the staff very attentive and very friendly
-the hotel in a very good location",4.0,August 2022,"August 8, 2022",One-Room Suite with Kitchenette,3,Family,7.9,0,0,0,1,1,0,0,0,1,0,0.00063086778569159
Good,There was no free parking area around the hotel. Valet parking is only available. Plus no one has replied to my msg about that.,"Comfort, location, price was great. The staff was friendly. All looked just okay.",7.0,September 2022,"September 27, 2022",Superior Queen Room,1,Solo traveler,7.9,0,0,0,1,1,0,0,0,1,0,0.0006308677856915899
Wonderful,Paying for parking,Location and accommodating staff,9.0,July 2024,"July 14, 2024",Small Queen Room,1,Couple,7.9,0,0,0,1,1,0,0,0,1,0,0.0006308677856915899
Great hotel in downtown Houston,There were some water pipe noises,The staff and location.,9.0,October 2023,"October 21, 2023",Small Queen Room,3,Family,7.9,0,0,0,1,1,0,0,0,1,0,0.0006308677856915899
Beautiful hotel and comfortable stay,Buzzing noise all night from air unit . needed it on because it become stuffy with no air on.,"Very nice and attentive staff, complimentary water , nice location",9.0,December 2023,"December 7, 2023",Superior Queen Room,1,Solo traveler,7.9,0,0,0,1,1,0,0,0,1,0,0.0006308677856915899
Great place for the price. It just needs some modernizations to be perfect.,Could have better insulation for sound proofing. Can feel the age of the decor and facilities.,Great location next the rail system. Staff was very friendly and helpful.,9.0,January 2024,"January 11, 2024",Small Queen Room,3,Solo traveler,7.9,0,0,0,1,1,0,0,0,1,0,0.0006308677856915899
wonderful stay,didn’t put enough coffee in the room,clean and beautiful hotel,10.0,February 2022,"February 6, 2022",Superior Queen Room,1,Couple,7.9,1,1,0,0,0,0,0,0,0,0,0.0006259816775703471
Bad,"There was dog poo outside my door and throughout the hallway. 
There was left over ice cream in the fridge 
The bathroom was not clean",The bed was comfortable,1.0,September 2021,"September 10, 2021",One-Room Suite with Kitchenette,1,Group,7.9,1,1,0,0,0,0,0,0,0,0,0.0006259816775703471
Good,"rooms were some what tight, bathrooms clean just not amazing","Property was clean, it was quite busy so there was a delay on room cleaning but definitely a priority for cleanliness and sanitation which I appreciate",7.0,March 2022,"March 21, 2022",Standard Twin Room,1,Solo traveler,7.9,1,1,0,0,0,0,0,0,0,0,0.000625981677570347
Would stay again if the air conditioning gets worked on,Bed was uncomfortable & the air conditioner did not work that well . It was warm in our room,It’s a nice clean hotel that’s downtown,7.0,August 2023,"August 22, 2023",Small Queen Room,1,Couple,7.9,1,1,0,0,0,0,0,0,0,0,0.000625981677570347
Wonderful,The beds are a little small,The hotel was amazing we had a hick up with the room we originally paid for a two room suite but received a one room from desk fix the issue immediately with no issues or question. I also loved the refill water stations lastly I just wish the bed was a little bigger,9.0,September 2021,"September 20, 2021",One-Room Suite with Kitchenette,2,Couple,7.9,1,1,0,0,0,0,0,0,0,0,0.000625981677570347
Wonderful,But it was me and a friend so we wanted the double beds..But the sofa bed wasn’t bad..,The upgraded room was nice..,9.0,February 2022,"February 17, 2022",Standard Twin Room,1,Group,7.9,1,1,0,0,0,0,0,0,0,0,0.000625981677570347
I would recommend and definitely stay here again.,The room was small however still enjoyed the cleanliness of the room.,The property was so close to everything and it was clean in our room!,9.0,September 2023,"October 16, 2023",Standard Queen Room,3,Group,7.9,1,1,0,0,0,0,0,0,0,0,0.000625981677570347
considering hotel in central location quiet heard metro but overall good stay,did not like shower floor but personal choice not something we have in the uk hotels,bed was very  comfortable,9.0,October 2023,"October 27, 2023",Small Queen Room,7,Solo traveler,7.9,1,1,0,0,0,0,0,0,0,0,0.000625981677570347
Happy,Clean the room,I like to clean the room,9.0,October 2021,"November 6, 2021",Small Queen Room,2,Solo traveler,7.9,1,1,0,0,0,0,0,0,0,0,0.000625981677570347
good experience overall!,the beds were interesting and the sofa bed was very hard!,in a good area! very clean as well!,8.0,April 2022,"May 4, 2022",Two-Room Suite,1,Group,7.9,1,1,0,0,0,0,0,0,0,0,0.000625981677570347
Overall the stay was simply ok Overpriced but ok,That all rooms are shared with pets,Room was ok,7.0,July 2024,"July 19, 2024",Standard Twin Room,2,Group,7.9,1,1,0,0,0,0,0,0,0,0,0.000625981677570347
My stay was good overall.,I felt cold in the room. The water fountain didn’t have much pressure in the 9th floor.,I loved to have a small microwave in the room. This made my stay comfy.,9.0,January 2024,"February 14, 2024",Small Queen Room,2,Solo traveler,7.9,1,1,0,0,0,0,0,0,0,0,0.000625981677570347
Was ok for the price we paid and location of the hotel.,"While the size of the room was great, the vent in the bedroom did not work. Had to keep the door to the main living area open to cool the bedroom.",The size of the room and amenities in the room.,8.0,October 2021,"December 14, 2021",Two-Room Suite,3,Couple,7.9,1,1,0,0,0,0,0,0,0,0,0.000625981677570347
Happy,Clean the room,I like to clean the room,9.0,October 2021,"November 6, 2021",Small Queen Room,2,Solo traveler,7.9,1,1,0,0,0,0,0,0,0,0,0.000625981677570347
I would definitely stay again. Great location. The ambiance was very nice.,No room cleaning between nights.,Very clean and accommodating.,10.0,July 2024,"July 30, 2024",One-Room Suite with Kitchenette,2,Couple,7.9,1,1,0,0,0,0,0,0,0,0,0.000625981677570347
Fair,Bed an tv,The bed was horrible an the tv wouldn’t connect to my phone as it said it would,5.0,July 2022,"July 11, 2022",One-Room Suite with Kitchenette,2,Couple,7.9,1,1,0,0,0,0,0,0,0,0,0.000625981677570347
Very Good,there was no hot water in the shower..,"room, bed",8.0,September 2022,"September 12, 2022",Small Queen Room,1,Group,7.9,1,1,0,0,0,0,0,0,0,0,0.000625981677570347
Was ok for the price we paid and location of the hotel.,"While the size of the room was great, the vent in the bedroom did not work. Had to keep the door to the main living area open to cool the bedroom.",The size of the room and amenities in the room.,8.0,October 2021,"December 14, 2021",Two-Room Suite,3,Couple,7.9,1,1,0,0,0,0,0,0,0,0,0.000625981677570347
Horrible smell everywhere.,The room and hallway smelled terribly of weed. We left. Never will stay there again.,The room and hallway smelled terribly of weed. We left.,1.0,July 2023,"September 27, 2023",Small Queen Room,2,Couple,7.9,1,1,0,0,0,0,0,0,0,0,0.000625981677570347
