Review Title,Negative Reviews,Positive Reviews,Rating,Stay Date,Review Date,Room Type,Number of Nights,Traveler Type,Overall Average Rating,Room amenities - positive,Room amenities - negative,Hotel amenities - positive,Hotel amenities - negative,Staff - positive,Staff - negative,Food and beverages - positive,Food and beverages - negative,Location - positive,Location - negative,PageRank Score
Extremely disappointing,"Black mould in the bathroom, air-conditioning unit falling of the wall, extraction fans covered in dust, carpets not properly vacuumed, top bed sheet was like plastic and shower was a bad slip hazard. Also the receptionist admitted they booked out there on-site parking to people not staying in the hotel so I had to park 1km away and the additional cost for parking was $52",Nothing was good unfortunately.  The backpackers hostel up the road was more appealing,1.0,November 2023,"November 30, 2023",Budget Queen Room,1,Couple,8,0,1,0,1,0,0,0,0,0,0,0.0004052502806715034
I even did a google review “see Luke Neal”,"Paid for on site underground parking. 
Card would not open door and room, 3 times in
one day we had to get new cards. Glad no cars
we’re waiting behind me. if business people have
meetings being late may upset the. I’m all good 
no big deal to us.",Great team excellent experience,10.0,August 2022,"August 28, 2022",Standard Twin Room,3,Solo traveler,8,0,1,0,1,0,0,0,0,0,0,0.0004052502806715034
Good,Noise from other  rooms,Close to  all amenities,7.0,May 2024,"May 14, 2024",Superior Queen Room with Solar Skylight (Unserviced),7,Couple,8,0,1,0,1,0,0,0,0,0,0,0.0004052502806715034
Bad,Worst hotel ever. Did not match the expectations at all. Not even a window in some of the rooms. Very expensive and the facilities did not match at all.,,1.0,July 2024,"July 21, 2024",Budget Queen Room,1,Family,8,0,1,0,1,0,0,0,0,0,0,0.0004052502806715033
Pleasant,"The room was extremely hot when we arrived at 9.30pm at night and the parking was full, bit scary to move car so late to  and walk back to hotel",,6.0,February 2022,"March 20, 2022",Budget Queen Room,1,Couple,8,0,1,0,1,0,0,0,0,0,0,0.0004052502806715033
Exceptional,Wish I could book a better rate direct instead of going through Booking.com all the time - staff always advise its cheaper through here which I find strange as they pay a commission..,Restaurant staff are amazing and the reason I keep coming back,10.0,April 2022,"May 14, 2022",Budget Queen Room,2,Couple,8,0,0,0,0,1,1,1,0,0,0,0.0004050325995550784
Overall good.,The staff were not that friendly.,Great rooms- good facilities!,7.0,July 2023,"July 15, 2023",Budget Queen Room,1,Solo traveler,8,1,0,1,0,0,1,0,0,0,0,0.0004044017461005227
Good,"Car parking seemed expensive. 
Breakfast choice limited , no friut/yoghurt  or tomatoes",Room had a fridge.Comfortable bed.,7.0,February 2024,"February 5, 2024",Standard Queen Room (Unserviced),3,Couple,8,1,0,0,1,0,0,0,1,0,0,0.00040284443149423376
Exceptional,Nothing to dislike,"Staff., Secure parking , private yet one minute walk to Northbridge.
Love this place.",10.0,May 2023,"June 20, 2023",Superior Twin Room with Solar Skylight,1,Couple,8,0,0,1,0,1,0,0,0,0,0,0.0003963790204787378
Very Good,"Everything was fine, no complaints","The bar was good & met some good people.
Bar staff were polite.",8.0,June 2022,"July 2, 2022",Budget Queen Room,1,Couple,8,0,0,1,0,1,0,0,0,0,0,0.0003963790204787378
Exceptional,,Friendly staff and car parking!,10.0,November 2023,"November 29, 2023",Standard Twin Room,1,Group,8,0,0,1,0,1,0,0,0,0,0,0.0003963790204787378
Exceptional,All was excelkent,Facilities and staff,10.0,August 2021,"September 3, 2021",Budget Queen Room,1,Group,8,0,0,1,0,1,0,0,0,0,0,0.0003963790204787378
"short stay but enjoyable, second visit in 2 months",na,"friendly staff
parking 
position",8.0,November 2022,"November 16, 2022",Standard Queen Room,1,Couple,8,0,0,1,0,1,0,0,0,0,0,0.0003963790204787378
"Peaceful, untroubled, relaxing and private",It was all good,Polite and professional staff. Beautiful facility. Excellent meals. Really a 5 star hotel at half the cost.,10.0,February 2024,"February 19, 2024",Budget Queen Room,5,Solo traveler,8,0,0,1,0,1,0,0,0,0,0,0.0003963790204787378
Perfect stay,There wasn't anything I didn't like.,"Great value. Lovely staff. Secure easy parking. Close to free bus into city.
Everything I needed.",9.0,May 2023,"May 21, 2023",Standard Queen Room,1,Solo traveler,8,0,0,1,0,1,0,0,0,0,0,0.0003963790204787378
"Beautiful apartments, best value.",Nothing I can think of.,"Love this place, always been my favourite place to stay. Great family facilities, staff are amazing. Regularly get upgraded for free.",10.0,May 2022,"May 29, 2022",Standard Twin Room,1,Family,8,0,0,1,0,1,0,0,0,0,0,0.0003963790204787378
Very comfortable,All good good,Good bar very helpful,8.0,March 2023,"March 29, 2023",Budget Queen Room,1,Couple,8,0,0,1,0,1,0,0,0,0,0,0.0003963790204787378
Exceptional,,"Great value, exceptional staff and facilities. Thankyou for much for accommodating.",10.0,August 2023,"August 29, 2023",Budget Queen Room,1,Solo traveler,8,0,0,1,0,1,0,0,0,0,0,0.0003963790204787378
Super basic but did the job!,"We arrived at 9pm so there was no option of anything to eat. We booked the hotel specifically for the parking but when we got there, the parking was not available until 10pm when the kitchen staff left. The reception staff were helpful after I had a word with the manager.","This room was super basic but had a comfy bed, a working tv and toilet.  Last minute hotel booking for 1 night so perfect for what we needed.",8.0,April 2023,"May 31, 2023",Standard Queen Room,1,Couple,8,1,0,0,1,0,1,0,0,0,0,0.00039619736146900755
Wonderful,"Parking getting out is pretty tight. staff sort of looked me over a couple of times I felt but overall we're professional and very good.

The first person on the first day was very friendly ""shakara""? Maybe. 

The hotel is much better than it used to be. Automatic doors etc are great.

The hotel has never been terrible it's always been value and it treats people with decency. Id recommend it to people.

Food is basic but fine for breakfast and the price is right. 

I think some hotels since Covid have gotten ahead of themselves and people are reconsidering travel.

This hotel is priced fair. 

I think it is good overall maybe just a little more friendly but also it's not unfriendly.","The rooms have gotten better at least those ones and the hotel has improved overall i think

There was no bond charged to me which was good as I find hotels that now do charge one do this for no reason. Accor are the worst for that.",9.0,December 2023,"December 15, 2023",Superior Queen Room with Solar Skylight (Unserviced),5,Solo traveler,8,1,0,0,1,0,1,0,1,0,0,0.00039276288275930343
not great as it was maybe taken over by Chinese ?,room was not made up for the second time I stayed here and reception didn’t seem to care! don’t know where the very nice reception girls were but the hotel should really use them to train the guys who show no interest in good customer service,use to be a great place to stay for a quick trip but going down hill quickly! once again requested parking had been booked out and no where to unload out the front as I saw the car standing in the taxi zone had already received a ticket! so did a few trips from paid street parking!,1.0,April 2022,"June 27, 2022",Superior Queen Room with Solar Skylight,1,Couple,8,0,1,1,0,0,1,0,0,0,0,0.00039189735226700354
Other than the breakfast it was good,The small beef sausages for breakfast. They tasted a little bit funky and ended up making me quite ill,location,8.0,August 2024,"August 19, 2024",Standard Twin Room,1,Group,8,0,0,0,0,0,0,0,1,1,0,0.00039152119370256205
Pleasant,Poor food offerings. Breakfast minimal.,Location,6.0,October 2022,"November 28, 2022",Budget Queen Room,2,Solo traveler,8,0,0,0,0,0,0,0,1,1,0,0.00039152119370256205
Good place but need takeaway coffee early in morning,Having to leave early to fly out to work they dont have take away coffee available in their restaurant/bar,The comfort and location,10.0,June 2022,"June 7, 2022",Standard Twin Room,1,Solo traveler,8,0,0,0,0,0,0,0,1,1,0,0.00039152119370256205
Very Good,Breakfast finishes too early,Location,8.0,March 2022,"March 11, 2022",Budget Queen Room,1,Couple,8,0,0,0,0,0,0,0,1,1,0,0.00039152119370256205
Not satisfying at all,Terrible breakfast,Location of hotel,2.0,June 2022,"June 29, 2022",Superior Queen Room,2,Solo traveler,8,0,0,0,0,0,0,0,1,1,0,0.00039152119370256205
"Easy, central, just enough if you are not fussy","The breakfast isn’t great and you can’t just get a coffee, you have to have breakfast","Location is good if you want to see the city.
The car park is great but a bit expensive - maybe guests should get a better rate than $20 a night",7.0,April 2024,"April 18, 2024",Budget Queen Room,9,Couple,8,0,0,0,0,0,0,0,1,1,0,0.00039152119370256205
Very Good,Payment for breakfast because I felt it should be complimentary considering the price of the hotel.,Nice ambiance and nice location.,8.0,November 2023,"January 4, 2024",Budget Queen Room,1,Solo traveler,8,0,0,0,0,0,0,0,1,1,0,0.00039152119370256205
Good value for money.,Breakfast.No options for vegetarians.,safe and good location.,7.0,May 2022,"June 21, 2022",Superior Queen Room with Solar Skylight (Unserviced),3,Solo traveler,8,0,0,0,0,0,0,0,1,1,0,0.00039152119370256205
Very Good,"No  hi low milk at breakfast 4 cereal.
No brown sugar for coffee
No newspapers
No saucers for tea cups in room, placed cup on side plate it slid off plate and split all down me burning me, in a saucer for cup they don't slid",,8.0,July 2024,"July 8, 2024",Budget Queen Room,3,Couple,8,0,1,0,1,0,0,0,1,0,0,0.0003903387692191289
Bad,"We arrived from a very long drive  to find a lot of riff Raff hanging around out side the hotel .
Upon entering our room we noticed immediately the smell then how dirty it was from the walls to the floors ,  the bathroom walls on the  floor where cigarette filters in the corner  of the bathroom , smears of  god knows what on the walls of the shower a dirty bath and near the toilet roll  dirty marks on the walls and back of the doors , the bottom of the toilet was filthy . we moved the  2 single beds and there was food underneath them . In the morning my son and I woke to screaming ,crying, shouting , banging  very violent noises comming from the room across we looked out side our key hole there was a camera directly above both doors the violence continued my son and I where getting up set I had to bang on the door and tell my son to call front desk I went back into my room when finally front desk went to the room as we watched back in our room  feeling very unsafe . A woman came out crying with a baby in a pram looking very shaken and sore .
In the morning I kindly explained that the room was dirty and that we felt very unsafe they only said ""oh sorry about that ""  . I would NOT recommend this hotel at all it's dirty from top to toe and unsafe .",Nothing 🤮,1.0,November 2021,"November 12, 2021",Superior Twin Room with Solar Skylight,1,Family,8,0,1,0,1,0,0,0,1,0,0,0.0003903387692191289
Good,No view🙄,Parking is good..location is good,7.0,May 2023,"May 15, 2023",Budget Queen Room,1,Couple,8,0,0,1,0,0,0,0,0,1,1,0.000390176811140368
Exceptional,,Accommodating staff,10.0,October 2023,"October 12, 2023",Standard Queen Room,1,Couple,8,0,0,0,0,1,0,0,0,0,0,0.0003886207028581802
Bad,Nothing,"No window and notification was sort of hidden, and unfriendly stuffs forced shit up",1.0,October 2022,"October 14, 2022",Budget Queen Room,1,Solo traveler,8,0,0,0,0,1,0,0,0,0,0,0.0003886207028581802
Bad,Everything,"Very bad attitude customer services 
Not helpful people",1.0,April 2022,"April 17, 2022",Budget Queen Room,2,Solo traveler,8,0,0,0,0,1,0,0,0,0,0,0.0003886207028581802
"Really enjoyed,  will definitely stay again so central to city",Everything was good,"Staff were friendly and excellent, very helpful",10.0,February 2024,"February 28, 2024",Superior Queen Room (Unserviced),4,Solo traveler,8,0,0,0,0,1,0,0,0,0,0,0.0003886207028581802
pleasant stay no hassle ...ease of check in..highly recommend to all,,staff wr very helpful....comfort was exceptional...ease of booking and check in ...tech verification,9.0,May 2023,"May 6, 2023",Superior Queen Room (Unserviced),2,Solo traveler,8,0,0,0,0,1,0,0,0,0,0,0.0003886207028581802
Pleasant,,Service and quietness,9.0,August 2024,"August 16, 2024",Superior Queen Room,1,Group,8,0,0,0,0,1,0,0,0,0,0,0.0003886207028581802
"excellent staff, great stay",Nothing,The staff,10.0,February 2024,"February 23, 2024",Superior Queen Room,1,Solo traveler,8,0,0,0,0,1,0,0,0,0,0,0.0003886207028581802
Exceptional,The Cafe in reception is a bit overpriced for the quality,Great customer service,10.0,December 2023,"January 13, 2024",Standard Twin Room (Unserviced),2,Family,8,0,0,0,0,1,0,0,0,0,0,0.0003886207028581802
Very good,,Staff very helpful 😊,9.0,November 2023,"November 26, 2023",Budget Queen Room,1,Couple,8,0,0,0,0,1,0,0,0,0,0,0.0003886207028581802
Exceptional,,"Always friendly, polite helpful staff 😊",10.0,September 2023,"September 18, 2023",Standard Twin Room,1,Family,8,0,0,0,0,1,0,0,0,0,0,0.0003886207028581802
Exceptional,,"Staff make everything very easy, close to nightlife/eateries",10.0,November 2023,"November 5, 2023",Standard Twin Room,1,Group,8,0,0,0,0,1,0,0,0,0,0,0.0003886207028581802
Exceptional,"All good, always",Friendly staff,10.0,December 2023,"December 6, 2023",Superior Queen Room with Solar Skylight (Unserviced),2,Solo traveler,8,0,0,0,0,1,0,0,0,0,0,0.0003886207028581802
Value for price,,"Good value, great friendly service",8.0,September 2023,"October 19, 2023",Standard Queen Room (Unserviced),2,Couple,8,0,0,0,0,1,0,0,0,0,0,0.0003886207028581802
Comfortable and enjoyable,Nil,Staff were excellent,9.0,May 2022,"May 20, 2022",Standard Twin Room (Unserviced),4,Solo traveler,8,0,0,0,0,1,0,0,0,0,0,0.0003886207028581802
Friendly with value for money,,"Close to where I needed to be , Staff very friendly and it didn’t cost the earth.",9.0,May 2022,"May 24, 2022",Budget Queen Room,5,Family,8,0,0,0,0,1,0,0,0,0,0,0.0003886207028581802
Absolutely loved and would highly recommend and the staff were absolutely amazing.,,The night manager who checked us in was beyond fabulous .. friendly and courteous and made us feel extremely comfortable.,10.0,March 2024,"April 2, 2024",Family Room with Solar Skylight,1,Family,8,0,0,0,0,1,0,0,0,0,0,0.0003886207028581802
Great Hotel and Hospitality,,I left my Bose headphones at the hotel on the day i was going back and noticed that right before i board to my flight. I made an urgent call and the receptionist/staff there help me to find my stuff and managed to find it. I asked for a favor to ship back my item to my country and they did that on the day itself. It was really a good service and trust on this hotel :),9.0,July 2023,"July 6, 2023",Standard Queen Room,2,Couple,8,0,0,0,0,1,0,0,0,0,0,0.0003886207028581802
Good,Too many druggos hanging around outside needs to be policed more often.,Great staff allways look after myself as i stay often,7.0,March 2022,"March 13, 2022",Budget Queen Room,1,Couple,8,0,0,0,0,1,0,0,0,0,0,0.0003886207028581802
Exceptional,I like this hotel nothing to fault so far,Service is always great,10.0,April 2024,"April 7, 2024",Superior Queen Room with Solar Skylight,1,Couple,8,0,0,0,0,1,0,0,0,0,0,0.0003886207028581802
Very Good,Blankets were not that warm for the cold weather,Exceptional service,8.0,July 2022,"July 5, 2022",Superior Queen Room,1,Couple,8,0,0,0,0,1,0,0,0,0,0,0.0003886207028581802
it was good,i got no complain,nice staff,8.0,February 2022,"February 24, 2022",Budget Queen Room,1,Solo traveler,8,0,0,0,0,1,0,0,0,0,0,0.0003886207028581802
Excellent will let friends know its a lovely place to stay in the city,Only issue would be the pillows were too firm,Lovely friendly helpful staff.,9.0,March 2024,"March 16, 2024",Budget Queen Room,1,Couple,8,0,0,0,0,1,0,0,0,0,0,0.0003886207028581802
Wonderful,Nothing,Really hotel service,9.0,March 2022,"March 29, 2022",Standard Twin Room (Unserviced),4,Family,8,0,0,0,0,1,0,0,0,0,0,0.0003886207028581802
Very Good,Thinking about the price for long term guest…..if around 90- 100$/ night may be I will book 3-6 months don’t need rent the house,"About the hotel and stafl is nothings to complain only the guest is not respect then the face of THE GREAT SOUTHERN HOTEL come down I think 3 star hotel only. And the guest have to polite, respectful friendly with every one of can’t do like that hotel will lost the face",8.0,April 2024,"April 20, 2024",Standard Twin Room,1,Family,8,0,0,0,0,1,0,0,0,0,0,0.0003886207028581802
All goid,,"Staff assist, customer service",10.0,September 2022,"September 18, 2022",Superior Queen Room with Solar Skylight,1,Solo traveler,8,0,0,0,0,1,0,0,0,0,0,0.0003886207028581802
All good,Can’t open the window,Friendly staff,8.0,May 2022,"May 9, 2022",Budget Queen Room,3,Couple,8,0,0,0,0,1,0,0,0,0,0,0.0003886207028581802
Exceptional,,Staff are Always helpful,10.0,November 2022,"November 11, 2022",Budget Queen Room,7,Solo traveler,8,0,0,0,0,1,0,0,0,0,0,0.0003886207028581802
Great place for a stop over,Nothing,"Super friendly staff 
Close to city",9.0,August 2022,"August 18, 2022",Budget Queen Room,1,Couple,8,0,0,0,0,1,0,0,0,0,0,0.0003886207028581802
An experience,"Scum clientele,paper thin walls",Staff very friendly,3.0,April 2023,"April 24, 2023",Budget Queen Room,8,Solo traveler,8,0,0,0,0,1,0,0,0,0,0,0.0003886207028581802
Comfortable with stunning staff.,"perhaps the distance from the airport. 
Fortunately we left very early in the morning.","friendly staff
very quiet area, although not very great area.
having said that, I never felt afraid walking at night.",8.0,November 2023,"November 9, 2023",Standard Twin Room,1,Couple,8,0,0,0,0,1,0,0,0,0,0,0.0003886207028581802
Disappointing,,"The woman who answers your phone needs lessons on customer service or replaced she was rude trying to dismiss my call to tend to screaming children in the background. I tried for over 30mins to get back through on the same number as there was an error with my online booking. On leaving I could not get out of the car park as the silly paper card would not go through the machine the call button to reception did not work and I had to run back to the desk to get help this took 20mins making me late for my hospital appointment.
I arrived at 7pm left or tried to leave at 5.30am so I didn't get an opportunity to explore",4.0,April 2023,"April 12, 2023",Budget Queen Room,1,Solo traveler,8,0,0,0,0,1,0,0,0,0,0,0.0003886207028581802
Wonderful,,Friendly staff very helpful 🙂,9.0,November 2022,"November 7, 2022",Superior Queen Room with Solar Skylight,1,Couple,8,0,0,0,0,1,0,0,0,0,0,0.0003886207028581802
Wonderful,Batteries flat in TV remote,It was peaceful and staff very friendly,9.0,August 2022,"August 2, 2022",Standard Queen Room,4,Solo traveler,8,0,0,0,0,1,0,0,0,0,0,0.0003886207028581802
Very Good,,Accommodating staff. Very friendly and professional.  Will listen and try to enable requests by guests.,8.0,August 2022,"August 20, 2022",Superior Twin Room with Solar Skylight,1,Family,8,0,0,0,0,1,0,0,0,0,0,0.0003886207028581802
would definitely stay again,,"excellent value for money
not far to walk to city centre
very friendly staff",8.0,July 2022,"July 7, 2022",Budget Queen Room,1,Group,8,0,0,0,0,1,0,0,0,0,0,0.0003886207028581802
Exceptional,Nothing 800pm,Relaxed friendly staff,10.0,April 2024,"April 12, 2024",Budget Queen Room,1,Solo traveler,8,0,0,0,0,1,0,0,0,0,0,0.0003886207028581802
Very Good,No Mircowave,The staff always provided a very good service to  me.,8.0,November 2022,"November 3, 2022",Standard Twin Room,1,Family,8,0,0,0,0,1,0,0,0,0,0,0.0003886207028581802
"I'll be back, it's my new go to accommodation in Perth",,"The staff,  the service was great
Especially in 1903",8.0,May 2024,"May 18, 2024",Standard Twin Room (Unserviced),2,Family,8,0,0,0,0,1,0,0,0,0,0,0.0003886207028581802
Exceptional,,"The staff are fantastic.
This place has always looked after me at moments notice.",10.0,August 2024,"August 16, 2024",Standard Twin Room,1,Family,8,0,0,0,0,1,0,0,0,0,0,0.0003886207028581802
Exceptional,N/a,Staff and appointment,10.0,August 2024,"August 10, 2024",Superior Queen Room (Unserviced),5,Couple,8,0,0,0,0,1,0,0,0,0,0,0.0003886207028581802
Fantastic,It was good,Friendly,10.0,August 2024,"August 10, 2024",Budget Queen Room,1,Couple,8,0,0,0,0,1,0,0,0,0,0,0.0003886207028581802
happy but not the best,walls were too thin could here next door and at 1:30am wasn’t great,very accommodating staff,7.0,January 2023,"January 29, 2023",Standard Twin Room,1,Couple,8,0,0,0,0,1,0,0,0,0,0,0.0003886207028581802
Good,They are improving the hotel at this moment,Friendly staff and great position,7.0,March 2023,"March 10, 2023",Standard Twin Room,1,Family,8,0,0,0,0,1,0,0,0,0,0,0.0003886207028581802
very good stay,nothing,good staff,5.0,November 2023,"December 3, 2023",Superior Queen Room with Solar Skylight,1,Solo traveler,8,0,0,0,0,1,0,0,0,0,0,0.0003886207028581802
Exceptional,,Love this place e friendly staff 😁 lovely Allround feeling,10.0,July 2024,"July 2, 2024",Standard Twin Room,1,Family,8,0,0,0,0,1,0,0,0,0,0,0.0003886207028581802
"Definitely will be back, makes the trek from Geraldton easy and comfortable",,Certainly flashier than I expected. I thought that for what I paid it would be a pretty standard place but it was super nice and the staff were really helpful with explaining things and answering questions.,10.0,June 2024,"June 30, 2024",Budget Queen Room,1,Couple,8,0,0,0,0,1,0,0,0,0,0,0.0003886207028581802
Exceptional,,"Stay were nice and friendly. Check in was efficient and hassle free. Was a very quiet and calming atmosphere, no loud noises. Check out was simple and again the hotel reception agent was friendly and focused on the customer 100%.",10.0,August 2023,"August 15, 2023",Budget Queen Room,3,Solo traveler,8,0,0,0,0,1,0,0,0,0,0,0.0003886207028581802
Good,"no nightlight with warm tint
no window to let in natural light","friendly and helpful staff 
the blankets",7.0,March 2023,"March 20, 2023",Budget Queen Room,1,Solo traveler,8,0,0,0,0,1,0,0,0,0,0,0.0003886207028581802
will be back!,a little noisy next door,excellent staff and very helpful,9.0,April 2023,"May 22, 2023",Budget Queen Room,2,Couple,8,0,0,0,0,1,0,0,0,0,0,0.0003886207028581802
Fair,the place needs a renovation and my mattress protector had piss stains,the service was fast,5.0,March 2023,"March 31, 2023",Standard Twin Room,1,Family,8,0,0,0,0,1,0,0,0,0,0,0.0003886207028581802
Exceptional,,Staff were very kind,10.0,June 2024,"June 27, 2024",Budget Queen Room,1,Couple,8,0,0,0,0,1,0,0,0,0,0,0.0003886207028581802
Very Good,,The gentleman that checked me in provided a great level of service similar to what you would expect at a 5 star resort,8.0,May 2022,"May 29, 2022",Budget Queen Room,1,Solo traveler,8,0,0,0,0,1,0,0,0,0,0,0.0003886207028581802
Wonderful,,Staff are helpful and friendly.,9.0,March 2022,"March 16, 2022",Budget Queen Room,4,Solo traveler,8,0,0,0,0,1,0,0,0,0,0,0.0003886207028581802
Exceptional,Nothing it was what I wanted,Friendly staff,10.0,February 2022,"February 20, 2022",Superior Queen Room with Solar Skylight,1,Couple,8,0,0,0,0,1,0,0,0,0,0,0.0003886207028581802
Exceptional,,Best hotel great value and awesome staff,10.0,February 2022,"February 3, 2022",Budget Queen Room,1,Solo traveler,8,0,0,0,0,1,0,0,0,0,0,0.0003886207028581802
Exceptional,,"Super nice and kind staffs.
They're really taking care of guest that's what I always
feel.",10.0,August 2022,"August 25, 2022",Superior Twin Room with Solar Skylight,1,Solo traveler,8,0,0,0,0,1,0,0,0,0,0,0.0003886207028581802
Exceptional,,Friendly staff always willing to accommodate,10.0,March 2022,"March 16, 2022",Superior Queen Room with Solar Skylight (Unserviced),2,Couple,8,0,0,0,0,1,0,0,0,0,0,0.0003886207028581802
Exceptional,,Staff again make the place 👍,10.0,September 2022,"September 12, 2022",Standard Twin Room,2,Family,8,0,0,0,0,1,0,0,0,0,0,0.0003886207028581802
Excellent staff and service,"Nothing, everything was perfect in my honest opinion. I wish other hotels were as good as The Great Southern Hotel.",Great Southern Hotel was excellent. Staff were friendly and welcoming. Excellent security and felt very safe from the minute I got to the hotel. Definitely will stay there again and would highly recommend it to anyone.,10.0,April 2023,"April 4, 2023",Budget Queen Room,1,Solo traveler,8,0,0,0,0,1,0,0,0,0,0,0.0003886207028581802
Value for money,No complaints,"Everything was as advertised,  no complaints 
Great reception staff",9.0,May 2023,"June 28, 2023",Standard Twin Room,1,Family,8,0,0,0,0,1,0,0,0,0,0,0.0003886207028581802
Relaxing,,"Warm friendly efficent team working in reception. gives a sress free  check in and check out  
Great little eatery attached to Hotel who cook delicous meals.
Thank you for a wonderful stay",10.0,March 2023,"March 11, 2023",Superior Queen Room with Solar Skylight (Unserviced),2,Couple,8,0,0,0,0,1,0,0,0,0,0,0.0003886207028581802
Exceptional,,Hassle free check in and check out. Staff are very friendly and on top of their work,10.0,April 2022,"April 25, 2022",Budget Queen Room,1,Couple,8,0,0,0,0,1,0,0,0,0,0,0.0003886207028581802
Awesome,,Good customer service,10.0,October 2022,"October 6, 2022",Budget Queen Room,2,Solo traveler,8,0,0,0,0,1,0,0,0,0,0,0.0003886207028581802
Exceptional,,"Everyone from the staff up till the owner were incredibly friendly, helpful and accommodating.",10.0,February 2023,"March 1, 2023",Budget Queen Room,1,Couple,8,0,0,0,0,1,0,0,0,0,0,0.0003886207028581802
Wonderful,,Staff are amazing,9.0,March 2022,"March 20, 2022",Budget Queen Room,1,Family,8,0,0,0,0,1,0,0,0,0,0,0.0003886207028581802
