Review Title,Negative Reviews,Positive Reviews,Rating,Stay Date,Review Date,Room Type,Number of Nights,Traveler Type,Overall Average Rating
Exceptional,,The Staff is exceptionally friendly and helpful!,10,April 2022,"May 17, 2022",Standard Double,1,Couple,9.2
Wonderful,,Location is great,9.0,May 2022,"May 15, 2022",Standard Twin Room,1,Solo traveler,9.2
Exceptional,,"It was my second stay in the hotel and I love it 
Perfect location and beautiful hotel",10,May 2022,"May 10, 2022",Standard Twin Room,1,Family,9.2
I really like open space of this hotel and the breakfast is one of the best.,,Excellent location with really nice staff.,10,May 2022,"May 9, 2022",Family Room (1 Adult + 2 Children),2,Solo traveler,9.2
Extremely likely recommended,"Who cares, I loved my stay","I wouldn't say I like writing reviews, but here I want to. That's one of the best hotels I have ever been to before. The staff is welcoming, and breakfast is fantastic; the room is super clean. Thank you, exceptionally likely recommended!",10,May 2022,"May 8, 2022",Standard Double,2,Solo traveler,9.2
perfect.,,"room, location and massage were perfect.",10,May 2022,"May 5, 2022",Standard Double,1,Solo traveler,9.2
Fabulous relaxed stay,I would like chromecast on room tv,Friendly helpfull English speaking staff and great guy at the bar. Breakfast with complimentary champaign was fabulous,10,May 2022,"May 5, 2022",Superior Twin Room,2,Group,9.2
Exceptional,,The staff were very professional and went out of their way to be helpful.,10,May 2022,"May 4, 2022",Standard Double,3,Solo traveler,9.2
Perfect Hotel to Discover Warsaw,,"Good beds, large room, clean, perfect localisation",10,May 2022,"May 2, 2022",Standard Double,2,Couple,9.2
Great time in Warsaw,none,"Very clean, friendly stuff, great location, great atmosphere",10,May 2022,"May 1, 2022",Superior Double,3,Couple,9.2
Loved it!,nothing,"location, breakfast and service",10,April 2022,"April 30, 2022",Standard Double,1,Couple,9.2
Fancy and seamless experience.,"Noisy roadworks outside, had to relocate rooms. I understand the hotel were not told in advance, perhaps a communication channel between the hotel and the city council needs to be opened up there.",Staff very polite and make you feel important. They all spoke English well which was a big plus. Free bottle of water every day left in the room was really useful too.,9.0,April 2022,"April 26, 2022",Standard Double,2,Couple,9.2
Very Good,"The location is great but if you are very sensitive to street noise, although the windows reduce the noise very good you might prefer to book for the inner ground rooms (not facing the main street)","The Polonia Palace Hotel located just within walking distance from the main train and bus stations, 2 big shopping malls and an excellent hub to go by the great public transport anywhere else in Warsaw. We got the Superior room on the 5th fl. facing the Pałac Kultury i Nauki (what I call the communist empire state building..) Very comfortable king size bed and everything you need for a short visit. Breakfast is great, everybody can find something from the variety served. We had an early flight and the stuff arranged for us a nice breakfast box on 4 am!! Will be back",9.0,April 2022,"April 24, 2022",Standard Double,4,Couple,9.2
great location and price is good for the facilities they provide,,location to warsaw central station,8.0,April 2022,"April 24, 2022",Superior Double,1,Couple,9.2
"When prorating location, price, and service, it is definitely number 1 in the city.",None,"The location, every day cleaning, the food and the price",10,April 2022,"April 22, 2022",Standard Double,4,Couple,9.2
will def be back.,lovely hotel,fab hotel. staff very helpful and friendly and assisted with my elderly mother .,10,April 2022,"April 21, 2022",Standard Twin Room,2,Family,9.2
Wonderful,,Only spent 1 night but the room was really comfortable,9.0,February 2022,"April 20, 2022",Standard Double,1,Couple,9.2
luxury on a budget :),nothing :),"excellent sized room, amazing breakfast and perfect location! very reasonable",10,April 2022,"April 18, 2022",Standard Double,1,Couple,9.2
Amazing,Nothing it was fab,Amazing room and great value for money. Beautiful view and perfect location,10,April 2022,"April 15, 2022",Standard Double,1,Couple,9.2
Exceptional,NA,"I am replying on behalf of my mother-in-law who fled wartorn Kramatorsk in Eastern Ukraine (train station attack was recently in the news). 
She speaks no English or Polish, so was afraid to flee her country on her own.
Despite all this, she felt very welcome and well taken care of at your hotel, so thank you.",10,April 2022,"April 11, 2022",Superior Twin Room,2,Solo traveler,9.2
Wonderful,everything was ok,Friendly and supportive personnel,9.0,April 2022,"April 10, 2022",Standard Single Room,1,Solo traveler,9.2
Exceptional,,Everything!,10,April 2022,"April 10, 2022",Standard Twin Room,1,Couple,9.2
good location,,"very nice staff, good location, good breakfast.",9.0,March 2022,"March 31, 2022",Standard Single Room,21,Solo traveler,9.2
Great experience - worth the stay!,Couldn't open the windows (at least in our room). Felt the lack of fresh air at times and everything was getting dusty very easily.,Very pleasant rooms. Wonderful staff: everyone was always friendly and helpful.,9.0,March 2022,"March 30, 2022",Superior Twin Room,7,Family,9.2
Ideal choice for family trip,"Absence of hooks for towels. There were only 2 on the door, but for families it's not enough.","Perfect location, extremely clean, excellent soundproofing. We were at family room (2 adults and 2 childrens) and apartment is safe for kids: lock on windows, soft & high bed, no sharp furniture. Bed was comfortable. There are a lot of space in wardrobe. And in addition they offers nice breakfast.",10,March 2022,"March 29, 2022",Family Room (2 Adults + 2 Children),2,Family,9.2
Best deal in town,There was nothing I didn't like. I have been staying there since 2014. At that time we still got a drink voucher. That would be nice to have again since they stopped with that a few years ago ;-),"Best deal in town, best location, stylish classic, great and friendly staff. Just a five star in every category. The only thing missing is actually a pool. But again, that's something which is not really needed, the spa is great, too",10,March 2022,"March 22, 2022",Standard Double,3,Solo traveler,9.2
Thorouhly recommended 4-star hotel in the centre,"Nothing, all good.","Very large room, comfortable bed, quiet. Also speedy check-in and check-out and an option to keep to store the luggage.",9.0,March 2022,"March 21, 2022",Superior Single Room,1,Solo traveler,9.2
great weekend trip to Warsaw,not always you can find a place on a street (hotel do not have parking place),good location nice and clean place to stay,9.0,March 2022,"March 20, 2022",Standard Double,2,Couple,9.2
Perfect experience,,Everything is quiet,10,March 2022,"March 14, 2022",Superior Twin Room,1,Group,9.2
Exceptional,,Amazing place super clean feels like 5 stars not 4,10,March 2022,"March 13, 2022",Superior Twin Room,1,Couple,9.2
Very Good,Unstable wifi,,8.0,March 2022,"March 12, 2022",Superior Single Room,1,Family,9.2
a well needed refuge after fleeing Ukraine.,,"ambiance, comfort, food, location, the fact they allowed pets, good command of English, willing to help",9.0,March 2022,"March 9, 2022",Deluxe Double Room,1,Couple,9.2
Very Good,Nothing,Location was great and the room was spacious and comfortable,8.0,March 2022,"March 9, 2022",Standard Twin Room,2,Family,9.2
Exceptional,,Very efficient communication and help from staff at the reception,10,March 2022,"March 7, 2022",Standard Double,2,Family,9.2
Exceptional,,Nice hall. Rooms clean and good equipment. Fridge but bar downstairs or room service available.,10,March 2022,"March 7, 2022",Standard Double,1,Family,9.2
Exceptional,Room heating was weird. It was either too hot or too cold.,"Everything was good, the breakfast was fantastic, very convenient location.",10,March 2022,"March 7, 2022",Standard Double,2,Solo traveler,9.2
Very Good,"Courtyard view is meh...

To be honest we knew not arriving early enough / staying long enough to make upgrade worthwhile.
If staying a few days or special occasion upgrade.","Location is good very close to shopping, train station etc.
Rooms considering the price and location a good size.
Hotel is very classic which I really like.
Next time will stay a little longer so will be a fairer review as this occasion very brief so review hard.",8.0,February 2022,"March 6, 2022",Standard Double,1,Couple,9.2
Perfection,nothing to not like,"property was well positioned, exceptionally clean & comfortable- value for money same hotel would cost triple in the UK",10,February 2022,"March 2, 2022",Standard Double,1,Couple,9.2
Very nice hotel with friendly team and great rooms.,Equipment in the bathroom is quite old.,Large room really adequate for a family.,9.0,February 2022,"March 1, 2022",Family Room (2 Adults + 2 Children),1,Family,9.2
Overall a suprice to visit this hotell,The staff in the bar was very slow and could not blend a proper drink wich was sad.,"We got a perfect view of the city and something extra on our room to celebrate annaversity, 

the staff was nice and helpful,
the sauna had 24h open wich was nice.",10,February 2022,"February 28, 2022",Superior Double,1,Couple,9.2
Very Good,"Breakfast used to much nice relaxing 
Deco in room a bit tired",Stuff v helpful,8.0,February 2022,"February 27, 2022",Family Room (2 Adults + 2 Children),2,Family,9.2
Wonderful,,All is Great,9.0,February 2022,"February 25, 2022",Superior Single Room,1,Solo traveler,9.2
"Excellent, I’ll be coming back",Nothing not to like!,"Breakfast was unreal, staff was extremely friendly and helpful and met all my additional requests.",10,February 2022,"February 25, 2022",Standard Twin Room,2,Family,9.2
Wonderful,,"extremely clean room 😎
Great breakfast buffet",9.0,February 2022,"February 24, 2022",Standard Single Room,3,Solo traveler,9.2
Exceptional,Staff did not wear their facemasks properly,"Clean hotel, great breakfast",10,January 2022,"February 23, 2022",Standard Double,2,Couple,9.2
Exceptional,Oustide security  camera was right in our windows.,"Interior and exterior was amazing. Very clean room, comfortable beds, delicious food in the restaurant, polite staff. Many thanks for Hotel Receptionist Maja for warm sevice.",10,February 2022,"February 19, 2022",Standard Twin Room,2,Group,9.2
Wonderful,Not enough time to use the gym/spa,"Friendly staff
Great breakfast options
Nice food in the bar
Housekeeping fantastic
Great location for everything",9.0,February 2022,"February 17, 2022",Standard Double,3,Couple,9.2
Great location and pleasant staff.,Nothing that I can think of.,Fantastic breakfast.   Great chef at the omlet station. Wonderful selections.,10,February 2022,"February 17, 2022",Superior Double,3,Couple,9.2
Exceptional,Overall covid safe but many staff with masks under their nose,"Very clean, spacious rooms and bathrooms, comfortable beds. Our room was facing the very busy avenue (Al. Jerozolimskie) but was pin drop quiet- windows must have very good sound proofing. Very nice and helpful staff. Incredible selection for breakfast, especially given the price.",10,February 2022,"February 14, 2022",Standard Twin Room,1,Family,9.2
"Was great, thank you",,Breakfast,9.0,November 2021,"February 10, 2022",Standard Single Room,4,Solo traveler,9.2
Exceptional,,"everything perfect , in the centre , clearness , staff , room ,",10,February 2022,"February 10, 2022",Standard Double,1,Couple,9.2
"Beautiful stay, amazing view",The breakfast wasn't really to our tastes. It was fine but we found it a little expensive in comparison to what we got in other restaurants elsewhere.,"The location was perfect! Close to lots of attractions and the main train station!
Gorgeous historic building and beautiful rooms. We had the most incredible view of the Palace of Science & Culture. We received a voucher free drink each at the bar. We also received some chocolates as we were celebrating my Mam's birthday",9.0,February 2022,"February 8, 2022",Superior Twin Room,3,Family,9.2
Wonderful,,The breakfast is great.,9.0,January 2022,"January 31, 2022",Standard Twin Room,3,Group,9.2
Quick 48 hour visit to Warsaw,While the hotel itself was quiet the traffic noise was pretty bad from 5am onwards.,Very friendly staff and very clean hotel. It is located in centre of town.,10,January 2022,"January 27, 2022",Deluxe Double Room,2,Couple,9.2
Recommended,,"Excellent location, nice personell, clean and comfortable room. beautiful building bothe external and internal.",8.0,January 2022,"January 20, 2022",Standard Double,3,Solo traveler,9.2
Highly recommend,,"Great location, top notch customer service. Terrific breakfast.",8.0,January 2022,"January 20, 2022",Family Room (2 Adults + 2 Children),1,Family,9.2
Wonderful,,"Finally reopened, we can now return on this very good hotel.
Very clean, as usual.
Very friendly staff, as usual.
Outstanding breakfast, as usual.",9.0,November 2021,"January 19, 2022",Standard Single Room,2,Group,9.2
Exceptional,,"perfect hotel! location, service, rooms everything",10,January 2022,"January 17, 2022",Standard Twin Room,4,Group,9.2
Exceptional,old style,nice,10,November 2021,"January 15, 2022",Standard Double,1,Solo traveler,9.2
Exceptional,,Everything,10,January 2022,"January 12, 2022",Standard Double,1,Couple,9.2
"Absolute delight, always a nice stop before either coming back home or exploring Poland !!!",,Always absolute pleasure to stay at Polonia. This hotel combines luxury with convenience of the location and flexibility and understanding by it's staff. People are legitimate friendly and honest. Breakfast is always a highlight....it is an absolute feast and although seems expensive it feels you easily for most of the day.....skip lunch and you get your value for money....,10,January 2022,"January 8, 2022",Standard Single Room,1,Solo traveler,9.2
It was fabulous and I will come back,,Everything,9.0,January 2022,"January 7, 2022",Superior Double,4,Couple,9.2
Exceptional,,"Everything was excellent! Welcoming and friendly staff, cozy and clean rooms, delicious breakfast! Really enjoyed staying there with my family and will definitely get back there when we're next time in Warsaw:)",10,January 2022,"January 6, 2022",Deluxe Double Room,1,Family,9.2
Over all stay experience was awesome.,,"Location is great , always warm, friendly and very helpful staff. Rooms are comfortable and very clean .",10,January 2022,"January 4, 2022",Standard Twin Room,1,Solo traveler,9.2
Great quality of stay and services for a reasonable price in the city center.,No complaints - only wishes. A view from the window was not so spectacular. SPA center could have a swimming pool and/or jacuzzi area.,A proper 4-star hotel. Perfect location and great service. Rooms are very cozy and comfortable. Restaurant for a reasonable price. Health and SPA center in a good condition. Very pleasant and responsive personnel.,9.0,January 2022,"January 3, 2022",Standard Double,2,Couple,9.2
"Great stay, would recommend.",,I booked a room for my parents and they thoroughly enjoyed their stay at the hotel. Breakfast was amazing. They loved the dinner too and staff were expremely helpful.,10,January 2022,"January 2, 2022",Deluxe Double Room,2,Family,9.2
Exceptional,,"Staff is very helpful and welcoming, the hotel itself is clean and comfortable, breakfast is also great.",10,December 2021,"December 31, 2021",Standard Single Room,2,Solo traveler,9.2
A wonderful hotel in the center of Warsaw,There is no such a thing.,"A great 4 stars ⭐️ hotel , very well positioned just in the very center of Warsaw. Super polite staff, close parking ( about 40 meters walk ).
Each morning a super tasty breakfast buffet is served and one of the chefs are preparing fresh omelettes for the guests. 
The hotel is areal palace indeed. 
Very clean rooms and well equipped. 
Coffee ☕️ and tea 🍵 available in the room. 
By the way : we ate twice at the hotels 🏨 bar and the food was absolutely gorgeous and tasty. 
Definitely we’ll come back and highly recommended.",10,December 2021,"December 25, 2021",Superior Double,2,Couple,9.2
We'd love to come back to this lovely hotel!,- Too much repetitive christmas music in the halls (we stayed in December),"- Excellent breakfast and food at the restaurant
- Well-thought facilities in the room
- Appealing interior
- Surprisingly rich history of the hotel
- Friendly staff",10,December 2021,"December 25, 2021",Standard Double,2,Couple,9.2
"Excellent stay, fantastic hotel",,Loved the atmosphere of the hotel and the great service,10,December 2021,"December 24, 2021",Standard Double,1,Family,9.2
A really pleasant stay and super friendly staff. Free gym and sauna included.,,"The breakfast was amazing although if you are planning to leave really early in the morning and not be able to catch a breakfast I suggest you ask the receptionist for a lunch box, that could be prepared for you if you order it while the kitchen is still open. We were unfortunately too late.",9.0,December 2021,"December 22, 2021",Standard Twin Room,2,Group,9.2
Nice hotel in a perfect location,"Pillows and bed sheets were unpleasantly hot.
The quality of cosmetics in the bathroom was average. To connect the kettle, we needed to place it on the floor (the cable was too short to reach the socket).","Perfect location, incredible price-quality ratio. The room was big and comfortable, with a bathtub (and for us it’s very important when choosing a place to stay!)
The staff was very nice and professional!",8.0,December 2021,"December 19, 2021",Standard Double,3,Couple,9.2
Very nice hotel,all was fine,"location, friendly stuff",10,December 2021,"December 19, 2021",Standard Double,1,Couple,9.2
Exceptional,...,Amazing,10,December 2021,"December 18, 2021",Standard Double,1,Couple,9.2
"Great hotel, will probably stay again if I'm ever back to Warsaw",,"Luxurious hotel for a decent price. Great location, walking distance to old town. Superb breakfast. Polite and welcoming staff, made late checkout a breeze and provided a taxi to the airport. Fast WiFi.",9.0,December 2021,"December 15, 2021",Standard Double,2,Solo traveler,9.2
Wonderful,The room has a warm colour but sadly more on the depressing side.,The reception staff was kind.,9.0,December 2021,"December 13, 2021",Standard Single Room,1,Solo traveler,9.2
dream,,one of the best hotels I visited.,10,December 2021,"December 8, 2021",Standard Double,2,Couple,9.2
Lovely Hotel!!,,"The Hotel Polonia is a Historic hotel in Warsaw.   It was quiet and had a nice refined style.   The breakfast was excellent with an Omelet chef.   It was one of our better breakfast hotels.   In addition, the Chef they have made wonderful lunch and dinner dishes!   The hotel also had transfers to the Airport which made our stay hassle-free.   The front desk assisted us in getting an easy Covid test at the Marriott 5 minutes away.   They also helped us with information on using the local transportation trams and buses which made our stay even more fun!!!   Thank you Hotel Polonia!!   Mark & Sheri Ryan, Fort Lauderdale, Fl.  USA",10,December 2021,"December 7, 2021",Deluxe Double Room,3,Couple,9.2
Wonderful stay and an amazing place.,Everything was perfect !,A wonderful and elegant hotel. I’m always charmed by Warsaw and the hotel which is of a high standard. Staff with manners and very helpful. Thank you for a great stay. I recommend it 100%.,10,December 2021,"December 7, 2021",Standard Double,1,Couple,9.2
very enjoyable,Everything was perfect,spotlessly clean hotel in excellent location,10,December 2021,"December 7, 2021",Deluxe Double Room,2,Couple,9.2
Exceptional,,"The facilities are amazing, the staff so friendly and the room spacious. We also loved the breakfast buffet. Lastly, the bed and the mattress were divine. Would definitely recommend 🤩",10,December 2021,"December 5, 2021",Standard Double,2,Couple,9.2
Exceptional,,"Perfect location, very nice room, friendly staff, beautiful interiors and great breakfast.",10,December 2021,"December 5, 2021",Standard Double,2,Couple,9.2
I'll be back,Pillow too hard,Excellent breakfast. One of the best I've had in any hotel,10,December 2021,"December 5, 2021",Standard Twin Room,1,Family,9.2
Exceptional,,"Excellent sumptuous breakfast, perfect transport location, quality mattress and pillows.",10,November 2021,"December 4, 2021",Standard Single Room,2,Solo traveler,9.2
Beautiful hotel in great location,More vegan options for breakfast.,Beautiful and clean hotel. Polite staff. Great location.,10,December 2021,"December 3, 2021",Standard Twin Room,3,Family,9.2
Stay at Polonia Palace,"We ordered the Limo service from Modlin Airport and we were quoted €85. The driver was there ready for us, the car was neat and clean. When we pulled up to the hotel the driver asked us for cash. Not only that but €95, not the originally quoted €85. He told us that he perfers cash. Now I wouldn't complain about €10, but after a flight and arriving to the hotel at midnight,  it was offputting that we had to dig for euro. We did not complain, just paid the money. We ended up canceling the Limo service going back to the Airport because of this. Poland has Uber, the cost of an Uber to the Airport is only €25 thats Including tip.","The Palace was absolutely beautiful,  clean and great service. The breakfast buffet is a MUST!  The rooms we a good size and were also very neat and modern.",10,November 2021,"December 2, 2021",Standard Double,3,Couple,9.2
4 Stars done right!,No criticisms.,Can't fault anything really. It's a great place.,9.0,November 2021,"December 1, 2021",Standard Single Room,3,Solo traveler,9.2
Wonderful,,The staff was very accommodating and helpful and the breakfast was excellent. Everything was very clean and the hotel felt luxurious.,9.0,November 2021,"December 1, 2021",Standard Double,4,Couple,9.2
For the purpose of my trip with work in your room and spend the evening in my room the spacious room,,"Room well arranged and pleasant space, not like Ibis etc.",8.0,November 2021,"November 28, 2021",Standard Double,2,Solo traveler,9.2
Wonderful,,"This  hotel give you, everything you need. Staff ok, rooms ok, breakfast ok, location ok, restaurant ok. It's a good place to stay.",9.0,November 2021,"November 24, 2021",Standard Twin Room,4,Couple,9.2
"This is THE hotel to stay at, when in Warsaw.",There are roadorks outside just now that somewhat changes the ease to enter the hotel. This is a passing matter. Rooms are very quiet and that outdoor work did not affect anything inside the hotel.,"Excellent hotel for a weekend. Magnificent breakfast, very helpful staff. I'll definitively stay here again if/when I return to Warsaw. A very short walk from the train station and very central if you enjoy walking in the park or to the old town.",9.0,November 2021,"November 23, 2021",Standard Single Room,3,Group,9.2
"Very nice atmosphere, friendly staff, 10/10!",,"Excellent breakfast, with multiple choices.",10,November 2021,"November 23, 2021",Standard Single Room,3,Group,9.2
Exceptional,,"great location, beautiful hotel, and very friendly helpful staff.",10,October 2021,"November 21, 2021",Standard Double,4,Couple,9.2
Exceptional,,Service is superb! Can't recommend enough.,10,November 2021,"November 18, 2021",Standard Twin Room,2,Group,9.2
Exceptional,,Great breakfast. Free room upgrade (for my birthday),10,November 2021,"November 15, 2021",Standard Single Room,2,Solo traveler,9.2
Perfect,"Maybe we're very unpretentious, but we were happy with everything","Hotel in the center of city was so quiet, we felt as we are alone. Very good location, all we can reach on feet. Good service",10,November 2021,"November 7, 2021",Standard Double,2,Couple,9.2
lovely hotel,Little bit of traffic noise but not bad as the view made it worth it,"Amazing food - both breakfast and dinner, gym was great, massage was great, staff were all nice",8.0,November 2021,"November 6, 2021",Standard Double,2,Couple,9.2
Exceptional,,Excellent breakfast and perfect location for a very reasonable price.,10,October 2021,"November 4, 2021",Standard Double,1,Couple,9.2
Exceptional,Nothing.,Everything.,10,October 2021,"October 31, 2021",Standard Double,1,Couple,9.2
"The location of this hotel is its main asset. It is central, close to the train station and close to",,The location was excellent. The restaurant was very good.,8.0,September 2021,"October 29, 2021",Superior Twin Room,2,Family,9.2
Perfect hotel in Warsaw,"Nothing everything was perfect.
Staff just everything","Everything was perfect.
Location hotel staff brilliant
Handled all questions efficiently 
Accomodation clean and smart to perfection.",10,October 2021,"October 28, 2021",Standard Double,3,Solo traveler,9.2
relaxing well looked after,nothing,ambience,9.0,October 2021,"October 27, 2021",Deluxe Double Room,3,Family,9.2
Wonderful,,"Very historic.
Very modern & convenient to train & metro.",9.0,October 2021,"October 26, 2021",Standard Single Room,3,Solo traveler,9.2
second home,,"millor imposible, hotel molt centric, personal molt amable.",10,October 2021,"October 26, 2021",Standard Double,1,Couple,9.2
Amazing,,"Beautiful hotel, great location, amazing breakfast and friendly staff. Couldn't have asked for more!",10,October 2021,"October 25, 2021",Standard Double,2,Couple,9.2
Exceptional,"The mattress could have been more comfortable, they seemed a bit old.","Incredibly friendly and helpful staff, beautiful hotel, super central but still quiet rooms, wonderful sauna area. It really felt like vacation.",10,October 2021,"October 25, 2021",Standard Twin Room,2,Group,9.2
"amazing hotel, cheap stay",nothing,beautiful and clean,10,October 2021,"October 24, 2021",Standard Twin Room,2,Group,9.2
Wonderful,All great,"Great rooms, good location and great breakfast",9.0,October 2021,"October 23, 2021",Superior Single Room,1,Family,9.2
