Review Title,Negative Reviews,Positive Reviews,Rating,Stay Date,Review Date,Room Type,Number of Nights,Traveler Type,Overall Average Rating
Fair,staff was not friendly enough. There was no pen or paper to write. No water bottle provided,near to the airport,5.0,October 2022,"October 2, 2022",Junior Suite,2,Solo traveler,8.2
Find another hotel with friendlier and more competent staff,"I booked this place, non-refundable, without knowing that they will charge me a third of the price for my dog which doesn't seem very dog friendly.

Given the prices in Bogota the hotel room is already on the pricier side, especially given the hotel itself (I stayed there before). I decided not to stay and talked to the manager who promised that he would cancel the transaction which didn't happen.

It seems a strange way to retain customers. I am in Bogota quite often and will never stay there before.

Besides that the staff is rather unfriendly.",,1.0,September 2022,"September 22, 2022",Executive Twin Room,1,Solo traveler,8.2
I paid for an specific reservation but I got a completely different one when I got to the hotel,The receptionists attitude,Close to the airport,5.0,September 2022,"September 22, 2022",Executive Twin Room,1,Solo traveler,8.2
Bad,"Could not pay with credit card online, even tho credit card was saved with reservation, so my guest was force to pay the bill, very poor service from staff, will never use this hotel again.",,1.0,September 2022,"September 7, 2022",Executive Twin Room,2,Solo traveler,8.2
Disappointing,i have booked for three People including my daughters and theo have offered le only 2 beds,,4.0,August 2022,"August 21, 2022",Executive Twin Room,1,Family,8.2
long queue of people when I arrived and staff was slow. Took nearly an hour to check in. The next morning the 6 am shutt,shuttle bus was crammed with people and disorganised,close to airport,6.0,July 2022,"August 20, 2022",Executive Twin Room,1,Solo traveler,8.2
The hotel has decreased its quality,"Hotel stopped providing shampoo, conditioner, vanoty kit, and, refusing to provide additional towels","Location, and airport shuttle",5.0,July 2022,"August 5, 2022",Executive Twin Room,1,Couple,8.2
Great Hotel if you need to stay near the airport,the check out and check in takes too long,"rooms are excellent, the staff is very friendly and helpfull. The airport shuttle service is absolutely perfect.",10,July 2022,"August 1, 2022",Executive Twin Room,1,Couple,8.2
Pricey stay for what they offer.,"No early check in, girls at the reception weren’t too friendly.  First we were assigned room 317 and they were painting the wall next to the room
door.  when we got in there was no main light working. it was around 7 pm so they moved us to room 306.  painting of corridor continued until 9pm I guess.  Too noisy all night I booked at this hotel because one of the reviewers stated it wasn’t noisy.  Rooms décoration very basic.",Proximity to airport and breakfast box for early flyers.,6.0,July 2022,"July 23, 2022",Executive Twin Room,1,Couple,8.2
"If you only need a place to lay your head for a few hours and need something cheap, its an ok option","The hotel is very run down. The rooms had no amenities in them such as shampoo or soap. The beds lacked comfort and you could hear planes taking off in the background, which makes it hard to sleep but maybe a bit expected given its location.","This hotel served its purpose as it was close to the airport. We had a 6 am international flight and needed to leave the hotel at 3:50 AM to make our departure. They had a shuttle that ran every 30 minutes. This went very smoothly and was convenient. We arrived at the hotel at 10:00 PM the night before our flight so we only had to spend a few hours there, which we were grateful for. We only interacted with the hotel front desk for check-in. I wouldn't say he was unfriendly, but rather going through the motions, which was fine. His English was good.",3.0,July 2022,"July 19, 2022",Standard Quadruple Room,1,Family,8.2
Disappointing,"the bed wasn’t comfortable 
the food was bad",near the airport,4.0,July 2022,"July 10, 2022",Executive Double Room,1,Solo traveler,8.2
Brief.,There was no light on in my room when I arrived and I had no idea where the wall switches were as they are the same color as the wall paint... I had to walk through a strange room to find a lamp in the dark with no idea how to turn it on.,The shower.,6.0,June 2022,"July 2, 2022",Executive Double Room,1,Solo traveler,8.2
poor,"No heating in the room. Hot shower. Got sick with flu, both of us. Toilet was not functioning correctly (flushing)",Nothing Executive about that room.,6.0,June 2022,"June 24, 2022",Executive Double Room,3,Couple,8.2
"comfortable, calm, but take carenof mosquitos on rooms","the room had mosquitos, and they bite us","location, staff",6.0,June 2022,"June 5, 2022",Standard Quadruple Room,1,Family,8.2
This hotel qualifies for three Starts only,"Poor breakfast, Standard Spa facilities",Location,6.0,May 2022,"June 1, 2022",Standard Triple Room,4,Family,8.2
Great stay. Great staff.,no comments here,"Conveniently located, beautiful hotel.",10,May 2022,"May 18, 2022",Executive Twin Room,1,Solo traveler,8.2
not worth the price but good for getting to and from the airport.,"The hotel did not provide basic supplies for an overnight stay. No bottled water, no tissues, no toothbrush/toothpaste, no facewasher. There was a lot of disruption in the common area due to maintenance and two beds left blocking the hallway overnight.",Good location and free 24 hour shuttle to airport.,1.0,April 2022,"April 23, 2022",Executive Double Room,1,Couple,8.2
good price and location. fair price,the quality of the beds and the attention of the people,the space and the location,6.0,April 2022,"April 22, 2022",Junior Suite,2,Family,8.2
Great hotel close to the airport with great staff but beware of cigarettes' smoke smelly rooms,"Rooms were not close to each as requested other but when pushed, got them changed. The room the kids got smelled like cigarettes' smoke, it was very hard to miss and very obvious, this room was not ok and should have been tagged as such by the cleaning staff and not assigned to us. When requested, they changed it to a different one but the new one only had 2 beds instead of the requested one with 3. It was 11 pm when all of this happened and we had to get up at 5 am so this was very inconvenient for all of us.","Close to the airport, staff, packed breakfast",6.0,March 2022,"March 23, 2022",Executive Double Room,1,Family,8.2
Pleasant,"Poor breakfast. Poor quality, without variety.
Excessive restaurant prices (12.000 COP for a cup of rice, 72.000 for a salmon dish)",Very good facilities. Good location.,6.0,February 2022,"February 28, 2022",Executive Twin Room,2,Solo traveler,8.2
Fair,"The heating didnt work and it was super cold inside. I reported it, norhing happened for a while. It took one and half hour to get a technician who confirmed that it was not working indeed. Bravo. From that point on it took only half an hour to get a mobile heater. By the morning check-out the room temeprature was ok...bit too late. I was placed in building 2, which has no facilities, it looks more like a dorm. Breakfast was really bad. One vending machine only, which had nothing to eat (only sweets). Rstaurant and bar acceptable but far from good. But I guess for the price this is what I get.",The staff was more or less  helpful in solving the problems,5.0,February 2022,"February 25, 2022",Executive Twin Room,1,Solo traveler,8.2
terrible experience,doesn’t have air conditioning,nothing,1.0,February 2022,"February 13, 2022",Executive Twin Room,1,Solo traveler,8.2
Poor,The queue for check-in was to slow,The location was great,3.0,January 2022,"January 25, 2022",Executive Twin Room,1,Group,8.2
Poor,"Noise level was high, room wasn't clean, there were no items for the pet, like a water bowl or cot. The breakfast was not very good",Close to airport.  Shuttle service,3.0,January 2022,"January 10, 2022",Executive Twin Room,1,Family,8.2
Very Poor,"The bus service was unreliable and did not arrive for 50 minutes, we eventually took a taxi. on arrival the Staff were rude and the check in process took 15 minutes per person - we were in a queue of 5 people, and only one staff member on check in and refused to have more staff to help. After immigration at Bogoata Airport, the last thing you want is a long wait for a bus then 45 minutes to check in. The breakfast the next day was incredibly basic.",Comfy bed and a nice shower,2.0,December 2021,"December 23, 2021",Executive Twin Room,1,Family,8.2
Very Poor,"Check-in service is absolute non-sense, with an strange policy of prioritizing airline crews, no matter how much you have waited in queue. At my arrival in room, there was no towels, no water bottles (both normally expected in a hotel of that category and price). Those finally arrived after 1 hour of waiting and constantly claiming to the reception desk. Rooms space is quite good, but the furniture seemed dirty and neglected. Bed was confortable, though. The breakfast and the prompt shuttle service to the airport at the end justified why I ended up in a place which is, at best, just a room to sleep a flight layover.",The location of this hotel is the only reason you may want to book it. Perhaps the price will tempt you to complete the reservation. Don't let yourself fool.,2.0,December 2021,"December 3, 2021",Junior Suite,1,Couple,8.2
Poor,bathroom wc wasn’t clean enough,,3.0,November 2021,"December 1, 2021",Executive Twin Room,1,Couple,8.2
Clean hotel but.....,"A bit expensive, and although they state pet friendly, I had to pay extra when I arrived with my dog.   The phone # for the free shuttle from the airport doesn't work and I had to pay for a taxi.   The morning I left for the airport....the shuttle was full and they wouldn't allow my dog and i on, and I didn't have time to wait for the next shuttle and once again had to pay for a taxi.",The hotel was clean and the staff was pleasant. It is close to the airport which is what I needed.,5.0,November 2021,"November 28, 2021",Executive Double Room,1,Solo traveler,8.2
Fair,"55 minutes waiting for check in!!!!! Only one receptionist (poor lady had no help) she try her best.
People on line screaming of frustration. Need more employees in that area. It was very frustrating.",The room service and baggage boy excellent.,2.0,November 2021,"November 16, 2021",Executive Double Room,1,Solo traveler,8.2
Fair,"Really bad WIFI. Spa was closed due to COVID, which is not advertised. Breakfast was sufficient for me, but it would be great to have some bread for non Colombians.","Great hotel, big rooms, next to the airport, very quiet as well.",5.0,November 2021,"November 12, 2021",Executive Double Room,1,Solo traveler,8.2
Facility is good but human service is never good.,"But service is out of expectation. Don’t expect free late check out service regardless of their posting (in Q&A section, old posting though). All the time staff is very busy, took a lot of time to ask something. When I asked cleaning three times but they showed up almost in 40 minutes. Shuttle to airport arrived at arrival floor even though he knew my departure which made some trouble to go up the upper floor with many luggages without cart.",Facility is good.,4.0,November 2021,"November 10, 2021",Junior Suite,1,Couple,8.2
Will not return,Service at the restaurant breakfast buffet really bad,Proximity to airport,1.0,October 2021,"October 10, 2021",Executive Twin Room,1,Family,8.2
Perfect Airport Hotel,"The hotel is not close to the city center, though that didn’t bother me. The shower has glass that looks into the sitting area, so privacy is a bit lacking, though I was traveling alone so it wasn’t an issue.","If you need a hotel close to the airport, this is the one for you. It is located directly off the airport property and is spacious, with a beautiful lobby and very comfortable, large rooms. My room had a sitting area and bed area. The shower was very cool as well. The staff was very attentive and friendly. There was 24-hr room service and included breakfast.",10,September 2021,"September 26, 2021",Junior Suite,1,Solo traveler,8.2
Pleasant,Poor and bad mannered staf,Rooms,6.0,August 2021,"September 14, 2021",Junior Suite,1,Solo traveler,8.2
A rather dreadful experience,"We had a fairly hideous experience at Hotel Habitel Select. We were due to be collected by the hotel shuttle bus between 11-11.30 pm from the airport. It arrived after midnight.
We then checked in at reception and there was no record of our booking. We waited well over an hour when eventually they admitted the had given our rooms away to guests who had chosen to stay an extra night. We were then taken to the adjacent hotel, to be presented with two twin rooms with no space for an additional bed. We were a party of five. A totally ridiculous situation ensued whereby there appeared to be an ineffective discussion between front desk staff, and back office management. Still no resolution. Eventually on insisting on speaking to a manager, did someone appear and he reluctantly requested that the front desk staff find us an additional bed space. No apologies made and we began to wonder if there was some sort of scam going on. We got to bed after 2am, to get up three hours later for an early flight.
Breakfast was a bit of a lottery too, with no coffee available for twenty minutes. That was the least of our concerns though.
I absolutely would never stay at again Hotel Habitel Select again.",,2.0,June 2024,"July 4, 2024",Standard Triple Room,1,Group,8.2
"Still okay, but not best choice","Noisy outside because of Airport and heavy Traffic, Waterdamage, wet floor, TV not functioning","Airport Shuttle, very near to the Airport",5.0,March 2024,"March 22, 2024",Standard Quadruple Room,1,Family,8.2
Bad,"1. According to them, if a child is over 13 years old, he or she is an adult and they charge more money, something that Booking.com doesn't say anything about ($45). So was twice. Dic. 22 and jan. 2
2. It took me around 3 hours to make the check in. We arrived at 10:45 pm 1/02/24 and the check in was 1: 42 am.
My flight it was at 6 am international as you can see my family an me sleep about 1 hour.
Someone need to take responsibility and give me my money back.
3. It was only 1 receptionist ( really?).
4. First night we heard like a toilet flushing all night long.",Transportation,1.0,January 2024,"January 4, 2024",Standard Triple Room,1,Family,8.2
The price is different to the offer in booking is a fake,"Location,’staff, clean and communication with the staff",Nothing,5.0,December 2023,"December 24, 2023",Executive Double Room,1,Solo traveler,8.2
I will never stay here again.,"The windows were broken so they were open towards the airport runway. Good luck trying to sleep in that. Also, I checked in here twice in one trip. I waited 45 minutes in the line up just to get to the counter, then another 15 minutes at the counter. Terribly slow.",Not much to like about this place anymore except the beautiful woman behind the front counter who did their best to deal with exasperated guests.,1.0,October 2023,"October 31, 2023",Executive Double Room,2,Family,8.2
Mala,La atencion,Regular,2.0,October 2023,"October 7, 2023",Executive Double Room,2,Solo traveler,8.2
,,,1.0,October 2023,"October 6, 2023",Junior Suite,1,Group,8.2
bad experience at all,"Since 12 midnight an alarm was on somewhere outside at front of the building for several times bothering me and we rent the room only for 3 hours for resting instead of staying at the airport sleeping in a chair or floor but never was expecting that noise mentioned above and the staff at the check out was not concentrated on their job,one was eating with a plate full of food right in front of the lobby and other old man was given food (sandwich) to a pilot at that time of the morning (2:30 am) but finally got my check out. see ya never my dears",staff was friendly and Room was clean,2.0,April 2023,"May 6, 2023",Executive Double Room,1,Couple,8.2
disappointing,waiting time fir checking was an hour and then told it was on the other tower,close to airport,4.0,April 2023,"April 11, 2023",Executive Double Room,1,Solo traveler,8.2
Not good!,"The shuttle service to the hotel was very bad. I wasn’t allowed on two shuttles. When I finally arrived at the hotel 55 mins later, it took an hour to check in.",,3.0,January 2023,"February 1, 2023",Executive Double Room,1,Solo traveler,8.2
Terrible,"Terrible staff extremely unfriendly, shuttle doesn’t work all the time and I struggle to connect to the wifi due to a poor communication",Close to the airport,1.0,January 2023,"January 4, 2023",Executive Double Room,1,Solo traveler,8.2
Disappointed,We got on a late flight that was delayed not only did thhe made us wait long with luggage and baby in arms but also decided to help some pilots that came after us and make us wait even longer. I asked if I could please get the room and come down and do the check in just so that the baby could sleep a bit and me rest a bit my arms and it was a big NO!,"Just location is convinient, I travelled with a baby and the next morning there was not enough shuttles to take us to the airport so I was standing up holding my baby cuz’ it was extremely full not safe at all! And the stuff said they can’t do anything about it.",1.0,August 2022,"August 24, 2022",Junior Suite,1,Family,8.2
used to be better,old. used to be better,close to the airport,6.0,June 2022,"June 20, 2022",Executive Twin Room,1,Solo traveler,8.2
Dissapointed,"The restaurant staff were slow to service and some of them just ignored us. The food is expensive for the quality, too long waiting for the food. Uncomfortable room, slow wifi in the rooms, I was charged $40.00 above the amount I booked at booking, no bottles of water available in the room, even in the dispensing machine, disturbing noise while sleeping at night.",Only the some front desk and transportation staff were attentive. And staff serving breakfast.,5.0,June 2022,"June 9, 2022",Executive Twin Room,7,Family,8.2
Won't book again,The WiFi connection was poor,The suff wasn't friendly,3.0,January 2022,"January 25, 2022",Executive Twin Room,1,Group,8.2
Stay very bad+Only good bed and close to the airport+Bad customer service and not hospitable,"Poor customer service at the front desk. Poor customer service at the restaurant (except an older employee, he was great). They keep one piece of my new clothes they did not give me back (I forgot in the closet). STAY AWAY from this HABITEL hotel.","Transportation to the airport, ONLY.",1.0,December 2021,"January 5, 2022",Executive Twin Room,1,Couple,8.2
Bad,"I was waiting 1 and half hour doing the check in,o nly one employee doing all. Then I had to give all the reservation information even it was booked in this app and I stayed in that place before. The breakfast was really basic and late to open and no coffee until 30 afterwards. I will never stay there again.",Nothing,1.0,December 2021,"December 20, 2021",Executive Twin Room,1,Solo traveler,8.2
Pleasant,"It’s a bit dirty , not 5 stars .",,6.0,December 2021,"December 16, 2021",Executive Double Room,1,Solo traveler,8.2
Very Poor,"Check in process took almost 40 minutes and we were number 2 in the cue, it's s very long process. Rooms are very noisy. Restaurant is extremely expensive.",Rooms are clean.,2.0,November 2021,"November 17, 2021",Executive Twin Room,1,Family,8.2
,,,5.0,June 2021,"September 7, 2021",Junior Suite,1,Couple,8.2
extremely noisy,noise.  It was like sleeping on the runway,hotel,4.0,May 2024,"June 15, 2024",Junior Suite,1,Solo traveler,8.2
Bad,"Breakfast with very little flavor - somehow everything tasted the same or not at all.
Old wooden blinds in the room could not be closed - on one window the ropes were even completely torn - ergo sleeping with street lighting.
The room furnishings were tasteless.
I left a day early - although another night had already been paid for 
Error when booking - hotel tried to charge the overnight stay twice - I still have to check whether it worked.
The surroundings of the hotel were simply desolate.
Worst overnight stay for several years",Nothing,1.0,April 2024,"May 5, 2024",Junior Suite,4,Solo traveler,8.2
DO NOT STAY HERE - absolutely awful,"Absolutely awful place! Do not go here.

We arrived and the bed wasn’t cleaned, there was hair and crumbs in the bed. They came up and changed the sheets in front of us and accidentally took my pyjamas 

The pool was awful, you are forced to buy a swim cap despite not being told this 

Breakfast was average 

Staff weren’t helpful 

No aircon",,1.0,February 2024,"March 23, 2024",Junior Suite,1,Couple,8.2
Bad,"Unfriendly staff
Errors in reservation requests",Airport Shuttle and proximity to airport,1.0,February 2024,"February 11, 2024",Standard Triple Room,1,Family,8.2
Bad,Transportation,Nothing,1.0,December 2023,"January 4, 2024",Standard Triple Room,1,Family,8.2
The worse place I have ever stayed,"Everything is  falling  apart, no ac in the room, the sheets looked like not changed since the last guest, floors were dirty, toilette seat had poo remains I had to clean with a towel and still I did not seat on it.
It was by far the worse meal I ever had in a hotel",,1.0,November 2023,"November 21, 2023",Executive Double Room,1,Solo traveler,8.2
Scam and arrogance - pls read below.,"Scam.

They charged 60 EUR more than agreed. 
- Tried to solve at front desk within the 2 days I stayed, 0 help. 
- Supervisor look in your face in an arrogant way, and walked away. Keep looking arrogant to you for entire stay.
- Service department confirmed the money will be refunded, after I filed a complain at 27-Sep. Confirmed in writing. Today 25-10 no refund, and no further replies on my emails. 

When things goes well, they go well. But when things doesnt go well, they will not help you, let alone solve it. 

Already took actions legally.",-,1.0,September 2023,"October 25, 2023",Executive Double Room,1,Couple,8.2
Very bad experience,"Very bad welcoming  I arrived on 21:45 
Wait 30 minutes to my check in then they say that they didn't find my reservation.. they even don't try to look they say that I have to call booking.. so I started to scream on the receptionist and then what a supervise they found my reservation on the computer",Nothing,1.0,December 2022,"December 31, 2022",Executive Twin Room,1,Solo traveler,8.2
Bad,Bad comunication and bad treatment. Injust.,Nothing.,1.0,July 2022,"July 23, 2022",Executive Twin Room,1,Couple,8.2
don’t believe the shuttle service every half hour . worst stay ever,"shuttle bus claimed to come every half hour. it’s a lie, made us wait for 1 hour and half middle of the night ,called twice kept saying it’s coming but never showed up . had to take taxi at the end",nada,1.0,May 2022,"May 8, 2022",Executive Twin Room,1,Group,8.2
Bad,,"No towels, no soap in shower. Refrigerator not work. Tower 2 - room 228.",1.0,November 2021,"November 28, 2021",Executive Double Room,1,Couple,8.2
Very Poor,"Rude check in agents. Waited almost 20 minutes, while airline personnel were given VIP treatment and put ahead of all other paying guests. There are two buildings and they told me I had an ""upgraded"" room in the other building. It was pouring rain and I didn't want to walk to another building so I requested a room in the building I was in. I was told the hotel was full. Manager was nowhere to be found. Was promised a discounted bottle of wine as a way of apologizing but when I saw the bill they charged me the entire amount (about $35 USD for a lousy brand). Will not be returning.",Room was clean. That is the only positive experience I took away from the night.,2.0,July 2024,"July 22, 2024",Junior Suite,1,Solo traveler,8.2
Exceptional,,"Amazing hotel for a layover, the airport vans running all day/night were very convenient. I highly recommend staying here.",10,February 2024,"February 23, 2024",Executive Double Room,1,Solo traveler,8.2
We DID not stay at this hotel and you are trying to charge us for 2 nights stay on 2 different weeks,We DID not stay at this hotel and you are trying to charge us for 2 nights stay on 2 different weeks!!!! Refund our money!!! This was cancelled 2 months before stay!!,We DID not stay at this hotel and you are trying to charge us for 2 nights stay on 2 different weeks!!!! Refund our money!!! This was cancelled 2 months before stay!!,1.0,December 2023,"January 2, 2024",Standard Triple Room,1,Family,8.2
"If you want to stay close to the airport go elsewhere, this is one of the worst hotels I’ve stayed at","We were by reception, where two receptionists weren’t doing anything, not paying us any attention as we wanted to check in. Other people then pushed infront and got answered immediately. We then got to our room and some of the lights did not work. On check out you’d think that an airport would have a speedy check out, this was not the case we had to wait 20 minutes to leave the hotel and then dash to the airport. This genuinely was the worst place I stayed in Colombia, and I stayed in places that are rated far worse. Just to emphasise this point I don’t often write reviews but this feels justified given the appalling service",It’s close to the airport,2.0,October 2023,"November 14, 2023",Executive Twin Room,1,Group,8.2
It was ok.,Our extra bed was not prepared upon arrival. The sink didn't drain properly.,,6.0,June 2023,"June 26, 2023",Junior Suite,1,Family,8.2
Will never book with you again,"Was told I had to walk to the other building. It seems due to your rate, we have to stay in a lower quality accommodation.",Had none.,1.0,January 2023,"January 25, 2023",Executive Twin Room,1,Solo traveler,8.2
Exceptional,All good.,"Very nice staff, clean, quite,nice breakfast. I will stay again!",10,July 2022,"July 14, 2022",Junior Suite,1,Family,8.2
