Review Title,Negative Reviews,Positive Reviews,Rating,Stay Date,Review Date,Room Type,Number of Nights,Traveler Type,Overall Average Rating
"Definitely will stay again, great bargain for citizen m hotels.","Shout out to Shanya and female tattooed malay supervisor in the mornings.  Great example of hands off, mature friendliness.  However, many of the other staff members a bit too 'full-on' they kind of hover around you as they don't have a set place to stay unlike in other hotels and it seems they are overtrained to greet the guests at every moment so you end up having to return greetings about 10 times per day which gets exhausting when all you want to do is work/study in the common area.  One staff member in particular, young lady, sprinted after me as I got into the elevator, jammed herself in the closing the door just to ask if I wanted to pay for my coffee 'now or put it on your bill'.  Just a bit too 'on you.'  So yeah, their training is making many of the staff become, well, a bit creepy is the only word for it.  Nice bunch and not their fault (probably) - but they gotta chill out and calm down when they have guests lol.
Sheets and pillows seem a bit cheap and not so good, mattress good.  Everything else great.",Extended stay to 5-6 nights.  Location is great as very walkable to Bukit Bintang main areas and can get taxis to cocktail bars etc.  Great study/work area downstairs and breakfast was superb.  Good menu also throughout the day.,8.0,October 2022,"October 15, 2022",King Room,2,Solo traveler,9
Great accomodation for short term guests and digital nomads.Wifi and workspace are excellent,Minor issues- They don’t offer room service or assistance with your luggage due to staffing shortages . You have to bring your own meal upstairs.,"The location,multiple working spaces and reliable wifi.",9.0,September 2022,"October 5, 2022",King Room,4,Couple,9
underrated hotel i must say!,price wise might reduce a bit since there is no swimming pool,"the room, ambience, location all perfect
really like the light control using iPad, it feels like very genZ 
check in was smooth, free parking",10,September 2022,"October 5, 2022",King Room,1,Couple,9
excellent staff and very comfortable,nothing,"great staff, very comfortable place with living / work rooms",10,September 2022,"September 29, 2022",King Room,1,Family,9
Very Good,TV channels are not much and auto time out.,Nice bed and shower gel are nice especially AM gel.,8.0,September 2022,"September 28, 2022",King Room,2,Couple,9
Wonderful,No kettle and coffee in the room,Clean and comfortable,9.0,August 2022,"September 26, 2022",King Room,1,Couple,9
Very friendly and relaxed. Clean.,None.,"Very relaxing lobby. Clean. Close to the food market. 
Room is good. Staff was super friendly and helpful.",8.0,September 2022,"September 26, 2022",King Room,2,Group,9
Best hotel to stay at,N/A,"The place is amazing and has all you need
The rooms are sparkling clean and extremely well thought-through 
The bed is massive and very comfortable 
The room is very smart - you control everything through a remote 
We loved the place and the staff!",10,September 2022,"September 14, 2022",King Room,1,Couple,9
Very Good,"Not on them, rather I have greater expectations.",I like the set up culture with friendly staff,8.0,September 2022,"September 13, 2022",King Room,1,Couple,9
CitizenM Hotel stay,Only the TV keep on and off while watching,"Great location 
Friendly staff
Affordable 
Easy access",9.0,September 2022,"September 11, 2022",King Room,1,Couple,9
Perfect transit hotel,"1. bathroom was bit slippery, (i kinda slipped and fell)
2. bit on the pricey range. (room was fairly small bit pricey for the size you get)
3. there was no kettle in room. hence no morning coffee for me :( (they have very selective facilities in room. only mandatory items were available)(good enough)","1. the bed was super comfortable! i slept so well
2. parking was a breeze not narrow
3. very friendly staffs (kudos to Aiman!) 
4. super easy check in and check out. hassle free!!
5. i love that the sink was not in the toilet, easy to do makeup etc. 
6. i love the lighting, they were just right :)",9.0,July 2022,"August 1, 2022",King Room,1,Couple,9
Exceptional,Nothing,The staff are amazing 😊😊😊😊,10,July 2022,"July 8, 2022",King Room,10,Family,9
Wonderful,"I couldn't connect to the chromecast on the TV. Wasn't a big deal, and it might just have been an issue on my device's side.","Staff was very helpful throughout my stay. There were a few technical hiccups during check-in, but they were quickly resolved. The room and bathroom were both clean. Bed was comfortable. Location was very convenient, lots of food options nearby and the train station is a few minutes walk away.

Sound isolation was excellent. Could not hear a thing from outside the room. One night there was a very heavy downpour, yet I couldn't hear the rain while in the room.

The room is a little small. I had no issues with room size as a solo traveler, but it may be a bit cramped for two. Bathroom was quite small as well, requiring a bit of maneuvering to get around the swinging shower door.

The view from the room wasn't great. It was facing an opposing block. It wasn't a problem for me, I just kept the blinds closed. During check-in you get asked your room view preference, so if you care about having a good view, let the staff know and they'll help you choose.",9.0,June 2022,"June 18, 2022",King Room,2,Solo traveler,9
Wonderful,Slight bad smell in the room,"The modernity and comfort of the room, good location and friendly staff",9.0,May 2022,"June 10, 2022",King Room,1,Solo traveler,9
I’ll consider CitizenM as one of my favorite hotel chain.,"hope they have more facility like gym room or swimming pool, but overall it’s excellent!","everything is excellent, love the art and detailing of the space..",9.0,June 2022,"June 6, 2022",King Room,1,Couple,9
Wonderful,Late check in,The technology that they use to control everything.,9.0,June 2022,"June 6, 2022",King Room,1,Family,9
Amazing Hotel with great location in KL!,- nothing :),"- Location, Location, Location! Directly by the night market, many Restaurants & supermarkts next to hotel, City Centre is not far
- very clean & nice rooms, great shower, comfy bed
- amazing & friendly staff, they will help you with ANYTHING! 
- very fast Wifi",10,June 2022,"June 6, 2022",King Room,2,Couple,9
"staff, rooms, services … my home away from home",no smoking area. we had to go out for the smoke.,"the ambiance, the design factors the design language the blend of culture and wow factor.",10,May 2022,"May 15, 2022",King Room,8,Group,9
Can stay again next time.,Did not Provide flask.,Excellent service by staff. Greetings and smile throughout. Room cosy and functional. Excellent electronic device ipad control all room items.,8.0,May 2022,"May 15, 2022",King Room,1,Solo traveler,9
An modern and ideal choice for soloist.,"It’s a perfect choice for solo traveller. For two people, 14m2 can be a bit too crowded.",free parking was easy to access. Room facilities are fresh and friendly to use. comfortable beddings. Very clean.,9.0,April 2022,"April 22, 2022",King Room,1,Couple,9
Regular stay.,"Room controls were reliant on an iPad and iPad takes a while to load up. Over reliance on tech, made it cumbersome.","New, clean, modern and well designed",8.0,May 2024,"May 20, 2024",King Room,2,Group,9
"Overall, good but that perfect for 4 star hotel.","Breakfast was ok, not many options. Many tables were used and not clean after customers left.
Iron was in a different room, they don’t bring to your room.
Amenities were not replenished every day.
Some of the rooms have windows to the opposite corridor which was strange. I usually don’t close the curtains so whatever I do people would see it. Nevertheless, Mr. Azli assisted me to the different room with the normal window.","Shower is the highlight. The power of water was strong.
Azli was very helpful and kind as well another lady with short hair, forgot her name.
Cleaning was every day👍
Very minimalistic room with comfortable bed.
Lobby was really beautiful.",8.0,April 2024,"May 8, 2024",King Room,2,Solo traveler,9
Clean but small,Very very small rooms for the price.,Clean and not too old.,8.0,April 2024,"April 11, 2024",King Room,1,Solo traveler,9
Perfect hotel for a quick stay at KL,"Room is a bit small, no boiler in the room, a bit on the expensive side compared to what it offers","Super clean, great location, friendly staff, high tech room is a lot of fun to use, free umberllas to use",8.0,December 2023,"December 3, 2023",King Room,3,Family,9
Style over comfort - glass pod wc in bedroom!,"Very smart hotel BUT too much designer style over comfort - too many i-pads and “hi tech”. Eg Work air con from i-pad. Ok was good. Work tv from i- pad - Problem not work. Staff come to fix, has to take old control from his pocket to get tv to work !! What happens next year when no staff, just ipads lol ? Sorry, but Citizen M is a bit TOO clever.","Chic, clean, interesting library/art display on g/f. Bar (expensive despite “happy hour”). Bfast looked good (but did not try). Room small. Very comfy bed. Ridiculous glass  “pod” shower/ wc in bedroom - water leaks all over plastic floor and wet thru day when use wc.",8.0,October 2023,"October 22, 2023",King Room,2,Solo traveler,9
Superb stay !,Dusty and not as clean as in the pictures. Can improve on that area. Other than that i have no comment.,Friendly staff and very helpful. Comfortable spaces can utilise if work from home or meeting with teams. Overall was superb,8.0,July 2023,"July 30, 2023",King Room,1,Couple,9
Modern hotel in central location,"A bit pricy for what you get, no slippers in the room, no gym, no pool, no bathrobes, no shampoo and conditioner, AC was loud during the night, no separate bathroom, so the other person wakes up, when one turns the light on, transparent toilet door. You can only enter the bed from one side, a bit unpractical for the second person to get in and out of the bed.","Good shower, comfortable bed, quiet room, beautiful lobby.",8.0,July 2023,"July 30, 2023",King Room,3,Couple,9
Relaxing Stay in KL,"- Too expensive for what is included. 
- Quite small rooms","+ Super clean and very friendly staff.
+ Controlling the room entirely with an iPad is really cool. 
+ Perfect location",10,May 2023,"May 29, 2023",King Room,1,Couple,9
Very Good,Room type selection too less,Very personality wit other hotel,8.0,April 2023,"April 15, 2023",King Room,1,Family,9
Wonderful,"a tad small, but on the other side we were impressed at how spacious it felt once we got settled in and how there was a place for everything. the small space is very well thought through and made best use of!","great location, clean, stylish rooms with all the amenities you need. perfect base for exploring the city on foot, with the night market just around the corner and great brekkie/coffee places in easy walking distance.",9.0,March 2023,"March 18, 2023",King Room,1,Couple,9
Good choice for a short stay at Bt Bintang area,"Rooms didn’t really have a view even though it said city view. We could hear our next door neighbours through the walls, but only because they were particularly noisy.","Small but clean and comfortable rooms with everything you need, including a hairdryer. This is a hotel with an interesting and modern concept, and a welcoming lobby design. We also appreciated the filtered water provided on ground floor. Staff are friendly and helpful.",8.0,December 2022,"December 26, 2022",King Room,2,Couple,9
Very Good,the rooms were really small,,8.0,September 2022,"September 23, 2022",King Room,3,Couple,9
Very Good,"small room
no kettle and coffee
no slippers","very clean room, comfortable bed and very attentive staff",8.0,June 2022,"June 6, 2022",King Room,4,Couple,9
New and modern concept,comfortable Bed but for two people a bit of a tight squeeze,"everyone was very welcoming and friendly very attentive staff 
special mention to Ambassador to Mary",8.0,May 2022,"May 19, 2022",King Room,8,Couple,9
Great city location and good value for money.,Breakfast was pretty much the same for the three days we stayed there. It would have been nice to have tea making facilities in the room.,"The location was excellent. We were close to Chinatown where there were plenty of restaurants and street food. We were a very short taxi ride away from the Petronas Towers and the Pavilion Mall. The room was compact, but the bed was huge and very comfortable. The breakfast had a limited choice but was tasty. Each floor had an ironing room.",7.0,July 2024,"July 31, 2024",King Room,3,Couple,9
Good,The air-conditioned wasn't that cool even we set the lowest temperature,Everything can control by the using tablet is quite good.,7.0,March 2024,"April 24, 2024",King Room,2,Couple,9
Comfortable !,The location wasn’t bad but it could have been better. The plus is the hop on hop off bus is in front of the hotel.,"Very nice hotel room, I have always liked the style of the hotel. Extremely comfortable bed and cool lighting.",7.0,April 2024,"April 9, 2024",King Room,1,Solo traveler,9
Good price quality,"The room can quickly become very small if you have 2 people, plus bags.","Friendly staff, right next to the famous street food.",7.0,September 2023,"September 18, 2023",King Room,3,Couple,9
wonderful stay with nice,electric kettle with some complimentary coffee/ tea sachets to compliment the guest would be recommended.,"nice colorful, cheerful ambience as guest enters the lobby... 
receptionist was friendly & helpful
using ipad to control lighting, tv, aircond..that is awesome
prayer mat was provided...thanks",7.0,August 2023,"August 25, 2023",King Room,2,Group,9
Fair,Heater not working and shower floor trap choked,"Functional and well organised layout with hi tech controls for lighting, air conditioning etc",5.0,August 2024,"August 12, 2024",King Room,2,Group,9
"Fair, nothing special.",Staff was slightly unwelcoming and off putting. My room had no soap in any of the dispensers and my garbage wasn’t taken out so I just believe my room was not cleaned before my stay.,Close to station,5.0,August 2024,"August 12, 2024",King Room,2,Solo traveler,9
Very comfortable and cosy and happy,No comment,Location close to landmark building,7.0,July 2024,"July 15, 2024",King Room,2,Couple,9
Good,NA,NA,7.0,June 2024,"July 2, 2024",King Room,1,Solo traveler,9
"Staff are very helpful and friendly, but the malfunction Aircon need to repair fast",Aircon at lobby was malfunctioned. And room Aircon not cold enough.,Location is very good and easy access to Bukit Bintang & Pavillon.,7.0,April 2024,"April 18, 2024",King Room,1,Family,9
Normal. staffs are polite,Being told that we are not entitled to breakfast when we already booked for it,"Bed
Parking is convenient",2.0,March 2024,"March 30, 2024",King Room,5,Couple,9
Perfect for a short stay in KL,,Fantastic location for the night food market and nightlife. Hotel is simple but good for the price. Had a great sleep here as there are blackout blinds and the bed was very comfortable.,7.0,February 2024,"February 24, 2024",King Room,1,Couple,9
Fine,,I had no breakfast but I was charged for it.,6.0,February 2024,"February 22, 2024",King Room,2,Solo traveler,9
,,,5.0,January 2024,"January 4, 2024",King Room,5,Family,9
Pleasant,"The room service is a little bit slow. We asked for slippers and had them delivered the next day. Also, it is more of a self service hotel where there is no concierge to help with luggage. In addition, iron machine is not available in the room, we had to walk down the hallway to iron our clothes in ironing room.",The room and the hotel in general is clean.,6.0,December 2023,"December 31, 2023",King Room,3,Family,9
First time staying,"When leaving the room the door not able to close properly. Have to pull hard. Otherwise the door will be unlocked if not aware. 

Coming back to the room, also facing same issue. Must push harder to get the door close properly.",The concept of your reception area and upstairs is very impressive with design of tables and chairs which giving more space to mingle around with friends Or work purposes.,7.0,December 2023,"December 19, 2023",King Room,1,Family,9
Pleasant,Room small and not for vegetarian person and family.,Location is great,6.0,August 2023,"August 24, 2023",King Room,2,Family,9
All good !!! The barista make good coffee,No twin bed room,The concept,7.0,August 2023,"August 10, 2023",King Room,2,Group,9
Great hotel but don’t feel safe as a solo traveller walking to hotel at night,"The location especially at night as it’s dark with certain strange characters, both nights there was small arguments going on outside the hotel .","The hotel was clean, modern and friendly accommodating staff",7.0,June 2023,"July 16, 2023",King Room,2,Solo traveler,9
"Eh, kind of a bummer.","I was prepared to have a small room but really. Great use of space but tiny is an understatement. With the two of us, one is standing and one is on the bed, only. No room for both of us to be standing. Try getting showered and dressed when you have to take turns standing/not being on the bed. One edge of the bed is against the window wall. Breakfast was weak. Location was not the best.",The ipad controls for lighting and shades was funky at first and then worked well.,6.0,April 2023,"June 18, 2023",King Room,4,Couple,9
The hotel itself is fine but you can get similar quality for that price with a much better location.,"I was disappointed with the location.  There is not much around the hotel other than that famous ""food street"" mentioned earlier in my review.   You really need to get a cab to see anything or access anything.  The neighborhood around the hotel is shady looking.","The hotel seemed relatively new so everything was clean and fresh looking.   There is a well-known ""food street"" within 3 minutes walking distance from the hotel which is open until late at night and actually has good food.",7.0,March 2023,"May 28, 2023",King Room,1,Solo traveler,9
"Nice, modern hotel","My door was broken. The staff knew it was broken, hence they told me to push the door when I checked in, but still gave me the room…
I literally had to foot kick the door each time in order to get in.","Nice, modern hotel with great, HUGE, comfortable beds. 
Room can be controlled by iPad. 
Convenient location in Bukit Bintang, waking distance to nice cafes and Jalan Alor. Great breakfast.",7.0,March 2023,"March 6, 2023",King Room,2,Solo traveler,9
very small room about the size of cruise room.,the room was very small and bathroom toilet was leaking,location,7.0,December 2022,"January 3, 2023",King Room,4,Couple,9
"hotel perfect, staff not really","average breakfast. 
on the 2nd night of stay, upon reaching the hotel after a concert, asked the staff at lobby whether the restaurant was still open. I was told the restaurant closes at 10pm (it was 10.30pm at the time. I then asked the receptionist is it okay to order takeout and have it at the living hall. the staff said it was okay and even stated there was a FIFA night. once the takeout has arrived, as soon as I sat on the table, another staff came, quite rude and high voice saying that no outside food is allowed in the living hall. the staff stormed off without me getting to explain I have asked about this matter earlier. I’ve approached the staff and explained, I felt the staff was a bit rude. another female staff came and change the topic to asking “oh there was a concert?”, which didn’t even try to acknowledge my explanation. I did not see any signs saying there’s no outside food allowed in the living hall at all. May I please suggest that a signage is put up VISIBLY stating no outside food allowed in the living hall. also, please train your staff proper etiquette to handle guests and standard policies of your hotel.","clean room, clean sheets, tech savvy hotel",6.0,December 2022,"December 13, 2022",King Room,2,Couple,9
nice short stay in K.L after so long covid closure,Nothing,Good location and also new hotel and valur for money. Staff very helpful,6.0,November 2022,"November 14, 2022",King Room,3,Couple,9
"Good location, very clean enough","The hotel has no boiling kettle in room, if no kettle available, please have a hot water dispenser at each level for customer needs.

Hotel newly renovated, clean but did find a dead small cockroach","Location good, Jalan Alor just 5 mins walk",5.0,October 2022,"October 24, 2022",King Room,2,Solo traveler,9
Can be better if what we didn’t like can improve,Door was hard to push open and the toilet flush wasn’t strong. Place was quite small.,Staff were very friendly and the hotel was very clean.,7.0,September 2022,"September 4, 2022",King Room,1,Couple,9
worth the money,the room door is too tight. hard to open,clean,6.0,July 2022,"July 18, 2022",King Room,1,Couple,9
Good,Waited long to check in . After 1 hour .,,7.0,June 2022,"June 10, 2022",King Room,1,Group,9
Good,Room too small,Smart function..nice window,7.0,May 2022,"May 20, 2022",King Room,1,Family,9
Almost Perfect (except for early check in),We came from an overseas flight and needed an early check in. Hotel charged us almost an additional day price (159 MYR early check in - 167.15 MYR room rate) and it doesn’t include a breakfast. We were exhausted and needed to accept it but it is not a fair price at all.,"Very helpful staff (Mary and all the team was fantastic, I can’t highlight this enough), great decoration, cleanliness, good location, cozy rooms and perfect breakfast.. Highly recommended!",7.0,May 2022,"May 4, 2022",King Room,2,Couple,9
Good,Staff a bit overbearing when entering/exiting lobby. Room service / coffee not available until 11am. Slight foisty smell near room (refuse shoot?),Comfortable bed,7.0,April 2022,"April 13, 2022",King Room,3,Family,9
"Great location, close to the metro & plenty of food options nearby.","The two thirds scale room was disappointing as was the crawl into bed. At the breakfast more cut fruit would be great. One thing that should definitely be improved upon is the placing of tea & coffee making facilities in the room , currently not available. This is not acceptable in an alleged four star establishment.","If you want to bring out your inner neck tattooed hipster, then this is the hotel for you. Duncan and his staff are very friendly and helpful. The coffee was barista made and the breakfast buffet was tasty and filling. The location is good being a short walk from the metro, food & night life. Lighting, television etc. is all controlled by an iPad. The more senior guest should probably travel with a least one grandchild to assist with the navigation of this device.",6.0,June 2024,"June 20, 2024",King Room,4,Couple,9
Okay if you spend most of your time exploring the city.,"The view from the room was quite bad and it was hard to tell if the blackout curtain was down or not at night..
Limited breakfast buffet and the coffee taste was not good. (you can get better coffee across the street). For the in-room controls, it is all done through the iPad which was annoying to use as it was quite slow and laggy, would have preferred a switch for the AC/Lights. The hotel charged me more than the price listed on booking.com without informing me. The all-day dining menu was below average, we ordered a pepperoni pizza one night and received a warmed-up ready-made pizza that came from a box at a hotel rate and took over 30 minutes.","Great location with everything being within walking distance and a bus stop in front. The hotel lobby looks very modern.
Staff were helpful with their recommendations of the area around. The room size and bed were cozy.",5.0,June 2024,"June 10, 2024",King Room,6,Couple,9
Pleasant,"Despite the limited space in the room, the AC in the lobby was not functioning.",Location and convenient shopping options nearby,6.0,April 2024,"May 21, 2024",King Room,3,Family,9
No a comfortable hotel room at all it’s just a box,"Staff not friendly or helpful  
No coffee facilities in room very small room and to watch tv on the bed only one chair
Had to crawl over my wife  to get inside of the bed not the best very disturbing for person sleeping",It’s clean,5.0,May 2024,"May 21, 2024",King Room,7,Couple,9
Not so bad at the end,Room too small with a complicated domotic system with an alarm that even if disactiveted rang every morning,Very nice lobby and location not far from city center. 15min walking distance.,7.0,February 2024,"February 13, 2024",King Room,1,Couple,9
Poor,Safety,,3.0,December 2023,"December 18, 2023",King Room,1,Family,9
Just ok. Receptionist should have more training in customer service and what to say and not to say,Service,Deco of room,4.0,June 2023,"June 21, 2023",King Room,2,Solo traveler,9
Average,"1. Unfortunately there was an issue with the aircond, apparently in our floor. Staff was nice to change the room but the new room still had the same issue. But it was quickly rectified by a staff. Suggest to do consistent checks on the facilities as it can be troublesome for some visitors who may be tired from their trip and due to the hot weather.
2. Secured my room at a slight lower price on this app but eventually payment is made at the property. Quite misleading. My supposed price on booking is 294 but was charged 311 per night upon checking in.","Near to hotspots in KL City Centre, and room’s cleanliness.",5.0,June 2023,"June 3, 2023",King Room,1,Couple,9
there is no kettle in the room..,too small,great location,6.0,April 2023,"April 24, 2023",King Room,1,Couple,9
Hotel staffs really friendly and helpful. Jalan Alor is just a short walk behind hotel for convenient street foods,there’s no kettle and drinking glasses in the room.,Room is clean,6.0,April 2023,"April 9, 2023",King Room,3,Couple,9
