Review Title,Negative Reviews,Positive Reviews,Rating,Stay Date,Review Date,Room Type,Number of Nights,Traveler Type,Overall Average Rating
Excellent hotel in a central location,Nothing that I didn't like.,"It was a fantastic hotel based in the centre of Old Town. So, everything was in walking distance, close to tourist attractions and all of the bars and restaurants. 
Super clean hotel, with a bar. We bought a bottle of wine from a shop and the bartenders gave us wine glasses and ice!
The beds were surprisingly large - small double - and super comfortable 
Beds were made, fresh towels l, bottles of water and sachets of coffee every day.
Loved that there was a hairdryer, shower gel,  shampoo and conditioner, too.",10,July 2023,"July 18, 2023",Twin Room,3,Group,8.9
Location very central for activities,,Early and late check in and out without any hassle,10,August 2024,"August 21, 2024",Queen Room,1,Group,8.9
Great Hotel in Bucharest,Nothing,"Location, spacious room, professional and friendly staff, decent breakfast",10,August 2024,"August 19, 2024",Queen Room,3,Solo traveler,8.9
"Easy to reach, well known, good service",,In the centre of night life,10,August 2024,"August 19, 2024",Queen Room,1,Group,8.9
Exceptional,,Location and staff,10,August 2024,"August 17, 2024",King Room - Mobility Accessible,2,Family,8.9
Exceptional,It could get loud outside during weekend nights.,"The Hotel is perfectly located in the Old Town Area, it's a very lively area with many outlets, restaurants, Bars and necessary amenities (Grocery stores, Pharmacies etc..) Nearby.

The hotel and the room were very comfortable, clean and spacious.",10,July 2024,"August 5, 2024",King Room,2,Family,8.9
Exceptional,,Location is good,10,July 2024,"August 3, 2024",Queen Room,2,Couple,8.9
excellent place to stay in Bucharest,,extremely friendly and helpful personnel,9.0,July 2024,"July 29, 2024",Deluxe King Room with City View,2,Group,8.9
"Prime Location, Friendly Staff,  and good Rooms",Nothing.,"The location is excellent, right next to the old town and all the good restaurants. The staff are friendly and helpful. The room is clean and spacious.",9.0,July 2024,"July 27, 2024",Queen Room,5,Solo traveler,8.9
"Excellent location, cossy room",,Excellent location.,10,July 2024,"July 26, 2024",King Room,1,Couple,8.9
It was a great stay.,The shower floor is slippery. I had to put the towel on the floor in the shower.,,9.0,July 2024,"July 25, 2024",Twin Room,2,Couple,8.9
Just perfect for a few days in Bucharest,"Consider that during weekends being right in the city old center,  the area can get a bit noisy, however if you plan to sleep early ask for a room towards the inner part of the hotel or towards the less noisy street and it will be just fine.","Is my second time staying at this hotel is for sure one of my favourite in Bicharest. The location is perfect, right at the beginning of walking streets with many restaurants nearby. Also easy to go in any direction. The reception team was very kind and willing to help and find solutions to any of my requests.",9.0,June 2024,"July 25, 2024",King Room,2,Solo traveler,8.9
Excellent place!,n/a,"Staff, location, accessibility, services, cleanness of the room.",10,July 2024,"July 22, 2024",Twin Room,2,Couple,8.9
Really enjoyed exploring the city and,Nothing,It was clean and the room was spacious the staff were really helpful.  There was a lot of choice at the breakfast buffet.,9.0,July 2024,"July 22, 2024",King Room,3,Solo traveler,8.9
Great Stay,"Having a balcony, but not able to get out onto it as windows only open partially, but not a big problem & had the same issue in another Bucharest hotel.","Location was really good, just on the edge of the pedestrian area of old city so can get a taxi straight to the hotel.  If it's your first visit to the city, the old town is where you want to be for the main attractions, restuarants, fountain show (weekend only) otherwise you could be walking for long periods which in 40 degree heat might be tiring. Stayed on a Sunday & Monday night (high floor) and no noise after midnight experienced (also stayed in another part of the city coming back & was more noise from traffic there than had here). Air con was efficient & quiet. View from room was good. Breakfast was decent. Staff friendly.",10,July 2024,"July 21, 2024",Deluxe King Room with City View,2,Solo traveler,8.9
I would take this accommodation again. Nice location not noisy but still very central,,Very modern and perfect location. Central but not noisy,9.0,July 2024,"July 16, 2024",Queen Room,2,Solo traveler,8.9
Good hotel,Nothing,"Everything is good. Location, very fast check-in, breakfast, personnel",10,July 2024,"July 14, 2024",King Room,1,Solo traveler,8.9
Exceptional,,"Clean,  great staffs, great location",10,July 2024,"July 5, 2024",Queen Room,3,Solo traveler,8.9
Exceptional,N/a,The staff were so lovely and extremely helpful.,10,July 2024,"July 4, 2024",Queen Room,2,Family,8.9
Very Good,,We received room with a direct view on the restaurant that is situated in front of the hotel. There were live concert in the restaurant in the evening and we couldn’t have a rest until the singers stoped to sing.,8.0,June 2024,"July 4, 2024",King Room,1,Couple,8.9
Wonderful,,"The location, staff was very kind",9.0,June 2024,"July 1, 2024",King Room,2,Family,8.9
Very Good,"Every thing was good about the hotel and the staff but we couldn't sleep because of the loud noise and songs coming from the nearby restaurants and buildings, which starts from 9pm and lasts till 4am.","Clean, secure and welcoming staff",8.0,June 2024,"June 28, 2024",Twin Room,2,Family,8.9
Exceptional,Only 1 washing machine works,Place,10,May 2024,"June 24, 2024",King Room,3,Family,8.9
Excellent,,Perfect location,9.0,June 2024,"June 24, 2024",Queen Room,3,Group,8.9
Excellent room and location.,,Excellent room and location.,9.0,June 2024,"June 17, 2024",Queen Room,2,Couple,8.9
Centrally located and very comfortable hotel,There was quite a loud music coming from outside in the evening (from the historical city center with bars). The hotel kindly provided the earplugs and we slept very well.,Centrally located and very comfortable hotel with delicious breakfast.,9.0,June 2024,"June 15, 2024",King Room,1,Couple,8.9
"it was a great hotel, neat and beautiful. noting bad about it !",there was conditioner missing in their fillable containers,It was very clean and comfortable the room was spacious and nice.,9.0,June 2024,"June 14, 2024",Queen Room,2,Couple,8.9
Large rooms at old town centre,"Gym is small and very cramped, even with 3 people in it it's already too packed. Bar serves only very basic cocktails - some OK, some extremely sweet.","Good breakfast buffet, with a variety of choices - additional nod to 3 coffee machines. Large, clean and comfortable rooms - and generally large, clean and comfortable hotel. Location's great: close to subway, accessible by rideshare/taxi, and still at the heart of the old town. Price is also quite reasonable for the service. Decent bar/restaurant open till late. Helpful staff.",9.0,June 2024,"June 9, 2024",King Room,1,Couple,8.9
Good location and food was excellent and good value. Would highly recommend,Non,Hotel was excellent and not to big,9.0,June 2024,"June 9, 2024",Deluxe King Room with City View,2,Couple,8.9
Exceptional,,Location was goo.  Room was good  Breakfast was good.,10,May 2024,"May 28, 2024",Twin Room,3,Family,8.9
Comfortable stay at a great location,It is odd that that the side of the bed is directly across from the door to the bathroom.,"Location is at the center of old town. Close to lots of restaurants. Spacious room. Free bottled water everyday. They clean the room ,and change the towels often.",9.0,April 2024,"May 26, 2024",Queen Room,4,Group,8.9
Wonderful,,great location,9.0,April 2024,"May 20, 2024",Queen Room,2,Solo traveler,8.9
Wonderful,,Breakfast and position,9.0,May 2024,"May 20, 2024",King Room,1,Solo traveler,8.9
Exceptional,,"Great location, very very clean, bed really comfortable",10,May 2024,"May 16, 2024",King Room,1,Group,8.9
Wonderful,,"Very central location, very clean and useful rooms.",9.0,May 2024,"May 15, 2024",King Room,3,Family,8.9
Exceptional,Nothing,Everything,10,May 2024,"May 15, 2024",Queen Room,2,Family,8.9
Perfect stay!,I wish we had at least one small window that we could open inside the room for some fresh air.,The room was very spacious and comfortable. Everything was clean and the staff was extremely friendly and helpful. Always my first choice in Bucharest!,9.0,May 2024,"May 12, 2024",Twin Room,2,Group,8.9
Number 1 Stay in Bucharest!,Food prices was a bit expensive.,"The location, short walking distance to public transportation, many sights and food places nearby. My number one priority in a lodging is comfort room: sleepily bed and rejuvenating shower. Not only they exceeded my expectations, this hotel provided a gym and laundromat. Also, food was delicious that I tried many things from their menu.",10,May 2024,"May 12, 2024",King Room,2,Solo traveler,8.9
Exceptional,Nothing,Everything,10,May 2024,"May 10, 2024",Queen Room,2,Family,8.9
It was lovely stay overall. Staff was prompt and helpful with questions. We thought the location was amazing.,"The pillows, were super uncomfortable. The buffet breakfast was not appealing",Location,8.0,May 2024,"May 6, 2024",King Room,4,Couple,8.9
Exceptional,,"Good location, friendly staff, very clean rooms. Very good sound insulation on the windows.",10,May 2024,"May 5, 2024",King Room,4,Couple,8.9
Perfect short stay in a luxury hotel,Nothing,"Great Location,Friendly Staff,
Modern New Clean Rooms.
Good Price.",10,April 2024,"May 4, 2024",Queen Room,2,Couple,8.9
"A GREAT, FRIENDLY,PROFESSIONAL OASIS IN THE CRAZINESS OF BUCUREST.",NOTHING,"EXCELLENT BREAKFAST AND THE WONDERFUL DANA AND DANNIELLE WITH THE SMILE AND HELP MADE IT EVEN BETTER.
THANK YOU DANIEL, THEODORA AT THE RECEPTION. ESPECIALLY THANKS TO  CHRISTIAN FOR ALL THE HELP,
PROFESSIONALISM  AND SMILE.WHAT A GUY!!!
THE PRIVATE DRIVER TO THE AIRPORT HIRED BY THE HOTEL WAS AN OASIS IN THE SEVERAL TERRORIZING TAXI 
EXPERIENCES  WE HAD IN BUCUREST.",10,May 2024,"May 2, 2024",Queen Room,2,Couple,8.9
Exceptional,,"amazing location, the rooms are renovated and clean",10,April 2024,"April 30, 2024",King Room,2,Solo traveler,8.9
Exceptional,,Location is perfect.... Staff is friendly and the Bar team is the best.,10,April 2024,"April 29, 2024",Queen Room,3,Couple,8.9
"Fantastic stay , would recommend to anyone.",Nothing,"Pretty much everything was perfect. The location was great and great value for money. All the Staff were very friendly and helpful when I needed something. Room was very spacious and clean with a comfortable bed. Nice view over the bank of Romania.  I didn’t have the breakfast but it looked nice from the outside. 
The two Daniels were great on reception and also Sabina. Nice gym also. Would come back.",10,April 2024,"April 24, 2024",Queen Room,3,Solo traveler,8.9
Nice and cozy hotel in the middle of historical downtown.,"My stay was a bit short , but i am sure there is nothing I would not like.","I picked this Hotel mainly because of the location, and i liked this hotel in terms of accommodations and housekeeping standards too.",10,April 2024,"April 22, 2024",Queen Room,1,Couple,8.9
Exceptional,Couldn't adjust temp in room,As described close to food area,10,March 2024,"April 22, 2024",Queen Room,1,Family,8.9
Exceptional,,Birthday cake was a very pleasant surprise 🎂,10,April 2024,"April 21, 2024",King Room,7,Family,8.9
"Loved our stay at this hotel, everything was great! Brilliant hotel! I will definitely come back.",Nothing to complain.,"Great location in the Old Town, 2min walking distance to a number of restaurants, cafes, bars and Metro line as well. Staff super friendly, clean room, excellent service and free water every day.",10,April 2024,"April 17, 2024",Twin Room,4,Group,8.9
"Central, clean and excellent service",Everything good.,"Location, staff and facilities excellent.",10,April 2024,"April 12, 2024",King Room,4,Family,8.9
Exceptional,,We loved everything. especially the breakfast and the service of the staff. Gabriella was extremely kind to the whole family and especially to our young daughter,10,March 2024,"April 11, 2024",Junior Suite,2,Family,8.9
"Loved our stay at this hotel, everything was great, food, staff, rooms & location",Nothing,Extremely well located right in the heart of the old town.,10,April 2024,"April 8, 2024",Queen Room,2,Couple,8.9
Wonderful,N/A,"Location was perfect. Hotel excellent, clean and very quiet rooms. Breakfast very good. Staff were very professional, helpful and informative",9.0,April 2024,"April 7, 2024",King Room,4,Family,8.9
Would stay here again,The restaurant offerings need more variety,,8.0,March 2024,"April 5, 2024",Queen Room,1,Solo traveler,8.9
I would like to visit hotel and city again.,,"Hotel in the heart of the city. Nice and friendly stuff, clean and breakfast was good.",10,April 2024,"April 5, 2024",Twin Room,2,Group,8.9
Very Good,Breakfast was expensive,"Friendly staff,  clean and spacious rooms and close to old town.",8.0,April 2024,"April 5, 2024",Twin Room,3,Solo traveler,8.9
It was good enough,,"Location is perfect, room is big enough and clean, bed is comfortable, shower is big enough, windows are big, day light is coming to room, employees are very kind and helpfull. Check in and check out is very easy and fast.",9.0,April 2024,"April 4, 2024",King Room,1,Solo traveler,8.9
Exceptional,No complaints at all.,Lovely clean hotel in the centre of the old town with plenty bars and restaurants only a few minutes walk  away. Staff very pleasant and helpful as well.,10,March 2024,"March 28, 2024",Queen Room,3,Couple,8.9
Wonderful,,"Location, restaurant and stuff.",9.0,March 2024,"March 24, 2024",Twin Room,1,Solo traveler,8.9
Brilliant hotel. Lovely location and friendly staff.,Prices in the bar,Location,8.0,February 2024,"March 23, 2024",Queen Room,2,Group,8.9
Clean and comfortable rooms. Great breakfast.,Noise from the club beside the hotel,The location is great. Easy walking distance to restaurants,10,March 2024,"March 20, 2024",King Room,3,Couple,8.9
Good location and good sized room very clean and new,Service of restaurant staff very poor and so so slow! Although they did compensate me for  my time and meal,The hotel was great and a very central location with a  good sized room .,8.0,January 2024,"March 16, 2024",Queen Room,3,Couple,8.9
Excellent,Nothing to say,Huge breakfast,10,March 2024,"March 16, 2024",Queen Room,2,Couple,8.9
Amazing stay,N/a,Central location. Amazing staff. Had great drinks in the hotel’s bar. Was able to get late check out.,10,March 2024,"March 12, 2024",King Room,1,Couple,8.9
Exceptional,N/a,"Location is great it is clean, staff friendly, feels secure. Good breakfest with big selection.",10,March 2024,"March 12, 2024",Queen Room,3,Couple,8.9
Great location,,"Great location in the old town, can practically walk to a number of restaurants, cafes and bars. And very interesting history around this area.",10,February 2024,"March 11, 2024",Queen Room,4,Family,8.9
Excellent,,"Nice staff, clean and comfortable",9.0,February 2024,"March 10, 2024",Queen Room,3,Family,8.9
"Wonderful stay with friendly staff - very central, clean and comfortable",,Excellent location and very comfortable,10,March 2024,"March 10, 2024",Twin Room,2,Group,8.9
"Great hotel, will come back soon",,"The property located in a great location in the old city, near restaurants and bars",10,March 2024,"March 9, 2024",Queen Room,4,Family,8.9
"Excellent location, comfortable, clean and delicious breakfast",,"Great location, the room was very comfortable and clean and the breakfast was excellent with a wide choice of food.",10,March 2024,"March 7, 2024",Queen Room,1,Family,8.9
We will stay here again if we return to Bucharest.   (We recommend you do the trip to Transalvania).,There was nothing negative about this hotel.  We thoroughly recommend this hotel (see youtube shalalala amigo for video review),Ideal location for exploring the Old Town (within five minutes walk).  The hotel is located near the Metro and in walking distance to the Old Town.   The staff were professional and friendly in reception and in the restaurant.   Housekeeping were amazing!,10,February 2024,"March 4, 2024",Queen Room,3,Couple,8.9
Exceptional,,Thank you for the flowers,10,March 2024,"March 3, 2024",King Room,1,Couple,8.9
"Great location, lovely staff",,The property is in a great location and is nice and clean,9.0,March 2024,"March 3, 2024",King Room,1,Couple,8.9
A very comfortable and pleasant stay with helpful and friendly staff.,"AC was rather loud at times and there was hair in the shower.  It was unfortunately not all cleaned up after I advised about it, maybe a more thorough inspection required for the bathroom.  Rest of the room was very clean.","Central location, easy to get around the city from the hotel.  The room was comfortable as spacious.  The front office and bar/restaurant staff were helpful and welcoming.  A special note to Cristian at the bar whose warm and kind interaction made our evening after a long day.  I also appreciated the kind apologiy note and gesture after I advised there was hair in my shower from previous guest.  Thanks to the Front Office team for that.",8.0,February 2024,"March 3, 2024",King Room,2,Group,8.9
Exceptional,,Very good! The staff was fabulous!!!  We enjoyed a lot from the hotel and uts services,10,February 2024,"March 3, 2024",Queen Room,4,Group,8.9
Perfect Location for a Oldtown Stroll,all was fine,"Good Location, clean room & not noisy",8.0,February 2024,"February 27, 2024",King Room,2,Couple,8.9
Enjoyed our time.,Windows cannot open on the 5th floor - would have liked some fresh air.,Location was great. The decor of the hotel was great.  Staff was awesome.,10,February 2024,"February 26, 2024",Queen Room,2,Group,8.9
Exceptional,,The bed was extremely comfortable.,10,February 2024,"February 23, 2024",King Room,4,Couple,8.9
Stephan you’re the best!,,Everything was perfect,10,February 2024,"February 19, 2024",Queen Room,3,Solo traveler,8.9
comfortable as expected,"my friend would have liked some black tea rather than earl grey, but other than that nothing bad!","location was perfect, room was comfortable and wasnt too noisy outside, staff were really friendly",9.0,February 2024,"February 16, 2024",Twin Room,2,Group,8.9
Exceptional,,"Exceeded my expectations, everything was impeccable, spacious, clean room, excellent service. Could not recommend more.",10,February 2024,"February 14, 2024",Twin Room,3,Family,8.9
Enjoyable stay,,"This hotel was well located for wandering around the old town, rooms were very comfortable and of a good size
Breakfast was included in our booking, there was a great choice to suit all tastes, I couldn't personally find a tea i liked, but that's  just down to preference ( I felt the breakfast tea was quite strong and bitter)
We had a drink in the hotel bar one evening which we felt was very expensive, especially compared to the local restaurants nearby
We came by train from the airport and local taxis were charging us 130 lei, per taxi ( we needed 2 as there was 4 of us and none of the taxis could fit in all our luggage)this was the cost from the train station to the hotel , luckily my daughter had the ""Uber "" app and we used them instead, at a cost of 17 lei !! So a huge difference, and he managed to fit all 4 suitcases in so we only needed one, just be aware of this",10,February 2024,"February 13, 2024",Twin Room,3,Family,8.9
Exceptional,,The location is great,10,February 2024,"February 12, 2024",Queen Room,3,Group,8.9
Great location in Bucarest..,not much,Location is excellent Breakfast is good and Hotel is very clean,8.0,January 2024,"February 12, 2024",King Room,1,Family,8.9
Excellent all round,No issues. Only would have liked the shower to be hotter.,"Excellent location, clean, safe and an excellent breakfast.
Also good value for money given the property and the location.",9.0,February 2024,"February 8, 2024",Queen Room,1,Solo traveler,8.9
Wonderful,Not enough facilities on the gym,Room is new,9.0,February 2024,"February 7, 2024",Twin Room,6,Group,8.9
"Wonderful hotel, centrally situated in the Old Town, with efficient, very friendly staff",It would be difficult to find something that we didn't like.  Everything was perfect for us.,"The location was excellent.  In the centre of the Old Town where we could just wander out of the hotel and be where we wanted to be within minutes. 
The breakfast was buffet style with everything you needed or could want. An important advantage of this hotel is that is serves breakfast from 06:30 in the morning.  This allowed us to eat before going on all day trips, which was wonderful.
The room was big and super clean. 
The staff were super friendly.  We also sampled the room service for dinner one evening and our meal was excellent.",10,February 2024,"February 6, 2024",King Room,3,Couple,8.9
Best localisation in old town. Very comfy and tidy rooms. Super friendly reception staff.,,Best localisation in old town. Very comfy and tidy rooms. Super friendly reception staff.,10,February 2024,"February 5, 2024",Twin Room,3,Group,8.9
Exceptional,,"Staff, breakfast, room, location-everything was perfect! 
Despite it is in the city center rooms are very quite!",10,January 2024,"February 5, 2024",King Room,2,Solo traveler,8.9
Exceptional,,"Staff were friendly and helpful, great location and the room was great",10,February 2024,"February 5, 2024",Twin Room,2,Group,8.9
Exceptional,Everything was perfect,"Great location, good breakfast.   Room was spacious and clean",10,November 2023,"January 31, 2024",Twin Room,3,Group,8.9
Exceptional,,"Room is extremely quiet, breakfast is amazing, location is very convenient",10,January 2024,"January 30, 2024",King Room,2,Couple,8.9
Exceptional,,The location was amazing! In the heart of the old town and everything was right on the door step! The room was beautiful! I could not recommend this hotel more!,10,January 2024,"January 29, 2024",Queen Room,2,Couple,8.9
Wonderful,,"excellent location all u expect from  an "" hilton"" hotel",9.0,January 2024,"January 28, 2024",Twin Room,1,Couple,8.9
The location was great and close to everything. Staff was very friendly and accommodating.,Nothing,Great location! Staff is excellent!,10,January 2024,"January 25, 2024",Queen Room,1,Couple,8.9
Exceptional,,Everything was amazing.,10,December 2023,"January 25, 2024",Queen Room,2,Family,8.9
We were very happy of our stay. A very nice hotel with friendly staff. If we ever go back to Bucharest we would not even,,The location is perfect. It’s right in the center of the old town and our room had a nice view of the beautiful surrounding buildings. Cafeterias and restaurants are nearby as well as Van Gogh cafeteria which is quite famous. The room was perfect. A large comfy bed and a beautiful bathroom as well. Overall the room was very clean. The staff was very friendly and they were always asking if we need anything or to clean our room. The breakfast has a variety of food and whatever we tested was pretty good.,10,January 2024,"January 24, 2024",King Room,5,Couple,8.9
Very Good,,My room was very welcoming and I appreciated the possibility of making myself a tea,8.0,November 2023,"January 16, 2024",Queen Room,1,Group,8.9
Great place to stay. Good value for money,,"Room was clean, comfortable and spacious. Breakfast was nice with plenty of choices.  staff were friendly and helpful. Location was great with loads of bars and restaurant outside the door",8.0,January 2024,"January 16, 2024",King Room,2,Couple,8.9
Exceptional,,"Amazing customer oriented service. Perfect location! Very polite and educated staff! By mistake I booked one more day that I did not use, they managed to cancel and refund the entire cost in a very reasonable time-frame! 
Thank you so much",10,December 2023,"January 15, 2024",Queen Room,2,Family,8.9
Thoroughly enjoyable.,,The staff were excellent and helpful with any advice required.,10,January 2024,"January 5, 2024",Queen Room,4,Couple,8.9
Wonderful,"The only downgrade in my book is that there was an extremely arrogant and annoying security guard during the late hours. We were sitting on the lounge and he couldn’t stop watching us (in a bad way) for hours, he was being disrespectful and used “brother” when talking to the girls. He also had a funny hairstyle making him look even more dumb and didn’t have any manners. I would absolutely suggest Hilton Garden Inn to replace him with someone else because he gives a bad impression and does noot look suitable for the job. That’s a hotel not a nightclub!","It was clean, comfortable and majority of the staff were professionals.",9.0,January 2024,"January 4, 2024",Deluxe King Room with City View,5,Couple,8.9
Exceptional service and facilities in a beautiful area in Bucharest,,"Everything was perfect. Modern room, great facilities and impeccable service by the staff! Breakfast had many choices, and the restaurant at this hotel was also really good",10,December 2023,"January 3, 2024",Queen Room,1,Family,8.9
"Wonderful time here, staff is so friendly and helpful.",Breakfast buffet,Convenient to city center.,10,January 2024,"January 2, 2024",Twin Room,6,Solo traveler,8.9
Fantastic stay. Will definitely return.,,My third time in this hotel. Location is exceptional. Staff are super friendly and ready to help. Super gluten free options for breakfast and room extremely clean.,10,November 2023,"January 2, 2024",King Room,5,Couple,8.9
Wonderful,The air conditioner was not working.,"It was a very comfortable stay, I would prefer here again.",9.0,November 2023,"January 2, 2024",Queen Room,2,Couple,8.9
Exceptional,Nothing,Everything,10,December 2023,"December 28, 2023",Twin Room,3,Group,8.9
