Review Title,Negative Reviews,Positive Reviews,Rating,Stay Date,Review Date,Room Type,Number of Nights,Traveler Type,Overall Average Rating
Perfect for a layover,"Although air conditioning is not needed in Bogota the room became very stuffy. We could've used a fan but that was not available nor was the air conditioner working. Also, the television was not working. Very strange.","The hotel is clean, staff are friendly and very helpful. The location is excellent, it is very close to the airport, the shuttle service is convenient. The restaurant food was satisfactory and breakfast buffet had a large selection. The rooms are spacious and modern.",7.0,March 2022,"March 29, 2022",Junior Suite,1,Family,8.2
Wonderful,Very nice,,9.0,March 2022,"March 28, 2022",Executive Twin Room,1,Solo traveler,8.2
Great location and good pric,Everything,Fantastic location good in everything,9.0,February 2022,"March 25, 2022",Standard Quadruple Room,1,Solo traveler,8.2
Perfect location by the airport for an early flight,,They changed me from sélect to premium.   😜,9.0,March 2022,"March 24, 2022",Executive Double Room,1,Solo traveler,8.2
Overall good to very good. Will definitely use again.,Speed of check-in - we had to wait at least 15 minutes in a queue to check-in.,"Pick-up from and return to airport is very convenient. Standard of accommodation is very good. Provision of ""breakfast to go"" given very early departure was a plus.",8.0,February 2022,"March 21, 2022",Executive Twin Room,1,Couple,8.2
clean and the location is good,staff could be more friendly,clean,7.0,March 2022,"March 21, 2022",Executive Twin Room,3,Couple,8.2
Good,,"central location (close to airport), regular shuttle connection",7.0,March 2022,"March 19, 2022",Standard Triple Room,1,Group,8.2
Wonderful,Not much to say here,"Very convenient to airport, comfortable room, great shower..room service good",9.0,March 2022,"March 15, 2022",Executive Double Room,1,Couple,8.2
Very Good,-,Location near airport,8.0,March 2022,"March 10, 2022",Executive Twin Room,1,Couple,8.2
convenient location,,everything about this hotel is perfect for travelling to the airport for a flight. really the only comment is that breakfast starts later than early flights so don't count on it if you need to leave at 6am for your flight,8.0,February 2022,"March 3, 2022",Executive Double Room,1,Couple,8.2
Recommended! Will return.,,"very comfortable beds and bathroom. Simple, and clean. very handy shuttle service from/to the airport. lovely staff.",9.0,March 2022,"March 2, 2022",Executive Twin Room,1,Couple,8.2
Fantastic overnight stay in Bogota,,"Location, Room, Bed, Cleanliness",8.0,January 2022,"March 2, 2022",Executive Double Room,1,Solo traveler,8.2
Good,Breakfast soso 🤔,Close to the airport and malls. Free transportation airport to hotel and hotel airport.,7.0,January 2022,"February 25, 2022",Executive Twin Room,2,Family,8.2
Wonderful,,Breakfast Amazing!!!,9.0,February 2022,"February 24, 2022",Executive Twin Room,2,Family,8.2
good,,close to airport,9.0,February 2022,"February 24, 2022",Executive Double Room,1,Solo traveler,8.2
Perfect for an overnight connection.,N/A,"The hotel has a shuttle picking passengers up from the airport 24/7. it was very convenient for an overnight stay due to a next-day connecting flight. I waited about 10 minutes after getting to the airport exit door and calling the hotel, before the shuttle arrived. They checked my name and reservation. Upon arrival the staff was very quick and friendly for check-in. 
The restaurant was open until midnight which was fantastic after a 17-hour trip. The burger was good although service was not super quick. They also have a 24H room service. The room was exactly as in pictures and perfectly clean. there are no coffee machines in the room but already made coffee in the lobby if needed. the hotel was very quiet and felt safe. I was able to be at 6 sharp at the airport for my 8am flight as the shuttle leaves every half hour.",9.0,February 2022,"February 23, 2022",Executive Double Room,1,Solo traveler,8.2
"Very comfortable and clean, good place to stay at the airport.",Check-in was a bit slow when we arrived at midnight.,"Very comfortable and clean, exactly what we needed for an overnight stay between connecting flights. Breakfast started at 6AM, just in time to catch our next flight.",9.0,February 2022,"February 22, 2022",Standard Triple Room,1,Group,8.2
Good,I tried to arrange for my girlfriend access to the room in advance. They kept her out. Disappointed,Near Airport,7.0,February 2022,"February 17, 2022",Executive Twin Room,1,Family,8.2
we would definitely return.,"The juices at breakfast tasted like they csme out of a box instead of being natural.  the eggs were just ok.  
  it had a business decor which could have been warmer.","the rooms were very large. it had all the amenites. very clean. great shower, beds, etc.    it is a great value. front desk was politecand helpful.",9.0,February 2022,"February 12, 2022",Executive Double Room,1,Couple,8.2
Very Good,The noise. You can hear the traffic,The stuff was super helpful and nice. The hotel is very close to the airport so it's great if you have a late or early flight,8.0,February 2022,"February 12, 2022",Executive Twin Room,1,Solo traveler,8.2
Wonderful,,"Perfect location for airport transfer and the shuttle was amazing and free! 
The staff were really friendly and accommodated our family needs.",9.0,February 2022,"February 5, 2022",Executive Twin Room,1,Family,8.2
Good place by the airport,Room needs renovation. Fridge was placed in a broken drawer. Old wardrobe.,"Just right next to the airport. Free transfer. Very kind staff. Super comfortable bed and pillows. Nice bedding and towels. Safety deposit box in the closet. Quiet room. Beautiful conference center. Lovely surroundings, loads of flowers. Warm water. Attentive staff, speaking English. Good restaurant and spa in the other part of the hotel. Lovely patio. Room service and vending machines. Lift. TV plays radio and music. Telephone and wake up calls accessible. Quick check in and check out. Clean room and bathroom. Possible to open windows and close blinds. Nice light, two lamps with warm light. Spa, gym, jacuzzi, sauna, restaurant on site. They accept cards, too.",8.0,February 2022,"February 5, 2022",Executive Twin Room,1,Solo traveler,8.2
Very Good,Rooms are not soundproof - i heard neighbours talking and their tv. Breakfast was so so…,Rooms are really international standard. not soundproof - i heard neighbours talking and their tv.,8.0,February 2022,"February 3, 2022",Executive Twin Room,1,Solo traveler,8.2
"LQMedellin, I'll be back!!!",,"Great location, friendly staff and good value overall.",8.0,November 2021,"February 3, 2022",Executive Twin Room,1,Group,8.2
Wonderful,,Excellent service! Transport provided is a plus! Clean facility,9.0,January 2022,"February 3, 2022",Executive Double Room,2,Family,8.2
Wonderful,,"The bed was comfortable, the staff was friendly, and the water pressure in the bathroom was amazing.",9.0,February 2022,"February 2, 2022",Executive Double Room,1,Couple,8.2
Great,N/A,"The airport shuttle is very helpful, team are friendly, room was comfortable and very clean, breakfast was okay",8.0,January 2022,"February 1, 2022",Executive Double Room,1,Solo traveler,8.2
Good,Transport runs every 30 minutes and not every 10 min as it was mentioned in the checkin. Also a long time line for checking in,Close to the airport,7.0,January 2022,"January 30, 2022",Executive Twin Room,1,Solo traveler,8.2
convenient location,it is quiet noise with the traffic of people leaving at night. my room wasn’t proper cleaned as I found many hairs on the floor.,the shuttle pick up at the airport is very convenient. the room was comfortable and spacious. there was complimentary water mask and toiletries.,7.0,November 2021,"January 30, 2022",Executive Double Room,1,Solo traveler,8.2
Wonderful,Everything was fine except for the fact that I booked two rooms and in fact the hotel received a booking of one room,,9.0,January 2022,"January 27, 2022",Executive Twin Room,1,Group,8.2
Very Good,"Small rooms, English not spoken.","Reasonably priced meals, close to the beach, friendly staff.",8.0,December 2021,"January 24, 2022",Executive Twin Room,2,Couple,8.2
great location and good breakfast service. The staff at the check-in desk needs some retraining,"the check in/out processes were incredibly slow, the staff was a bit rude when other guests complained about how slow the whole process was",the location and breakfast service,8.0,January 2022,"January 24, 2022",Executive Twin Room,1,Family,8.2
Beautiful hotel,The location is near to the airport the hotel is beautiful  but its around is not good area.,"The comfortable room, the cleaning and the hotel staff were the  most important issues that I liked in this hotel",8.0,January 2022,"January 23, 2022",Executive Double Room,2,Solo traveler,8.2
Very convenient,A water kettle in the room would be nice.,Super convenient after a long flight. Comfy beds. The airport shuttle was really well organized and the breakfast buffet had vegetarian options :) would go there again!,9.0,January 2022,"January 20, 2022",Executive Twin Room,1,Couple,8.2
Nice stay close to Bogota Airport,"Beds were little bit hard, but still comfortable.","Nice hotel, very close to the airport with an own shuttle. Very pleasant for a night before an early flight.",8.0,January 2022,"January 17, 2022",Executive Twin Room,1,Solo traveler,8.2
Wonderful,Some of the food for the breakfast was cold,Like everything,9.0,January 2022,"January 16, 2022",Executive Double Room,1,Family,8.2
"location was wonderful and the restaurant and bar were above average, but the staff at check in and checkout acted like",desk staff was not welcoming,location,7.0,January 2022,"January 14, 2022",Executive Twin Room,1,Couple,8.2
Very good location,,Hotel is nearby the airport and provide shutter to the airport every 30 minutes.,8.0,January 2022,"January 11, 2022",Executive Double Room,1,Solo traveler,8.2
Very Good,cost dinner,service,8.0,January 2022,"January 10, 2022",Executive Twin Room,1,Couple,8.2
Wonderful,Rooms are more run up than in premium facility9,"This time the staff was nicer, beds are awesome, clean, location, van to and from airport",9.0,January 2022,"January 9, 2022",Standard Triple Room,1,Group,8.2
AMAZING,,Ive loved this property since the first time. simply love it!,7.0,January 2022,"January 5, 2022",Executive Twin Room,2,Family,8.2
Wonderful,,The location and the shuttle service,9.0,January 2022,"January 5, 2022",Executive Double Room,1,Solo traveler,8.2
perfect airport hotel,,super convenient,9.0,January 2022,"January 4, 2022",Executive Double Room,1,Solo traveler,8.2
Wonderful,The mattress was confortable but firm and the sheets where soft.,The room was spacious and clean.,9.0,January 2022,"January 4, 2022",Executive Double Room,1,Solo traveler,8.2
"Confortable, oportuno y cómodo",Na,Na,8.0,January 2022,"January 4, 2022",Executive Twin Room,1,Family,8.2
Very Good,"Bed was too small (2 twin size) asked for a bigger bed in another room, they couldn't accommodate me",Shuttle and location to airport,8.0,January 2022,"January 4, 2022",Executive Twin Room,1,Family,8.2
Wonderful,Quiet and clean room. Good for over night stay if you depart early the next day. Breakfast was pretty good.,,9.0,January 2022,"January 3, 2022",Executive Twin Room,1,Solo traveler,8.2
"Good location, otherwise okax","Very loud music from the nearby park and the gym - feels like a night club during the day.
Breakfast is of poor quality","Very good location in La Candelaria, quite cheap.",7.0,December 2021,"January 1, 2022",Executive Double Room,1,Couple,8.2
Very Good,overall was great.,"the shuttle bus was supposed to come every 30min.  i called a few time and they said every time only 5 more minutes.  after 1,5hr I took a taxi.    sorry bad service here.",8.0,December 2021,"December 31, 2021",Executive Twin Room,1,Solo traveler,8.2
Convenient stay near the airport,Breakfast should start earlier considering that many guests stay here because they have a very early morning flight,"Location next to the Airport and easy to arrange pick up, with a van passing every 30 minutes all day long. Comfortable beds, clean room.",8.0,December 2021,"December 30, 2021",Executive Twin Room,1,Family,8.2
Wonderful,,"Best location for staying near the airport. Next door is a major car rental company (Alamo, National), which is very convenient. Typical modern hotel without much charm, but everything in order.",9.0,December 2021,"December 28, 2021",Executive Twin Room,1,Family,8.2
as always great,nothing to add here,"comfortabel after long flight, always nice to return",9.0,December 2021,"December 21, 2021",Executive Double Room,1,Solo traveler,8.2
Wonderful,"Wifi was unstable. 
Some of the people in reception seemed like didn't like to give answers to our questions and were very condescending.","Transportation airport-hotel every 30 min.
Breakfast.
Very comfortable beds.",9.0,December 2021,"December 14, 2021",Executive Double Room,2,Couple,8.2
Very Good,a bit old-fashioned inside,"free transport from the airport, good breakfast included",8.0,November 2021,"December 13, 2021",Executive Twin Room,1,Couple,8.2
"The food was poor,sit down restaurant got an F.","I ate one dinner in the dining room and I was very disappointed. My home is in the united states so that is what I have to compare this experience with. To make a long story short, the meal was brought out piece at a time. That part was consumed the I had to sit and wait for another part of the menu. Lousy way to serve a meal!!!",The free breakfast was good but the menu was a little too limited,9.0,November 2021,"December 13, 2021",Executive Double Room,5,Solo traveler,8.2
Convenient,The checkin was slow. There was a queue and we had to wait for more than half an hour after landing from a really long flight.,Really close to the airport and with free shuttle transport 24 hours.,7.0,November 2021,"December 5, 2021",Executive Twin Room,2,Couple,8.2
Conveniently located and good value.,"The check-in process took very long, probably 45 minutes. Efficiency of check-in needs to be greatly improved.",we had a forced layover in Bogotá and this hotel was convenient and affordable. The room was lovely and clean.,8.0,November 2021,"December 3, 2021",Executive Double Room,1,Couple,8.2
Very Good,,"It's very very close to airport, that's very convenient when you have connecting flights, has free transfer to and from airport. Breakfast is included; room service 24/7 including food. Room was very clean and nice.",8.0,December 2021,"December 3, 2021",Executive Twin Room,1,Solo traveler,8.2
only one night after a flight from Europe and lengthy delays in immigration but pleased overall.,a little bit run down with hand towel in the bathroom rather tatty but clean.,very close to the airport and free shuttle service. efficient reception staff and good breakfast included. good value altogether.,8.0,December 2021,"December 3, 2021",Executive Double Room,1,Couple,8.2
very nice stay highly recommended! great stuff!,it gets cold inside the room- breakfast choices are very limited,"close to airport, clean, nice stuff, confortable.",8.0,November 2021,"November 22, 2021",Executive Twin Room,1,Solo traveler,8.2
Comfortable and tidy,Lady in the reception when checking in,"Tidy rooms, nice garden and facilities overall",8.0,November 2021,"November 14, 2021",Executive Twin Room,1,Couple,8.2
Wonderful,Usually I dont like carpets because I'm alergic but here was ok.,Close the airport. Shuttle every 30 minutes 24 /24. Large room and bathroom. Modern and very clean bathroom. Front desk very fast. Room service food delicius and god price.,9.0,November 2021,"November 14, 2021",Executive Double Room,1,Solo traveler,8.2
a good hotel to stay near airport bogota,"The room a bit old, and the process of check in a bit long, when you arrived at late at night and tired , it can make you inpatient..","The shuttle is on time and frequent, it make the travel to go to the hotel is so much easier and its free too. The bed also spacious so it can fit 3 asian people like me and family. The breakfast especially the egg and the juice are delicious. They have a pretty tiny garden inside that is good for birding, the hotel itself near parks and wetlands that perfect for birding in bogota",8.0,October 2021,"November 4, 2021",Executive Double Room,1,Family,8.2
Good,Restaurant took more than 15 minutes to take my order. I looked like the staff were overwelmed beacuse the restaurant was crowded.,Very close to the airport and hotel offer transportation,7.0,October 2021,"October 26, 2021",Executive Double Room,1,Solo traveler,8.2
Good,A lot of noise,Excellent staff,7.0,October 2021,"October 25, 2021",Executive Double Room,1,Couple,8.2
The hot water did not work very well,The hot water was poor,Everything,9.0,September 2021,"October 20, 2021",Executive Double Room,1,Solo traveler,8.2
"Nice location, clean and good beds.Served the one night purpose,","The check in process took for ever. Very slow. The room was much smaller than expected, and the van going to and from the airport barely made it on time. Waited for more than 20min to be picked up.","The beds were great, and breakfast was nice.",7.0,October 2021,"October 17, 2021",Junior Suite (3 Adults),1,Family,8.2
It's a nice place to stay and rest while you wait for your next flight.,"Alarm clock wasn't updated (it show a different month, and time, so I could't use it to set the alarm clock) 
Room Service, it took more than 20 minutes for me to get a bottle of water, it was late and I had to wake up early the next day  I waste time waiting for the bottle of water
The TV didn't have any signal, so I couldn't turn in on.","I choose the hotel because it has transportation to the airport and because it's really close, that's very convenient.",8.0,October 2021,"October 5, 2021",Executive Twin Room,1,Solo traveler,8.2
"In general very good value for money, and very convenient for the airport",30 min delay to receive room service,"Check-in, room cleanliness, comfort",8.0,September 2021,"September 27, 2021",Executive Double Room,1,Couple,8.2
very good,,stay in this hotel every time I have 1 night between flights in Bogota,9.0,August 2021,"September 22, 2021",Executive Double Room,1,Group,8.2
Good airport hotel,,"-airport shuttle very handy
-helpful staff",8.0,September 2021,"September 10, 2021",Executive Double Room,1,Group,8.2
Good value hotel very close to the airport,,"Shuttle service very good
The hotel is very close to the airport 
Breakfast bag to take away early in the morning",7.0,September 2021,"September 7, 2021",Executive Double Room,1,Solo traveler,8.2
"Relaxing, convenient, effortless","Breakfast could have been a little better, seemed a bit cheap.","I enjoyed the comfort of the room, it was large, clean and you can notice they have paid attention to detail.",9.0,August 2021,"September 3, 2021",Executive Double Room,1,Solo traveler,8.2
Amazing,"All
Was good",Near to airport,8.0,July 2021,"September 1, 2021",Executive Twin Room,1,Solo traveler,8.2
Very Good,The worst box breakfast ever.,Confortable beds  and location.,8.0,August 2021,"August 21, 2021",Executive Twin Room,1,Couple,8.2
Great hotel close to the airport.,"When I arrived at the restaurant they seem to be a bit understaffed it took a bit for the waiter to reach the table. 

In the reviews it said that the breakfast was great, but it was not extra ordinary. I got my fruits, orange juice, was asked for the selection of hot beverage, up until that point. Good. 

When the eggs arrived, not only the were a bit cold, but the bread was never offered nor brought to the table.","The room was big and the bed was really comfortable. 

As a place to stay and sleep is perfect. 

Loved that a shuttle van is included in the fee.",9.0,August 2021,"August 20, 2021",Executive Double Room,1,Solo traveler,8.2
Good,"good price, nice place",booking,7.0,July 2024,"August 12, 2024",Executive Twin Room,1,Group,8.2
Perfectly adequate for overnight stay to/from the airport.,"Reception staff polite but slow and  not exceedingly helpful. Room was very large but a bit drab. Sockets were loose and dangerous looking. QR code needed to accès room service, restaurant closed at 10 pm. Wasn’t as nice as in the photos.
A bit expensive for the overall standard.
But no major problems and close to the airport.",Good location close to the airport. Free shuttle service to the airport. Very good continental breakfast. Free filtered water fountain.,8.0,August 2024,"August 11, 2024",Junior Suite,1,Solo traveler,8.2
Loved the hotel.  Nice and comfortable. We will be back when we have layover flights.,The staff at the front desk could have a better attitude toward costumers inquiries.,"The trim was great for 4 people.  Comfortable beds. Clean. 
Breakfast was good. Wide variety of things to eat.",9.0,August 2024,"August 6, 2024",Standard Quadruple Room,1,Family,8.2
Good convenient place near the airport for a short stay.,"Accessing the gym was not included, check out took a long time.",I liked having a good hotel near the airport so I could take a shuttle since I had a late arrival. The breakfast was really tasty and fresh and the room was clean and quiet.,8.0,July 2024,"August 4, 2024",Junior Suite,1,Solo traveler,8.2
Nice,It takes a long time to check in because there is always a line.,"I liked everything, specially the service of the bus to the airport and that I was able to leave my bags there for some hours",9.0,July 2024,"July 21, 2024",Standard Quadruple Room,1,Family,8.2
Classy airport hotel.,"I could not find where to take the shuttle bus when I flew in late at night from Cartagena. I exited at the doorway i was told to exit from by the hotel, but I saw no sign of the shuttle bus. I realise it only runs every 30 mins, so as  it was after 12 midnight, I felt it necessary to take a taxi for safety. I told the taxi driver the name of my hotel, but as there were 2 Habitel hotels side by side, he didn't know which one was the right one. I ended up checking into the other hotel and then being directed to the right one. Once there all was good. There was water to drink and a v comfortable room. Lots of hot water and bed comfy. I had no time to test the gym or spa, but it is clear there are lots of facilities for guests.",General feel of hotel. Shuttle bus and proximity to airport. Good breakfast.,9.0,July 2024,"July 13, 2024",Executive Double Room,1,Solo traveler,8.2
Very Good,The bathroom sink wasn’t draining it did take too long for being repaired!,"The room space good enough, comfortable bed and good view",8.0,June 2024,"June 21, 2024",Standard Quadruple Room,2,Family,8.2
"Good experience, great staff, sparkly clean, very convininent location.",There’s nothing close to.,The shuttle was very comfortable. Breakfast was very good.,8.0,June 2024,"June 14, 2024",Standard Triple Room,2,Group,8.2
A cheap airport hotel if that’s what you are after,"Slow check-in, hard pillows but luckily I bought my own, very simple but for a 12 hr stop-over all good",Cheap and close to the airport - breakfast was good,8.0,June 2024,"June 12, 2024",Executive Twin Room,1,Family,8.2
It was good overall,"The heater didn’t work 
No well equipped gym (need dumbbells)","• Very close to the airport
• Clean
• great coffee shop 
• great staff",8.0,May 2024,"June 5, 2024",Executive Twin Room,1,Couple,8.2
Very Good,,Near airport. Convenient for visitors in transit. Free shuttle bus every 30 minutes.,8.0,May 2024,"May 31, 2024",Executive Twin Room,1,Group,8.2
Great airport hotel!,Airco op de kamer,,8.0,April 2024,"May 26, 2024",Junior Suite,1,Solo traveler,8.2
Very Good,The common areas could do with some care and maintenance,Friendly staff and great food,8.0,April 2024,"April 23, 2024",Executive Double Room,2,Solo traveler,8.2
Near to the airport with a shuttle,"The check in was confusing - and that had something to do with a language barrier.  We did not get a receipt - which was a problem the next day.  We didn't learn until after we checked in that we were in the adjacent building which we had to walk to in the rain.  When we checked out, they had no record in the building where we were staying that we had paid the night before.  They had to go talk to someone in the other building and it was cleared up, but we missed one shuttle.",Great breakfast; room was fine for two people; airport shuttle,7.0,March 2024,"April 19, 2024",Executive Twin Room,1,Family,8.2
Very Good,,"Close to the airport, free shuttle, great breakfast, awesome staff",8.0,March 2024,"April 15, 2024",Junior Suite,1,Couple,8.2
Good accommodation near the airport,,Nice hotel near the airport. Rooms very nice and clean and hotel also offers a free-of-charge airport shuttle,8.0,March 2024,"April 1, 2024",Junior Suite,1,Group,8.2
"Great place, close to airport, very safe","A lot of flights leave early and the breakfast opens at 06, but they give you a little bag with a sandwich and a juice if you leave earlier 
The fridge in the room was empty, no water, no nothing","Very nice hotel
Close to the airport with a shuttle
Nice restaurant and nice staff",9.0,March 2024,"March 30, 2024",Junior Suite,1,Couple,8.2
Good,,"Great location and the free/frequent transfer is a bonus. Watch out though as there is only one van and it can get full. Clean comfortable rooms, nice breakfast and friendly staff. Recommended for a stop over if not visiting the city centre much.",7.0,March 2024,"March 30, 2024",Executive Double Room,1,Family,8.2
Convenient place next to airport,,Next to the airport with free 24/7 suttle bus,9.0,March 2024,"March 24, 2024",Standard Triple Room,1,Group,8.2
good,That I keep getting emails to review this hotel when I've done it already,bed,7.0,March 2024,"March 6, 2024",Junior Suite,1,Group,8.2
