Review Title,Negative Reviews,Positive Reviews,Rating,Stay Date,Review Date,Room Type,Number of Nights,Traveler Type,Overall Average Rating
I hope stay this hotel again,Nothing,I like staff very friendly and room also comfortable,10,August 2022,"August 7, 2022",Twin Room,7,Solo traveler,8.9
Exceptional,,Excellent breakfast and very central hotel,10,August 2022,"August 6, 2022",Deluxe King Room with City View,3,Couple,8.9
Exceptional,,I liked everything,10,August 2022,"August 5, 2022",Queen Room,2,Solo traveler,8.9
Exceptional,Some rooms have windows that don't open but there is air conditioning of course,"This is the third stay at this hotel and it was as good as every time. Clean, great location, very good breakfast.",10,July 2022,"August 4, 2022",Queen Room,3,Family,8.9
Great experience.would highly recommended,,hotel and staff excellent.as an added touch I had a birthday while there and arrived back at room to find a gift waiting.excellent touch,10,August 2022,"August 2, 2022",Queen Room,7,Couple,8.9
excellent experience,-,"clean, great location, helpful staff with luggages, everything was excellent",10,July 2022,"July 30, 2022",King Room,6,Couple,8.9
It is worth staying in if you want to nice and clean place closed to the main tourist attractions.,Is kind of blend.,"The hotel is nice, clean and close to the main tourist attractions and at a reasonable price.",8.0,July 2022,"July 29, 2022",Deluxe King Room with City View,4,Couple,8.9
"Excellent hotel, place and staff","Maybe the ironing table could be better, not such a hard surface. And if the rooms have a desk, some stationery would be useful.","The room furniture, the very comfortable bed, everything was so clean, the staff... it's an excellent place to stay.",10,July 2022,"July 27, 2022",Queen Room,4,Solo traveler,8.9
great stay,,cozy and clean,10,July 2022,"July 26, 2022",Queen Room,1,Couple,8.9
"clean and beautiful apartment ,the location",nothing,the location and helpful staff,10,July 2022,"July 25, 2022",Junior Suite,3,Family,8.9
As expected :),"Booking through booking.com apparently means the stay doesn't count to my Hilton Honours nights. Poor show, Hilton.","As you'd expect from a Hilton, clean, comfortable, good breakfast. I enjoyed the waffles and grinned at the prossecco. The location is super handy for exploring the city a bit. Desk in room, a fridge, kettle and good wifi - just what I needed for a day of work.",8.0,July 2022,"July 25, 2022",King Room,1,Couple,8.9
excellent stay,none identified,"location, clean, friendly staff",9.0,July 2022,"July 24, 2022",King Room,2,Couple,8.9
Just great,,Everything breakfast was very good staff very nice and helpful,10,July 2022,"July 22, 2022",Junior Suite,3,Couple,8.9
Exceptional,,"Perfect Location, helpful and polite stuff and very clean.",10,July 2022,"July 22, 2022",Junior Suite,2,Family,8.9
totally recommend.,,"The staff were very welcoming & considerate with us. We were showed a room at first that we weren’t so much comfortable with, so they agreed for us to change it without hesitation. The staff were also very helpful with getting around the city & professional as well!
An extra gesture they did, that one of us had their birthday along our stay, & they surprised us with some macaroons & a little sparkling wine! which really made our day & warmed our hearts. in conclusion, totally recommend! especially in addition to the location, which is in the center & close to everything:)",10,April 2022,"July 20, 2022",Queen Room,3,Group,8.9
"A beautiful place right on the beach, perfect for families with children ... modern, clean and comfo",All is ok.,"A beautiful place right on the beach, perfect for families with children ... modern, clean and comfortable rooms, fresh and tasty food.
Super nice owners **** ...",10,April 2022,"July 19, 2022",King Room,2,Family,8.9
"Great hotel in the centre of the old town, great breakfast.",nothing not to like about this hotel.,great location in the old town and a 5 minute walk from the metro station. very comfortable and clean withe very friendly staff.,10,July 2022,"July 17, 2022",Queen Room,1,Solo traveler,8.9
Exceptional,,"Good Hilton, good rooms, good breakfast! I can recommend this place with pleasure.",10,July 2022,"July 14, 2022",King Room,1,Group,8.9
Exceptional,"A little dark, not enough lighting","Spaciou room, comfortable beds, clean, friendly staff,perfect location.",10,July 2022,"July 12, 2022",Twin Room,4,Family,8.9
can’t wait to stay here again,"nothing, it was perfect",Everything. location was awesome,10,June 2022,"July 9, 2022",King Room,3,Couple,8.9
Exceptional,Nothing,Location and price,10,July 2022,"July 8, 2022",Queen Room,1,Group,8.9
Wonderful!,,"FOOD WAS EXCELLENT!!!!   Rib eye, Salmon, Breakfast",10,July 2022,"July 7, 2022",King Room,2,Solo traveler,8.9
excellent,nothing,close to everything,10,June 2022,"June 28, 2022",Twin Room,2,Group,8.9
"exlellent hotel in down town, close to everything",n/a,location,10,June 2022,"June 25, 2022",Junior Suite,3,Family,8.9
Exceptional,,Everything,10,June 2022,"June 24, 2022",Queen Room,2,Family,8.9
Exceptional,,nice and clean hotel. very central and lovely location.,10,April 2022,"June 20, 2022",Queen Room,2,Solo traveler,8.9
Wonderful,Two small chocolates from hotel cost 50lei ;; too expensive,Perfect location,9.0,June 2022,"June 19, 2022",Queen Room,4,Couple,8.9
"Great hotel, good comfy rooms and nice staff",,"Well designed, comfort, clean",9.0,June 2022,"June 19, 2022",King Room,3,Group,8.9
Wonderful,nothing,The location was absolutely perfect for exploring the old town. clean comfortable and great value for money. would stay here again!,9.0,June 2022,"June 19, 2022",King Room,2,Couple,8.9
Exceptional,,Staff was supportive and wonderful.,10,June 2022,"June 15, 2022",Queen Room,1,Couple,8.9
Exceptional,There is so much noise due to the clubs and bars behind the hotel,"The staff was very friendly and helpful. The room was clean, comfy and well equiped. Hotel has really an excellent location, exactly near the old town. We enjoyed the city on foot. We asked to change us room on the first day because the room that was given to us was quite noise (there are some clubs behind). The man who was at reception was really kind and willing us to help! Thank you for everything!",10,June 2022,"June 14, 2022",King Room,3,Couple,8.9
Exceptional,,location + room size + great service,10,May 2022,"June 3, 2022",King Room,5,Solo traveler,8.9
Very Good,,great location lovely hotel,8.0,May 2022,"June 2, 2022",Twin Room,2,Group,8.9
Exceptional,,"Friendly staff, location was perfect beautiful room all you need for a perfect stay in bucharest",10,June 2022,"June 2, 2022",King Room,1,Family,8.9
Overall a very nice stay at the Hilton and situated in a great location,Not possible to open a window in the room (although airco worked very well) and due to the position of the room in the building you could not tell what the weather was like until you went outside.,Hotel is in great location with a nice restaurant with outside terrace.  Staff were helpful and friendly. I would stay at this hotel again if visiting Bucharest. Also has a small gym with adequate equipment.,9.0,May 2022,"May 31, 2022",Queen Room,5,Group,8.9
Exceptional,"No shelves in the closet 
I asked to freeze something for medical reasons and they didn't agree 
No bath..just shower","Location 
Service
Clean",10,May 2022,"May 29, 2022",Deluxe King Room,4,Couple,8.9
Exceptional,-,"Easily the best hotel in town. Amazing food, ideal location and great customer care.",10,May 2022,"May 29, 2022",Twin Room,4,Solo traveler,8.9
Exceptional,View from the room to interior court,Breakfast is very generous,10,May 2022,"May 28, 2022",Queen Room,2,Couple,8.9
"staff very helpful, great location - couldn’t fault it at all.",,the cleanliness,10,May 2022,"May 27, 2022",Twin Room,2,Group,8.9
excellent stay in a strategic location...,"at one point one had to wait several minutes before the water in the shower got really warm; there were long waiting queues for both check-in and check-out and the staff was a little overwhelmed, but they were nice anyways; the security guy in the lobby who was staring at everybody was a little creepy.","excellent strategic location close to everything; very clean modern rooms; surprisingly quiet (my room was facing the street), great breakfast (zacusca = eggplant spread is to die for!).",8.0,May 2022,"May 25, 2022",Deluxe King Room,1,Solo traveler,8.9
Wonderful,Nothing,"Great location, great value for money. Overall a great place to stay for a business trip.",9.0,March 2022,"May 22, 2022",King Room,1,Solo traveler,8.9
Value for money. Staff were great. Great location and everything we needed.,Nothing to not like. We enjoyed our stay.,"Great location. Close to restaurants, bars and metro. Breakfast buffet was great. Loved the food and service. Room was a good size and had everything we needed.",10,April 2022,"May 22, 2022",Twin Room,7,Group,8.9
Great location - everything you'd need.,n/a,"Location of the hotel was superb, right in the middle of the Old Town.  Our room was really big with lots of space.  Bed was large and comfortable.  The hairdryer was really good which is rare for a hotel hairdryer! We were able to check in a little earlier than expected too which is always welcome.",9.0,May 2022,"May 19, 2022",King Room,2,Couple,8.9
Great hotel,nothing all good,Great location lovely hotel great staff,10,May 2022,"May 17, 2022",King Room,2,Group,8.9
Exceptional,,"The location was perfect, entertainment and restaurants within walking distance and main shopping centres about 10/15 mins away",10,May 2022,"May 16, 2022",Queen Room,3,Family,8.9
Exceptional,none,"breakfast, room",10,May 2022,"May 15, 2022",Queen Room,2,Couple,8.9
short but sweet,,"good location
modern and clean
nice bar area",9.0,April 2022,"May 10, 2022",King Room,1,Couple,8.9
Wonderful,water is not hot ! in big showers u get cold,,9.0,May 2022,"May 9, 2022",Queen Room,2,Solo traveler,8.9
Wonderful,no parking,"great location and friendly staff, especially in the breakfast place",9.0,May 2022,"May 5, 2022",King Room,1,Couple,8.9
Exceptional,Nothing,"Clean , nice location",10,May 2022,"May 5, 2022",Queen Room,4,Family,8.9
Excellent as per usual,Nothing,Everything. This is a great hotel which is why I continue to go back,10,February 2022,"May 5, 2022",Queen Room,3,Solo traveler,8.9
"Excellent hotel, more like 5 star! Service is outstanding",Receiving my food took a very long time - 30 minutes! No view from my room.,"All staff (reception, room service, at the bar) were all outstanding. The food in the bar is superb. Hotel is clean, modern and new. Room was impeccable. Location is great. Rate was fabulous. Room was clean and so spacious. I slept like a baby with a large and comfortable bed.",10,May 2022,"May 4, 2022",King Room,1,Solo traveler,8.9
Wonderful,,Location was very convenient. Located in the middle of old town. Also beds were comfortable and we had a goods night rest.,9.0,May 2022,"May 4, 2022",Twin Room,2,Group,8.9
Exceptional,,Everything was great,10,May 2022,"May 3, 2022",Queen Room,7,Couple,8.9
Good location and very clean,"There was a tray outside of the room for several hours and over the night. 

The phone in the room has no indication of what’s the reception number/dial","The location is excellent for exploring the old town, parliament, fountain and a few famous churches. Perfect for eating and drinking in the old town restaurant. There is a shopping mall nearby. 

The room is super clean and the bed is very comfortable. 

Staff speak very good English. They are polite, friendly enough but not very welcoming towards the sightseeing questions.",9.0,April 2022,"April 28, 2022",Queen Room,1,Solo traveler,8.9
good averall,cramped lobby,"great location,",9.0,April 2022,"April 25, 2022",King Room,3,Solo traveler,8.9
Recommend Stay in Bucharest,Restaurant is a bit crowded during breakfast hours.,"Second time we stay at this hotel. Perfect location close to the old city and metro station, good breakfast, spacious and quiet room. Kept in good condition very helpful stuff.",9.0,April 2022,"April 25, 2022",Deluxe King Room,5,Couple,8.9
Wonderful,,"The crew was great,location was very convenient.",9.0,April 2022,"April 25, 2022",Twin Room,3,Group,8.9
Everything was perfect especially the attentive helpful staff made my stay wonderful,Nothing,Excellent choice and yummy,10,April 2022,"April 21, 2022",Queen Room,2,Couple,8.9
Comfortable stay in a great location and value for money,,"Excellent hotel, we stayed for 4 nights, and nothing was too much trouble for the staff when we asked. They are friendly, attentive, and very professional. I would highly recommend this hotel.",10,April 2022,"April 20, 2022",Queen Room,4,Couple,8.9
Very nice,,Breakfast could be better. Location is perfect!,9.0,April 2022,"April 18, 2022",Queen Room,4,Family,8.9
I felt like home,everything was spot on,"location, staff, the restaurant",10,April 2022,"April 12, 2022",Twin Room,1,Group,8.9
good location and good service especially a really nice girl from the breakfast with dark hair her name starts with M I,not much variety in the breakfast and the hot water it’s not really hot,very good location,8.0,February 2022,"April 11, 2022",Twin Room,2,Family,8.9
Short but very enjoyable,N:A,modern clean and comfortable in great location,8.0,April 2022,"April 11, 2022",Twin Room,1,Family,8.9
"good value, efficient repairs when needed. great location.","buffet breakfast limited, hot food always cold. should have a microwave available. staff not in uniform.",comfortable rooms and good staff,9.0,April 2022,"April 10, 2022",Queen Room,5,Couple,8.9
Wonderful,,"Excellent location just in the heart of the old town. Polite staff, comfortable and clean room with great view.breakfast was great, surprised that they offered gluten free bread. We had every day two bottles of water, treat of the hotel.thank you so much!",9.0,March 2022,"April 6, 2022",Queen Room,3,Couple,8.9
Wonderful,,The staff was extremely friendly and the facilities were great. I would definitely stay here again.,9.0,February 2022,"March 29, 2022",Queen Room,5,Solo traveler,8.9
Great value and epic breakfast.,,Breakfast was outstanding. Staff were all lovely. Awesome location.,10,March 2022,"March 28, 2022",Twin Room,3,Group,8.9
Very recommended!!!,-,"Very good breakfast!
Everything is fresh!
Always clean 
Fast service with a smile 😃 
Excellent!
The staff is friendly and helpful!",10,March 2022,"March 28, 2022",Deluxe King Room,4,Family,8.9
"Relaxing, after helping Ukrainian refugees in Galati",,"Clean, new, modern…",10,March 2022,"March 25, 2022",Queen Room,1,Group,8.9
highly recommended,N/A,"great location, very clean, comfortable bed, sound proofed room, good breakfast, friendly stuff",9.0,March 2022,"March 24, 2022",Junior Suite,1,Solo traveler,8.9
Exceptional,coffee machine could have been provided,extremely warm staff,10,March 2022,"March 23, 2022",Queen Room,2,Solo traveler,8.9
Very pleasant,,"great location, very good breakfast. Good clean room and very good water pressure in the shower . Staff very helpful",9.0,March 2022,"March 21, 2022",King Room,2,Couple,8.9
Comfortable stay in the heart of old city,"There was some big supportive columns in my room & bathroom, it was preventing me to see the view from my window. The minibar could have been filled with some drinks, the hotel restaurant should have some local tastes since Romanian kitchen is one of the best!",Best location in the heart of old city of Bucharest. Clean & well designed room with ''work from hotel room facilities''.,9.0,March 2022,"March 21, 2022",King Room,3,Group,8.9
"Quiet and clean rooms, breakfast was a bit small",Breakfast was a bit small,Quiet and clean rooms,9.0,March 2022,"March 21, 2022",Twin Room,2,Couple,8.9
Exceptional,,"The rooms were clean, very comfortable, and the staff was amazing. I highly recommend this hotel for anyone visiting downtown .",10,March 2022,"March 21, 2022",Twin Room,2,Family,8.9
Great stay overall,"Breakfast options were a bit disappointing with not a lot of variation - especially all those artificial sugary juices (No natural juices provided). Also missing more breakfast healthy options
A bit outdated furniture - lots of dark colors 
More sustainability focus should be the norm","Spacious, clean room with very nice view in old town
Great location, right in the city center - you can't be in a better location
Attentive staff
Comfy beds
Complimentary water/coffee in room
Good coffee and wine (bar)
Good quality washing products",9.0,March 2022,"March 21, 2022",King Room,1,Solo traveler,8.9
Great place in great area for young and old,nothing,it was great! we had an amazing stay at this beautiful hotel,10,March 2022,"March 20, 2022",King Room,2,Couple,8.9
Great place to stay,The heat was a bit too high.,"Awesome location , very nice and attentive staff , very clean and well kept.",10,March 2022,"March 20, 2022",Queen Room,4,Couple,8.9
Excellent stay,,The hotel was excellent. The staff were very nice. The location of the hotel was perfect. Facilities were excellent. Very recommended hotel to stay in Bucharest. Definitely will come again.,9.0,March 2022,"March 18, 2022",Queen Room,4,Couple,8.9
It's our 4th time we come to the hotel,,"Location, service, the reception guy named Christian who took care, did it in a very kind way and changed our room when we came back later so that we will get what we expected.",10,February 2022,"March 17, 2022",Deluxe King Room with City View,1,Couple,8.9
Wonderful,The water in the shower wasn’t strong enough,,9.0,March 2022,"March 15, 2022",Twin Room,3,Group,8.9
Wonderful,The water pressure in the shower was a bit low.,"Great location, super clean and comfortable.",9.0,March 2022,"March 15, 2022",Twin Room,2,Family,8.9
hilton=quality,breakfast could been more diverse e.g missed fresh fruit,quite room and excellent service,10,March 2022,"March 13, 2022",Queen Room,2,Couple,8.9
Exceptional,It was great,It was great,10,February 2022,"March 13, 2022",Queen Room,1,Solo traveler,8.9
Very reccomended Hotel,"Very hot in the room, we did not have window that could be opened. 
The air conditioner did not allow control
And the water in the shower wasn't hot enough",Almost everthing was perfect ...,9.0,March 2022,"March 13, 2022",Queen Room,4,Couple,8.9
Exceptional,,Location right in the centre of the Old Town and the room size was very big,10,March 2022,"March 11, 2022",King Room,3,Couple,8.9
Beautiful but noisy,"The air conditioning system was very noisy and  made for an uncomfortable disturbed sleep. Even when we turned off the room system completely, it made little difference and when we spoken to the receptionist about it, they said this was a problem throughout the building. So, if you like a quiet nights sleep, this is not the hotel for you.",This hotel is located perfectly for the Old Town and the standards and cleanliness was 4 star.,8.0,March 2022,"March 9, 2022",Twin Room,3,Couple,8.9
"Great location, shame about the noise",The noise of the air conditioning all night was not good. Not a great nights sleep,"great location, exceptionally clean",8.0,March 2022,"March 9, 2022",Queen Room,2,Couple,8.9
Great experience,The staff could have been more helpful and friendly. Not all of them though! Some of them were great!,"The rooms were huge and the mattresses incredible. If we visit Bucharest again, we will definitely choose the same hotel!",10,March 2022,"March 7, 2022",Twin Room,3,Group,8.9
Wonderful,"The shower pressure is too low, and must be a door to close the shower so it wont wet all the floor","The breakfast, the bed and the restaurant",9.0,March 2022,"March 7, 2022",Twin Room,2,Family,8.9
Exceptional,No special facilities,"Excellent hotel, big comfy rooms, very clean and has an amazing location",10,March 2022,"March 6, 2022",Twin Room,3,Group,8.9
Exceptional,,"The staff was very friendly and helpful. The room was clean, comfy and well equiped. Nice breakfast and lobby. We enjoyed the city on foot, the hotel is very well situated.",10,March 2022,"March 4, 2022",Twin Room,2,Couple,8.9
Exceptional,,Great location and friendly staff! Room is decently sized and bed is very comfortable!!,10,March 2022,"March 4, 2022",King Room,1,Couple,8.9
Wonderful,,in the best location of Bucharest,9.0,March 2022,"March 2, 2022",Queen Room,5,Family,8.9
"Clean, quiet, comfortable with exceptional staff!",,"Absolutely superb hotel. The staff were exceptional (particularly Sabine) and were always happy to help with any query, from allergen content of the restaurant food to helping us to print boarding passes for our flight. Location is brilliant, rooms are clean and quiet. Breakfast is very well stocked and varied.",10,March 2022,"March 2, 2022",Queen Room,4,Couple,8.9
Exceptional,,"clean, brand new furniture, all very ergonomic.",10,February 2022,"February 27, 2022",King Room,3,Couple,8.9
amazing!,,"great location, very clean… beds absolutely comfortable",10,February 2022,"February 27, 2022",King Room,1,Couple,8.9
One of the Best Hotels I Have Ever Stayed In!,nothing,"Staff were fabulous, professional & attentive - everything was wonderful & the breakfast superb. Would definitely recommend this Hotel. Great location too!",10,February 2022,"February 19, 2022",Twin Room,3,Couple,8.9
great hotel in the downtown,,nice servise. great location in the downtown.,9.0,February 2022,"February 14, 2022",Queen Room,1,Solo traveler,8.9
Exceptional,,excellent location,10,February 2022,"February 13, 2022",King Room,1,Couple,8.9
Very Good,"We had multiple bookings and from 4 consecutive nights, our room was cleaned only once, even if we requested it in the other days.
Plus some of the toiletries were expired since January 2021 (so more than 1 year ago). And when we informed and showed that to housekeeping, the lady said that they must be still good. Plus one towel in the room had a hole in it.","Central location so everything is within walking distance and there are always taxis around.
Clean common areas and they offer complementary fruit water and pieces of cake in the evening.",8.0,February 2022,"February 10, 2022",Queen Room,1,Couple,8.9
Exceptional,"it’s nothing to do with the hotel, but be careful of the taxis in front of the hotel, even the taxis that hotel called, the taxis’ drivers will charge you three or four times more.","Everythins was perfect, the hotel is just in the heart of the old town, clean and comfortable.",10,January 2022,"February 6, 2022",Twin Room,1,Group,8.9
definitely this hotel deserves all the appreciation,,the location is probably  the  best in town. the room was very nice. the breakfast was good. So definitely I will come to this hotel  whit pleasure.,10,January 2022,"February 6, 2022",King Room,2,Solo traveler,8.9
Exceptional,Nothing,Everything,10,January 2022,"January 31, 2022",Queen Room,1,Family,8.9
Exceptional,no,all,10,January 2022,"January 31, 2022",Queen Room,4,Solo traveler,8.9
Wonderful,The chair had some stains on it.,"Great for solo traveling and remote working. The room was nice, had a nice desk and a comfortable chair.
The bed mattress and pillows are high quality and comfortable.
The view from my room was awesome and the placement of the hotel makes it an excellent choice for anyone who travels into Bucharest.
A big plus it’s also that is exactly near a cab park.",9.0,January 2022,"January 27, 2022",Queen Room,3,Solo traveler,8.9
excellent,"the only downside was there was a dog barking early every morning outside our window in the nearby church, but obviously not hotel’s fault","great location, super comfortable bed, nice room. all that you’d expect from Hilton",10,January 2022,"January 22, 2022",King Room,2,Couple,8.9
Exceptional,,"I visited the Restaurant of the Hotel with my family (which also stayed at the hotel) for Christmas eve dinner. 
Delicious food, waiters are very attentive, and super nice atmosphere. Plus it’s all at an affordable price.
Special thanks to Christian for being professional and friendly!
Can totally recommend it and will definitely come back again.",10,December 2021,"January 21, 2022",King Room,4,Family,8.9
excellent stay,n/a,friendliness of staff,10,January 2022,"January 20, 2022",King Room,1,Solo traveler,8.9
Everything was great,,"Central location, the parking they offer is not their own, but an underground city Interparking, still very comfortable to use and even cheaper if you use their app. Rooms are big; beds are comfortable, breakfast is rich. Would stay there again! Totally worth the money.",10,December 2021,"January 19, 2022",King Room,1,Couple,8.9
Our stay was comfortable and the staff were very hospitable and we would love to stay here again if we travel back to th,,"every person that we met that worked there were absolutely amazing, so accommodating, and very nice. The food is amazing from the breakfast to what is served in the restaurant. The beds are extremely comfortable, the selection of TV options for adults and children are phenomenal. I truly don’t know what more I could say besides this would be the place we would choose over and over again when we come to Bucharest. we spent more time at our hotel than we have at any other hotel while traveling. We were so thrilled and happy with staying here and absolutely recommend it especially for those with children!",10,January 2022,"January 18, 2022",Junior Suite,3,Family,8.9
Excellent hotel,,"Breakfast was very good. Excellent selection of international and Romanian food. True coffee, fresh orange juice, etc.
The hotel is close to the pedestrian area, museums, big boulevards.",10,January 2022,"January 11, 2022",Queen Room,4,Solo traveler,8.9
