Review Title,Negative Reviews,Positive Reviews,Rating,Stay Date,Review Date,Room Type,Number of Nights,Traveler Type,Overall Average Rating
"Really cool, quirky hotel.",Everything was great.,"Awesome quirky hotel! Great social lobby with unique decor. Great breakfast buffet and bar, really comfortable bed. The room, although cozy, was laid out very well. Sensible placement of plugs, lights etc. I keep looking in every nook and cranny to see what other cool things were hidden away. We really enjoyed our stay. I will be seeking out CitizenM hotels around the world from now on.",10,July 2023,"July 31, 2023",King Room,1,Family,9
BACK FOR SURE,Norhing,"We received a very warm welcome with positive vibes from the staff.
The room is perfect and fully stuffed.
Position also very god not so far from all the attractions.",10,August 2024,"August 18, 2024",King Room,1,Couple,9
A very pocket friendly and excellent accommodation near Bukit Bintang,Nothing to dislike here.,"Located southwest of Bukit Bintang's central area, this property is 10 minutes from popular spots like Jalan Alor Food Street, Art Street, Times Square, etc. There is a convenience store and a supermarket with an ATM next to the hotel building, and grabbing a taxi with the Grab app is never an issue.
The bed was super comfortable and the pop interiors of this hotel are impressive. The hotel is super clean and the breakfast spread was just right. We arrived at 0200AM in the morning and did not have any problems thanks to the 24-hour reception.
The checkout is also very fast and smooth.

You cannot enter the hotel without your room key card after 2400, which is a good security measure.",9.0,August 2024,"August 14, 2024",King Room,3,Couple,9
I would stay there again.,None,"An amazing small hotel. Clean and comfortable. 
2 mn walk to the food street.",9.0,August 2024,"August 13, 2024",King Room,2,Couple,9
Best sleep.,Would be nice to have normal colour lights. The different lights was hard to live with. Also Ipad took a long time to load which was hard when I needed to turn the lights on straight away.,The bed was so comfy! Location on town was very convenient.,10,August 2024,"August 12, 2024",King Room,1,Family,9
Exceptional,,"I loved everything about this hotel! You can control everything using a small Ipad, from the windows, the LED and television! If you are a Digital Nomad/Remote Worker, you will absolutely fall in love with this place! The internet connection is excellent and there is a shared space where you can meet other remote workers. For a hotel this affordable, it ultimately exceeded my expectations. I would give this hotel a rating of 11 if the website lets me to!",10,May 2024,"August 12, 2024",King Room,3,Solo traveler,9
Comfortable stay in a good location,"I wish that the light control was a little bit more fine-grained (i.e. can turn off only specific lamps through the app).
Storage space wouldn't be enough for two people with two large luggage cases.","Very comfortable bed.
Good breakfast, especially dimsums. 
Efficiently utilized room space.
Close to Imbi monorail station, Jalan Alor, not so far from Bukit Bintang. 7 Eleven and KK nearby.
View from the window (I chose city view when checking-in).",9.0,August 2024,"August 11, 2024",King Room,5,Solo traveler,9
Great Stay!,"Check out time at 11 I find a bit off, it might just be me though.","Beautiful property, great location and love the high tech feel of the room.",9.0,August 2024,"August 6, 2024",King Room,2,Couple,9
Really enjoyed my stay here.,All good.,"Very nice hotel - comfortable, clean, nice design and helpful staff. I would definitely stay here again.",10,August 2024,"August 4, 2024",King Room,2,Solo traveler,9
"Super modern decor, super flexible staff",Everything was great,Kind and helpful staff,10,August 2024,"August 4, 2024",King Room,2,Couple,9
Nice hotel,,"We know this hotel from other cities. This time we were three with a 5-year-old son. We had concerns whether sleeping in a bed with three would be comfortable enough. It turned out that our stay was great. We slept comfortably. The room was well-equipped and big enough. Great location, close to most attractions and public transport. The hotel staff were very helpful. We will gladly come back!",10,July 2024,"August 2, 2024",King Room,4,Family,9
Great location and pretty hotel,"The AC temperature can only go up to 28 max. It was really cold in our room and we couldnt do anything about it. 

Not a big issue but might be helpful for others: When you check in, you will have the option to choose a room with ""city"" or ""green"" view. We chose the green view thinking it would be a park or garden view, but turned out our room was looking at only a wall, with some small plants by the window. I think it would be better to have some real photos of the rooms at that step, which will be helpful for first time KL visitors :)","Great location, very good shower, friendly vibe, super fast check in and check out. Great attention to details and decorations. Theres a 7eleven and a money exchange counter right next to the hotel which is extremely convenient.",8.0,July 2024,"July 28, 2024",King Room,3,Couple,9
Exceptional,,"Cool technology on rooms. Great use of space. Staff were wonderful. The manager, Duncan, even came and sat with us and spoke to us, which was wonderful. Hogly recommend.",10,May 2024,"July 27, 2024",King Room,2,Family,9
the bed of my dreams,nothing :),"the bed is what dreams are made of. black out blinds, amazing pillows, I had the most perfect 11hr sleep after a long and annoying travel day.",10,July 2024,"July 26, 2024",King Room,1,Solo traveler,9
Decent hotel with a great location,"Room is inconvenient 
1. No charging points near bed 
2. Bathroom flooring is plastic and weird 
3. Bed is stuck to 3 walls so the person sleeping towards the inside has to jump over the other person at night to access the washroom.","Location is amazing. Right next to 7/11. Staff is very helpful and courteous. Reception and first floor (public areas) is beautifully designed. 
Room itself is small and kinda inconvenient. It’s manageable for tourist as one spends most
Of the time out. It’s not recommended for business travel where convenience is key.",8.0,July 2024,"July 24, 2024",King Room,4,Couple,9
Wonderful,Room sizes are small,Clean Rooms clear instructions to check in and friendly staff,9.0,July 2024,"July 23, 2024",King Room,2,Family,9
Brilliant,Breakfast was expensive and limited choices,"Very good location, hotel was very posh and loved the iPad feature to control the room however does take long to load up initially",10,July 2024,"July 23, 2024",King Room,4,Couple,9
Exceptional,,"This surely is the future of hotels! 

A well thought-out self-checkin process, clean modern facilities (tablet control of virtually everything in the room was a nice touch), and the shared spaces were pretty awesome. Others have probably already commented on the great location (away from the noise, but close enough to walk). I liked _everything_ about my stay here. Will absolutely stay at this chain again.",10,July 2024,"July 22, 2024",King Room,2,Solo traveler,9
Great stay,.,"Super comfortable bed and good location, would definitely stay again.",9.0,July 2024,"July 22, 2024",King Room,4,Couple,9
"Recommend experience, location very convenient and staff very kind",Sometimes the soap looks was empty same for the shampoo. I guess is because was thick,"Location and the staff is very kind, trying. To help all
the time",9.0,July 2024,"July 18, 2024",King Room,2,Solo traveler,9
Exceptional,"I stayed for a few nights at citizenM Bukit Bintang on separate occasions. A little feedback on my second stay: the toilet and floor were a bit unclean and the air conditioner is not working and it was inconvenient that there was no kettle in the room, so I had to get hot water from the lobby restaurant whenever I needed it.  Apart from those few issues, overall the stay was fantastic; I highly recommend this hotel.","I personally loved the bed, it was so comfortable and huge. The  room was spacious. Loved the design of the hotel and also the facilities. Will definitely come back next time.",10,July 2024,"July 16, 2024",King Room,3,Solo traveler,9
Nice stay and consider to stay again for next trip.,"Toilet is too small, the swing door is too trouble to open and wrong side of the opening.","Staff are nice and friendly, environment is good. The bed is big and comfortable and free parking👍🏼",8.0,June 2024,"July 15, 2024",King Room,1,Couple,9
Good for overnight stay,,"Super comfy beds, pillows you'll dream of. There was self check in but the staff didn't seem to want anyone to use it unfortunately.",10,July 2024,"July 13, 2024",King Room,1,Couple,9
Great stay indeed!,Nil.,I like their hotel design and check-in/out approach. Their room is clean too.,10,July 2024,"July 12, 2024",King Room,1,Couple,9
Exceptional,,Breakfast and facilities,10,July 2024,"July 11, 2024",King Room,5,Family,9
Exceptional,,Amazing,10,July 2024,"July 11, 2024",King Room,1,Couple,9
Exceptional,,Amazing,10,July 2024,"July 11, 2024",King Room,5,Solo traveler,9
"Area not congested. Easy access to facilities, shopping and street food markets.",,Location,10,July 2024,"July 9, 2024",King Room,1,Family,9
Exceptional,There is no refrigeration function in the refrigerator and no outlet to charge your phone when you lie down.,"It was very clean and cozy.It has good transportation around it, and there are shopping malls and night markets within walking distance.
Twin Towers and Suria Mall are 15 minutes away by car.",10,July 2024,"July 9, 2024",King Room,2,Family,9
"Loved staying there for 2 nights, would definitely come again","Breakfast could have had better options, but not a major thing",Close proximity to everything yet still away from very noisy surroundings,10,July 2024,"July 8, 2024",King Room,2,Solo traveler,9
Exceptional,,Amazing location. Kind and helpful staff.,10,June 2024,"July 8, 2024",King Room,1,Family,9
Exceptional,,Amazing location everything walking distance and there is a 7 eleven in hotel building. Staff super friendly and nice,10,June 2024,"July 7, 2024",King Room,4,Group,9
Exceptional,,The interior design and cost was certainly the important points. Highly recommended.,10,June 2024,"June 30, 2024",King Room,2,Solo traveler,9
"the room was perfect, clean and functional with well designed lobby and friendly helpfull staff",nothing specific,"cleannes, functionality, design",8.0,June 2024,"June 29, 2024",King Room,3,Solo traveler,9
Exceptional,,"More than perfect.
Very friendly and helpful staff especially Mr. Kesh in reception. 
Thank you.",10,June 2024,"June 24, 2024",King Room,4,Solo traveler,9
Wonderful,NONE,"This was a bit larger than usual Citizen M hotel room

Staff are so helpful and super clean room.

Perfect location a bit quite and close to all bukit bintang night life!",9.0,June 2024,"June 20, 2024",King Room,2,Solo traveler,9
"Great location, but needs to work out some kinks.","The iPad for controlling the room seemed cool, at first. But after awhile, it was a pain to change channels on the tv and other functions as the iPad was always in sleep mode. So you had to wake it up, go to the media setting, then change your channel. Also, it glitched once and needed a hard reboot. Also, the two channels I was mainly watching HBO and Times Warner (or such) both went out. Leaving me with only English news.",Great location. Super comfortable bed. Modern hip style.,8.0,June 2024,"June 20, 2024",King Room,3,Solo traveler,9
"Super nice room, value for money in a perfect location","Both male staffs I encountered during check in and check out were not friendly nor helpful, but the one female staff serving other guest next to me was very friendly and helpful. I guess it's a hit and miss thing.","The room is wonderful, love all the tech features, the bed is very comfortable, the pillow is amazing, The location is perfect. Would definitely come back and recommend this hotel",9.0,June 2024,"June 19, 2024",King Room,1,Couple,9
Great hotel will come again,Nothing,Fantastic location and very comfortable:),9.0,June 2024,"June 19, 2024",King Room,2,Solo traveler,9
Definitely I will introduce to my friends,Nothing,"Beautiful and full use of space 
Good sleeping area",10,June 2024,"June 14, 2024",King Room,1,Solo traveler,9
"My stay was marked by exceptional service, a vibrant and unique hotel atmosphere, will book again!","To be honest, the only minor issue during my stay was the noise from some lively kids next door, which wasn't the fault of the hotel. However, a quick phone call to the reception resolved the issue promptly. Apart from this small inconvenience, there was absolutely nothing to fault about the hotel. Everything else about my experience was delightful!","I recently had the pleasure of staying at a wonderfully located hotel in Malaysia, and it absolutely exceeded all my expectations! As a first-time visitor, its central location made it incredibly convenient to explore the must-see attractions around. Upon arrival, the self-service check-in process was a breeze, enhanced by the warm welcome from the friendly staff. The manager, Duncan, personally greeted me and even offered a refreshing welcome drink, which was a lovely touch.
The hotel itself boasted a cool, unique design that added an element of fun to my stay. Originally placed in a courtyard-facing room, I requested a switch to a city view, and they accommodated my preference immediately and without any additional charge. I was impressed by the cleanliness, safety, and overall friendly atmosphere of the hotel and their cool all-in-one touch system that sets the mood, TV, lighting, and temperature!
What truly set this hotel apart was the exceptional service, especially from a staff member named Eriq. Eriq was not only professional and knowledgeable but also genuinely caring. He went above and beyond by assisting me with a personal issue I encountered, which speaks volumes about his dedication to guest comfort.
I am already looking forward to my next stay at this hotel. For anyone seeking a clean, safe, and friendly place to stay in Malaysia, this hotel is a fantastic choice. Highly recommended!",10,June 2024,"June 14, 2024",King Room,2,Solo traveler,9
Wonderful,The breakfast wasn't quite what I hoped for but that is a personal preference and others loved it!,Almost perfect from start to finish location was fantastic and the staff were all very friendly would deffinetley stay here again.,9.0,June 2024,"June 14, 2024",King Room,2,Solo traveler,9
Everything perfect except the size of the room,Pity the room is so small. If you're staying longer than a day it might start feeling as a smart decorated prison cell.,"Actually everything is great about this hotel. The location, the high tech rooms, the public spaces, parking.",9.0,June 2024,"June 14, 2024",King Room,3,Couple,9
Clean modern inexpensive boutique hotel,"No kettle in room. 
Didn't answer e-mail.","Located next to Jalan Alor food street. 
Clean, chic, well-decorated, big common space.",10,June 2024,"June 8, 2024",King Room,2,Couple,9
Cool city stay.,,Cool space with friendly and really helpful staff. Breakfast was excellent and easy location to get about in KL.,10,May 2024,"June 6, 2024",King Room,1,Family,9
The Most Comfortable Hotel in KL,I wish they'll have more option for tit bits or finger food at the bar area.,"I would come again and again because of the comfy bed,good services and the vibes.
The breakfast is superb especially the nasi lemak sambal!",10,June 2024,"June 4, 2024",King Room,1,Family,9
Modern and exciting,Nothing,Nice,10,June 2024,"June 4, 2024",King Room,1,Couple,9
Unforgettable,Can't think of any! Overall is excellent.,"Our first experience w/ citizenM is a love at first sight! We were greeted by Kesh; excellent service. He is one of the ambassador, checked in was smooth, he is also a great chef! 

CitizenM is super cool w/ great decor, great team! Our room is super nice w/ smart embedded features and great bed. We slept like babies! Oh and we extended an extra night. Wanted to extended more nights, but it was at 100% occupancy. Will definitely come back, perhaps when we visited other countries too! 

Thank you to the team! Kesh, Duncan, Fiqah, Shida and the rest. Amazing job!",10,May 2024,"June 1, 2024",King Room,1,Couple,9
Exceptional,,"The beds are the super comfy. The location, Jalan Alor is just behind this property.  Dawat Restauran is just behind. It serves fabulous Indian food. Believe me, the cook cooks amazing food which I have seldom got in india",10,May 2024,"May 30, 2024",King Room,3,Family,9
Wonderful,"Their breakfast wasn't having enough options bit we stayed in KL for 5 days and only one day we tried. Rest of the days we went to Dawat restoran for brunch. They serve excellent banana leaf. Just try their chili chicken, mutton briyani, banana leaf,","The location, it's too good for INDIANS travelling to KL as there is a restaurant Dawat just behind the hotel which serves fabulous food. And cost wise also it is very reasonable.  The hotel in itself is good, the lounge area is one of the best. They have mac books on the first floor if somebody wants to work. Staff is also very friendly",9.0,May 2024,"May 30, 2024",King Room,1,Family,9
Perfect stopover hotel,Nothing,"Great hotel, rooms very modern and comfortable, and location next to the street food market was fantastic",10,May 2024,"May 30, 2024",King Room,1,Solo traveler,9
Exceptional,,"The whole smart control thingy just made things so easy to make us wanna stay longer.
Kinda like those Japanese traveller hotel but nicer and bigger.
Will continue to choose this hotel for future stays.
Food street - Jalan Alor is just around the corner thus no worries on food choices.
Shopping mall - Pavilion is also just around the corner. Like a 10 mins walk so all is good.",10,May 2024,"May 28, 2024",King Room,1,Family,9
All you need for a comfortable stay in KL,,"Very neat hotel, rooms and all facilities are crispy clean, the staff is welcoming and helpful, nice breakfast, reception is manned 24/7 for odd hour check-ins/check-outs and queries, great location with a short walk to MRT, a food street around the corner. The hotel definitely 10 out of 10!",10,May 2024,"May 22, 2024",King Room,4,Solo traveler,9
Exceptional,"A little space in the room but it compensated with huge lobby,so no problem for short stay.","Comfortable matras, big window in rom, remote controlled lights and climat. Comfortable lobby where you can work",10,May 2024,"May 20, 2024",King Room,2,Couple,9
Wonderful,,Location and service,10,May 2024,"May 18, 2024",King Room,1,Family,9
"Comfortable, very good location","No coffee/kettle in room, very limited food wise for vegetarians","Very comfortable room, good location.",8.0,April 2024,"May 14, 2024",King Room,2,Solo traveler,9
Definitely recommended to stay here,Nothing. Everything is perfect,"It was amazing! The room is a bit smaller but kudos to the team for knowing on how to decorate the room and make it comfortable for us to stay. The location is also convenient as it is just a walking distance to Jalan Alor, and quite near to any public transportation should we need to go anywhere.",10,May 2024,"May 6, 2024",King Room,2,Couple,9
Wonderful,Room too small for two people; demeanor of one particular reception staff,Smart-home system; tidiness,9.0,May 2024,"May 6, 2024",King Room,2,Couple,9
Wonderful,The plugs were really far from the bed,The bed was soooo comfortable and big,9.0,May 2024,"May 5, 2024",King Room,1,Couple,9
Exceptional,Check in time,Everything,10,April 2024,"May 5, 2024",King Room,1,Couple,9
Perfect!,,"Extremely clean, comfortable and modern",10,April 2024,"May 4, 2024",King Room,3,Couple,9
Nice stay !,Nothing I could thing of.,Perfect location to visit KL. The interior design of the lobby is one of a kind. Art lovers would like this place. All the staff members were welcoming and willing to help.,9.0,May 2024,"May 3, 2024",King Room,3,Solo traveler,9
Gem in Kuala Lumpur,,The vibe of hotel,10,April 2024,"April 28, 2024",King Room,1,Solo traveler,9
Exceptional,The water in the bathroom drains slowly so it sometimes overflows when opening the door,"This is wonderful experience! It’s a smart room, you can control everything in room only via an ipad was set up in the room. The bed is soft and comfortable, it is also next to the window, so the view is very nice",10,April 2024,"April 28, 2024",King Room,1,Couple,9
Recommend 100%,Nothing,Great Location.  Great Staff.  Great Accommodation. Great Shower. Clean and ideal.,10,April 2024,"April 26, 2024",King Room,2,Couple,9
Short stay worthwhile,They did not fix the air conditioning at the lobby for 2 days. Its quite uncomfortable especially with our baby,Location of the hotel is quite good. Love the bed and ipad. The view from our room  was great,8.0,April 2024,"April 24, 2024",King Room,1,Family,9
we love it!,"when arriving in pouring tropical rain, with all of our luggage, it was late and the main entrance was locked. since there were two staff members at the front desk, i would expect them to open the doors for us before we were trying to open the closed doors","top hotel; great rooms, looks and beds are best you can get.  costs a little more, but it's worth it. my kid is crazy about the design and dreams for his own room to be like that.",10,April 2024,"April 22, 2024",King Room,1,Family,9
Good overall,"Ipad to control everything is good however when it doesnt work, which happened, it is annoying","Clean, comfortable",8.0,April 2024,"April 13, 2024",King Room,3,Couple,9
"Lovely short stay at CitizenM, will definitely come back.","Nothing for us but the bed position can be a little tricky for some as it's against the window and takes the whole width of the room, there's no walking space around the bed, however that's the best set up of small room + huge bed.","Excess our expectation base on ""you get what you pay for"". 
Very clean and quite room, SUPER large and comfy bed/pillows/linen (I miss these the most when we leave :)).  Small room but there are enough space for luggage and things (we travel light).  Love the block out blind and room temperature setting as well.
7/11 is next door and Jalan Alor Food Street is just at the back corner of the hotel's block.  Short walking distance to Berjaya shopping mall, can be little bit tricky navigate with Google map at first.
Lovely art display and library at reception.",10,April 2024,"April 11, 2024",King Room,3,Couple,9
Very Good,It is like 20mins walking to the malls.,"Value for money
Good location
Helpful staff
24/7 service
Keep luggage when you are away.
Clean and comfy rooms
Everything in your room is Controlled by the tablet in your room.",8.0,March 2024,"April 9, 2024",King Room,7,Couple,9
Very Good,,The staff were very friendly. The room was small but comfortable. The shower was hot and powerful.,8.0,February 2024,"April 3, 2024",King Room,1,Family,9
Nice stay at KL,"TV channels didn't work properly, but it was not a problem for me.
There was no replacement for breakfast.","Nice decoration and modern concept.
It's much of a self-service system.
Very interesting auto check-in system.
Room automation and lighting system are cool.
Excelent location.
Good breakfast, but there is no replacement , so if you go for a late breakfast, you may not find all options like scramble eggs. 
It is a small room,  but enough for us.",10,April 2024,"April 2, 2024",King Room,4,Family,9
"Beautiful arty hotel, cozy and fun, in a central location",Nothing,"Everything !! :) first the lobby is amazing, full of arty pièces which we love. The room is small but comfortable, and fun with the colored lighting. 
The staff was very welcoming and nice, and the location of the hotel is very good, close to the main spots (by grab or 15-20 min walking from Chinatown bars). We also loved their humor on the toilettries :) Excellent value for money !",10,March 2024,"April 1, 2024",King Room,1,Couple,9
THE BEST FOR PROFESSIONAL TRAVELLERS,NON,EXCELLENT MANAGEMENT AND SERVICE,10,February 2024,"March 30, 2024",King Room,2,Solo traveler,9
Exceptional,,Great,10,March 2024,"March 29, 2024",King Room,4,Couple,9
amazing trip,nothing,Beautiful decoration. Friendly Staff. Fast Check-in system.,10,March 2024,"March 26, 2024",King Room,2,Couple,9
Wonderful,No food room service,Hotel staff was extremely nice!,9.0,March 2024,"March 24, 2024",King Room,4,Group,9
"Excellent, book if you're in the area.",,This is a really brilliant little hotel in an excellent location. We were able to walk to the Pavillion Mall (one of the area's most trendiest malls with superb food courts and shopping experience). The staff in this hotel were exceptional. They really looked after us and when we noted we had an early morning excursion they made sure breakfast was available so we could have some before departing! Thank you for this. The hotel is clean and branding is spot on. Really enjoyable place to stay.,10,February 2024,"March 23, 2024",King Room,3,Couple,9
Great stay!,Tight space but we like it.,"It was clean, smelling nice, no humidity!",10,February 2024,"March 15, 2024",King Room,2,Couple,9
A night in the future,,"Nice minimalist modern rooms.

Loved the cuddly toy and the moods for the room!",10,March 2024,"March 11, 2024",King Room,1,Solo traveler,9
Wonderful,Breakfast can be improved.,Cleanliness/hygiene well maintained.,9.0,March 2024,"March 8, 2024",King Room,3,Family,9
Exceptional,,"Super cool location, I’d definitely recommend for stay in KM. It’s easy to get there and the location is nice to explore the city. The room was super clean with funny texts all around. The breakfast was diverse and personal really friendly and helpful",10,February 2024,"March 3, 2024",King Room,1,Solo traveler,9
