Review Title,Negative Reviews,Positive Reviews,Rating,Stay Date,Review Date,Room Type,Number of Nights,Traveler Type,Overall Average Rating
Very nice indeed. We only stayed one night but will be back to stay longer.,"It is currently next to a construction site of the villa next door, but this work looks likely to finish in the next couple of months. Actually unobtrusive when sitting by the pool.","Hotel is very new, so the standard of fixtures and fittings is high. Rooms are excellent, spacious and quiet. Staff are exceptional, in line with other reviews. Renato the barman is above and beyond, and well worth coming back from an evening meal out in town (v cheap Uber ride back, bit too far to walk) to have a nightcap by the very pleasant pool. Probably cheaper than town as well!",9.0,September 2023,"September 10, 2023",Duplex Room,1,Couple,9.1
We had a wonderful stay and would definitely return to this hotel,,The front desk staff was great ( Samuel ) The breakfast offering was excellent and friendly staff and the location was wonderful.,8.0,September 2023,"September 6, 2023",King Room with Sea View,1,Couple,9.1
It was lovely,,Breakfast was great. Pool side food was ok . Guacamole was not great. Would have like more snack options,8.0,September 2023,"September 5, 2023",King Room with Pool View,3,Family,9.1
Come here and say hi to Samuel!,Nothing not to like!,"A little off the beaten path from the main touristy areas of lagos we found this lovely affordable hotel. Staff are A+++, Samuel at the front desk has all the best tips. Everything in Lagos is close to here, so it's a great home base to tour around. The breakfast is delicious and leaves you full for most of the day. Would definitely come back.",10,September 2023,"September 5, 2023",Deluxe Double Room with Balcony and Sea View,2,Family,9.1
Wonderful,"Height of glass obstructed view on balcony.

No milk for coffee in room..","The  quality of both food and drink
.The friendliness of staff
The room",9.0,September 2023,"September 4, 2023",Standard Queen Room,7,Couple,9.1
Exceptional,,Great property and the staff was very knowledgeable.,10,September 2023,"September 3, 2023",Superior Queen Room,1,Group,9.1
Exceptional,"The cocktails from the pool bar should be stronger, given the price.  Typically we had to order doubles in order for the drink  to mixer ratio to be adequate.","Very nice hotel, with great friendly staff.  Our room was adequate size, but the balcony was very large and had a hot tub.  We really enjoyed the balcony in the evening after the baby went to sleep.  Breakfast each morning was also quite good.",10,August 2023,"September 2, 2023",Superior Queen Room,4,Family,9.1
Exceptional,,Friendly staff and clean hotel,10,August 2023,"August 29, 2023",Deluxe Double Room with Balcony and Sea View,2,Couple,9.1
"We had a lovely,  the staff were fabulous",Building site opposite,Excellent breakfast...Great pool,9.0,August 2023,"August 27, 2023",Duplex Room,3,Family,9.1
Exceptional,"To be honest, the whole family rated it the best hotel we've ever stayed at so all good!",Amazing hotel and the staff were even better!,10,August 2023,"August 26, 2023",Duplex Room,7,Family,9.1
Exceptional,"More space in the room for a family of 4, but this wasn't a deal breaker.","This is a beautiful boutique property.  We enjoyed everything about the property.  The room was very clean and the beds were comfortable.  There was a small TV, however, that could only be viewed by those sat on the sofa/slept on sofa bed.  It's It's a bright hotel, friendly service, great pool, and exceptional breakfast in the morning.  The location was ideal...walking distance to the beach and a short UBER ride into town.  Would definitely stay here again.",10,August 2023,"August 20, 2023",Deluxe Double Room with Balcony and Sea View,3,Family,9.1
"Cute, beautiful and clean",Liked everything,The hotel was very nicely decorated and clean. Rooms are perfect for families.,10,August 2023,"August 19, 2023",Duplex Room,1,Family,9.1
Great overall experience,,"Lovely hotel, great staff and lovely food",10,August 2023,"August 17, 2023",Deluxe Double Room with Balcony and Sea View,1,Family,9.1
Absolutely fantastic! We loved it!,"A bit more variety on lunch/dinner menu would have been great, but what was on the menu was fresh and delicious!",Proximity to the beach; fantastic breakfast and wonderful staff! Lovely room with great shower and stunning deck with ocean views.,10,July 2023,"August 13, 2023",King Room with Sea View,3,Couple,9.1
The best hotel in Lagos with the friendliest staff,Everything was perfect.  And I'm a hard critic.,"The hotel was beautiful and an excellent location, in close  proximity to all the best beaches and restaurants. The staff was very helpful and friendly, rooms were stylish and comfortable, there was a saltwater pool and lounging area. You also have access to filtered water refills for your room rather than relying on staff to restock water bottles. Very convenient.
I extended my stay by an extra day because I loved it here so much.",10,August 2023,"August 8, 2023",Deluxe Double Room with Sea View,5,Family,9.1
Fantastic <3,I liked everything,"Everything was been fantastic. Large room, clean and salted pool. Friendly staff.  comfortable environment. A varied breakfast. (Before that, I spent 5 days in a more expensive hotel, in a better location, but we did not have good conditions. I felt a real rest at the Atlantic Hotel.)",10,August 2023,"August 4, 2023",Deluxe Studio,1,Couple,9.1
Exceptional,,"This property was gorgeous! When we arrived a team member showed us to our room, which was beautiful! The pool area is lovely and was not overcowded. The pool bar serves delishes cocktails and snacks. We had a great time here and would highly recommend this hotel.",10,June 2023,"August 1, 2023",Duplex Room,1,Group,9.1
"Great hotel, would highly recommend","Distance to Lagos although I knew that when booking. Uber is quick and cheap plus most hire a car so makes it easy.
Building works next door. The hotel can't help this but it did disturb the quiet except on Sundays when no work was carried out.","The location to the beach was really good plus the restaurants there were great. The staff in the hotel were above and beyond - some of the best I've known, genuinely wanting to help their customers. All food at the hotel was delicious and breakfast was such a good range. Decor and inside the hotel was modern and very clean/tidy.",9.0,July 2023,"August 1, 2023",Deluxe Double Room with Balcony and Sea View,7,Couple,9.1
Exceptional,,"Great room, helpful staff, excellent location and breakfast with lots of options",10,July 2023,"July 31, 2023",Duplex Room,2,Family,9.1
I was brilliant,Everything was fine,Serwis was extremely kind,10,July 2023,"July 30, 2023",Deluxe Double Room with Balcony and Sea View,1,Family,9.1
Wonderful,,"Room, pool",9.0,June 2023,"July 29, 2023",Duplex Room,2,Family,9.1
Exceptional,Nothing,Everything,10,May 2023,"July 25, 2023",Duplex Room,3,Family,9.1
Very Good,The decor is quite old fashioned.,Nice big bath room and bedrooms and very nice staff ;-),8.0,July 2023,"July 24, 2023",Twin Room,4,Family,9.1
It was fantastic,,The hotel was very clean and the personnel was very nice . Totally love it,10,July 2023,"July 23, 2023",Deluxe Double Room with Balcony and Sea View,2,Group,9.1
Exceptional,,"Location was walking to one of many beaches.
A good breakfast, many selections.",10,July 2023,"July 22, 2023",Deluxe Double Room with Sea View,2,Couple,9.1
Would 100% recommend and be going back,,"Great, friendly staff nothing was too much trouble. Small boutique hotel with lots of facilities. Lovely breakfast included in price",10,July 2023,"July 21, 2023",Deluxe Double Room with Balcony and Sea View,2,Family,9.1
"Lovely location, comfy rooms",Na,Beautiful quite location. Incredible breakfast.,9.0,June 2023,"July 19, 2023",Standard Queen Room,4,Couple,9.1
"Samuel was our main point of contact at the front desk on the property and was a joy to work with. He was helpful, pleas","The fridges in the room barely work, would not recommend storing anything perishable in them. You are better off leaving beverages below the air conditioning vent.","Incredibly clean and modern with authentic Portuguese touches. The building is not too large, but but very spacious. The rooms are large and clean and the balconies the same. The cleaning staff works all day so you can have your room serviced no matter when you leave it. You can tell when you re-enter that it has truly been cleaned, not just tidied. They even vacuum the balcony!  The pool and surrounding area is large enough for all the guests so it does not feel too crowded. It is also sheltered from the wind so it remains warm and comfortable regardless of surrounding weather. The employees are attentive, helpful and very pleasant. It is clear they the property is well staffed and the employees enjoy and take pride in their work. The breakfast is large and full of variety, there will be something for everyone! The pool menu is expansive and reasonably priced as well. There are pool & gym towels available in addition to the room towels. The property is a pleasant 5 minute walk from a large beach and a 5-10 minute, reasonably priced Uber to the town.",10,July 2023,"July 17, 2023",Deluxe Double Room with Sea View,5,Couple,9.1
Love Lagos!,,Absolutely Awesome! From the staff's friendliness to the hotel ammenties... we loved our stay!,10,July 2023,"July 17, 2023",Duplex Room,2,Family,9.1
perfect,I just loved everything!!!,"A perfect place at a very high level, a nice welcome, people with a desire to help. Immaculately clean rooms, I highly recommend.
There is plenty of food",10,June 2023,"July 10, 2023",Duplex Room,1,Family,9.1
"The staff are absolutely incredible. They couldn't be nicer, kinder or more helpful.",The coffee set-up could be a little better.,"The staff are absolutely incredible. They couldn't be nicer, kinder or more helpful. We were blown away by the service we received throughout our stay. From the breakfast staff to the lovely staff at the pool, they couldn't be more brilliant.",9.0,July 2023,"July 10, 2023",Deluxe Double Room with Balcony and Sea View,4,Group,9.1
"Excelente hotel, exceto horário check in",Avalio como abuso check in as 16h e check out as 11h,Conforto e café da manhã,10,July 2023,"July 8, 2023",Deluxe Double Room with Balcony and Sea View,3,Family,9.1
GREAT EXPERIENCE AND STAFF-AMAZING ROOMS,"Having a greater variety of food options for breakfast would have been great. The food was really good, but I wish they had some local Portuguese delicacy for breakfast.","The room and property were very clean, well decorated, and spacious.
The beach was conveniently located. It was walking distance from the hotel, and the beach was great.
The breakfast was good since the staff gave us the option to order fresh eggs which was cooked on the spot for us.",10,June 2023,"July 6, 2023",Deluxe Queen Room,2,Couple,9.1
Best hotel in Algarve!,,"Everything was perfect- from the service, to breakfast and overall hospitality! We had a room with a jacuzzi in the balcony overlooking the ocean, would highly recommend booking this type of room to be able to get the best experience! Carlos is an amazing host and will make everyone feel like they are home!",10,May 2023,"July 6, 2023",Superior Queen Room,1,Group,9.1
"This hotel is the best in the area. The staff is unbelievably friendly, pleasant and helpful. Absolu",,"This hotel is the best in the area. The staff is unbelievably friendly, pleasant and helpful. Absolutely pick this over Belmar or any other in the Lagos area.",10,July 2023,"July 5, 2023",Deluxe Double Room with Balcony and Sea View,1,Family,9.1
Relaxing retreat in Lagos,,"Location was perfect. Felt very high class. 6 minute walk to the best beach (big, clean) in Lagos. Clean room and comfy beds. Amazing staff. Binny’s service and cocktails were a highlight. Samual was very friendly and helpful with recommendations as well. Would recommend staying here.",10,July 2023,"July 3, 2023",Duplex Room,3,Group,9.1
magnificent hotel,,"stunning location, great pool, good food",10,June 2023,"July 3, 2023",Deluxe Double Room with Balcony and Sea View,3,Family,9.1
Nice people good service,Nothing,Very well laid out. Pool area was great,10,July 2023,"July 3, 2023",Deluxe Studio,5,Family,9.1
Amazing,,"Great location, clean and well kept.   Breakfast was amazing!   Pool is nice with a bar and snacks.   Great for kids and families.    Beach nearby is great.   It is a short distance way by foot (not stroller friendly).   Beach can be accessed by road for stroller and cars (parking) but it is a little further away 15 minute walk.",10,July 2023,"July 2, 2023",Deluxe Double Room with Sea View,5,Family,9.1
Loved it.  Will definitely come back!,,"Location was great, staff super friendly, breakfast was awesome, nice pool and bar area and love that you can walk down steps to the beach.",10,June 2023,"June 29, 2023",Standard Queen Room,1,Solo traveler,9.1
Exceptional,Can't think of much.,Accommodated an early arrival and had excellent facilities!,10,June 2023,"June 28, 2023",Superior Queen Room,1,Family,9.1
Beautiful hotel and beaches.,Did not like that the TV was a small TV on a desk across from a small sofa instead of on the wall across from the TV.  Booked room same time as friends traveling with us and their room was larger and had large TV on wall and their room was less money!  Very confused since booked at same time and used same website...,Breakfast was excellent.  Location was awesome.  Hotel and pool were beautiful and very clean.  Staff recommended restaurants and made reservations for us.,9.0,June 2023,"June 28, 2023",Deluxe Double Room with Balcony and Sea View,4,Couple,9.1
Exceptional,,"Loved everything! Wonderful, easy parking and check in. Friendly and kind staff. Beautiful property. The breakfast was great, lots of fresh options. Location was a short drive from town and very peaceful, walking distance to nice beaches.",10,June 2023,"June 26, 2023",Superior Queen Room,4,Couple,9.1
perfect oasis …especially for families,,"Everything about the hotel is excellent …staff, property, large room (recommend the duplex room for families), pool, pool bar & breakfast. the on site parking was also a plus. would definitely return for the perfect Lagos home base!",10,June 2023,"June 26, 2023",Duplex Room,4,Family,9.1
"Excellent, highly recommended","The room deserves better towel.
No tissues in the room
Check in at 4PM is too late
Elevator and floors are confusing - lobby is at -1 and the first floor is at 0.","Room was great 
Breakfast was fantastic 
Friendly and helpful staff
Nice pool to relax",9.0,June 2023,"June 25, 2023",Standard Queen Room,3,Couple,9.1
Exceptional,hot water takes a long time to work,location is great- by the beach. beautiful setting and amenities,10,June 2023,"June 21, 2023",Deluxe Studio,1,Group,9.1
Exceptional,,"Wow , what a lovely hotel . The staff are super friendly and kind . The room was perfect , big comfy bed , great shower and balcony with pool and sea views. Breakfast was amazing, spoilt for choice every morning . The food they serve throughout the day was very delicious too. My girlfriend and I throughly enjoyed our stay. Would 100% recommend this hotel and would love to go back.",10,June 2023,"June 19, 2023",Deluxe Double Room with Balcony and Sea View,6,Couple,9.1
Exceptional,"Check in takes a little long, however front desk was very helpful and thorough","Beautiful hotel, modern finishes,  lovely rooms, great breakfast and very welcoming pool area.",10,June 2023,"June 18, 2023",Standard Queen Room,1,Couple,9.1
Exceptional,,"Super friendly staff, all excellent!",10,June 2023,"June 17, 2023",Deluxe Double Room with Balcony and Sea View,2,Family,9.1
Immaculate hotel with great pool and close to beach and restaurants,Nothing,"Immaculately clean hotel with really nice pool
A short walk to a swimming beach with two good restaurants 
we had a family duplex which was poolside and really spacious with two bathrooms and two tvs 
The town centre is a short drive away and it’s well worth heading there for a day 
Staff are friendly with an impressive breakfast
Easy free parking out front",9.0,May 2023,"June 14, 2023",Duplex Room,2,Family,9.1
Very relaxing stay,"It's a bit out of the way, a 25 minute walk to the bars and restaurants. Also didn't like the lack of privacy in the bathroom.","The hotel was beautiful and the staff were so helpful, especially Bunny in the bar. Such a relaxing place, never too busy, a hotel I would definitely return to.",9.0,June 2023,"June 13, 2023",King Room with Sea View,8,Couple,9.1
Gem hotel near the beach,I liked everything,Staff super friendly. Room with huge wrap around balcony and hot tub (room 100). Very close to the beach. Great breakfast. Short taxi to Lagos centre. Fantastic stay.,10,June 2023,"June 12, 2023",Deluxe Queen Room,2,Couple,9.1
"We enjoyed our stay very much . Easy access to great restaurants , entertainment and shopping",Linch options could be better,"Breakfast needs healthier and gluten free options 
Non dairy yogurts more fresh fruit 
Room was perfect for families
Beach was beautiful and easy access",10,June 2023,"June 10, 2023",Duplex Room,4,Group,9.1
Exceptional,,"Wow, we were blown away by this hotel! The staff, room, food and beach were unmatched.",10,June 2023,"June 9, 2023",Duplex Room,5,Family,9.1
Wonderful,,great pool and restaurant/bar attached to pool area. staff very helpful !,9.0,June 2023,"June 8, 2023",Superior Queen Room,3,Couple,9.1
Wonderful,"This property is quite a distance from the old town and marina area. In some ways, it was exactly what we wanted. But there really isn't much for public transportation near the property so it did become a hassle to order rides anytime we needed to get to town or wanted to go out to eat. There are two restaurants within walking distance which are both right on the beach, and the hotel does have a limited bar menu for food, but the hotel does not have a full restaurant.","Our stay here was an absolute dream! The whole property is gorgeous! Our room was spacious and the balcony overlooked the pool and had a great view of the ocean. Being so close to the beach I would expect some sand to get in but no, the whole place was spotless. It is clear the staff work so hard to make your stay great. The folks at check in were helpful, not only with answering general questions but also with booking an excursion for us. The staff that worked the breakfast and the pool bar and kitchen area were all great. The breakfast spread was incredible! Fresh fruit, yogurt, meat and cheese, lots of breads and pastries, eggs to order, bacon and sausage, fried mushrooms and veggies. The pool area is so nice, lots of lounges and umbrellas so I never felt like I had to rush to get a seat by the pool. It's also an eight-minute walk to one of the beaches which was so convenient.",9.0,June 2023,"June 7, 2023",Deluxe Double Room with Sea View,4,Couple,9.1
Exceptional,,Staff were amazing and everything was in an amazing way.,10,June 2023,"June 5, 2023",Deluxe Double Room with Balcony and Sea View,1,Family,9.1
"Beautiful, relaxing resort a very quick drive away from the old town","The balcony doors wouldn't close fully, so it let noise in.",Great breakfasts. Bed was large and comfortable. Pool side bar service was great,9.0,May 2023,"June 5, 2023",Deluxe Double Room with Balcony and Sea View,4,Couple,9.1
I would absolutely stay here again,We hated leaving!,"The hotel is beautifully decorated and maintained. The staff was very friendly, attentive and full of suggestions for points of interest. I was in the middle of telling my husband how much I liked the hotel when one of the bartenders appeared with blankets for us. She’d noticed me zipping up my jacket. The breakfast buffet was great along with the egg menu. It’s just a lovely environment. The pictures make it look like a pretty large hotel but it really had an intimate feel. While not directly on the beach it was a maybe ten minute walk down to a beautiful beach with a couple restaurants.",10,May 2023,"June 4, 2023",Duplex Room,4,Family,9.1
"sun, surf and relax",,"clean, safe close to a beach…friendly staff",10,June 2023,"June 3, 2023",King Room with Sea View,3,Solo traveler,9.1
five star service and facilities for a four star price! amazing,"everything was excellent, just be aware there is construction in the surrounding area but that’s not a fault of the hotel!","the staff here are so exceptional, they really make this place special. our room was super comfortable as well, and we loved having a balcony with loungers (I believe all the rooms have balconies!).

I also loved the size of the hotel, the perfect boutique size in my opinion.

the pool was incredibly clean. the food menu is mainly snack type food but it was good and well priced. the included breakfast was good value too!",9.0,May 2023,"June 3, 2023",Deluxe Double Room with Sea View,3,Couple,9.1
Exceptional,Nothing.,Jose was so nice and accommodating.the pool area was beautiful and the rooms were great along with the location. I would definitely recommend this hotel.,10,May 2023,"June 1, 2023",Duplex Room,1,Group,9.1
Relaxing stay at Lagos Atlantic Hotel,,We enjoyed our stay at Lagos Atlantic Hotel a lot. Especially relaxing on the nice pool and making use of the pool bar. Very nice and clean room and super friendly staff. We would definitely come back. Very convenient parking area and good breakfast.,9.0,May 2023,"May 31, 2023",Economy Twin Room,3,Couple,9.1
Exceptional,Nothinh,"The staff, Jose, was exceptional. The rooms, pool and view was beautiful. They could not have been more accommodating. Wonderful breakfast!",10,May 2023,"May 29, 2023",King Room with Pool View,1,Group,9.1
Amazing hotel with great amenities and team!,Everything! Pool and room and bar were perfect!,"Everything! Great great hotel with wonderful team, rooms, pool and breakfast!",10,May 2023,"May 29, 2023",King Room with Sea View,2,Family,9.1
We will definitely return next time we are in Lagos.,Nothing,"Staff are very friendly and very helpful. Facilities are well maintained, clean and bright, overall inviting. Room had a comfortable bed, nice bathroom and a lovely balcony overlooking the pool. Convenient parking lot right by reception and rooms.",10,May 2023,"May 29, 2023",Deluxe Double Room with Sea View,3,Couple,9.1
second visit and another excellent stay,some building work nearby,excellent service and good facilities,8.0,May 2023,"May 28, 2023",King Room with Sea View,7,Couple,9.1
Blissful,Nothing to dislike!,"Warm friendly staff, great hospitality!",10,May 2023,"May 27, 2023",Deluxe Double Room with Balcony and Sea View,2,Couple,9.1
Ideal,,"Stunning, beautiful facilities. Pool gorgeous.  Wonderful location. A beautiful part of Portugal.",10,May 2023,"May 26, 2023",Economy Twin Room,1,Couple,9.1
Wonderful,Building work next door,"Fabulous staff , room facilities and location, shame about the building work in the location right next door to the hotel, had we been told about the situation we may not have booked, but to be fair apart from 7am start time for the cranes and diggers and the dirt and dust being blown about, I still had a lovely time",9.0,May 2023,"May 25, 2023",Superior Queen Room,9,Couple,9.1
Very Good,"more choice of food in the evenings
building work on adjacent site although not too noisy",Very friendly staff - great breakfasts  - cleanest hotel I have ever stayed in,8.0,May 2023,"May 25, 2023",Standard Queen Room,7,Couple,9.1
Wonderful,"room smelt moldy, smell got better with the door open. besides that a beautiful room!",,9.0,May 2023,"May 21, 2023",Deluxe Double Room with Sea View,1,Group,9.1
It was excellent!,location wasn’t the best but my family loved it because it was in a quiet neighborhood,Staff. Food.,9.0,April 2023,"May 21, 2023",Economy Twin Room,2,Family,9.1
"Great staff, nice place!","Our room was up a flight of stairs and only had about 1.5 feet between the top of the stairs and the very heavy sliding glass door into the room.   If you have balance problems etc, I'd ask for a room that doesn't have these stairs as not all the rooms do.","Very nice staff, excellent breakfast (buffet and order off the menu), clean room and comfortable bed, nice pool area",10,May 2023,"May 18, 2023",King Room with Sea View,1,Couple,9.1
Exceptional,,Great location and facilities. Close to beach and quick drive to town of Lagos.,10,May 2023,"May 18, 2023",Economy Twin Room,1,Couple,9.1
Exceptional,,Two level rooms,10,May 2023,"May 16, 2023",Duplex Room,2,Family,9.1
I’ll be back 😎,,"The people were lovely - friendly, helpful, eager to please. Special praise to the “chef”/boss lady at Reception, and her male colleague. Both went out of their way to make my stay excellent.

Also deserving of high praise is Ms. Binnie at the poolside bar/cafe. She is eager to please and a lovely calm presence.

The breakfast spread was surprisingly generous for such a small hotel.",10,May 2023,"May 12, 2023",Deluxe Double Room with Sea View,5,Solo traveler,9.1
Loved the staff and pretty much everything really,Nothing,Both amazing,10,May 2023,"May 11, 2023",Deluxe Double Room with Sea View,4,Couple,9.1
"Absolutely Fabulous, will definitely go back soon.",,The Staff at the Hotel were amazing and really treated us well. We had an amazing time,10,May 2023,"May 10, 2023",Deluxe Double Room with Sea View,1,Couple,9.1
Value for money!,N/A,"Staff were excellent and always accommodating. 
Location of hotel was great. 
Faclities in the hotel were great.",10,May 2023,"May 8, 2023",Deluxe Double Room with Balcony and Sea View,3,Family,9.1
"great stay, we will come back",nothing,"very helpful support and friendly team
nice breakfast
location close to the beach
nice pool",10,May 2023,"May 7, 2023",Deluxe Double Room with Balcony and Sea View,1,Family,9.1
