Review Title,Negative Reviews,Positive Reviews,Rating,Stay Date,Review Date,Room Type,Number of Nights,Traveler Type,Overall Average Rating
"Excellent stay, great location",Pillows unusually thick to the point of being impractical,"Great location, great service, friendly, helpful staff. Great food too.",9.0,June 2023,"July 4, 2023",Superior Single Room,1,Solo traveler,9.2
Great stay,Rooms are comfortable but somehow outdated.,"It’s a stunning hotel with a beautiful lobby and friendly staff, good breakfast and great location.",8.0,July 2023,"July 3, 2023",Standard Double,1,Solo traveler,9.2
Excellent choice,,"I booked the room, but it was for my husband and son.  They report : Comfortable, spacious room. Very good  service. Convenient location.",9.0,June 2023,"July 1, 2023",Superior Twin Room,3,Family,9.2
High quality and professionalism,,"Quick staff, services, safety and nice cleanliness",10,June 2023,"July 1, 2023",Standard Double,2,Family,9.2
Perfect location in Warsaw,Nothing specific to mention.,Perfect location in the exact center of Warsaw.,9.0,June 2023,"June 30, 2023",Standard Double,2,Couple,9.2
Great,,Amazing breakfast buffet,10,June 2023,"June 30, 2023",Standard Single Room,1,Solo traveler,9.2
excellent stay,"friendly staff , large rooms",excellent hotel and location,10,June 2023,"June 30, 2023",Standard Twin Room,1,Group,9.2
Wonderful,,"Every thing was perfect. Good location, wonderful breakfast.",9.0,June 2023,"June 29, 2023",Superior Double,3,Family,9.2
An ideal hotel choice in Warsaw near train and coach station,,"1. Excellent location which is near to train and coach station.  Several currency exchange shops nearby. 
2. 10 minutes walk to shopping mall where there are wide choices of restaurant to choose. 
3. Breakfast is definitely a bonus with lot of choices, even desserts and sparkling wine are provide.  You must spare a longer time to enjoy the breakfast.
4. Room is spacious and the bed is comfortable.",8.0,June 2023,"June 29, 2023",Standard Twin Room,2,Solo traveler,9.2
Quality hotel in prime location,,"First class hotel in superb central location, near the railway station and a 20-minute walk from the Old Town via a street packed with shops, restaurants and bars.  Excellent bar and breakfast room.",9.0,June 2023,"June 29, 2023",Standard Double,1,Couple,9.2
An extremely comfortable hotel for a one night stopover,,"Smart, spotless with a team of helpful staff.",9.0,June 2023,"June 28, 2023",Deluxe Double Room,1,Couple,9.2
"good place to stay and centrally located to landmarks, transport.",less veg options for breakfast.,good snack menu.,9.0,June 2023,"June 28, 2023",Standard Double,1,Solo traveler,9.2
Could of stayed forever,Nothing to write about here.,"The ambiance,the position in the City and the feeling that we were staying in a first class hotel with the service to match..",9.0,June 2023,"June 27, 2023",Standard Twin Room,1,Couple,9.2
"Great location, great staff, great rooms!",,"The staff at the hotel and restaurant were very friendly and helpful, and we were very impressed with our rooms. The breakfast had everything you could ever possibly want and all good quality food. The beds were very comfortable, the bathrooms were very clean. It's in a great location directly across from the Palace of Culture and Science, and only a 15min walk from Old Town. We would stay again!",10,June 2023,"June 26, 2023",Standard Double,1,Family,9.2
Excellent again!,,"It was my second time staying at Polonia Palace Hotel and I'm sure not the last one. Perfect location, very good breakfast, nice and specious rooms and amazing service. There is nothing I can complain about. I'd like to mention that this time we used their spa as well and here too our experience was very good. Very professional, kind and helpful, adjusting the service to your needs. Smooth room service and their beef tatar ruined any other beef tatar experience around the city (best we have had anywhere in Warsaw and Gdańsk where we stayed a few days as well). Highly recommended!",10,May 2023,"June 25, 2023",Deluxe Double Room,5,Couple,9.2
Lovely short stay,"It looks like there have been a few cost cutting measures since we last stayed here. There used to be a beautiful flower arrangement in the bar, and nibbles always came with your drink. At breakfast, you could get a nice vodka. Sadly no longer the case.","All the staff were extremely friendly and helpful. The breakfast was very good, although no vodka now. Everywhere was spotlessly clean.",9.0,June 2023,"June 23, 2023",Standard Double,3,Couple,9.2
An excellent  hotel. We love the hotel.,,"Everything  was perfect.  Breakfast- excellent.  Location- wonderful.  The room, excellent.",10,June 2023,"June 20, 2023",Deluxe Double Room,4,Family,9.2
beautiful space and great location,nothing. was great.,love this property. Beautiful room and reception.,10,June 2023,"June 19, 2023",Superior Double,1,Couple,9.2
Excellent,USB charging points in the rooms,The variety of the breakfast was excellent,8.0,June 2023,"June 18, 2023",Superior Single Room,3,Solo traveler,9.2
Exceptional,I found it perfect,"Very nice breakfast. Lovely staff. Hotel is amazing 
Would come back and encourage others to stay as well",10,June 2023,"June 16, 2023",Superior Double,1,Family,9.2
excellent!,gym equipment,location,9.0,June 2023,"June 16, 2023",Deluxe Double Room,2,Solo traveler,9.2
I stay there every time.   well located near airport and train statiion,,"room,  bar",10,June 2023,"June 15, 2023",Superior Twin Room,3,Solo traveler,9.2
Very Good,no tooth past and tooth brush,"breakfast, location",8.0,June 2023,"June 14, 2023",Superior Twin Room,4,Family,9.2
Wonderful,Not much. Breakfast layout haphazard. Bath plug broken. Difficult to think of much else.,Virtually everything. Top quality hotel with excellent access to all forms of transport. Lovely rooms and facilities. Good service all round by staff. Well liked by other guests.,9.0,June 2023,"June 14, 2023",Deluxe Double Room,5,Family,9.2
Exceptional,,Hotel ideally situated to get round Warsaw. Easy to walk to old town or walk to the public transport stops.,10,June 2023,"June 12, 2023",Standard Double,5,Family,9.2
Exceptional,"Quite pricy, and hot breakfast could be more various and include e.g. pancakes. We had no view from the room and the noise from aircon from the roof was quite big. But with windows shut and aircon in the room everything was ok. All in all - very nice hotel, would recommend.","The location is the best - in the very centre, near reataurants, bars and shopping. Warsaw Chopin airport can be reached by public transport, the stop is just in front of the hotel. Very clean room, helpfull staff, good breakfast.",10,June 2023,"June 11, 2023",Superior Twin Room,2,Group,9.2
Very Good,breakfast was very poor. doesn't worth the money,almost everything was nicd,8.0,June 2023,"June 8, 2023",Superior Twin Room,1,Group,9.2
Best bed ever!,"Nothing much to complain about, only that I waited a bit during check-in because it was probably a busy time.","I don't usually comment on beds as I can easily sleep on any decent bed, but the bed in this hotel is definitely one of the best I've ever experienced! It fits the body and it is very stress-releasing. If I had the chance to visit Warsaw again I would definitely love to experience it again!
The room I stayed was very spacious, too.",9.0,May 2023,"June 7, 2023",Standard Single Room,1,Solo traveler,9.2
An excellent place to stay in Warsaw City Centre,"As the hotel is located in the city centre, local friends who are visiting you will need to be familiar with the one way streets and may also find it challenging to find street parking.","The hotel is very centrally located in the city centre of Poland, within walking distance of the Palace of Cutlure and the main railway station. There are numerous shops and restaurants nearby. My room was very quiet and I slept well. I enjoyed the welcome drink at the bar. There was a good selection of hot and cold food available at breakfast. There was also a spa downstairs where I was able to have a relaxing body massage.",10,May 2023,"June 6, 2023",Superior Single Room,2,Solo traveler,9.2
Exceptional,Repeatedly difficult to connect to WiFi. Did not have/find a shoehorn in my room.,Superb hotel at excellent location. Great service. Beautiful. To be much recommended if you want a special place to stay in town.,10,June 2023,"June 5, 2023",Deluxe Single Room,2,Solo traveler,9.2
Great hotel for the weekend!,Honestly..cant say anything negative about the property.,"Very friendly and helpful staffs at the reception. Location is superb, walking distance to major shops and main train station.",10,June 2023,"June 4, 2023",Standard Twin Room,1,Couple,9.2
The place of choice for Warsaw trip!,n/a,"Great location, ideal for exploring the beautiful Warsaw. Good size rooms! Very good breakfast - we were spoilt for choice. Staff at Polonia Palace are excellent, attentive and most helpful.",10,May 2023,"June 4, 2023",Standard Double,2,Couple,9.2
Exceptional,Nothing.,Excellent location.  On site parking was very helpful.  Staff helpful.,10,June 2023,"June 2, 2023",Superior Twin Room,2,Group,9.2
Breakfast was very good. Close to Meter and busses for gritting around.,,Everything about the Polonia was excellent.,10,May 2023,"June 1, 2023",Deluxe Double Room,3,Couple,9.2
"Great location and hotel, enjoyed my stay",,Great location and stay,10,May 2023,"May 31, 2023",Standard Double,2,Couple,9.2
Amazing stay in Warsaw,"I even dont know what to mention here, actually the property exceeded our expectation.","The location is very central, but its really quiet in the room. Its super clean and comfortable. The staff is nice and the lobby bar was nice as well.",10,May 2023,"May 30, 2023",Standard Single Room,2,Group,9.2
Very nice.,Lack of facilities.,"Clean, comfortable, breakfast second only to the Bristol hotel.",8.0,May 2023,"May 29, 2023",Standard Twin Room,1,Solo traveler,9.2
Outstanding,Outstanding architecture beauty,"Staff were more than helpful 
Location in next to none 

Overall excellent experience",10,May 2023,"May 29, 2023",Standard Twin Room,1,Family,9.2
A piece of Warsaw histrory,,"Beautiful interiors
Perfect location
Delicious breakfast",10,March 2023,"May 27, 2023",Standard Single Room,1,Group,9.2
Exceptional,The terrible Booking.com transfer failures,Hotel was outstanding in all respects,10,May 2023,"May 19, 2023",Standard Double,7,Family,9.2
Exceptional,n/a,"This is one of the best hotels I have ever stayed in. very clean, quiet place.",10,May 2023,"May 16, 2023",Standard Single Room,2,Solo traveler,9.2
Would be my first choice for our next stay in lovely Warsaw.,Breakfast a little crowded but excellent buffet.,Beautiful classic hotel. Very good value for money. Spacious room with excellent facilities.,9.0,April 2023,"May 13, 2023",Standard Double,1,Couple,9.2
very enjoyable,nothing,location and cleanliness,10,May 2023,"May 12, 2023",Standard Double,2,Couple,9.2
Exceptional,,"Cozy, spacious room. Impressive interiors. Good breakfast.",10,April 2023,"May 10, 2023",Standard Double,2,Couple,9.2
Thank you!,,Beautiful elegant European hotel in walking distance to all attractions.,10,April 2023,"May 8, 2023",Superior Twin Room,1,Couple,9.2
Great location and friendly staff.,"Despite being there for two nights I would have expected house keeping to have sorted the issue with the bath not draining. For a 4* hotel, this should have been corrected.",It’s location and level of care in the building.,8.0,May 2023,"May 7, 2023",Standard Single Room,2,Solo traveler,9.2
Perfect stay in Warsaw,,"Perfect localisation, very close to Main Train Station, lots of trams, buses nearby, close to metro. Lots of good restaurants nearby. Very good breakfast with lots of choices. Lobby bar open till late (23.00) with hot kitchen.",10,May 2023,"May 3, 2023",Superior Double,3,Couple,9.2
Exceptional,,Excellent location. Great quality. Accomplished staff.,10,May 2023,"May 3, 2023",Standard Twin Room,1,Couple,9.2
One of the best hotels I've stayed,coffee quality in buffet is not good.,"Amazing hotel, luxurious, smells nice!",10,April 2023,"May 3, 2023",Standard Double,4,Couple,9.2
Exceptional,Nothing...its exceptional,"Everything. I've been staying at the hotel since my first trip to Warsaw in 2015. The character, history, position and friendly staff add value to the experience.",10,April 2023,"May 1, 2023",Deluxe Double Room,5,Solo traveler,9.2
Nice stay in nice hotel,all was good,"very nice room on quiet side of hotel, definitely  ask for quiet room other face  busy main road . very good breakfast  with big choice of hot, cold  and vegan dishes , catered for all tastes . only point was water in the room from tap is chlorinated and makes tea taste strange ( i drink a lot of tea!!)",9.0,April 2023,"April 26, 2023",Standard Double,1,Solo traveler,9.2
It met my expectations.,Lower prices for room.,"Location, food, friendly staff,  access to public transport.",10,March 2023,"April 21, 2023",Superior Single Room,3,Solo traveler,9.2
amazing stay in the heart of Warsaw,"nothing, it was amazing and it was our second time int time hotel",excellent,10,April 2023,"April 14, 2023",Family Room (2 Adults + 2 Children),2,Family,9.2
excellent very recommended,nothing,"excellent location, great staff",10,April 2023,"April 12, 2023",Standard Double,5,Couple,9.2
great value for central 4 star hotel. Also a great breakfast.,nothing,beautiful old school hotel. Very central.,9.0,March 2023,"April 12, 2023",Standard Twin Room,2,Solo traveler,9.2
All perfect.,,"From the staff, to the structure of the hotel everything is wonderful. The breakfast was delicious and our room had a fantastic view and a very comfortable bed.",10,April 2023,"April 9, 2023",Standard Double,2,Family,9.2
Exceptional,,"Breakfast is delicious, fresh, and filling. So good!",10,April 2023,"April 7, 2023",Standard Twin Room,3,Group,9.2
Wonderful,,"A hotel with history, in the middle of the centre.",9.0,April 2023,"April 5, 2023",Standard Twin Room,2,Solo traveler,9.2
,,,10,April 2023,"April 3, 2023",Superior Double,1,Family,9.2
Exceptional,,Very comfortable beds! Excellent breakfast!!,10,April 2023,"April 3, 2023",Standard Single Room,4,Family,9.2
Wonderful,There was no jacuzzi facility or pool.,"The room was very clean and cosy.  Despite been so close to the street, it was very quite.",9.0,March 2023,"April 2, 2023",Superior Double,3,Couple,9.2
will come back,the restaurant needs to be reopened,its 110 years are in the walls and can tell stories,8.0,March 2023,"March 31, 2023",Superior Double,1,Couple,9.2
perfect,,beautiful hotel in the middle of Warsaw,8.0,March 2023,"March 31, 2023",Standard Twin Room,1,Solo traveler,9.2
Exceptional,,Fantastic location. The room was clean and quiet. We thoroughly enjoyed our stay.,10,February 2023,"March 25, 2023",Superior Twin Room,3,Group,9.2
Almost approach perfecr except payment system.,"When we are booking room we didnt include breakfast. and then morning time when we had time for eat breakfast, that staff request to us immediately pay for counter. i told to them my room number and i start to tale food in the dish. but 1 more time to come to me request to pay. and also, when i using hotel bar, i also request to them to include my room charge. but they also request to us immediately paying. 
so if possivle for convinient for guest to include room charge for every service.","Best location
clean
kindful staff",10,February 2023,"March 24, 2023",Superior Double,2,Family,9.2
Lovely gem in the centre of Warsaw,Breakfast could have had a little more variety. But such a minor point in on the overall scheme of things.,"Excellent location. 5 minutes walk to Warsaw central station. Across the ministry of culture and science. Minutes from shopping and eating choices.
Lovely hotel and a great room with a view.
Posh toiletries.
Very friendly staff.",10,March 2023,"March 24, 2023",Deluxe Double Room,2,Couple,9.2
"Old World Charm, maintained in Mint Condition!",,"Old world Charm, maintained in mint condition! clean, quiet comfortable rooms, with good WiFi, and powerful shower. Sauna was great, and the Breakfast was superb! wide variety, and delicious! warm welcome, at the front desk, and Lunch and Dinner was delicious! looking forward to staying again! located only a few blocks walk from the main train station.",10,March 2023,"March 20, 2023",Standard Double,1,Couple,9.2
Very Good,"The pillows of the bed were not really comftable. They must be harder. 
Internet was not easy to use.",The location was good. The employees were friendly. The room had a good size.,8.0,February 2023,"March 20, 2023",Standard Double,4,Solo traveler,9.2
Exceptional,,"Exceptional service, clean and spacious room, great breakfast 👌",10,March 2023,"March 16, 2023",Superior Double,2,Couple,9.2
Best solution for NYE,,"Central position, cozy and clean room, kind staff, real value for money.",10,January 2023,"March 15, 2023",Superior Double,2,Couple,9.2
wonderful hotel,,everything was great!,10,March 2023,"March 14, 2023",Standard Double,1,Couple,9.2
Wonderful,"Mini bar was empty, and a guest is supposed to call reastaurant even for just a bottle of sparkling watter.","My stay was short, one night with early departure for tranzit, so  did not have enough time to explore and use all facilities, but what I saw impressed me. Location is perfect and staff fully proffesional and kind.
Will come back for sure, though in period when price would be discounted ;-)",9.0,March 2023,"March 14, 2023",Standard Double,1,Solo traveler,9.2
Exceptional,,"Very good stay at middle of Warsaw. Friendly staff, clean room and great restaurant. Highly recommended.",10,March 2023,"March 12, 2023",Superior Double,2,Couple,9.2
A delight.,Nothing.,Everything. Breakfast was exemplary.,10,March 2023,"March 12, 2023",Standard Double,2,Couple,9.2
Wonderful,Beds and pillows were very hard,"Breakfast was excellent! A bit pricy, but definitely worth it!",9.0,March 2023,"March 10, 2023",Standard Twin Room,3,Group,9.2
Vert nice,,"Vert Nice breakfast, the AC not totally silent but otherwise the room was very clean and comfortable.",9.0,March 2023,"March 7, 2023",Standard Twin Room,1,Solo traveler,9.2
Met all of our expectations and more,,Everything.  Friendly and helpful staff,10,March 2023,"March 6, 2023",Superior Double,3,Couple,9.2
Wonderful,Only stay for two days,Super good hotel,9.0,February 2023,"February 28, 2023",Standard Double,2,Solo traveler,9.2
"We had a really nice stay , the location of the hotel is perfect.",The bed had a hard mattress.,"The room was big and comfortable, we were very satisfied with the facilities.",9.0,February 2023,"February 28, 2023",Standard Double,3,Group,9.2
Wonderful,Nothing. Perhaps they can put hand lotion in the communal bathrooms in the reception area.,Very friendly and accommodating. They allowed me to check in early and check out late as I had a late flight,9.0,February 2023,"February 27, 2023",Standard Twin Room,2,Solo traveler,9.2
made our Warsaw stay very enjoyable,nothing,very enjoyable stay at hôtel Polonia. great hotel and location,10,February 2023,"February 24, 2023",Standard Double,3,Couple,9.2
Exceptional,Not applicable for this place,Everything is perfect ❤️,10,February 2023,"February 21, 2023",Superior Double,3,Family,9.2
Wonderful,There was no soap in the room ;(,Everything,9.0,February 2023,"February 20, 2023",Standard Twin Room,2,Family,9.2
Exceptional,,"I asked for a quiet romm as I was travelling for work.
I received one at the end of corridor which was comfortable and quiet. 
Very good and varied breakfast",10,February 2023,"February 20, 2023",Standard Single Room,1,Solo traveler,9.2
Nice and easy,/,"breakfast, room, location",9.0,February 2023,"February 13, 2023",Standard Twin Room,2,Group,9.2
Very good value for the price,"I would only appreciate larger cups for tea at the breakfast but that's a small thing. 
I would also recommend sending invoices by e-mail instead of printing two copies (= becoming more eco-friendly).","A nice and clean room, comfortable bed, enough space for clothes. My room was very quiet, however, a colleague complained of hearing trams going in the street. Complementary bottle of water provided every morning. All bare necesities provided. Nice breakfast with a variety of choice. Location close to the city centre. The staff was nice. I paid right at the check-in and therefore the check-out was very quick.",9.0,February 2023,"February 13, 2023",Standard Single Room,3,Group,9.2
Exceptional,I could not find fault. I thought it was well run and had a thoroughly enjoyable stay.,"Staff were excellent and polite. Room cleanliness was excellent. Gym was small but sufficiently equipped and clean. Staff again very courteous.
Bar food was good with excellent staff.
All round a good job.",10,February 2023,"February 13, 2023",Superior Double,11,Solo traveler,9.2
A beautiful historic building in an excellent location with friendly helpful staff and an outstanding breakfast selectio,,"Beautiful building, excellent location and outstanding breakfast",10,February 2023,"February 13, 2023",Deluxe Double Room,3,Couple,9.2
Wonderful,,"Great place, a beautiful building, and very helpful staff. Nothing to complain about.",9.0,February 2023,"February 8, 2023",Standard Single Room,1,Group,9.2
Exceptional,,Conveniently located near the railway station. Walking distance to Old Town. The hotel & rooms have a much cozier atmosphere than most of the chain hotels. Very friendly staff. Spacious rooms with fridge.,10,February 2023,"February 6, 2023",Standard Double,2,Couple,9.2
"Perfect Location, Very Clean, Very Comfortable and i would recommend this hotel to all my friends",nothing,"Perfect Location, comfortable bed, very clean and i would definitely stay again",10,January 2023,"February 5, 2023",Standard Double,2,Couple,9.2
Exceptional,,Great location and nice staff!,10,January 2023,"February 4, 2023",Standard Double,1,Family,9.2
Comfortable place in central location,,"Renovated old building right next to Central Station. Comfortable rooms, very good breakfast.",9.0,January 2023,"January 30, 2023",Superior Twin Room,2,Group,9.2
Exceptional,No,The location and the room was very clean,10,January 2023,"January 30, 2023",Standard Twin Room,4,Couple,9.2
Exceptional,"It would be nice if there were more types of noodles
European style and oriental style","1)Arriving before the stipulated check-in time, thank you for the consideration of the hotel for allocating the room.
2)It was good for a 4-star hotel,There was a variety of food, had a good meal
3) It's a 4-star hotel, but the interior is as good as a 5-star",10,January 2023,"January 26, 2023",Standard Single Room,1,Solo traveler,9.2
Great hotel in the center of Warsaw,Nothing,"Great hotel with superior location in the center! The hotel looks awesome, have comfortable and quite rooms. Definitely recommended!",10,January 2023,"January 23, 2023",Standard Twin Room,2,Solo traveler,9.2
Exceptional,,"For me this is the best hotel to stay in Warsaw.  I usually choose Polonia when I am in the city. Fabulous breakfast,  cozy rooms, great location,  very helpful staff. Thank you🤗",10,January 2023,"January 23, 2023",Standard Twin Room,1,Family,9.2
Wonderful,,"Fantastic hotel. Beautiful room, so comfortable. Food amazing. In the centre of Warsaw.",9.0,January 2023,"January 16, 2023",Deluxe Double Room,3,Family,9.2
central and comfortable,"I had a town view which was a little noisy. double glazing but the trams are heavy and make the room vibrate. it did t bother me too much though. nice bathroom, shower and bath plus lots of hot water.","nice hotel, central location. clean and comfortable.",10,January 2023,"January 16, 2023",Superior Double,2,Solo traveler,9.2
Perfect stay in capital city,Room temperature - too high even with window opened,"Very good localisation, central, close to main train station. Close to metro, trams and buses. Lots of restaurants nearby. Lobby bar opened till late with opportunity to eat. Very good breakfast with lots of choices.",9.0,January 2023,"January 10, 2023",Standard Double,3,Couple,9.2
"Great value for money, however, need to upgrade food :)","Breakfast were poor, not much choices and not very delicious.","So good location, everything is very close by walk. Loved it!",10,January 2023,"January 5, 2023",Standard Double,1,Group,9.2
Good comfy stay in the center of Warsaw,"room for breakfast bit small,breakfast could be better.","perfect location,right in the center,comfortable and large rooms,polite staff,nice interior.",9.0,December 2022,"January 4, 2023",Standard Double,1,Group,9.2
"I strongly recommend stay in the hotel. excellent location and spacious stylish rooms, great city view and value for mon","common breakfast, the 1 day we went down for breakfast which was til 11.00 ( new year) and We arrived in restaurant at 10.40 and get attitudes from front desk lady that we have to hurry cause soon is finished. She didn’t show up for 10 minutes so we was waiting in front the breakfast room door to give our room number. I think 10.30 when breakfast is til 11,00 on the 01.01 is more then enough time and attitudes was unnecessary.","location, cleanest hotel I have been in, reception, late restaurant working hours on new years eve, room service excellent, great breakfast in bed",10,January 2023,"January 2, 2023",Deluxe Double Room,2,Couple,9.2
Wonderful,Kettle broken and inflated price for New Year's eve. They sorted the kettle straight away for us,Quality and cleanliness,9.0,January 2023,"January 2, 2023",Standard Double,1,Family,9.2
very good hotel,TV was old,"hot tub in the bathroom, good value",8.0,December 2022,"January 1, 2023",Standard Double,2,Couple,9.2
The best hotel in Varsovia,,"Staff was very friendly. Clean staff was incredible.
Breakfast is amazing !!!!",10,December 2022,"December 31, 2022",Standard Twin Room,3,Family,9.2
