Review Title,Negative Reviews,Positive Reviews,Rating,Stay Date,Review Date,Room Type,Number of Nights,Traveler Type,Overall Average Rating
Good,"Surprising but cleanliness was not okay.
We had some disgusting issues in the room which was left from previous guest.
When I reported this to the reception with photos, they apologized and did their best to compensate.
We appreciate the effort. However, this does not change the reality that the room was not cleaned before us. And unfortunately I could discover this after 2 nights staying in that room which was disturbing.","Location is great. Delicious breakfast with lots of options.
In general the staff is kind except some not trained ones.",7.0,March 2022,"March 13, 2022",Queen Room,5,Couple,8.9
Not worth it,"This hotel is below the hilton standard.
We asked for fresh towels and they didn't provivded us explaining the hotel is fully booked and suggested we use the old ones. So if you like to shower twice a day its not the hotel for.
Also if you want to sleep late, no one is available to clean your room after 3 p.m. i think its the worst Hilton I've ever been to, you can find better options in the old town","Great location, clean rooms",5.0,March 2022,"March 6, 2022",Queen Room,4,Couple,8.9
Good,"no parking
no minibar
a lot of noise coming from the heater and from something else outside",,7.0,January 2022,"January 25, 2022",Queen Room,2,Couple,8.9
Pleasant,Stayed in room 712. There was a terrible noice in room from heating system,The location is excellent,6.0,January 2022,"January 19, 2022",King Room,3,Solo traveler,8.9
Nice hotel with tiny rooms,"I would say tiny rooms, but that would mean the rooms were way bigger than they really are. They fit the bed and basically nothing more. I was surpised when you pay way more than in other hotels because you expect the Hilton will offer something more. Enough for one or maximum two nights but no more.","Nicely located in a central position to visit the most important locations in the city. 
Clean and modern rooms in an elegant building.",5.0,December 2021,"January 2, 2022",King Room,2,Couple,8.9
Good,No parking,,7.0,December 2021,"December 19, 2021",Queen Room,1,Solo traveler,8.9
"It’s like those hotels next to the airport, don’t spend any special dates there","Well I was planning to spend my birthday in a nice 4 star hotel, I was received by an impatient and extremely unfriendly front desk receptionist “Monica”. The room was clean, of course, but it is super small and with an outdated TV with no Netflix or internet access, which was extremely disappointing since everything was closing at 9PM.","I have to say room service was great, and food as well. Also on our last night we finally got help from Alex in the reception, he was friendly, helpful and welcoming.",4.0,November 2021,"November 4, 2021",King Room,2,Couple,8.9
Pleasant,"The room was not cleaned properly (dust and hairs on the table, a tooth cleaning stick in the bathroom, some papers on the floor). I arrived at midnight and had to work early in the morning the next day so didn’t manage to sort this out immediately (which I should have done on the spot). I complained to the receptionist about this the next day and was told that cleaning is more difficult these days. Precisely these days, in a pandemic and with increasing Covid cases, cleaning should be much more thorough. I got a tiny discount as compensation, but very disappointing. Also, I had to constantly remind hotel guests to wear masks as the receptionists didn’t seem to be paying attention to this.",Central location,6.0,October 2021,"November 3, 2021",King Room,2,Solo traveler,8.9
Disappointing. Should have been better.,"One of the chairs was stained. The fridge had a curly hair in it, attached to a shelf with something sticky! This made me question how thoroughly the generally tidy room was cleaned, during this time, when hygiene is paramount. The ‘hot’ breakfast wasn’t even warm. When I mentioned it the response I got was “sorry to hear that”. Nothing was done about it. The breakfast I’d paid for 3 days was always the same temperature. It wasn’t just one item, it was everything - eggs, beans, sausages, bacon and mushrooms.",Great location. Comfortable bed.,4.0,October 2021,"October 3, 2021",Queen Room,3,Couple,8.9
Good,Stains on bed cover,Perfect location and helpful staff,7.0,September 2021,"September 24, 2021",Queen Room,3,Couple,8.9
Pleasant,for us it was hard to breathe in the room. the window doesn't open and the ac wasn't good.,"very nice staff, clean and easy.",6.0,September 2021,"September 24, 2021",Queen Room,4,Couple,8.9
"Good, but not great.",Very disappointing view; leaking shower; leaking toilet flush,"Location, size of room, size of bedroom.",6.0,September 2021,"September 23, 2021",Deluxe King Room with City View,2,Solo traveler,8.9
"Pleasant stay, but bad experience with staff.","My first stay with Hilton. At checkout, the staff said I had a drink at the bar and I had to pay when I didn't. When I said I didn't she was standoffish and showed me a couple of receipts. In the end, she didn't charge me but was an unpleasant experience.",Nice room and central location.,7.0,July 2021,"September 17, 2021",Queen Room,2,Solo traveler,8.9
I would not recommend,"The bathroom was not cleaned when we got the room 
Unhygienic bathroom with curtains next to the toilet stained with faeces","Nice staff 
Decent breakfast",4.0,September 2021,"September 17, 2021",King Room,2,Couple,8.9
Only the location was good,Just didn’t feel comfortable right from the rooms to cleanliness to service. Quite disappointed,Only the location,4.0,September 2021,"September 14, 2021",Queen Room,3,Couple,8.9
Expected a lot more,"The hotel felt a bit cheap, you can see the poor quality of work of renovation that was done.
Dark room, photos a bit misrepresented the 'level' of hotel.
The bed mattress was sliding to the side very easily.",The location is great,5.0,September 2021,"September 10, 2021",Queen Room,2,Couple,8.9
Pleasant,they did not agree to cancel the breakfast from the invitation i made when i ask them when i made the chek inn,,6.0,June 2024,"June 5, 2024",Deluxe King Room,2,Group,8.9
Disappointing,All the rest,Only the location,4.0,May 2024,"June 1, 2024",Twin Room,8,Couple,8.9
Some rooms are affected by local noise,We came for a restful night and unfortunately we did not get much sleep. We finally got to sleep around 5.15am due to the noise of a nightclub outside our window. The music was so loud which really gave us bad taste for the trip.,Really good location until the time hit 10pm when there was a nightclub that started right outside our room.,1.0,May 2024,"May 26, 2024",Queen Room,1,Couple,8.9
"Worst experience of staying in a Hilton Hotel, and one of the worst hotel experiences I have ever had.",The worst experience of staying in a Hilton hotel anywhere in the world. The room looked out onto the street but even on the 6th floor the music blaring from the outdoor speakers in the bar across the road made it impossible to sleep. The music was so loud in the lobby that when the hotel doors open you could hear people speaking. It finally stopped around 6am.,The worst experience of staying in a Hilton hotel anywhere in the world. The room looked out onto the street but even on the 6th floor the music blaring from the outdoor speakers in the bar across the road made it impossible to sleep. The music was so loud in the lobby that when the hotel doors open you could hear people speaking. It finally stopped around 6am.,3.0,May 2024,"May 20, 2024",King Room,1,Solo traveler,8.9
Over priced,"Hotel is old. It’s not the Hilton level . 
There weren’t bathrobes. When we asked should wait for 20 mins. It was so cold room. When we ask to help, they weren’t kind and not really wanted to help us. We were cold all 24 hours. 

The reception wasn’t kind and open to us. 

If you stay for one night the breakfast is not included. 
With the price for 1 night it’s weird.",Clean room and nice location,5.0,January 2024,"January 24, 2024",Twin Room,1,Couple,8.9
Expensive for poor quality.,"The staff were not friendly and not at all helpful, when asked questions about the area. They definitely were not approachable. There was nothing about the local area in the reception or in the room.","The location was good in the old Town, close to many restaurants and right in the heart of the old Town.",5.0,December 2023,"January 14, 2024",Twin Room,3,Family,8.9
Poor,The room was very very cold! And the bathroom was unheated,,3.0,January 2024,"January 5, 2024",King Room,1,Family,8.9
Good,"Very noisy outside till 6am, I was not able to sleep at all",Room is ok,7.0,October 2023,"October 1, 2023",King Room,2,Couple,8.9
Fair,"When you check in, the whole room was in someone's black hair.  From the personal hygiene kit, only a shower cap and 3 soap bottles screwed to the wall.  There was no mini bar.  There is little light in the room, just like in a cave. Breakfast is super poor.",,5.0,July 2023,"July 14, 2023",King Room,3,Solo traveler,8.9
"The staff's treatment is bad, there is no parking for cars, the breakfast is not good, and they asked us for a very","The staff's treatment is bad, there is no parking for cars, the breakfast is not good, and they asked us for a very high additional amount for a slight delay during checkout",,5.0,July 2023,"July 7, 2023",King Room,2,Family,8.9
Bad,I booked two rooms for my brother's family and there is stated that they have two children 9 yo. So I booked two rooms. The problem is not that the rooms are even not on the same floor and not even that the rooms are in the opposite sides of the hotel (de facto the rooms are on different floors and in different sides) but the real issue is that one room has two adult sleeping places and one place for one child and the second room has one sleeping place for one child. How could one of the children 9 y.o. sleep without his parents on different floor and in opposite side of the hotel?!?! As a result my brother (56 y.o. 1meter 86 cm)was sleeping in a small child bed.,Nothing,1.0,July 2023,"July 5, 2023",Junior Suite,1,Family,8.9
poor and disappointing,"bathroom leak, electrical failures and noise",restaurant,1.0,January 2023,"February 3, 2023",Twin Room,3,Family,8.9
Bad,,"noise from the bar outside, impossible to sleep at night",1.0,November 2022,"November 24, 2022",King Room,1,Solo traveler,8.9
left a bad first impression of Romania,The staff was extremely rude when dealing with payment,The staff wqs extrememly unhelpful,3.0,September 2022,"September 30, 2022",King Room,1,Group,8.9
"lovely hotel inside, but don’t expect a good nights sleep - in middle of nightclub district","the location is right in the middle of where all the night clubs are, so whichever room you have there’s music and people noise well into the early hours. the streets smell of pee the next morning due to all the drunken partygoers. the night manager’s reasoning, when we asked whether there was a quieter room, was most people come to Bucharest Old Town for the partying. that’s just not the case for everyone and I’d expect for what we paid to have a good nights sleep.","the hotel inside was lovely, rooms were great and comfortable",4.0,September 2022,"September 25, 2022",King Room,1,Couple,8.9
For me this was my last time in Hilton.,"I expected much more from the name Hilton. we did not like the claustrophobic feel in our room and asked to change. there was no effort from the staff to help us. and the small things:  there is no way to take a shower without wetting the floor massively and the floor towel disappeared after our first day, the cattle did not work properly and in our second day they forgot to make our room. The A/C shut itself off from time to time, without the A/C it is impossible to breathe in the room – the windows facing a shaft inboard and it is impossible to open them",location.,3.0,September 2022,"September 23, 2022",Deluxe King Room,5,Solo traveler,8.9
I’m not happy,the windows don’t open!!!; you have to pay 15 euro for breakfast per person/per day; there is no parking to the hotel and nobody from the personal assisted to find suitable parking,location,3.0,September 2022,"September 6, 2022",Twin Room,2,Couple,8.9
just fine. wouldn't recommend it and won't stay in it again,the staff at the reception didn't explain much when i paid for the breakfast didn't help me didn't say anything.,the location,2.0,August 2022,"August 30, 2022",Twin Room,4,Family,8.9
"1- No near by Parking as they mentioned  2- They Do Not have a luggage man to carry with you, you have to do it by yours","1- No near by Parking as they mentioned 
2- They Do Not have a luggage man to carry with you, you have to do it by yourself from the car till the reception then till the room.
3- The stuff are very unprofessional and impolite.
4- Rooms are uncomfortable and you can hear all the surroundings.
5- Breakfast is very very simple and doesn’t deserve its price.
6- The price is very high compared by the service the you receive.",only the Location..,2.0,July 2022,"July 2, 2022",Junior Suite,2,Family,8.9
Worst hotel  decision in Bucharest,"Service overall was the worst experience I have had at any Hilton across the world.
I stay at many weekly.

Having stayed in Bucharest for two weeks, I could only tolerate 2 nights here before I had to go or speak out.

Food is average for an area that provides a broad menu selection and again the service Staff would return after delivering our food to our table.

I can't describe all the instances that caused our early departure to another Hotel down the street but I was the best decision

Given the cost for a business stay at this location in Bucharest and a Staff that cannot deliver decent service I recommend you choose anywhere else as we did!!!","Location was excellent!!!
With the exception that the Staff wouldn't give us 2 minutes to assist or give us directions

Won't recommend this Hilton for any reason give the way we were greeted and put off during our stay.

What makes it worse is that I'm a Team Member and ashamed to admit it while I was there.

We had to move to another hotel to get better service, accomodations, food and to be acknowledged by the reception desk 
Do not book here!

Go down the street anywhere even next door for what your looking for in a pleasant stay in Bucharest",4.0,May 2022,"June 23, 2022",Queen Room,1,Couple,8.9
service below acceptable level,"third night, the cleaning lady forgot to clean the room. Came back exhausted from a conference at 8:00 pm. Receptionist said house keeping left at 4:00 pm..super. Next morning, I needed a wake up call at 4:00 am. this call never came... super!",could have been good...,4.0,June 2022,"June 6, 2022",Queen Room,3,Group,8.9
Bad,It has dissapointed me that they have charged me a higher amount than my reservation in Booking was and even once they recognised that it was a mistake on their side they didnt pay me back the difference after two weeks. It is not acceptable for a Hilton hotel to procceed like this. Very unsatisfied.,,1.0,April 2022,"April 28, 2022",King Room,2,Family,8.9
"If you want to sleep at night, don't go !!!","it's close to the old part. But consider that the bars around this hotel are playing extremely hard! never ever I've been to a place where there is so much noice. it is not normal. It's impossible to sleep. loud music and drunk people the whole night. 


it makes feel like  Manhattan New York is a quite place!",Nice building,1.0,April 2022,"April 17, 2022",Junior Suite,2,Family,8.9
A big disappointment this time.,"Hilton failed this time. The coffee milk in the room was  altered/bad, as in the picture, the armchair was stained, there was no  shower cap, one girl at the reception behaved pretty rude and 3 out of 5 receptionists were not wearing the protective mask on the nose, in a Bucharest with a 6,5  per 1000 infection rate.","The bed and the pillows are very comfy, which is a big plus.",5.0,September 2021,"October 2, 2021",Queen Room,1,Solo traveler,8.9
I would never stay there again.,"Rooms are small, room service could be better. 
They put a kettle in the room, but no cups to make your coffee/tea.
We ate at the ""Beef Room"" restaurant which is the only restaurant in the hotel, and the service was so bad, the waiter forgot half of our order, and at the end when we ordered the bill we didn't get it, the waiter just told us what's the amount we needed to pay. 
Overall NOT recommended.",The location is great,5.0,August 2021,"August 23, 2021",Queen Room,3,Family,8.9
Highly recommended!,,"Location, services available to guests, hospitality  and friendly/helpful personnel.",10,May 2023,"May 18, 2023",Queen Room,2,Couple,8.9
Exceptional,,"great staff,clean sheets,amazing location!",10,May 2023,"May 16, 2023",Twin Room,2,Group,8.9
"excellent location, great food , staff and room.",nothing,"the staff , really helpful polite and friendly .
especially in the breakfast room",10,October 2022,"October 22, 2022",Queen Room,1,Couple,8.9
Exceptional,,"Exceptional hotel that is situated in the heart of Bucharest, 2 min from University and 2 min from the old town. 

But the location isn't the only one that makes this hotel amazing; the architecture is wonderful, with big rooms that are modern, spacious, bright and clean. The bathrooms are impeccable.

 Furthermore, the breakfast has a wide variety to accommodate each and everyone and everything is delicious. 
The rooms on the 7th floor have a breathtaking view of the city. 

Of course, 10/10 for the personnel from the cleaning crew, reception, restaurant to the management for their work ethics, professionalism. A special thank you for the manager of the hotel.

Hilton Garden Inn is now my new address whenever I will be in Bucharest. 

See you soon!",10,January 2022,"January 9, 2022",Queen Room,10,Solo traveler,8.9
"Great location, great service",,Staff very polite,10,October 2021,"October 1, 2021",Twin Room,4,Solo traveler,8.9
Perfect and clean stay,,"I loved how covid friendly the hotel was. The room was sealed after it had been cleaned,  everything in the room was extremely clean. In order to reduce the number of people accessing the rooms and avoid the spread of covid, you had to request for the room to be cleaned, which I loved. Everything was up to Hilton standards, and I am definitely gonna book the same hotel next time.",10,September 2021,"September 27, 2021",Queen Room,3,Couple,8.9
Exceptional,There was no view and windows do not open.,Overall everything is excellent.,10,September 2021,"September 14, 2021",Queen Room,3,Couple,8.9
Excellent,Noisy from the old town clubs,,8.8,June 2022,"July 24, 2022",Queen Room,1,Couple,8.9
"best location, nice",breakfast area was tight and the selection didn’t have a wide variety,the location and it was renovated and clean,8.0,July 2022,"July 17, 2022",Twin Room,4,Solo traveler,8.9
Very Good,Loud music during breakfast,Staff friendliness,8.0,September 2021,"September 22, 2021",King Room,1,Couple,8.9
"except for the noise issue, stay was ok.","At check in, I was not told that the room I was given will be noisy and that I would have been able to choose a different room without this problem. This being a known issue by the staff, I do not appreciate not being told at check in, especially since most of the times, people coming for a stay are generally very tired after their trip. I was not able to sleep due to loud thumping music for part of the night.",Clean room and premises. Friendly staff. Excellent breakfast.,7.0,October 2022,"October 4, 2022",Queen Room,1,Solo traveler,8.9
"Best location, very pleasant staff","the hot water pressure was very poor and maximum 35 degrees 🥶 not 40 like it is shown on the griff 
the breakfast quality food is very poor… the vegetables  were not fresh",the location is really great 👍,1.0,January 2022,"January 28, 2022",Queen Room,2,Solo traveler,8.9
Exceptional,,,10,August 2024,"August 16, 2024",King Room,2,Family,8.9
Exceptional,,,10,August 2024,"August 15, 2024",Deluxe King Room,4,Family,8.9
Exceptional,,,10,August 2024,"August 14, 2024",Queen Room,3,Couple,8.9
Exceptional,,,10,August 2024,"August 12, 2024",King Room,1,Solo traveler,8.9
Wonderful,,,9.0,August 2024,"August 12, 2024",King Room - Mobility Accessible,1,Group,8.9
Exceptional,,,10,August 2024,"August 11, 2024",King Room,1,Couple,8.9
Exceptional,,,10,August 2024,"August 11, 2024",King Room,1,Couple,8.9
Wonderful,,,9.0,August 2024,"August 8, 2024",Queen Room,1,Family,8.9
Very Good,,,8.0,August 2024,"August 4, 2024",Twin Room,1,Group,8.9
Exceptional,,,10,July 2024,"July 29, 2024",King Room,1,Couple,8.9
Exceptional,,,10,July 2024,"July 22, 2024",Queen Room,1,Couple,8.9
Exceptional,,,10,July 2024,"July 17, 2024",Queen Room,3,Group,8.9
Exceptional,,,10,July 2024,"July 17, 2024",Junior Suite,1,Couple,8.9
Wonderful,,,9.0,June 2024,"July 14, 2024",Queen Room,3,Solo traveler,8.9
Exceptional,,,10,July 2024,"July 14, 2024",Queen Room,3,Family,8.9
Exceptional,,,10,June 2024,"July 9, 2024",Twin Room,1,Family,8.9
Exceptional,,,10,June 2024,"July 4, 2024",King Room,2,Couple,8.9
Exceptional,,,10,June 2024,"July 4, 2024",Queen Room,2,Group,8.9
Wonderful,,,9.0,April 2024,"July 2, 2024",Queen Room,2,Couple,8.9
Exceptional,,,10,June 2024,"June 25, 2024",Twin Room,1,Family,8.9
Exceptional,,,10,June 2024,"June 25, 2024",Queen Room,4,Solo traveler,8.9
Wonderful,,,9.0,June 2024,"June 24, 2024",Queen Room,1,Family,8.9
Exceptional,,,10,June 2024,"June 20, 2024",Twin Room,4,Group,8.9
Exceptional,,,10,June 2024,"June 17, 2024",King Room,1,Solo traveler,8.9
Wonderful,,,9.0,April 2024,"June 16, 2024",Queen Room,4,Solo traveler,8.9
Exceptional,,,10,June 2024,"June 15, 2024",Queen Room,2,Couple,8.9
Wonderful,,,9.0,June 2024,"June 11, 2024",King Room,4,Family,8.9
Exceptional,,,10,June 2024,"June 7, 2024",Queen Room,1,Family,8.9
Very Good,,,8.0,June 2024,"June 4, 2024",Queen Room,2,Couple,8.9
Wonderful,,,9.0,May 2024,"June 2, 2024",King Room,2,Couple,8.9
Exceptional,,,10,May 2024,"May 31, 2024",King Room,1,Solo traveler,8.9
Exceptional,,,10,May 2024,"May 24, 2024",King Room,5,Solo traveler,8.9
Very Good,,,8.0,May 2024,"May 20, 2024",King Room,3,Solo traveler,8.9
Exceptional,,,10,May 2024,"May 16, 2024",Twin Room,3,Couple,8.9
Exceptional,,,10,May 2024,"May 14, 2024",King Room,3,Solo traveler,8.9
Exceptional,,,10,May 2024,"May 14, 2024",King Room,1,Couple,8.9
Exceptional,,,10,May 2024,"May 13, 2024",King Room,1,Solo traveler,8.9
Exceptional,,,10,May 2024,"May 12, 2024",King Room,2,Group,8.9
Exceptional,,,10,April 2024,"May 9, 2024",King Room,4,Solo traveler,8.9
Exceptional,,,10,May 2024,"May 7, 2024",King Room,1,Couple,8.9
Exceptional,,,10,April 2024,"May 6, 2024",Queen Room,2,Couple,8.9
A great place to stay,,,10,April 2024,"May 3, 2024",Queen Room,3,Solo traveler,8.9
Exceptional,,,10,May 2024,"May 2, 2024",Queen Room,1,Solo traveler,8.9
Exceptional,,,10,March 2024,"April 27, 2024",Queen Room,1,Family,8.9
Exceptional,,,10,April 2024,"April 26, 2024",Queen Room,2,Couple,8.9
Exceptional,,,10,April 2024,"April 22, 2024",King Room,2,Solo traveler,8.9
Exceptional,,,10,April 2024,"April 17, 2024",Queen Room,1,Family,8.9
Exceptional,,,10,February 2024,"April 16, 2024",King Room,2,Solo traveler,8.9
Exceptional,,,10,April 2024,"April 15, 2024",King Room,3,Solo traveler,8.9
Exceptional,,,10,April 2024,"April 14, 2024",Queen Room,2,Couple,8.9
Exceptional,,,10,April 2024,"April 13, 2024",King Room,2,Couple,8.9
Exceptional,,,10,April 2024,"April 12, 2024",Twin Room,3,Solo traveler,8.9
Exceptional,,,10,March 2024,"April 11, 2024",Queen Room,2,Couple,8.9
Exceptional,,,10,April 2024,"April 11, 2024",Queen Room,2,Solo traveler,8.9
Wonderful,,,9.0,April 2024,"April 10, 2024",Queen Room,4,Couple,8.9
Exceptional,,,10,April 2024,"April 7, 2024",Queen Room,5,Couple,8.9
Exceptional,,,10,April 2024,"April 5, 2024",Queen Room,1,Couple,8.9
Exceptional,,,10,March 2024,"March 30, 2024",King Room,2,Solo traveler,8.9
Exceptional,,,10,March 2024,"March 30, 2024",King Room,1,Couple,8.9
Exceptional,,,10,March 2024,"March 27, 2024",Junior Suite,3,Family,8.9
Exceptional,,,10,March 2024,"March 27, 2024",Queen Room,2,Solo traveler,8.9
Exceptional,,,10,March 2024,"March 23, 2024",Twin Room,1,Group,8.9
Exceptional,,,10,March 2024,"March 22, 2024",Deluxe King Room with City View,1,Solo traveler,8.9
Exceptional,,,10,February 2024,"March 19, 2024",Queen Room,3,Solo traveler,8.9
Exceptional,,,10,March 2024,"March 15, 2024",Twin Room,3,Solo traveler,8.9
Very Good,,,8.0,March 2024,"March 7, 2024",King Room,1,Family,8.9
Exceptional,,,10,February 2024,"March 2, 2024",Queen Room,3,Couple,8.9
Exceptional,,,10,February 2024,"February 27, 2024",Queen Room,1,Couple,8.9
Exceptional,,,10,February 2024,"February 24, 2024",King Room,1,Family,8.9
Exceptional,,,10,February 2024,"February 22, 2024",Twin Room,4,Group,8.9
Exceptional,,,10,February 2024,"February 22, 2024",Queen Room,1,Solo traveler,8.9
Exceptional,,,10,February 2024,"February 18, 2024",Twin Room,2,Group,8.9
Exceptional,,,10,February 2024,"February 17, 2024",Queen Room,1,Solo traveler,8.9
Wonderful,,,9.0,February 2024,"February 13, 2024",Queen Room,3,Couple,8.9
Exceptional,,,10,February 2024,"February 12, 2024",Twin Room,3,Group,8.9
Wonderful,,,9.0,January 2024,"February 8, 2024",Queen Room,4,Group,8.9
Exceptional,,,10,February 2024,"February 7, 2024",Twin Room,2,Family,8.9
Exceptional,,,10,January 2024,"February 7, 2024",Queen Room,3,Family,8.9
Exceptional,,,10,February 2024,"February 6, 2024",Queen Room,2,Couple,8.9
Wonderful,,,9.0,December 2023,"February 5, 2024",Twin Room,3,Family,8.9
Exceptional,,,10,November 2023,"February 2, 2024",King Room,2,Couple,8.9
Exceptional,,,10,January 2024,"January 31, 2024",Twin Room,2,Family,8.9
Exceptional,,,10,January 2024,"January 31, 2024",Junior Suite,1,Family,8.9
Exceptional,,,10,January 2024,"January 30, 2024",Queen Room,2,Couple,8.9
