Review Title,Negative Reviews,Positive Reviews,Rating,Stay Date,Review Date,Room Type,Number of Nights,Traveler Type,Overall Average Rating
Exceptional,,"Good service 

There is a free shuttle from and to the airport",10,June 2024,"June 18, 2024",Executive Double Room,1,Solo traveler,8.2
Excellent,N/A,Location,9.0,August 2024,"August 19, 2024",King Room,3,Couple,8.2
Comfort,Nothing,Excellent service,9.0,August 2024,"August 18, 2024",Standard Triple Room,1,Family,8.2
"Good location for layovers, breakfast. Make sure you check cleaningness as soon as you enter.","I rented two rooms, for the 2 there was a window in each room imposible to close, so all the cold breeze and plane noises entered during the night.
Also for one of the rooms, the bathroom was stinking of cigarette smoke. Since we arrived to late we didn't request to be moved to another room. But it kinda makes you wonder if the bathroom was cleaned in the first place.","It is very close to the airport, has a shuttle service every half hour.
Good breakfast options.
Comfortable beds
They can keep your luggage after your check out so you can tour around the city before you flight. Remember that traffic makes you take 45-60 mins to travel from Zona T to the Airport",8.0,August 2024,"August 16, 2024",Executive Twin Room,1,Family,8.2
Nice modern stay with restaurant close to the airport.,Not much. If you face the road you might have some noise from cars (the airplane noise is inevitable).,"Very modern hotel with great rooms, restaurant, excellent breakfast, clean, comfortable, really liked it. Close to the airport with free shuttle every 30 minutes.",9.0,August 2024,"August 12, 2024",Junior Suite,1,Solo traveler,8.2
Wonderful,,Very near to airport and shuttle service,9.0,August 2024,"August 10, 2024",Standard Quadruple Room,1,Group,8.2
Good,It was a bit dated and there really wasn't anything to do there,The location close to the airport,7.0,August 2024,"August 5, 2024",Junior Suite,2,Family,8.2
Convenient location,Restaurant was overpriced and poor- service was slow too. Shuttle was due to leave at 4:30 am but left earlier- there was no clear communication about this.,Location and shuttle service.,7.0,July 2024,"August 1, 2024",Junior Suite,1,Couple,8.2
Pleased with the facilities and kindness of the staff,"I had an early flight. I was in the breakfast area at 4:20 am,  it was already finished and not replenished so other guests missed breakfast as well when the staff had told us quick breakfast was available until 5am",The flexibility to check in ahead of time,8.0,July 2024,"July 28, 2024",Executive Twin Room,1,Solo traveler,8.2
Close to the airport and free shuttle,"For a hotel so close to the international airport you think that front desk staff speak also English. Unfortunately the lady that checked us in, did not speak English.","The hotel is close to the airport. There is a free transfer from and to the hotel from the airport, which is very nice. The breakfast was ok. Not super good, but nice to eat something before going on the plane.",8.0,June 2024,"July 24, 2024",King Room,1,Couple,8.2
Good stay for closeness to the airport,Room seemed unfinished,Location and the breakfast was amazing,7.0,July 2024,"July 24, 2024",Junior Suite,1,Couple,8.2
excellent,"everything was good, nothing negative",excellent breakfast and facilities,9.0,July 2024,"July 24, 2024",Executive Double Room,1,Couple,8.2
Nice time,The pizza,Location,9.0,July 2024,"July 20, 2024",Junior Suite,1,Family,8.2
Very Good,Nothing. All ok,"Excellent location for a night stay near the airport of Bogotá. Easy pickup and dropoff. Good rooms, good bed. Clean.",8.0,July 2024,"July 18, 2024",Executive Double Room,1,Solo traveler,8.2
Very Good,The personal in the reception was very unfriendly. There is a lpt of noise,The hotel is very close to the airport thus ideal if you have an early flight,8.0,July 2024,"July 17, 2024",Junior Suite,1,Family,8.2
Ideal for a layover close to Bogota airport.,There were a few minor niggles due to a lack of maintenance- no fridge in the room but a gap where it had been.,It’s close to the airport with a free shuttle and breakfast included which made it perfect for an impromptu layover hotel. The staff were friendly and helpful. Breakfast was good and the shuttle efficient.,8.0,July 2024,"July 12, 2024",Junior Suite,1,Family,8.2
Really awesome!,"They were doing some bigger construction work. While I didn't hear too much noise, the part of the hotel that our room was in looked very unfinished from outside. Inside, while everything was beautifully designed and clean, there were a few little things, where you could see that things were ""unfonished"". 
Not too bad at all! But something you notice.","The staff/service, design and breakfast were amazing. It's so close to the airport, so very practical for layovers. The airport shuttle worked well.",9.0,July 2024,"July 10, 2024",Junior Suite,1,Couple,8.2
"Convenient, very close to the airport","* The first room I was offered was a disaster with broken window and very noisy
* Avoid room from the street
+ Next room (garden view) was OK, basic, simply but I did not expect anything else","* Close to the airport
* Nice staff",7.0,June 2024,"July 9, 2024",Junior Suite,1,Solo traveler,8.2
Very friendly hotel with excellent airport shuttle service.,It was quite noisy through the night a fan motor or something,Excellent airport shuttle service and breakfast was excellent.,9.0,July 2024,"July 8, 2024",King Room,1,Couple,8.2
Very Good,Restaurant food not so good,"Great location, great staff",8.0,June 2024,"July 8, 2024",King Room,1,Family,8.2
Very Good,Restaurant food not so good,"Location, excellent staff, amenitites",8.0,July 2024,"July 8, 2024",King Room,1,Family,8.2
Very Good,,airport shuttle,8.0,July 2024,"July 3, 2024",Junior Suite,1,Solo traveler,8.2
Wonderful,,"Clean, transport and staff attention.",9.0,June 2024,"June 26, 2024",Executive Twin Room,1,Family,8.2
Best close option to the airport,Nothing. All good,Very good value modern and clean only 5 minutes from the terminal including breakfast and free shuttle,8.0,June 2024,"June 24, 2024",Executive Twin Room,1,Solo traveler,8.2
Very Good,property needs some updating.  didnt like that floor in shower was not level,Great location near airport. Hotel bus to airport convenient,8.0,April 2024,"June 18, 2024",King Room,1,Couple,8.2
Clean and good breakfast,Desk attention,Breakfast,7.0,May 2024,"June 1, 2024",Junior Suite,1,Couple,8.2
Will go back. Hopefully they improve the breakfast,Breakfast,Very close to the airport.,9.0,May 2024,"May 30, 2024",Standard Triple Room,1,Family,8.2
"Lovely hotel, but they need better food safety practices.","Dogs were allowed in the restaurant. During breakfast, a guest was allowed to bring her dog to the food station while she made her plate. I find this to be extremely unsanitary.",The hotel was in a great location. Shuttle service to the airport was an excellent benefit.,7.0,May 2024,"May 26, 2024",Standard Triple Room,1,Family,8.2
Dissapointed,"When i was doing the check-in there was not order with the guests at the front desk all over, not line even though i was patiently waiting only 2 people working , the facilities at the hotel were not mentioned just kind of "" here is your key, bye bye"" and that's it. Not explaining where where elevator were, nothing mentioned about the breakfast in the morning even though it was included with my room, not mentioned of the Wi-Fi, the check-in  process  was very poor. I didn't find the staff very friendly during check in. First impression! It's nice when staff acknowledge and notice you are there and this was not the case.

1st night couldn't sleep so much noise in the hallway coming from other guests 11-2am. I had to change rooms to another floor next day.

I have a few family members coming to see me that I haven't seen in 25 years, they came in the evening and the staff at the front desk said to them and to me that it was not visiting hours, and they can charge me extra. I felt embarrassed and sad like I mentioned haven't seem them in 25 years it supposed to be exciting to see my family, they couldn't come earlier because there were driving from another city, they were coming for a short visit not to stay with me in my hotel room.
I disagree with this rule its ridiculous. I worked for the hospitality industry and stayed in many hotels and never heard this rule.","Staff was great at the restaurant, great food, great location, comfortable bed.",7.0,May 2024,"May 25, 2024",Executive Twin Room,3,Couple,8.2
Good for a quick transit.,Only stayed for a quick 1 night transit. Breakfast was a very basic buffet.,"Free airport shuttle every 30 min. Nice big room, had a free upgrade. Shower nice, but a bit weird with glass window to shower in a tripple room. Nice for a quick transit, nice and very big bed.",9.0,May 2024,"May 24, 2024",Junior Suite,1,Group,8.2
Very Good,,"Close to the airport, clean rooms and friendly staff",8.0,April 2024,"May 21, 2024",Executive Double Room,1,Solo traveler,8.2
Wonderful,,Everything was good,9.0,May 2024,"May 13, 2024",Executive Double Room,1,Couple,8.2
Good hotel for one night near the aurport,Very noise - all night planes,Easy place for a stopover,7.0,May 2024,"May 11, 2024",Junior Suite,1,Couple,8.2
"Nice hotel, but has gotten expensive over the years and service has not improved. Good stay, not great",Was given a twin room when we ordered a king. King room we were then assigned had no air conditioning. Opened window and there was classical music playing all night long. Had to ask 3 times for towels,Location and cleanliness,8.0,April 2024,"May 9, 2024",King Room,1,Couple,8.2
Good value and close to airport. Good shuttle service.,,Location,7.0,April 2024,"April 30, 2024",Junior Suite,1,Solo traveler,8.2
Good,,"Great location for the airport. Clean and comfortable, nice staff very helpful. Would use again",7.0,April 2024,"April 24, 2024",Executive Double Room,1,Family,8.2
Convenient to Airport,All good,"Was next to the airport, as we had an early morning flight. They were helpful and allowed us to check in earlier than the check-in time (very much appreciated) and there was a 24 hour shuttle to the airport.",9.0,April 2024,"April 24, 2024",Junior Suite,1,Couple,8.2
Nice hotel,"If you have a problem with the itinerary, regarding your booking, they don’t provide you other options or solutions, even they don’t reply to you about of a solution to support you.",,7.0,April 2024,"April 22, 2024",Junior Suite,1,Solo traveler,8.2
Convenient stay,,Very close to airport if landing in late or flying out early. Buffet breakfast and shuttle bus to airport were very convenient.,8.0,April 2024,"April 16, 2024",Junior Suite,1,Couple,8.2
Very Good,Check in takes a lot of time,"Very good breakfast, next to airport",8.0,April 2024,"April 13, 2024",Junior Suite,1,Family,8.2
Best choice for overnight only near Airport,,"The Hotel shuttle bus picks up from the Airport 24/7  ( free of charge )
We left very early and Hotel gave us a take away food + Drink+ Fruit  bag  ( instead of Breakfast )
Nice Shower
Elevator",9.0,March 2024,"April 4, 2024",Junior Suite,1,Group,8.2
Wonderful,,The breakfast was good and the location easy to find and easy to come back to the airport.,9.0,March 2024,"April 3, 2024",King Room,1,Family,8.2
Very Good,,Excellent airport pick-up and drop off,8.0,March 2024,"March 31, 2024",Executive Double Room,1,Couple,8.2
Wonderful,,I most enjoyed the labeling of the trees in the front of the hotel. I've often wondered why a facility like the Habitel Hotel didn't do a similar thing. I always have a little free time and really enjoy a stroll around the grounds. It is nice to have a name on the tree.,9.0,March 2024,"March 23, 2024",Executive Twin Room,1,Solo traveler,8.2
Wonderful,,"Good airport pickup, very close. Nice large room, hot water, internet, very good breakfast included with room. helpful check in personnel.",9.0,March 2024,"March 18, 2024",Executive Double Room,2,Solo traveler,8.2
Wonderful,There was no air conditioning in our room,,9.0,March 2024,"March 18, 2024",Executive Double Room,1,Couple,8.2
Perfect Airport Hotel - difficult to expect more,very small details: i think there’s no gym and they should stop the jazz music in the corridors after 10pm…,"International standards met with this hotel. Very clean, quiet, confortable bed, and tasty restaurant. Wifi is fast. Located 5 min from the airport and 20/30 to downtown (Chapinero), the property offer a bus shuttle from/to the airport 24/7 and also drivers to the city at very reasonable price (aligned with uber). We found it perfect for 1 night.",8.0,March 2024,"March 10, 2024",Standard Quadruple Room,1,Family,8.2
Very good location and airport shuttle service,Room comfortable but rather basic,"Friendly and helpful staff.
Excellent airport shuttle service
Very good breakfast",9.0,March 2024,"March 7, 2024",Executive Twin Room,1,Solo traveler,8.2
Decent hotel close to the airport,There was no water or coffee/tea making options in the room.,"Good sized rooms, good breakfast. Nice staff.",7.0,March 2024,"March 5, 2024",Executive Double Room,1,Solo traveler,8.2
Short but convenient stay. Nice restaurant. Well maintained grounds.,,Proximity to airport,8.0,February 2024,"February 28, 2024",Executive Double Room,1,Solo traveler,8.2
Wonderful,I didn't have air conditioner in the bedroom and it was really hot.,,9.0,January 2024,"February 27, 2024",Executive Double Room,3,Solo traveler,8.2
Comfortable Stay for the Night,"We did not know about the shuttle in advance, and we would have appreciated knowing that.",Great location near the airport with a shuttle to the hotel. Very kind staff. Clean.,8.0,February 2024,"February 25, 2024",Junior Suite,1,Couple,8.2
Good,,"Good shower with hot water, good pressure, clean and spacious rooms",7.0,February 2024,"February 25, 2024",Executive Double Room,1,Couple,8.2
"Perfect location, service, and very nice hotel.","The price was a little high for Bogota, but everything was excellent.","Awesome airport transportation, and great service. Very good hotel.",9.0,February 2024,"February 22, 2024",Junior Suite,1,Solo traveler,8.2
"Great location, but painfully s-l-o-w desk staff","Check-in was painful. When we arrived in the morning, we provided all the needed check-in information. Later, when we returned to the hotel to get a room assignment, we had to repeat the same process all over again – but this time it took 25 minutes, reminding us of the sloth scene in Zootopia. Check out was also painfully slow.  And the room could have used a more thorough cleaning, although it was acceptable.","The Habitel airport hotel was convenient. It’s located just outside the airport, and just a few minutes’ walk to the Transmilenio and bus “CIAC” stop.  There was great coffee in the lobby.  The room was large and comfortable, although it was a bit faded. The shower was A+. We had to leave at 5am, so we missed breakfast – so they made us a bagged breakfast with sandwiches, fruit, and juice.",8.0,February 2024,"February 15, 2024",Junior Suite,1,Couple,8.2
Ideal stopover. They need to improve customer communication,Poor communication didn’t respond to messages,Ideal stopover from the airport. Communication about the shuttle was poor though. They never responded to my multiple questions about that.,8.0,February 2024,"February 14, 2024",Junior Suite,1,Solo traveler,8.2
Functional hotel of satisfactory quality,Nothing,Location. Airport shuttle,8.0,February 2024,"February 14, 2024",Junior Suite,1,Solo traveler,8.2
Near airport & excellent shuttle service plus good breakfast,,Shuttle service was great,8.0,February 2024,"February 12, 2024",Executive Double Room,1,Couple,8.2
Quiet even though 5 minutes from the airport. Efficient and courteous staff. All good for what it was,,A good stopper between flights,8.0,February 2024,"February 11, 2024",Junior Suite,1,Couple,8.2
Convenient airport hotel,,Location near airport. Shuttle easy and 24 hours,8.0,February 2024,"February 8, 2024",Executive Double Room,1,Couple,8.2
Good,Reception staff are extremely slow.,It's close to the airport,7.0,December 2023,"February 4, 2024",King Room,1,Couple,8.2
"Best option close to the El Dorado Airport. Free shuttle, clean and quiet rooms.",Heating is not working very well so the rooms can be a little cold at night.,"Very close to the airport. Rooms are clean and quiet and the beds are comfortable, so a good night rest is not a problem after a long flight. Amazing facilities, restaurant is also good.",9.0,January 2024,"February 3, 2024",Junior Suite,1,Couple,8.2
Great option for airport travel,,"Excellent location for airport travel
Free shuttle bus included in room rate 
Clean",9.0,January 2024,"January 27, 2024",Junior Suite,1,Couple,8.2
It was like a welcome oasis of calm after crowds of people at the airport and in the city.,. We wished that there had been 2 chairs to sit on in our room. A small bedside table on each side of the bed and better overhead lighting whilst in bed as well as a central bedside light switch to turn on and off all the lights in the room would have been helpful.,Comfortable clean hotel with good restaurant and excellent breakfast. Staff were all friendly and helpful. We really liked the potable drinking fountains on every floor. The green areas and outside relaxation space surrounding the hotel.,8.0,January 2024,"January 26, 2024",Executive Double Room,1,Couple,8.2
Wonderful,,Everything,9.0,January 2024,"January 24, 2024",Standard Triple Room,1,Group,8.2
Great location if you want to stay close to the airport.,Expensive options at the restaurant. Better noise isolation required.,Great option for an overnight stay before taking an international flight. Timely shuttle to the airport every 30 minutes.,9.0,January 2024,"January 24, 2024",Standard Quadruple Room,1,Family,8.2
Good,Te staff was a little confused,Comfor,9.0,January 2024,"January 23, 2024",Standard Triple Room,1,Family,8.2
Wonderful,"Many passenger from a delayed flight were sent to this hotel, the queue to check in was more than 45  minutes.","Really good breakfast, near to the airport with free shuttle every 30 minutes from the airport to the hotel and return.",9.0,December 2023,"January 22, 2024",Junior Suite,1,Couple,8.2
Wonderful,,"Perfect for the night when you have to stay one night for connections. The beds were nice, as well as the bathroom. Good food in the restaurant. It is only 4 minutes away from the airport and they supply a shuttle every 30 minutes. Great value!",9.0,January 2024,"January 15, 2024",Standard Triple Room,1,Family,8.2
Best hotel in the area,N/A,"I've been saying it for a while and will continue. It's the best hotel to stay when making a layover in Bogota. Close the airport, free shuttle to and from the hotel to aiport. Good breakfast included in price, they take care of you and your belonging with an smile. This time we used laundry services and luggage storage and was excellent.",8.0,December 2023,"January 15, 2024",Standard Quadruple Room,1,Family,8.2
Nice hotel,Little expensive.,Nice and clean,8.0,January 2024,"January 11, 2024",Standard Quadruple Room,1,Family,8.2
"Overall,its a good go to hotel in Bogotá.",Our A/C wasn’t working. Maintenance took over an hour to come check it out. I had to call twice. They did not give us another room but give us 1 fan instead for a quadruple room.,Near airport. Clean hotel. Friendly staff. The breakfast was delicious.,7.0,January 2024,"January 8, 2024",Standard Triple Room,2,Family,8.2
Nice hotel clean and close to the airport. Shuttle to airport is a bonis,Check in took too much time.,Comfortable clean nice calm,8.0,January 2024,"January 7, 2024",Executive Double Room,1,Solo traveler,8.2
Excellent solution when staying overnight at Bogota airport.,"The shuttle back to the airport left earlier than announced, so we had to wait another half hour for the next one, which caused some stress on departure.","Excellent option for a stop-over at Bogota airport, just 5 min from the airport with free shuttle. Clean and modern rooms and good breakfast.",8.0,October 2023,"January 5, 2024",King Room,1,Solo traveler,8.2
Good,The check in process was extremely slow and could surely be improved. I arrived at night around 11pm and although only few persons stood in front of me in the line it took more than 1 hour to check in.,"Breakfast was nice, extremely close to the airport and a convenient shuttle. I was also able to leave my luggage for a few days without any problems or additional costs",7.0,December 2023,"January 3, 2024",Executive Twin Room,1,Solo traveler,8.2
Very Good,Not as clean as it could have been. Toilet seat loose. Poor range of vegetarian food at breakfast,Location and airport shuttle,8.0,December 2023,"January 3, 2024",Executive Double Room,1,Couple,8.2
I will be staying again for sure.,"The check in process takes too long. I waited more than 45 min to check in. Traveling with family (3kids), at one point, the waiting gets to long.","This is my go to hotel in Bogotá. Overall its a nice clean, with friendly staff hotel. Near airport El Dorado.",7.0,January 2024,"January 3, 2024",Standard Triple Room,1,Family,8.2
Reasonable accommodation for a layover,"The bathroom in our room was quite noisy, but we were tired enough to eventually ignore the noise","Good value. Comfortable room to get some rest between flights - we didn’t stay for very long, but the bed was comfortable enough for our few hours of sleep and the room stayed nice and dark well after sunrise.",8.0,January 2024,"January 3, 2024",Junior Suite,1,Couple,8.2
I would stay again,,"Conveniently located near the airport, the breakfast offered was very good, and the bed provided was comfortable",8.0,December 2023,"December 29, 2023",Executive Double Room,2,Couple,8.2
NORMAL,CHECKIN DEMORADO,TRANSPORTE AEROPUERTO,7.0,November 2023,"December 28, 2023",Executive Double Room,1,Couple,8.2
Overnight stay between flights,"It was pretty noisy with planes taking off but that was the downside of being close to the airport which was a positive.
It did get quiet after about 11.",It was close to the airport. Staff were friendly and room was clean.,8.0,November 2023,"December 26, 2023",Executive Twin Room,1,Solo traveler,8.2
"Nice place, very close to the airport with free shuttle","Despite e-mailing on multiple occasions saying that my flight kept getting delayed and that I would have a very late check in, and that I only wanted to have a nap and shower, I still had to pay for a second night even though I was out by the check-out time of my original day.",It was very close to the airport. A free shuttle to and from the airport was included. Receptionist spoke English.,7.0,December 2023,"December 26, 2023",Junior Suite,1,Solo traveler,8.2
Very Good,,They gave us a package breakfast as we left too early for buffet,8.0,December 2023,"December 25, 2023",Executive Twin Room,1,Couple,8.2
Wonderful,It was very noisy. The cleaning staff ignored do not disturb sign on the door and entered our room before checkout.,The room was big and bed was comfortable. Good breakfast.,9.0,December 2023,"December 20, 2023",Executive Double Room,1,Couple,8.2
Good,Staff did not speak english. There was a party at the hotel so it was very noisy. We could also hear airplanes very loudly all night long and people from nearby room going to the bathroom at nite. The restaurant was a bit chaotic in the afternoon and checking is a bit slow.,Bed was comfortable.,7.0,December 2023,"December 20, 2023",Executive Double Room,1,Couple,8.2
"Very good, I would come back again.",The mail didnt respond quickly to know where the transport is located.,"The attention, the patience and how they explain everything is very good.",9.0,December 2023,"December 19, 2023",Executive Double Room,3,Solo traveler,8.2
Great in proximity to the airport,place a heater in the rooms,Very convenient place that is very close to the airport.,9.0,October 2023,"December 15, 2023",Executive Double Room,1,Solo traveler,8.2
Was good,The room itself was clean and comfortable but what ruined everything was that we found a lot of man's beard in the bathroom sink,"Friendly staff, location",8.0,December 2023,"December 14, 2023",Executive Twin Room,1,Family,8.2
Good,"Room outdated, you have to ask for a blow dryer and iron at the front desk no shampoo they only have all in one soap","Staff very friendly, good service,the food was great",7.0,December 2023,"December 12, 2023",Junior Suite,3,Couple,8.2
Great place for travelers.,It was a good hotel.,The staff was amazing. Breakfast good. Location is very convenient. Bus shuttle service is so helpful!,8.0,December 2023,"December 12, 2023",Executive Double Room,1,Solo traveler,8.2
Wonderful,"Check in took a really long time. There should be more staff at check in to speed up the process. 
The room was incredibly cold at night. There were blankets so we managed. There was a thermostat on the wall but no instructions on how to use it and we couldn't work it out. It would have been helpful to have instructions.
Also at 7.30am a member of staff knocked on our door - we don't know why but it woke us up unnecessarily - I assume this was a mistake but there was no apology.
I would have liked more vegetarian options at breakfast.","Comfortable beds and amazing shower. 
Staff were all friendly.
Great location near the airport.",9.0,December 2023,"December 11, 2023",Junior Suite,1,Group,8.2
A will  go back,Every think wos  good,Good,8.0,November 2023,"December 11, 2023",Executive Double Room,1,Solo traveler,8.2
Wonderful,There was no coffee machine in the room,The staff at the desk was extremely friendly and professional,9.0,December 2023,"December 8, 2023",Executive Double Room,1,Solo traveler,8.2
