Review Title,Negative Reviews,Positive Reviews,Rating,Stay Date,Review Date,Room Type,Number of Nights,Traveler Type,Overall Average Rating
Exceptional,,great short stay with great accommodations. Comfort space and suitable for couple. Will come here again and hope that this hotel can keep this standard,10,November 2022,"December 4, 2022",King Room,1,Couple,9
Superb Brilliant Pick For My Stay,None,"it’s modern facilities, from Self Check in until the moment I stepped into the room, brilliant.
The room is tiny but it is enough for a short stay.
Great location near Jalan Alor food street.
Cleanliness is Tip Top
Bed is comfy",10,November 2022,"November 28, 2022",King Room,1,Couple,9
Exceptional,,Excellent food.  Excellent personnel.,10,November 2022,"November 26, 2022",King Room,5,Family,9
Exceptional,,"great breakfast, helpful staff—nothing was too difficult!",10,November 2022,"November 25, 2022",King Room,2,Solo traveler,9
I had a great time. Breakfast was great and so are the staff. They go out of their way to help you and make sure that yo,,Great lounge and colourful interior. Its a heaven for art enthusiasts. The fact that you can control everything in your room without getting up from your bed is such a convenience.,10,November 2022,"November 24, 2022",King Room,2,Solo traveler,9
Great place to stay,,Room design and cute features,8.0,November 2022,"November 24, 2022",King Room,1,Family,9
fantastic - we’ve just booked to stay again at the end of our trip because we liked it so much!,N/A nothing to improve,"Everything was spotlessly clean, shower was fantastic and bed was very comfortable. The tech in the room was really cool too!",10,November 2022,"November 21, 2022",King Room,3,Couple,9
Exceptional,The little sink. In the room,Best experience with my wife birthday,10,November 2022,"November 20, 2022",King Room,1,Couple,9
Exceptional,"No-thing
Best hotel in Kuala Lumpur","Room itself is small, but it's extremely cosy with amazing design, everything in its' place
App control is terrific
Lights in the room are fantastic
Personnel is top notch and beyond any good words, they are just supreme",10,November 2022,"November 19, 2022",King Room,6,Couple,9
Great place to stay in KL,n/a,"Clean, modern room with a very comfortable king size bed. Friendly staff! Great location, easy to get to and close to the night street food market. I would definitely stay here again!",10,November 2022,"November 18, 2022",King Room,4,Solo traveler,9
Very Good,I think I got food poisoning from the hotel’s breakfast on the morning of Nov 16.  Felt nauseated starting mid-morning that whole day and had diarrhea well into the second day.,,8.0,November 2022,"November 17, 2022",King Room,2,Solo traveler,9
Amazing!,Nothing,"Everything. From the room service, cleanliness, facilities, everything exceeded expectations",10,November 2022,"November 17, 2022",King Room,4,Solo traveler,9
Exceptional,,"Everything was just perfect. It's an amazing hotel, very good price and the best location.
Staff was lovely and great.",10,November 2022,"November 16, 2022",King Room,3,Solo traveler,9
Wonderful,Nothing,"Hotel staff was friendly, kind and helpful, room and the hotel itself was in very good condition and equipped with everything you might need and breakfast was also plentiful and great selection to choose from.",9.0,November 2022,"November 15, 2022",King Room,2,Solo traveler,9
Exceptional,Close to city centre and food,The hotel design and ambience,10,November 2022,"November 15, 2022",King Room,4,Couple,9
"Fancy design, smart tv and smart room functions controls, convenient location, king size bed, I enjoyed my stay every ni","slow check in, we waited for 20 minutes for staff checking in.","Fancy design, smart tv and smart room functions controls, convenient location, king size bed.",9.0,October 2022,"November 15, 2022",King Room,4,Solo traveler,9
"modern, cheap and comfortable",all perfect,modern style,10,November 2022,"November 9, 2022",King Room,1,Group,9
"If I go back to KL, defenitly will be my first option.",everything is lovable,"Everything, the modern look at the lobby, delicious breakfast, modern rooms with iPad control of the complete rooms including lights changes, comfortable bed, excellent price, amazing location, self service check in, nice view.",10,October 2022,"November 9, 2022",King Room,1,Group,9
"Great stay, amazing staff","My only feedback is that while I can see there is a unique check-in style where the customer must scan their own passport and enter their own details into the computer, I had just come from a 20+ hour flight, 2 hours to clear immigration and baggage in the airport and then one hour taxi ride. I'd had very little sleep and felt exhausted. The staff were lovely and kind and welcoming so no criticism of them but had there been a choice, I would have preferred to have staff in this instance do the check-in for me as it would have allowed me to take a breath and relax a little on arrival. Might be something to consider for future :)","The staff at this hotel were truly some of the best - warm, kind, helpful, generous. They remembered your name, were happy to share a laugh, gave useful travel advice and just really made my experience in KL welcoming and enjoyable, so thank you so much to them. The room's design and features were unique and modern, the bed was exceptionally comfortable and huge TV a plus. The hotel was a great place for me to do my study with lots of tables and chairs in the art-filled yet uber functional 'living room' space and also the hotel's proximity to Jalan Alor and the delicious food there made for great convenience.",9.0,October 2022,"November 9, 2022",King Room,2,Solo traveler,9
Great experience,Needs a swimming pool,"Modern, incredible staff",10,November 2022,"November 9, 2022",King Room,2,Couple,9
"Overall, it was a comfortable stay and staff are all friendly and kind. Definitely value for money",Room is a bit too small,Facility is new and clean. Beds are  comfortable,9.0,November 2022,"November 8, 2022",King Room,3,Couple,9
"Comfortable, smart, and good value.",None,Hotel concept and smartness. Room size is perfect compared to same brand in other cities. Location is very convenient.,10,November 2022,"November 8, 2022",King Room,2,Group,9
just perfect,,"everything. the room, the staff, the location, the food and the ambiance. Sadly when im staying there, their chromecast were out of service, but their staff (lily and nicole) were helpful. although the problem did not fix until i check out, but their hospitality make me understand. its ok guys. u just do the best. im staying again soon. this will be my 2nd home 😂",9.0,November 2022,"November 4, 2022",King Room,2,Couple,9
great,nothing,the staff were exceptionally good.,10,November 2022,"November 4, 2022",King Room,4,Solo traveler,9
Exceptional,,Everything exellent.,10,November 2022,"November 3, 2022",King Room,2,Couple,9
outstanding spot in an incredible location.,"I wish the shower grout has been sprayed with bleach or something, to brighten it. 
I also had some hair fluff on my floor; accidental, I’m sure. 
None of which out did all the positives! 🤩","Everything! 
The tech, the staff, the layout of the room, the safety, the location, the tv quotes, the autonomy I had.",10,November 2022,"November 3, 2022",King Room,1,Solo traveler,9
Wonderful,,"Great location, beautiful interior design, clean & comfortable room, friendly and helpful staff, convenient check-in and check-out system. Will definitely return..",9.0,October 2022,"November 1, 2022",King Room,1,Couple,9
Overall great stay but probably not for a single woman.,The location. It’s great that it’s near the night street food market and very conveniently next to a convenience store and restaurant also easy access to other places in KL and short walk to the tube station BUT I did not expect to see ladies of the night very close by. As well as men who cat call. Not the hotels fault but it did make me very uncomfortable. They also handled a accidental fire alarm situation very poorly.,"Very clean, modern and lots of open space. Also well sign posted!",10,October 2022,"October 28, 2022",King Room,3,Solo traveler,9
Will stay again if I ever visited Malaysia in the future,Only if room and bathroom size can be bigger..,"The style of the hotel is unique,  I liked it.
Staff are so nice.
The food was good.
The best part was the very very comfortable bed next to the window, so you can sleep comfortably while looking at the buildings, streets and the stars 😀",9.0,October 2022,"October 27, 2022",King Room,1,Family,9
Exceptional,,Everythings was perfect. Highly recommended!!!,10,October 2022,"October 27, 2022",King Room,1,Couple,9
funky affordable luxury,nothing,"i loved the shower. the coffee is proper tasting coffee. I loved the ground floor area. great art and comfortable seating. 
but the best thing is the staff. they are warm friendly and anticipate what u want without being intrusive. not easy to do.",10,October 2022,"October 27, 2022",King Room,4,Couple,9
Delightful stay,Very few Vegetarian options in Breakfast,Interiors,10,October 2022,"October 26, 2022",King Room,3,Couple,9
Exceptional,No pool although that's not essential.,"Location is the best, right next to Jalan Alor for street food and elfresco dining and close to Changkat Bukit Bintang for Nightlife, super comfy bed, funky modern decor, ipad operates everything, staff very friendly and accommodating. Would definitely stay again. Very good value.",10,October 2022,"October 25, 2022",King Room,2,Solo traveler,9
Exceptional,nothing,super stylish and fun decor- lovely staff. great stay overall.,10,October 2022,"October 25, 2022",King Room,1,Family,9
Exceptional,the restaurant food and drinks were not very good,"very high tech and comfortable rooms, great location",10,October 2022,"October 24, 2022",King Room,1,Couple,9
Exceptional,The iPad to operate everything in the room is a nice gimmick but frustrating at times. A lot of fun to start with...,"Everything, innovative, modern , good facilities and food if you don't want to walk 5 mins away to one of the most amazing restuarant markets on the planet, and a 10 min walk to the ginormous Pavillion Shopping Centre with brilliant restuarants and foodcourts.",10,October 2022,"October 19, 2022",King Room,3,Family,9
"Delightful stay, very highly recommended.","Breakfast buffet can't make up it's mind whether it's more Chinese or British style. A bit of each, none with whole heart.
Quite sexist intro screen on the room's iPad control gadget. Maybe change that (...or is it just me & my weird fantasy?)","A newly opened modern hotel (2019) of a Dutch chain. Coveniently located near the Berjaya long-distance bus dropoff point and literally just around the corner from the famous Jalan-Alor open-air restaurant street. 2-3 minutes walking time to get all the Asian food delights you're looking for.
Very friendly, young and motivated crowd of staff to help you out with all your needs.",9.0,October 2022,"October 17, 2022",King Room,2,Solo traveler,9
Comfortable and convenient stay in KL,Nothing,"Rooms were spacious and comfortable, with daily towel changes, bottled water, toiletries and shampoo/soap. The common facilities such as working spaces were clean and fairly quiet. Location was great, walking distance to Jalan Alor and Petaling Street, so lots of good food options around.",10,September 2022,"October 17, 2022",King Room,4,Couple,9
very convenient stay for a tourist,,"- very good location. walking distance to food and bar streets.
- very comfy bed
- nice breakfast-
- helpful staff",9.0,October 2022,"October 15, 2022",King Room,3,Group,9
Exceptional,,"We loved staying at citizenM KL. From the day 1 the staff was friendly and always smiling, ready to help with anything. We were impressed with their service and how tasty the breakfast was. We had a bigger room (with no view, just the small inside garden view which we chose on purpose as we wanted more space, we didn't care much about the window view) and the room was very cosy and spacious. The bed was to die for - one of the best sleeps we had! The location was also a big plus. Big thanks for having us to Tony, Jade, Pei Ee, Jeswyn, Mahen, Mary, Lily and our lovely and best friend: Haziq!",10,October 2022,"October 10, 2022",King Room,4,Couple,9
one of best stay for me,NOTHING! everything’s perfect,"superb clean and best location, the staff were superb well trained and friendly",10,October 2022,"October 10, 2022",King Room,1,Couple,9
Very Good,poor breakfast,"all good, near centre, just 5-10 mins walking",8.0,October 2022,"October 8, 2022",King Room,2,Solo traveler,9
can’t recommend highly enough; fantastic place to enjoy KL,,"clean
stylish
well designed
loved the tech
staff were incredibly friendly
great location",10,October 2022,"October 7, 2022",King Room,3,Couple,9
"Amazing Location, Best Staff, Delicious Food!",Nothing!,"I loved everything - especially the sweet front office staff - Jade was very helpful and positive and made my check-in super easy. Breakfast was diverse and one of the most delicious I've had in a hotel. The rooms are neat, clean and smartly organized with super comfy beds, nice mirrors and huge windows showing a panoramic view. Perfect for a work trip! Location is top-notch with all the cool streets, bars and food spots right around the corner. I will be definitely coming back.",10,October 2022,"October 7, 2022",King Room,1,Solo traveler,9
"Great location, great staff, great value for money. Highly recommended.",,"The location is absolutely fabulous. Chinatown, the fancy malls, the twin towers, etc., are all within walking distance. Jalan Alor, a buzzing food street, is just a couple of minutes away. The room was very comfortable and high-tech... I love how everything can be controlled by an iPad.

But the standout attraction is the staff. They were cheerful and helpful and were always ready with a smile and greeting.",10,October 2022,"October 6, 2022",King Room,4,Couple,9
A super well run boutique brand that is situated in capital cities. More please.,There was not a kettle for the room.,Mary and her colleagues were excellent with food suggestions and getting about the area.,9.0,September 2022,"October 4, 2022",King Room,2,Group,9
Amazing!,"I don't think there is anything that I didn't like about the place, but maybe the check-in and check-out process could be a little more guided as it was very technological heavy and is foreign if you are not used to it.","CitizenM definitely exceeded my expectations for its price point. The interior design was immaculate and my stay was beyond comfortable. I went there for a little staycation and everything there from the lobby to the room was very well designed. I especially loved the fact that I could control most of the utilities in the room with a single touch with the Ipad. 
I had the pleasure of eating at their bar, and I was pleasantly surprised that the food was just as good. I loved their signature cocktail (blushing lychee) so much that I ordered a second cup to bring back to my room.  I will definitely be coming back again.",10,October 2022,"October 4, 2022",King Room,1,Couple,9
Good place to stay as a solo traveller,"The food served during breakfast can be improved. Slightly decline from my first visit. The hashbrown wasn't crispy and I was highly expecting the sausage to be tasty and juicy from my first visit,however, it wasn't the same.","Parking is available. Hotel room is clean. Check in is swift, the person attended to me was Pei Yee if not mistaken. This is my 2nd time visiting the hotel. Breakfast coffee is excellent",9.0,October 2022,"October 3, 2022",King Room,1,Solo traveler,9
Very Good,,Location and room,8.0,September 2022,"October 2, 2022",King Room,1,Family,9
Great,"Bed frame a bit too high, hard to get up. 1 side of bed against wall so partner has to crawl past to get off bed. Sink in bedroom - a bit small so water splashes on flr.","Clean, new. Walking distance to Jalan Alor(l5mins or less) and  shopping areas such as Pavilion, Berjaya Times Square. 15 mins walk to Chinatown.
Fun lights in toilet - controlled by ipad in room",9.0,October 2022,"October 2, 2022",King Room,2,Family,9
Wonderful,,"The interior design, hotel atmosphere and staff were so delightful. The breakfast was great.",9.0,September 2022,"September 28, 2022",King Room,3,Couple,9
a pleasant one with basic needs.,nothing to complain for the price. but I think can improve on the cleanliness a bit more. I hope they maintain the place well.,it’s simple and nice with good location,8.0,September 2022,"September 27, 2022",King Room,4,Couple,9
Best stay for long working hours,So far none.,The room is clean and comfy .,10,September 2022,"September 26, 2022",King Room,1,Solo traveler,9
Friendly staff and cool rooms,The rooms were cold and no amount of adjusting the iPad controls seemed to change that.,"The rooms are small but really well planned out so you have everything. The showers are really nice. Beds are comfy. The iPad controls for the room worked fairly well. The whole capsule, hyper modern stuff is really fun. Breakfast is delicious! The staff are really friendly and polite, always greeting you and happy to help.",9.0,August 2022,"September 24, 2022",King Room,5,Couple,9
Exceptional,,"Great stay - the room was super comfortable and clean, the staff super lovely and helpful. Recommend 100%",10,September 2022,"September 23, 2022",King Room,2,Couple,9
"Great and comfortable stay, high value for money especially for backpackers",It’s a little easy to miss the hotel from the street.,"The room is so well designed with everything well thought through, from the two blinds to allow varying levels of light to get into the rooms to the availability of plugs and really good internet connection. The bed is also huge and extremely comfortable. The shower is also good with strong water pressure. I would absolutely be happy to stay here again.",10,August 2022,"September 22, 2022",King Room,1,Solo traveler,9
"clean, quiet, friendly hotel a short distance from an exceptional street to experience fun and delicious outdoor dining.",,the room was very quiet.  I slept very well.  My son and I also really liked the location.  we ate breakfast at the small restaurants a block or two behind the hotel and dinner on a street behind the hotel that was very lively with outdoor dining.  What a fun experience.,10,September 2022,"September 22, 2022",King Room,3,Family,9
A very modern hotel,,Love the location and the decor of the hotel! The staff were also very friendly and helpful! Would definitely stay at citizenM again for my next future in Kuala Lumpur!,10,September 2022,"September 21, 2022",King Room,1,Family,9
I recommend with no doubt,everything is great,"this place is really really good!! Stuff guys are so awesome! very friendly and kind and polite, it is pleasure to deal with them. location is great, the room have full smart house system to rule light, curtains, tv, temperature from one tablet. Cleanness is perfect. Size of the room is not really big, but it feels spacious because of great layout, even for 2 persons. Also they have kitchen with good prices and big co-working zone which very comfy for work. And also wifi speed is great.",10,September 2022,"September 19, 2022",King Room,1,Couple,9
Will comeback again!,,The staff was so friendly! The room was very modern and stylish! Very clean rooms!,10,September 2022,"September 18, 2022",King Room,4,Couple,9
Exceptional,none actually,"It has all the comfort required for the business and working trip, and also the collection of books are amazing",10,September 2022,"September 17, 2022",King Room,1,Solo traveler,9
Wonderful,,"The staff, especially Maher (indian lad), helped us a lot with the check out. All the best!",9.0,September 2022,"September 14, 2022",King Room,4,Family,9
Exceptional,,"love the stay, atmosphere, staffs, very high tech room and cosy! they also have places to do meet and greet! wonderful! equipped with PC and work table in the living room! breakfast is great! love it!",10,September 2022,"September 14, 2022",King Room,1,Group,9
great stay with free parking,nothing I dislike,"It’s so modern, like you are living in the space",9.0,August 2022,"September 13, 2022",King Room,1,Group,9
Comfortable and perfectly sized for a solo traveler.,"Slippers in the rooms, or better cleaned floor. Floors felt a little sticky.","Room is small by many hotel standards, but perfect for a short solo biz trip. Smart use of space with the underbed storage and safe. 
Love the art and attention to design throughout the hotel. 
Location is fantastic, a very short walk from Jalan Alor/Bukit Bintang. 
The main road outside the hotel is convenient to get to KL Sentral and Chinatown with fairly smooth traffic, easy to book Grab rides.",8.0,September 2022,"September 12, 2022",King Room,2,Group,9
Exceptional,Probably too simple then again. Its the matter of price,Liked it all,10,August 2022,"September 12, 2022",King Room,1,Family,9
Great place!,,"Great hotel, fantastic team!",10,September 2022,"September 12, 2022",King Room,3,Couple,9
Exceptional,,Everything! It's the perfect stay for a digital nomad or a person needing an incredibly comfortable place to stay with great food and work spaces. The photos make the room look a lot smaller than they are in real life. Everything exceeded our expectations!,10,September 2022,"September 12, 2022",King Room,3,Couple,9
Exceptional,"Rooms a bit small, not suitable for long stay with a big case but great for 2 or 3 nights",Amazing hotel. Very clean and staff really helpful and friendly. Went away for night and left cases abd greeted by name when walked back In,10,September 2022,"September 9, 2022",King Room,1,Solo traveler,9
I love it pretty much especially with the deco & they hv a strategic place too.,Nothing.,They hv such a comfy bed & great room services. The view is nice too.,10,September 2022,"September 9, 2022",King Room,3,Solo traveler,9
The best hotel,Nothing,First i like the decoration of the room and staff. Look modern and the white color make me feel calm and relax and the staff is very friendly. All the room electric switch just control using ipad. The second thing i like is the shower gel. The shower gel smell very nice compared to the other hotel that i was stay. Third things the hotel location is strategic. Located at the heart of kuala lumpur. Full of facilities and easy to find food and going for shopping. Just walk and no need to use transport. Very recommended to stay at this hotel and the price is reasonable. Very worth it to spend money to stay at this hotel.,10,September 2022,"September 8, 2022",King Room,2,Group,9
Exceptional,do not have tea & cofee provide in room,Clean & technology in advanced,10,September 2022,"September 8, 2022",King Room,1,Group,9
"amazing stay, would come back again",the view. wish the room provide a better view,"everythinggg✨perfect location, just a few walk away from Alor Street and Changkat Street, where you can easily find food and entertainments",10,September 2022,"September 4, 2022",King Room,1,Couple,9
Great hotel!!,N/A,"During our trip through Malaysia,We had a stop in Kuala Lumpur and we stayed in citizenM. Just the night at this hotel made us want to stay more in the city. We loved everything about it. From the friendly stuff who made us feel like we are among friends to the decoration and the little details here and there... Great great vibes..  it's just AMAZING. We will definitely go back once in Kuala Lumpur.",10,August 2022,"August 29, 2022",King Room,1,Couple,9
Superb!,Nothing so far.,"Just a 2 nights stay and I feel a home. Breakfast is also good, the spread is just nice and the breakfast area is so comfortable. I came down for breakfast around 10+am and food are still fresh. I like the idea of not having room service, to avoid ""stale"" or unpleasant smell in the room and along the corridor. Rooms amenities are good, housekeeping staff have an eye for detail.",8.0,August 2022,"August 29, 2022",King Room,2,Solo traveler,9
Brilliant,the power source is too far away from the bed,I would definitely stay again if I visit KL again! Very comfortable! great views and friendly staff!,10,August 2022,"August 28, 2022",King Room,1,Solo traveler,9
i think it’s worth every cent,nothing,very nice it’s super cozy,10,August 2022,"August 24, 2022",King Room,1,Couple,9
Would come right back,,"Really nice room, very clean and well thought through. Also there is a great communal area with Mac Desktop computers in case you need to do some travel research.",10,July 2022,"August 22, 2022",King Room,3,Couple,9
Exceptional,,"The staffs are awesome in this hotel. Every-time when you enter to the hotel you can feel the positive vibes coming from the hotel ambience and staffs’ interactions. They have one of the best ambience with the collection of old and new art/paintings. I just loved my stay in CitizenM. Breakfast was also as lovely as the staffs. Even if you want vegetarian breakfast only, like me, you will definitely get plenty of options.",10,July 2022,"August 21, 2022",King Room,6,Couple,9
Definitely a great hotel that exceeded all my expectations,,"Very nice decor.
Extremely friendly and helpful staff.
Room was exceptionally clean.
Location of the hotel is great. 
Facilities and various features in the room were easy to use",10,August 2022,"August 18, 2022",King Room,2,Couple,9
Exceptional,,"Everything was 10 out of 10, fantastic place 👏",10,August 2022,"August 13, 2022",King Room,1,Family,9
perfect short stay for young couples,no makeup mirror was provided and the light is a bit dim,"good location with walking distance to Jalan Alor (must go place for street food), modern and chic interior, comfortable bed, and smart home concept!",10,August 2022,"August 9, 2022",King Room,1,Couple,9
