Review Title,Negative Reviews,Positive Reviews,Rating,Stay Date,Review Date,Room Type,Number of Nights,Traveler Type,Overall Average Rating
Beautiful hotel,,The bar/food staff were excellent! Lots of insight on places to go for dinner. Very friendly and helpful. Really enjoyed our stay and would stay there again,9.0,October 2022,"October 4, 2022",Deluxe Double Room with Balcony and Sea View,3,Couple,9.1
Very clean and super welcoming,,"The pictures do not do this hotel justice! It is so much nicer in person. Very friendly staff who are happy to help at all times. The breakfast was also amazing, we just wish there were more meat options that weren’t pork. Other than that it was great!!",10,September 2022,"September 30, 2022",Duplex Room,3,Group,9.1
wish we could have stayed longer.,,our room was fabulous. overlooking pool with views of beach. private outdoor space. easy walk to a great beach.  all staff were very gracious.,10,September 2022,"September 30, 2022",King Room with Sea View,2,Couple,9.1
Exceptional,,"Immaculately clean, incredible staff, away from the busy town, fantastic pool, friendly patrons, great food, not pretentious. Highly recommend!",10,September 2022,"September 30, 2022",Deluxe Queen Room,1,Solo traveler,9.1
Great Stay in Lagos. Would absolutely return!,,"What a great stay..I don't have a single negative thing to say. 

Hotel is immaculately clean. The staff are beyond friendly and helpful. Strikingly so really (Joana, Vivian, Bimini (?) to name only a few. Every staff member was so warm to us. 

The breakfast is the best I've experienced in my many hotel stays. So many options. 

Lovely pool (although its a touch cold). Deck surface is great. 

Great to be able to get drinks and food by the pool.. Reasonably priced too. I was shocked!

The gym is great also. 

I can't even recommend this place enough! Thanks guys! Would totally go back!!",10,September 2022,"September 29, 2022",Deluxe Double Room with Balcony and Sea View,4,Family,9.1
Good value for money,Bit far from city center,"Friendly staff, comfortable room, good variety of breakfast.",8.0,September 2022,"September 25, 2022",Deluxe Double Room with Balcony and Sea View,3,Solo traveler,9.1
our 4 night stay was perfect! the staff was wonderful and gave excellent dining suggestions; the massage with Anna was a,pool was not heated,"The property was very conveniently located; clean,modern rooms and delicious breakfast",10,September 2022,"September 20, 2022",Deluxe Double Room with Sea View,4,Couple,9.1
We enjoyed our stay here.,,"Helpful staff made us feel welcome, walking distance to beach and restaurant, good hotel facilities, good breakfast, clean and stylish rooms.",10,September 2022,"September 19, 2022",Deluxe Double Room with Sea View,1,Group,9.1
Atlantic Lagos is highly recommended!,nothing,"friendly and welcoming staff, great clean rooms and facilities and breakfast is wonderful! 
Jose R. and his staff make our stay extra special!",10,September 2022,"September 13, 2022",Deluxe Double Room with Balcony and Sea View,2,Family,9.1
Very Good,,"The room was very spacious, two-floor with two beds, bathrooms and balconies which made it really convenient for four people. The hotel staff was really friendly and super accomodating. It's in a quiet location.",8.0,September 2022,"September 13, 2022",Duplex Room,2,Family,9.1
Superb,"Some doors banging in the corridor at night, but this is a minor complaint.","Clean and modern room, great location, great pool, pool table a bonus. Breakfast superb. Friendly staff. Felt upmarket so value for money.",9.0,August 2022,"September 11, 2022",Deluxe Double Room with Balcony and Sea View,1,Family,9.1
A wonderful place to relax and enjoy life.,,"Excellent hotel: clean, modern, professional. Extremely friendly and accommodating staff. Wonderful breakfast.",9.0,September 2022,"September 11, 2022",Deluxe Double Room with Balcony and Sea View,3,Family,9.1
Amazing and I will be back,How short my stay was!  Hahaha,Everything. Staff was analyzing and faculty is awesome. It’s a nice place to get away from the business of the main downtown tourist areas.,10,September 2022,"September 9, 2022",Deluxe Double Room with Balcony and Sea View,2,Solo traveler,9.1
We will return.,Larger window or more windows in Room.,Excellent customer service. Jose is a great manager.,10,September 2022,"September 2, 2022",Economy Twin Room,1,Solo traveler,9.1
Enjoyed our stay and will recommend to friends in future,Great breakfast spread,"Location great, staff friendly and helpful, courteous and personable",9.0,August 2022,"August 25, 2022",King Room with Sea View,1,Couple,9.1
Exceptional,,beautiful property with amazing staff,10,August 2022,"August 20, 2022",King Room with Sea View,3,Couple,9.1
would love to come back,can’t think of anything,Very clean place and staff was friendly  Breakfast was amazing and Josue manager top notch,10,August 2022,"August 18, 2022",Duplex Room,1,Family,9.1
just stay here no place better in Lagos,nothing,everything… room was beautiful and clean. location was perfect 5 min walk to a great beach. staff were fantastic from Giovanna at the front desk super helpful and sweet to the girls at the buffet breakfast and hotel staff nothing was too hard for them. really great bunch of staff you can see it’s run well and professional,10,August 2022,"August 13, 2022",King Room with Sea View,2,Group,9.1
"Excellent, hope to be back soon",zero,"Where to start raving about this fabulous place? 
- excellent staf, ALL of them. From receptionists, breakfast team, bar team, pool team, housekeeping. they were al cheerful, happy and very kind people.
- the excellent breakfast. everyday, all the time, no shortage, everything fresh, clean and tasty. 
- pool with sunbeds and barservice!
- bar services some great delicious healthy fresh snacks which make a good meal if you don’t want to go out. best sangria’s ever!
- comfortabel rooms, top housekeeping
- sooooo close to the beautiful beach.
- 20-30 min walk to Lagos or short drive by car
we just loved it!",10,August 2022,"August 11, 2022",Duplex Room,8,Family,9.1
would come back again,a bit far and hard to get an Uber to town but we loved it either way,amazing room and facilities. sparking clean. only downside was the glass bathroom walls,10,August 2022,"August 8, 2022",King Room with Sea View,1,Group,9.1
We had a fantastic time.,Nothing,"This hotel is beautiful!  It is a quick walk to the beach, free parking, a fantastic breakfast, and the best staff!  It is about a 30 minute walk to the center. or a quick uber ride.  However, the location of the hotel is much quieter and more calm than the center.  I think this location is perfect for families.  The pool is perfect and we loved the food and the pool cafe.",10,July 2022,"August 8, 2022",Deluxe Double Room with Balcony and Sea View,4,Couple,9.1
"Perfect welcome, ambiance, hotel facilities! One of our favourite hotels ever! A must visit!",,"We absolutely loved everything about the Lagos Atlantic hotel! It is a wonderfully charming hotel that mixes the old European charm with the new modern, clean look. Everything was so clean, well located, wonderful view and ambiance.
We loved the rooms, the lobby, the breakfast that was incredibly delicious, fresh and so many options, the clean gym with a view.

We also cannot say enough THANK YOU to the staff! Special thank you to the hotel manager who is always around to make sure everything is perfect and always smiling and welcoming, special thank you to Binny who made all of our meals special! 

This hotel and quality of our stay was really a highlight in our Portugual trip !",10,August 2022,"August 2, 2022",Deluxe Double Room with Balcony and Sea View,4,Family,9.1
Wonderful,,A beautiful hotel with friendly staff. We only stayed for one night but wish we could have stayed longer.,9.0,July 2022,"July 31, 2022",Deluxe Double Room with Balcony and Sea View,1,Family,9.1
Exceptional,Only think I didn’t like about this hotel is that it wasn’t availble to stay there another day or two.,"I stayed here with my family for one night. Very friendly staff, they asked for photos of passports in advance so when we arrived there was no waiting for checkin. We had family room on two floors. It was very clean, nice design, exit from room directly to swimming pool. We stayed in many different hotels during our trip to south Portugal and this was the far best hotel with super price performance ration. Would definitely pick it up again!",10,July 2022,"July 30, 2022",Duplex Room,1,Family,9.1
We had an excellent stay and the staff was helpful and efficient.,,The hotel was very clean and nicely updated. rooms were large and the shower had great water pressure. Breakfast was delicious with a variety of choices. easy walk to the beach.,9.0,July 2022,"July 26, 2022",Deluxe Double Room with Balcony and Sea View,3,Family,9.1
Boutique quality clean hotel steps away from everything,,"Wonderful 3 day stay, quiet and very clean , very friendly stuff that accommodated us in every possible way.. thank you ! Breakfast food and coffe were wonderful too . I like when it’s not overwhelmingly a lot of variety, but rather good quality. Amazing dining area with open space. The most beautiful beach is just steps away, same for lovely old town. I wanted non - commercial Portuguese feel of the hotel and I got it which actually exceeded my expectations. Few things to be aware is some construction nearby that takes a part of view , irons for cloth are at the front desk , so bringing my own steamer was a good decision. If I ever go to Lagos again I would definitely come back and stay again in the same hotel.",9.0,June 2022,"July 23, 2022",Deluxe Double Room with Sea View,3,Group,9.1
Exceptional,,"super friendly staff, comfortable and clean room, and amazing breakfast. I recommend to rent a car because the area is big, and the hotel has free parking.",10,July 2022,"July 18, 2022",Economy Twin Room,2,Couple,9.1
Good for a short stay,The location requires you to have a car to visit Lagos. There are two places to eat within walking distance which can be boring if you are staying more than 2 days. There is construction going on next to the hotel which can spoil an otherwise nice view.,The room and bath were spacious and modern and very clean. Rooms vary considerably so you need to be sure you specify what you would like. We asked for a sea view room on a top floor with a nice balcony. Unfortunately we got the smallest balcony in the hotel and we could not be moved to another room. Only 2 rooms have this small balcony. The sea view from the room also overlooks construction next door. We were staying 5 days. We were told people with shorter stays get better rooms?? The pool area was very nice and the pool is not heated. The breakfast buffet was excellent with choice of eggs made to order. There is a bartender for drinks and light meals. We had a rental car and there was ample parking with 2 electric car chargers. There is a nice beach within walking distance.,8.0,June 2022,"July 14, 2022",Deluxe Double Room with Sea View,5,Couple,9.1
Exceptional,,"Very nice and clean hotel. Breakfast was enough varied, fresh and made from good raw materials. Plus point for the omellet.",10,July 2022,"July 12, 2022",Deluxe Double Room with Balcony and Sea View,2,Family,9.1
Exceptional,,Amazing hotel close to the beach. The front desk staff was very helpful.,10,July 2022,"July 11, 2022",King Room with Pool View,2,Family,9.1
Amazing hotel!!,,"The room was nice and super clean, the staff very friendly and helpful and the breakfast was amazing. We really enjoyed that the hotel wasn't too big and the breakfast area was very spacious, so that it didn't feel crowded. The pool area was great, usually quiet and with enough nice relaxing chairs.",10,July 2022,"July 10, 2022",Deluxe Double Room with Sea View,7,Couple,9.1
"We are already looking into booking again for Summer 2023, highly recommended!!","I do feel that some music and atmosphere was slightly missing around the bar area in the early afternoon.

Just some music at a conservative volume would elevate the pool even more!!!",The location and views were incredible. The main star of the show was the pool and breakfast room!,9.0,July 2022,"July 7, 2022",Deluxe Double Room with Sea View,5,Couple,9.1
Wonderful,,"Very nice hotel. Staff was very nice and helpful too, especially the hotel manager is a lovely and funny guy.
I liked the interior design a lot. Breakfast was great, and the snack bar next to the pool was very convenient for us with a small child.",9.0,May 2022,"July 7, 2022",Deluxe Double Room with Balcony and Sea View,12,Family,9.1
Great,,Great,9.0,July 2022,"July 6, 2022",Deluxe Double Room with Sea View,5,Couple,9.1
"Had a great stay, staff were great, highly recommended.",Nothing,"Clean, well maintained and all the rooms seemed to have a good view.",10,July 2022,"July 4, 2022",Deluxe Double Room with Balcony and Sea View,4,Couple,9.1
"very nice room, nice pool area, delicious breakfast, spacious parking",,Everything was perfect.,10,May 2022,"July 1, 2022",Deluxe Double Room with Balcony and Sea View,2,Group,9.1
"Good view, good pool and breakfast, good location and friendly staff",Nothing to complain about. Everything was very good.,"Extremely friendly staff, very good tips driving and going around in the close by areas and the centrum, got a god map over the close by locations and explanations along. Very good breakfast. What a view. We had 2 floors rooms and on from the second floor You could see the ocean and from the lower floor You had direct entrance into the big swimming pool. City centrum and beach also in the walking distance. Our family liked this place a lot, got our favorite turning our vacation in Portugal, will definitely stay there again and recommend. Also parking places available for the car. Very nice and spacious breakfast room as well, bar by the swimming pool was also open.",10,June 2022,"June 27, 2022",Duplex Room,1,Family,9.1
Fantastic hotel !!!!,"Nothing, everything was just PERFECT! Absolutely 10 out of 10 !!!!","Excellent hotel - one of the best I have ever been. The room was great, spacious with wonderful beds. Bathroom was really amazing, very big, with great shower and all you need - soap, shower gel, very soft towels, spotless cleaning. The bathroom looks as pretty new, I am so impressed from the cleanness in this hotel. All hotel smells so nice. WIFI works perfect, lightings were very great, swimming pool was so relaxing. The hotel provided towels for the swimming pool, which is so nice. We had also a big terrace with sunbeds, table and chairs and fantastic see view. Breakfast was so delicious, with great variety of food. The staff was super helpful and cooperative. They went beyond expectations and assist with everything we asked!!!",10,June 2022,"June 20, 2022",Deluxe Double Room with Balcony and Sea View,3,Family,9.1
Exceptional,,"The staff was excellent! Jose is the best! 😎
The hotel is very nice and clean, rooms are big and the beds very comfortable, breakfast was delicious, the pool was perfect (salty water).
Praia Porto de Mos is like 6 minutes walking and is a very nice beach. 
The best hotel in Lagos! 🥰",10,June 2022,"June 19, 2022",Deluxe Double Room with Balcony and Sea View,5,Group,9.1
Exceptional,,"Peaceful and relaxing pool, perfect size room with beautiful large balcony, amazing breakfast even catered for me as a vegan. Stones throw from the beach and a 25 minute walk to the old town (where we spent most nights) but Ubers are very cheap. Staff will do anything to go above and beyond to help you out. Honestly exceeded my expectations by far I wish we stayed for longer - could not recommend lagos Atlantic enough.",10,June 2022,"June 16, 2022",King Room with Pool View,4,Couple,9.1
Exceptional,A bit far away from the interesting parts of lagos,"Staff was great, rooms and beds were super comfy, giant shower, awesome breakfast",10,May 2022,"June 15, 2022",Economy Twin Room,1,Group,9.1
fabulous relaxing luxurious,… nothing,layout location … peaceful .. fabulous room .. clean … comfortable .. secure .. great parking .. Amazing staff,10,June 2022,"June 12, 2022",Deluxe Queen Room,4,Couple,9.1
Exceptional,,"Spacious room with sea view, comfortable beds, good and diverse breakfast, attentive and helpful staff.",10,June 2022,"June 10, 2022",Deluxe Double Room with Balcony and Sea View,3,Family,9.1
"Brilliant staff, breakfast, rooms and pool",,"Excellent staff, great choice at the breakfast buffet, comfy rooms (balcony, big firm beds and nice shower) and lovely pool area to relax. 

Highly recommend",10,June 2022,"June 5, 2022",Deluxe Double Room with Sea View,7,Couple,9.1
Wonderful stay,,clean and spacious room! Modern color scheme throughout = relaxing. Nice pool and friendly staff. loved it and would return again to this property.,10,May 2022,"June 1, 2022",King Room with Sea View,3,Couple,9.1
Wonderful,,"Hotel was very clean and rooms were spacious and recently refurbished 
friendly and helpful staff
Relaxing atmosphere 
Close to a large nice beach",9.0,June 2022,"June 1, 2022",Deluxe Double Room with Balcony and Sea View,3,Couple,9.1
Friendly personal and clean spacious rooms,,"-  newly built/ renovated hotel
- nice spacious rooms
- very friendly personnel 
- good breakfast",10,May 2022,"June 1, 2022",Deluxe Queen Room,2,Couple,9.1
perfect for us in every way,"Only external noise from building work going on outside the hotel area, nothing at all to do with the hotel.","A very warm welcome.  Very high standards of cleanliness throughout.  An excellent breakfast, very efficient attentive staff.  Nice pool area and bar without music being played constantly which is a big plus. Rooms serviced to a very high standard every day. Beautiful beach with 2 restaurants/cafes within 5 minutes walk but it would not be suitable for anyone who was not fit.  Lagos was 30-45 minutes walk but most guests had hired a car.",10,May 2022,"May 30, 2022",Deluxe Double Room with Balcony and Sea View,6,Couple,9.1
"Excellent stay, highly recommend!",,"Breakfast, room, staff, proximity to the beach",9.0,May 2022,"May 30, 2022",Duplex Room,5,Group,9.1
Exceptional,,"lovely people, quit/relaxed environment and nice breakfast.",10,May 2022,"May 23, 2022",Deluxe Double Room with Balcony and Sea View,6,Couple,9.1
"Excellent hotel in quiet location, near beautiful beaches",A few safety issues: the terrace wooden brown steps need to be marked as you could trip if you were not paying attention. The glass bathroom door also needs  some kind of marking (it is difficult to see when closed). There is a lack of privacy in the bedroom with just see-through glass separating  the toilet/bathroom area from the bed.,"We liked the configuration of the hotel, the way you could reach your room from the pool area without having to go into the hotel, the high standard of cleanliness, the lovely fresh and varied breakfast served by the pool, the staff friendliness, the modern bedroom and comfy bed.The 5 minute walk to a beautiful beach with a nice restaurant. Convenient hotel snack-bar. We really felt we were able to relax in this hotel - quiet location and lovely pool area.Good secure car park. We would definitely recommend this hotel.",10,May 2022,"May 23, 2022",King Room with Sea View,4,Couple,9.1
Exceptional,,"The room I stayed in was fabulous (own balcony, nice view, very comfortable and great to relax)!",10,April 2022,"May 19, 2022",King Room with Sea View,3,Solo traveler,9.1
Wonderful,,the staff was exceptionally friendly,9.0,May 2022,"May 15, 2022",Duplex Room,4,Couple,9.1
Exceptional,,"Friendly staff,  clean, great location and fabulous breakfast.",10,May 2022,"May 8, 2022",Duplex Room,1,Family,9.1
Exceptional,,"This hotel is exceptional - clean, convenient location, great value, good breakfast, very helpful staff.  It exceeded our expectations. It is located outside of the city center and you need a car to get there, but it is only 5 minutes drive. You can walk to very large beautiful beach where you have few restaurants and great hiking trails. I highly recommend this hotel.",10,April 2022,"May 8, 2022",Deluxe Double Room with Balcony and Sea View,3,Family,9.1
Wonderful,"Nothing.
Maybe just a little far from the centre to walk in wvery night",Good sized room and nice balcony area. Comfortable bed. Great buffet breakfast. Lovely pool area. Friendly and helpful staff. Free parking.,9.0,May 2022,"May 7, 2022",Deluxe Double Room with Balcony and Sea View,3,Family,9.1
Exceptional,,"Fantastic! 
Clean 👍
Helpful staff 😁
Good breakfast 👌
Amazing Shower 🚿",10,May 2022,"May 5, 2022",Deluxe Double Room with Balcony and Sea View,5,Couple,9.1
Hotel actually looks even better than on photos,,"Room is very spacious with exceptionally comfortable beds (great pillows :))
Breakfast is tasty and plenty to choose from
Beautiful sandy beach is nearby",10,April 2022,"May 3, 2022",Deluxe Double Room with Balcony and Sea View,2,Family,9.1
Just perfect we are going back!,The only criticism I have is the water fall in the reception it’s far too loud the pressure needs turning down it sounds like flooding water leek rather than a tranquil feature,"Loved this hotel, we will definitely go back 
it’s small and perfectly refurbished 
the rooms were light and spacious large comfy bed, the breakfast was exceptional .
The staff were excellent and very attentive. 
we like a bit of a walk so the 25 min walk to Lagos town was perfect and the 5 min walk to the beach was perfect. 
the restaurant’s on the beach were excellent.",10,April 2022,"May 1, 2022",Deluxe Double Room with Balcony and Sea View,6,Couple,9.1
Fabulous all around,,Marco was amazing! So was all the hotel staff we interacted with.,10,April 2022,"April 28, 2022",Deluxe Double Room with Balcony and Sea View,2,Family,9.1
very enjoyable.,we got a room with a pull out sofa.  there was no room to move once the pull out sofa was set up for sleeping.,very clean and staff very responsive.,8.0,April 2022,"April 26, 2022",Deluxe Double Room with Balcony and Sea View,3,Group,9.1
Exceptional,,"the decor was pretty, lovely pool area that was very relaxing , nice breakfast with good choices , comfortable bedroom with a good shower. staff were also very friendly. it was about a 25 minute walk to centre but a nice walk and taxis are inexpensive",10,April 2022,"April 23, 2022",Twin Room,4,Group,9.1
Exceptional,Cold water in the pool .,"Clean, close to the beach, good for family...",10,April 2022,"April 18, 2022",Deluxe Double Room with Balcony and Sea View,2,Family,9.1
Beautiful accommodations and excellent breakfast. Staff was very friendly.,"The location requires you to drive to most destinations, but this seems typical for the area.  There is one beach within walking distance.  Also, the pool is not heated.",Breakfast was fabulous and the rooms were spacious and comfortable.  We appreciated the comfortable beds and friendly staff.,9.0,April 2022,"April 18, 2022",Duplex Room,1,Family,9.1
Exceptional,Nothing,"Very nice place to stay. Everything was perfect...location, staff, breakfast. We really enjoyed our holiday.",10,October 2021,"October 31, 2021",Duplex Room,4,Family,9.1
Lagos Gem,,"The staff were outstanding and provided great local recommendations.
The facility is clean and breakfast was fantastic and plentiful.
we absolutely recommend.",10,October 2021,"October 30, 2021",Twin Room,2,Couple,9.1
Exceptional,There wasn't much not to like.,"Everything was amazing.  Attentive staff, scrumptious breakfast, central location, clean and well laid out rooms, best view ever.",10,October 2021,"October 30, 2021",Deluxe Double Room with Balcony and Sea View,2,Family,9.1
Thankyou !,,the staff! the cleanliness! we thoroughly enjoyed our stay.,10,October 2021,"October 29, 2021",Deluxe Double Room with Balcony and Sea View,9,Family,9.1
excellent service.,Three days gone so quickly,Everything particularly service,10,October 2021,"October 26, 2021",Duplex Room,3,Family,9.1
Exceptional,,"Extremely nice staff, very good service.",10,October 2021,"October 25, 2021",Deluxe Double Room with Balcony and Sea View,9,Family,9.1
We used this for a one night stay en-route to the airport. It was perfect.,,"Really friendly service, clean modern rooms, great pool, excellent breakfast and really good value for money.",10,October 2021,"October 24, 2021",Duplex Room,1,Family,9.1
would definitely stay here again,,"LOCATION WAS AWESOME  very friendly and helpful checkin, nice facilities",10,October 2021,"October 11, 2021",Deluxe Double Room with Sea View,1,Couple,9.1
Wonderful,,"Everything!
There was no issue with the adjacent construction site! Other reviews suggested noice. There was none",9.0,October 2021,"October 9, 2021",Duplex Room,7,Family,9.1
Exceptional,,"I really enjoyed my stay here, the staff were extremely pleasant and helpful. The hotel was extremely clean and bright. The facilities were brilliant including a gym that is one of the best hotel gyms I have seen. The pool was fantastic and the small bar offered delicious food and drinks. The room was nice and cool with a large balcony offering sea views.",10,September 2021,"September 30, 2021",Deluxe Double Room with Sea View,6,Couple,9.1
Exceptional,"Nothing, all was great.","Room was big and comfortable. Beautiful view on the ocean. Spotless clean. Nice breakfast. Good coffee. Pool was great, and there were always free sunbeds. Room was cleaned every day. Staff was super helpful and nice, especially Jose from reception. Super stay, highly recommending.",10,September 2021,"September 23, 2021",Deluxe Double Room with Sea View,3,Group,9.1
