Review Title,Negative Reviews,Positive Reviews,Rating,Stay Date,Review Date,Room Type,Number of Nights,Traveler Type,Overall Average Rating
Excellent,Cannot park even briefly close to the hotel in order to unload the luggage. Maybe this is a problem only if someone arrives by car. Would prefer the restaurant to close a bit later.,"Excellent location, large and comfortable rooms, polite staff and good breakfast.",10,April 2023,"April 16, 2023",King Room,1,Family,8.9
Wonderful,Only one problem the kettle in the room was faulty.,The quality and freshness of the food exceeded expectations.the fresh fruit beautifully prepared .all meats and salads were good,9.0,April 2023,"April 13, 2023",Queen Room,5,Couple,8.9
very good experience,nothing,location and stuff,10,April 2023,"April 12, 2023",Twin Room,1,Couple,8.9
Wonderful,,Breakfast good,9.0,April 2023,"April 2, 2023",King Room,4,Group,8.9
Nice location,,clean and tidy,8.0,March 2023,"March 31, 2023",King Room,2,Couple,8.9
perfect,everything was perfect,the location within the old city,10,March 2023,"March 27, 2023",Queen Room,2,Solo traveler,8.9
Very Good,no fresh air in rooms,"location, cleanliness",8.0,March 2023,"March 26, 2023",Queen Room,3,Couple,8.9
Exceptional,Sometimes it was really a lot of people on breakfast while there were few places to seat. Therefore you might need either wake really earlier or wait.,"Liked the room. It was like on photos from booking site. Everything worked there. Also the location of hotel is perfect. A lot of points of interest (cafe, restourants, sightseeing)",10,March 2023,"March 24, 2023",Twin Room,6,Family,8.9
Wonderful,Location was excelent,,9.0,March 2023,"March 20, 2023",Twin Room,3,Couple,8.9
Epic,,Excellent selection. Great staff,10,March 2023,"March 17, 2023",Queen Room,2,Group,8.9
Short trip but worth a stay,,Everything,10,March 2023,"March 16, 2023",King Room,1,Solo traveler,8.9
Very Good,,Plenty of different kind of food to take on breakfast. Nice hot coffee. Each member of personnel was helpful.,8.0,February 2023,"March 8, 2023",Queen Room,5,Solo traveler,8.9
"Excellent stay, very kind staff.","Although the room had triple windows, as there are plenty of bars around, on Saturday night there was a bit of noise. Didn't bother us really though.","The location was excellent, in the entrance of the Old town. Everything was at a walking distance, restaurants, bars and important monuments/museums. The staff was very kind and helpful, we got a complimentary upgrade to a junior suite. The room was clean, spacious and had a nice view of the city as it was on the 6th floor. Breakfast was really good, with a range of options. I would definitely recommend it.",9.0,February 2023,"March 6, 2023",King Room,2,Couple,8.9
Wonderful,The price is one of the highest in Bucharest,"Great Location, room and breakfast. Nice reception staff",9.0,March 2023,"March 5, 2023",King Room,3,Solo traveler,8.9
Very Good,"You have to clean better, especially WC. Also, it is time to make some repairment of furniture.","Location
View
Chec in procedure",8.0,February 2023,"March 1, 2023",Queen Room,3,Couple,8.9
Wonderful,-,"Nice room, very clean and comfortable. Excellent location, in the heart of old city. Very nice breakfast and friendly staff.",9.0,February 2023,"February 27, 2023",Queen Room,2,Group,8.9
Great location. The price more suitable for business travelers,"1. The housekeeping and room service were not up to to the standard of such elite chains. Had to reach them through the reception multiple times. Although it may have been due to higher occupancy during our stay days, we don't know. 
For the delay in service, they did give us complementary drinks, must acknowledge the gesture.
2. The price was perhaps a shade expensive for what we got but again it may have been the location premium. 
3. Construction was happening just outside the hotel, but that's not the fault of the hotel.","1. The location was as good as it gets. Everything was in and around the area.
There are lot of good eating areas around..
2. The breakfast was decently good, although better to go at least 1 hour before the closing time (which varies between weekday and weekends). Again sometimes you might have to wait a bit, we didn't have to but some others had to.
3. The rooms were nice and clean.
4. The service staffs were helpful but most were not the smiley kinds except the front office ones. Nothing wrong with that as long as they are doing their job well.
5. Everybody understands English language well.",9.0,February 2023,"February 17, 2023",Junior Suite,3,Family,8.9
Wonderful,Can hear all the noise coming from nearby clubs. Especially during weekend,"Location
Clean rooms",9.0,February 2023,"February 13, 2023",King Room,3,Solo traveler,8.9
Very Good,"The noise coming from outside in the night that only stopped at 5 am. Even though I was on the last floor (7th), I could barely sleep.","The location was great, I liked to convenience of being close to everything in Bucharest. Also cleanliness.",8.0,February 2023,"February 13, 2023",Twin Room,1,Couple,8.9
Good hotel almost inside old town!,"This is my second stay at this hotel, a few years ago I remember it being cleaner. It was not necessarily not-clean, but there were some problems to be fair. Also the room I stayed was quite small, but again it could be rated enough for a single person.","The hotel is located almost inside old town, with many bars, pubs and restaurants all around. Also it is not far away from other attractions and business sector depending on the type of transportation you choose. 
The building combines a classic and a modern structure, which looks good both inside and outside. Free wi-fi is efficient all around. Reception staff is very friendly and helpful. Breakfast offers very tasty options with a wide variety of choices including local Romanian food.",8.0,February 2023,"February 7, 2023",Queen Room,4,Solo traveler,8.9
highly recommended.,No cupboard in the room only for hanging clothes no shelves .,"great location, warm, comfortable, big room for 2 adults. 
we had a 2 twin room.",9.0,February 2023,"February 7, 2023",Twin Room,4,Family,8.9
Very Good,The parking is very expencive,The Barekfast was wonderful,8.0,November 2022,"February 6, 2023",Queen Room,4,Group,8.9
Very Good,"I would have liked having a small spa/relax area. 
Room view was horrible: firstly, there is a big pipe in front of the window which blocks half the view, then over the street is an old grey building bringing you to ""depression"", especially on a grey winter. 
Not having mini bar stuff in the room not optimal, even there is a small cornere at the reception where you could get whatever you want. And the cherry on the top, a 75 g buiscuits item does cost 15€. Even they are bio, this is beyond outrageous. 
At the bar in the evening, after 22 p.m. they don t have anything from the kitchen, not even a pie. I got it when they don't have anymore personal to cook, but the pies could be easily stored and served on the bar!
Overall, decent stay but not making it special in any way.","Location is central, very good. Staff is very friendly, from reception to bar/breakfast. I have enjoyed the bed, medium hard matresses, even when it s not that big for 2 persons. The room is pretty big for a queen type.",8.0,February 2023,"February 6, 2023",Queen Room,1,Couple,8.9
perfect hotel to stay,,the location was perfect,10,February 2023,"February 6, 2023",Queen Room,2,Couple,8.9
Wonderful,"Day if check in receptionist was not pleasant. ( that was the only one all others were lovely.)
A bit noisy friday and Saturday night.","Location is perfect. 
Majority of staff are very friendly.
Food in restaurant fabulous.",9.0,January 2023,"February 3, 2023",King Room,4,Family,8.9
Very Good,The hotel has no wellness at all which I would expect on this level.,"Very nice hotel, excellent breakfast, comfortable beds, excellent location.",8.0,January 2023,"February 2, 2023",Twin Room,2,Family,8.9
"Loved it, had a great experience, highly recommend to all visiting Bucharest.","Love city of Bucharest, but I felt the hotel was a bit far from Old Town and any other place we wanted to visit. Not a big deal for those that do not mind a 15-20 min drive, there are plenty of taxi and ubers around.","The hotel was amazing, top 10% of hotels I have ever stayed at. The staff was excellent; breakfast was amazing, a ton of variety to choose from; the gym and spa are a great amenity; and the room met all expectations. I was able to get an free upgrade, but regardless I would pay for a suite room any day. Loved the fruit basket, the personal note, and the quality and speed of the room service.",9.0,January 2023,"February 2, 2023",King Room,1,Couple,8.9
Excellent location,"Only gripe is that the rooms are supposed to be sound proofed but could here, even with ear plugs in, the loud music from local bar/club starting at 10pm going on until around 2.30/3am. It's just a bit tiring not having much sleep when you're booked on tours that pick you up early!
Pillows were too soft!","The location was perfect. Staff were very friendly. The hotel was really clean. Rooms had everything you needed, even a pair of slippers!",9.0,January 2023,"February 1, 2023",Twin Room,3,Family,8.9
"Quick overnight stay, comfy and had everything we needed at our disposal.",No windows (to open) in the room.,,8.0,January 2023,"January 17, 2023",Queen Room,1,Couple,8.9
Lovey stay,Breakfast should be included in the price. The toiletries should be in small containers. The big containers make hotel cheap,location and lovely clean rooms,9.0,January 2023,"January 16, 2023",King Room,1,Solo traveler,8.9
Wonderful,The front desk lady was not super helpful but we managed to get a nice room after the first one had very bad smell (cigarette).,"The Hotel is very central located. Very nice room, super comfy bed.
Nice breakfast.",9.0,January 2023,"January 8, 2023",King Room,2,Family,8.9
great stay and the staff were very friendly and helpful,"the breakfast could be better priced, there was a great coffee shop very close by that had croissants and coffee for two at half the price of the hotel breakfast for one","great location, good size room and friendly staff",8.0,January 2023,"January 6, 2023",Queen Room,9,Couple,8.9
Great location and comfortable,,comfortable and clean,9.0,January 2023,"January 2, 2023",Queen Room,3,Couple,8.9
nice and good location,,"really nice staff 
clean room 
good breakfast",8.0,October 2022,"January 1, 2023",Junior Suite,1,Family,8.9
Wonderful,Non,The locashin,9.0,December 2022,"December 22, 2022",Queen Room,3,Couple,8.9
Excellent,,"Restaurant in hôtel was excellent, team of staff on reception were very helpful.",9.0,December 2022,"December 14, 2022",Queen Room,5,Couple,8.9
great place to stay. close to old town. the hotel is very good,the hot water in the shower sometimes become less hot and that's annoying. also the bad and the pillow is not comfortable,"breakfast was excellent and very tasty.  the hotel is close to the old town . many Restaurant
  .in the area",9.0,December 2022,"December 7, 2022",Queen Room,4,Group,8.9
Wonderful,"You must fix the ventilation at the restaurant, i go in with perfume smell and come out with french fries smell, not ok, must shower and change clothes.
In rest ok, clean,good food and friendly staff, been there 2 times and will return in the future.",,9.0,December 2022,"December 4, 2022",King Room,2,Couple,8.9
Exceptional,-,"Comfy bed, great location, very clean",10,November 2022,"November 27, 2022",Queen Room,1,Couple,8.9
Very comfortable stay,,"Our stay at the hotel was wonderful. The location was unique, next to the old town and quite close to transport. The room was clean and comfortable. The breakfast was very rich. The staff very kind and especially Christian who was always willing to help us in whatever we wanted and always with a smile.",10,November 2022,"November 21, 2022",King Room,1,Couple,8.9
beautiful and comfortable,n/a,location,9.0,October 2022,"November 20, 2022",Deluxe King Room with City View,3,Couple,8.9
comfty hotel at great location 👍,nothing,"location, cleanliness & service",10,November 2022,"November 11, 2022",Queen Room,4,Couple,8.9
I would recommend for others,- room size is a bit small,"- fast and early check in process 
- excellent location in the middle of old town 
- clean room and excellent room service 
- nice view on historical buildings",9.0,November 2022,"November 6, 2022",King Room,2,Solo traveler,8.9
"very good hotel, recommended",staff could be a little bit more polite,"most of the things were
perfect",10,September 2022,"November 5, 2022",King Room,2,Solo traveler,8.9
Wonderful,"The breakfast room was very crowded, it needs more space and more tables. Additional sweet options in the breakfast.","Nice location, big room, comfortable bed! Freshly baked eggs, omeletes and waffles in breakfast options.",9.0,October 2022,"October 30, 2022",King Room,2,Couple,8.9
Wonderful,,Great location,9.0,October 2022,"October 30, 2022",Twin Room,2,Family,8.9
Excellent location good facilities.,Cleaning in my room,Location,9.0,October 2022,"October 17, 2022",King Room,2,Couple,8.9
Very Good,"One of the headlights could not be turned off (broken switch). I had to go down a long corridor to the door to turn off all the electricity in the room in order to sleep.
The bathtub could use more thorough cleaning.",Great location in the centre of old town. Friendly and helpful staff. A wide choice of fruits at breakfast.,8.0,September 2022,"October 4, 2022",Twin Room,1,Solo traveler,8.9
Nice stay in the city centre,,"The location is great, really in the city centre. The breakfast was very valid and tasty, with many options available. The room was big, clean and modern.",9.0,September 2022,"September 13, 2022",Queen Room,4,Solo traveler,8.9
Wonderful,There was too much noise coming from the nearby clubs until the early morning.,"The staff and location was excellent. The rooms were clean. The breakfast has many options, but could be further improved, to include more healthy and special dietary options. The environment was amazing. Thanks for a lovely stay.",9.0,September 2022,"September 13, 2022",Twin Room,4,Group,8.9
We enyjoyed our stay. The staff Wes very helpful and nice.location was great .,"Very uncomfortable sofa bed .
Even caused us physical bruises getting in and out of the sofa bed!","Nice clean room in excellent location
Tasty breakfast",9.0,September 2022,"September 12, 2022",Junior Suite,1,Family,8.9
Wonderful,There was loud music playing outside until about 1:30am.,"Breakfast was good. Location fine.
This was our first time in Bucharest, and the staff were helpful.",9.0,September 2022,"September 11, 2022",King Room,3,Couple,8.9
All in all an almost perfect accomodation.,"Apart from the Reception staff, rest personnel with quite low english Knowledge, that made some communications rather difficult. Ground floor toilettes near the Restaurant/bar, not accesible by the elevator (only stairs).
Quite late serving time on lunch hours. We waited 45' for one club-sandwitch!","Location in Bucharest Old Town couldn't be better!
breakfast perfect, tasty and diverse. Better coffee options possibly, Not simple machine coffee!.
Very clean Hotel. 
They surely honor HILTON brand name and the 4 Stars.",9.0,September 2022,"September 7, 2022",Queen Room,5,Couple,8.9
Wonderful,Air conditioning switches off after 180 min,Room and breakfast,9.0,September 2022,"September 6, 2022",Queen Room,5,Family,8.9
Perfect,,Everything was perfect. Thanks to Hilton.,10,September 2022,"September 5, 2022",Queen Room,2,Solo traveler,8.9
I recommend the hotel,cleaning staff was lazy,great location,9.0,August 2022,"September 3, 2022",Queen Room,4,Solo traveler,8.9
Great location and facilities,"You always have some fan noise from the ventilation, and this became a bit annoying during my week long stay. A touch of mold in the bathroom could have been cleaned up/removed.","Great location on the edge of the old town, easy to access rest of the city from here. I like Modern decor of hotel as well.",8.0,August 2022,"September 3, 2022",Queen Room,3,Solo traveler,8.9
Excellent stay,Can be a little noisy at night as my room was facing the road,"Location is excellent, staff were exceptionally friendly, room is very spacious and comfortable, air conditioning is excellent",10,August 2022,"September 2, 2022",Queen Room,3,Family,8.9
"Well run, professional and very pleasant hotel.",Nothing.,"The staff were always helpful and considerate.
The room was comfortable, clean and refreshed daily.
The buffet breakfast was well organized and blended 
Romanian cuisine with other European foods.
Would certainly stay again, great location.",9.0,August 2022,"August 29, 2022",King Room,2,Couple,8.9
Exceptional,,The room was nice and clean! The stuff was exceptionally friendly!,10,June 2022,"August 25, 2022",Queen Room,2,Solo traveler,8.9
Wonderful,,"Modern, clean and comfortable hotel in an excellent location in the Old Town.",9.0,July 2022,"August 23, 2022",Twin Room,2,Group,8.9
Wonderful,,"Perfect location
Excellent breakfast
Great bed and very nice room",9.0,August 2022,"August 6, 2022",Queen Room,3,Couple,8.9
good location but pricey,noisy - despite ear plugs provided in the room,good position,8.0,August 2022,"August 2, 2022",Junior Suite,4,Family,8.9
Exceptional,,great location in the city center,10,July 2022,"August 1, 2022",King Room,2,Solo traveler,8.9
A very elegant building.,,"Highly recommended. A very varied and versatile menu.
Staff worked hard to make you happy.",10,July 2022,"August 1, 2022",Queen Room,1,Solo traveler,8.9
Generally it was good,Lack of view,The breakfast was good. The staff were friendly,8.0,July 2022,"July 24, 2022",Twin Room,3,Group,8.9
Great location,,Really well located. Very nice staff,8.0,July 2022,"July 18, 2022",King Room,1,Group,8.9
recommend,clean,location,9.0,June 2022,"July 5, 2022",Queen Room,2,Group,8.9
Very Good,"Fist night give me bad room for noise near night club , when I arrive I asked & I request for good room.",Good food & very good cleaning & good location,8.0,July 2022,"July 2, 2022",King Room,5,Family,8.9
a nice stay in the heart of Bucharest,breakfast could be improved!,"location,staff,comforts",9.0,June 2022,"June 29, 2022",Twin Room,1,Group,8.9
Wonderful,,Hotel location,9.0,June 2022,"June 27, 2022",Twin Room,4,Group,8.9
"Very good, but use Bolt/Uber in Bucharest, NOT the yellow taxi","DON’T TAKE THE TAXI OUTSIDE! They are charging 5 times more than Uber/Bolt. I’m Romanian and asked them how much would be till the train station, because we were in a hurry, and one taxi driver said 100RON. We paid 14RON with Bolt. The usual price to Gara de Nord is between 14-22RON, even with traffic. They’re taking advantage of the tourists who don’t know. I don’t understand why Hilton hotel let them sit there and mess with customers like that. Hilton should have more respect for itself and its customers!",The room was big and quiet,9.0,June 2022,"June 23, 2022",King Room,1,Couple,8.9
Very Good,,"Great location, in the middle of the city. Subway and parking lot near by the hotel",8.0,June 2022,"June 19, 2022",King Room,2,Couple,8.9
Wonderful,There is not place in front of the hotel to gare the car.,,9.0,June 2022,"June 19, 2022",Twin Room,1,Group,8.9
Lovely city break,No information in the room. No view in an interior room and it was very dark little natural light (room #237). Kettle wouldn't stay on. Bit strange having a massive industrial pipe across the window.,The location was central for getting all over the city. Bus stops close by. Ideal for night life in the old town. Great breakfast you must try the waffles!,8.0,June 2022,"June 18, 2022",Queen Room,5,Family,8.9
Wonderful,The disco from the alleys is loud but we enjoyed that. Some wouldn't,We liked everything ♥️,9.0,May 2022,"May 30, 2022",Twin Room,4,Family,8.9
"Once I entered the building, I felt at home.",I was not a fan of the area as much as the loud music every night could keep you awake if you weren't very tired.,"I loved the room, it was extremely comfortable. The breakfast was execellent every day. It was extremely comfortable in the eating area and the breakfast staff were extremely friendly and welcoming.",8.0,May 2022,"May 30, 2022",Twin Room,7,Solo traveler,8.9
Amazing,Not changing bedding frequently,"Location very excellent 
Breakfast very good
Room small
Staff wonderful",8.0,May 2022,"May 28, 2022",Queen Room,5,Couple,8.9
Wonderful,Old Town is the hotspot in Bucharest. It's a little noisy at night. The windows keep most of the noise out.,"The hotel is giving free room and board to Ukraine refugees. 
Breakfast was great.",9.0,May 2022,"May 25, 2022",King Room,2,Couple,8.9
Very Good,,"Convenient location, nice room.",8.0,May 2022,"May 23, 2022",Deluxe King Room with City View,3,Solo traveler,8.9
Wonderful,The hotel has no parking.,Good location. Friendly staff. Excellent breakfast. The room was very clean with comfortable bed.,9.0,May 2022,"May 17, 2022",Twin Room,1,Family,8.9
Wonderful,Room size and windows block.,Location,9.0,April 2022,"May 8, 2022",Queen Room,1,Couple,8.9
Picturesque and enjoyable!,"Minor shortcomings in the room (shampoo, hair dryer), but not something important…","Very organized, clean, comfortable, very kind staff (Maddalena!), Wonderful view from the room, close to the center and the old town, wonderful breakfast! BRAVO!",10,May 2022,"May 6, 2022",Queen Room,3,Couple,8.9
"Great location, right in the middle of old town","The room wasn’t properly cleaned before my arrival. There was thick dust on top of the lamps and there were crumbs on the carpet. Also the floor heating (by the windows) had a lot of dust and lint/dust bunnies in it. 

The fridge shelf had something sticky on it and seemed also dirty. 

The marble countertop in the bathroom had toothpaste on it from the previous guest. 

The AC in the room was set on 25 C at all times…too warm for my liking and it seemed to change back to 25 no matter what I’d set it on. 

I’d stay here again if they’d fix the cleaning issues","Fantastic location, great staff and amazing views. 
Big room and pretty quiet considering the hotel is in the middle of old town",8.0,April 2022,"May 5, 2022",Deluxe King Room with City View,2,Solo traveler,8.9
Wonderful,Nothing I remember,"- Great location, nice staff, helpful, all good",9.0,April 2022,"May 5, 2022",King Room,2,Couple,8.9
Good choice of accommodation,"The breakfast is quite expensive, it could have a bit more variety for this price.","The location is great. The staff is very friendly. The rooms are spacious, comfortable and clean. I always try to stay in this hotel when I come to Bucharest.",9.0,March 2022,"May 3, 2022",King Room,1,Group,8.9
Perfect stay,,"Great location, staff and breakfast",9.0,April 2022,"May 2, 2022",Queen Room,2,Solo traveler,8.9
"it was comfortable, enjoyable although it was short",nothing,"comfortable, great location, supporting staff, great breakfast",8.0,April 2022,"April 29, 2022",Queen Room,1,Solo traveler,8.9
Very Good,"Shower flow low, water temperature unstable","Room, location, breakfast",8.0,April 2022,"April 28, 2022",Queen Room,3,Family,8.9
great stay. will come again,,"good location
clean and tastefully decorated",10,April 2022,"April 27, 2022",King Room,1,Couple,8.9
excellent!,breakfast was good but not that good which you would expect from a Hilton chain!,location was superb!! right in the city center!,9.0,March 2022,"April 23, 2022",Junior Suite,2,Group,8.9
Very Good,to consider and provide halal food,"A cozy hotel, in the center of the old city, many restaurants and cafeterias around. Experienced and fluent English speaking.  staff. Very good breakfast.",8.0,April 2022,"April 22, 2022",King Room,2,Solo traveler,8.9
Wonderful,I think that along with the not cheap price there should be a swimming pool and sauna and Jacuzzi,,9.0,April 2022,"April 17, 2022",Queen Room,2,Family,8.9
Very good location but rooms for improvment like 7/24 room service and fully firendly reseption,"Some staff at reception is very helpful and firendly
Some are like working at for public sector…",,8.0,April 2022,"April 15, 2022",Queen Room,3,Group,8.9
Everything was perfect except the club noise at midnight,There was a noise issue (big music) at night from the club in front of the hotel. Hope that sound proof will be reinforced in the future.,The room is very clean and comfortable.,8.0,March 2022,"April 15, 2022",King Room,3,Solo traveler,8.9
"Nearly perfect, but not quite.",The only thing about our whole stay was lack on ventilation in room.,"Staff were very pleasant and helpful. Very clean. Very quiet in the bedroom. Receptionist gave us an umbrella and looked after our luggage for 5 hours on last day. Would love to stay again, next time we'll ask for a room with a opening window.",8.0,April 2022,"April 14, 2022",Queen Room,5,Couple,8.9
We really enjoy our stay and the breakfast was nice. The staff we interacted with were friendly and helpful. We used the,"There was a faint cigarette or smoke smell in the bathroom, probably coming through the extractor fan","Great location, clean and nice rooms, friendly staff",9.0,April 2022,"April 10, 2022",Queen Room,1,Couple,8.9
Worthy the price,Not very friendly stuff at the reception,"Good location, clean, big beds, good enough breakfasts",8.0,February 2022,"April 6, 2022",Twin Room,2,Solo traveler,8.9
Wonderful,,location,9.0,April 2022,"April 5, 2022",Twin Room,2,Group,8.9
Wonderful,expensive relatively.,"perfect location, good rooms.",9.0,March 2022,"April 3, 2022",King Room,1,Couple,8.9
great location to explore Bucharest on foot while enjoying an American-style accommodation.,"bed was hard, tight quarters","central location, good breakfast, competent staffing with excellent English skills. historic (c1888) building in walkable old town.",8.0,March 2022,"March 30, 2022",King Room,4,Couple,8.9
