Review Title,Negative Reviews,Positive Reviews,Rating,Stay Date,Review Date,Room Type,Number of Nights,Traveler Type,Overall Average Rating
Modern Comfort and Stylish Design: A Review of My Stay at CitizenM Hotel,the washbasin felt a bit cramped and could have been larger for added comfort and functionality.,"During our recent family trip to Kuala Lumpur, we had the pleasure of staying at CITIZENM, a truly unique and technology-equipped hotel. From the moment we stepped into the lobby, we were captivated by the impeccable decor, featuring pieces by renowned artists that added a touch of sophistication to the space. The atmosphere exuded a youthful and vibrant vibe, reminiscent of a Silicon Valley startup, which we found both refreshing and exciting.

What truly set CITIZENM apart, however, was the exceptional staff. The level of hospitality we experienced was beyond compare. Duncan, the boss, was incredibly welcoming and made us feel like valued guests. Lily and Jeswyn stood out as beacons of warmth and assistance throughout our stay, going above and beyond to ensure our needs were met and that we had an unforgettable experience.

The technology-infused rooms added an innovative twist to our stay. The seamless control of various room features through the tablet provided a modern and convenient touch. It felt like we were experiencing the future of hospitality firsthand.

The breakfast at CITIZENM was a delightful surprise. Despite not being a large buffet, the variety and taste of the dishes were impressive. The handcrafted coffee and chocolate were standout highlights, adding a delicious touch to our mornings. Overall, the breakfast experience added to the exceptional stay we had at the hotel.

In conclusion, our time at CITIZENM was a delightful blend of cutting-edge technology, artistic ambiance, and exceptional service. The staff, particularly Duncan, Lily, and Jeswyn, made us feel like part of the CITIZENM family, and their kindness and assistance made our stay truly memorable. We look forward to returning and creating more wonderful memories at this remarkable hotel.",9.0,July 2023,"August 10, 2023",King Room,2,Family,9
I liked it,nice breakfast,"great place , friendly staff",9.0,August 2023,"August 6, 2023",King Room,2,Solo traveler,9
Exceptional,,Very modern hotel close to the centre . Room was compact but the layout was superb and was fantastic for our weekend in KL . Would highly recommend,10,July 2023,"August 3, 2023",King Room,2,Couple,9
Hip and cool vibe in perfect spot in KL,,"Colourful and chill vibe, very nice staff, perfect location near the hotspots and nightmarkets.",9.0,August 2023,"August 3, 2023",King Room,2,Couple,9
Exceptional,Nothing special.,CitizenM facility and room are comfortable and well nicely designed. CitizenM is good for tourists who require a comfortable bed and a common lounge for taking a break. The room and shower room are very clean and all room facilities can be controlled by a iPad next to the bed. The hotel is located in central KL and you can find out many bars and restaurants near the hotel.,10,July 2023,"July 31, 2023",King Room,1,Solo traveler,9
very innovative and chic place.,"no room service, but didn't need it anyway",cool tech in the room. quite cosy. cool art everywhere.,9.0,July 2023,"July 31, 2023",King Room,2,Solo traveler,9
Great Stay!,No kettle for hot water😔,"The Bed!
Super Comfy!",9.0,July 2023,"July 31, 2023",King Room,1,Couple,9
Overall a hotel worth for revisit,"Not sure how does the air conditioner works. We did try to set high fan speed, but it automatically turned to lower fan speed.",The good vibe and friendly staff,10,July 2023,"July 31, 2023",King Room,1,Couple,9
Excellent hotel with strategic location and great comfort,,"Strategic location, modern design, staffs are very professional, comfortable bed and room",10,July 2023,"July 31, 2023",King Room,1,Couple,9
Exceptional,Everything was great.,"I very enjoy my stay. For me the most important, is the sleep. It a very quiet hotel and room compare to the other hotels. Breakfast is very good, staff is very good. Food market is 100 meter, city center 500 meter. Room was very immaginative, not large but its Asia so it was no problem.",10,July 2023,"July 29, 2023",King Room,2,Couple,9
Excellent place to stay in KL,,A truly excellent place in KL.  Recommended.,10,July 2023,"July 29, 2023",King Room,1,Couple,9
Exceptional,,Nice common area,10,July 2023,"July 29, 2023",King Room,1,Solo traveler,9
Very good value for your bucks.,"Location was not the best, but for the rest of the things I would say totally worth it.","The entire hotel concept was really cool, it's like a hip place to stay. Even the common area and the lounge on level 2 were so comfortable to hang around. If you need to wait for long hours, sitting there is very pleasant.

Although the room is not big, the full wall window, the smart system and the layout makes it feel very spacious. Nothing to complain about cleanliness. Staff was really friendly and helpful. Location was relatively good in the middle of Bukit Bintang, 10-15 minutes walk away from all the big malls (Pavilion, Lot 10, etc.)",9.0,July 2023,"July 28, 2023",King Room,2,Solo traveler,9
"The staff and manager are extremely friendly and attentive, they really did a good job and making sure everyone who is s",,The design of the facility is so unique and special,10,July 2023,"July 28, 2023",King Room,2,Group,9
Very nice property that is conveniently located.,1 hour away from the airport.,Everyone was very helpful in making our stay comfortable.  The manager went out of his way to suggest things to do and talk to us about our travels.  Kudos to him.,10,July 2023,"July 28, 2023",King Room,1,Couple,9
Fantastic!,,"Room was very clean, comfortable, and perfect for a good sleep. Lobby area was lovely and staff were very helpful. Loved it!",10,July 2023,"July 27, 2023",King Room,2,Group,9
Great Find,Nothing,"Quirky, modern, tasty breakfast, central location, helpful staff!",10,July 2023,"July 25, 2023",King Room,1,Couple,9
Wonderful,,"Near jalan alor
Easy to get public transport
Comfortable friendly staff",9.0,July 2023,"July 24, 2023",King Room,1,Family,9
Great experience - exceeded our expectations,"Nothing to complain. If anything, providing heated plates for breakfast would be nice to keep things warm.","The hotel is stylish and yet cosy. The staff is kind, forthcoming and very helpful. The helped us select the room according to our needs and also helped us book our bus to Singapore. 

The rooms are small but don’t feel like it because everything is well designed. Bed was super comfortable and the city view room was was really nice.

Breakfast was delicious although it cooled down quickly because plates aren’t warmed. Despite this, the coffee which you have to order and the varied buffet were most excellent.

From the hotel you can walk to the city center and discover some historic side roads with many Kopitiams and cafes. There is a big shopping center the opposite way from the city center for those who fancy some shopping. Finally, the hotel is roughly 100 meters from the famous food street Jalan Alor.",10,July 2023,"July 23, 2023",King Room,2,Couple,9
Exceptional,Everything was great! I did not like having to leave 😐,"The most comfortable bed ever! Good breakfast, great coffee, friendly staff, incredibly clean! Absolutely recommended!",10,July 2023,"July 23, 2023",King Room,2,Family,9
Wonderful,Evening staff not so good at answering basic tourist questions.,"Clean, great location and daytime staff was super.helpful..",9.0,July 2023,"July 23, 2023",King Room,3,Solo traveler,9
"Easy, comfortable and simply the best!",The only thing i could think of was when the noise of room service’s next door can be heard since they claimed the rooms are soundproof,"1) The swift check in and check out.
2) Common area was comfortable to chill
3) Incorporation of tech in the room was brilliant and convenient
4) Ironing room safe your time from waiting the staff to send it over to your room and safe the space in your room as well",10,July 2023,"July 16, 2023",King Room,1,Couple,9
"Good hotel, ideal for 1 or 2 nights",Nothing,Good location and friendly staff,9.0,July 2023,"July 15, 2023",King Room,2,Couple,9
Great Hotel!,"Guest rooms a bit small, but not a big concern if you hang out in the lobby and also spend time outside exploring KL.","Stylish and fun lobby! Great for hanging out, having a drink, etc. Breakfast was nice and we appreciated the attentive service from all staff. Location is great with Jalan Alor directly behind the hotel! Also, it was so nice to be able to borrow an umbrella from the hotel when going out.",10,July 2023,"July 15, 2023",King Room,2,Couple,9
Best trip i had so far,,Everything was perfect. The lights and everything provided in the room was perfect.,9.0,July 2023,"July 14, 2023",King Room,1,Group,9
Exceptional,TV,"Very nice design, perfect friendly staff. Clean rooms, no Netflix in TV - only one minus. In general everything was perfect.",10,June 2023,"July 12, 2023",King Room,2,Couple,9
Great!,,"Great location, very close to Jalan Alor. Massive double bed and so comfy. Really helpful and friendly staff. Liked the Ipad to control things in the room.",10,June 2023,"July 10, 2023",King Room,2,Couple,9
Exceptional,,"Very modern (room features manageable by an Ipad or your phone)
Perfectly clean
So central and still quiet to sleep
worth the price
very friendly staff
great breakfast

wonderful!",10,July 2023,"July 9, 2023",King Room,2,Solo traveler,9
Modern clean apartment in KL,N/a - overall pretty satisfied,"(1) Very clean rooms with a large beds and super comfy pillows 
(2) Reception was very accommodating in terms of checkin times 
(3) Nice breakout area",8.0,July 2023,"July 9, 2023",King Room,2,Couple,9
Very Good,,Clean and good use of technology,8.0,July 2023,"July 6, 2023",King Room,2,Solo traveler,9
A hotel to remember,Nothing,Clean and Professional,10,June 2023,"July 4, 2023",King Room,1,Family,9
Exceptional,,"Nice, clean, tiny room but very very good!!!",10,July 2023,"July 2, 2023",King Room,2,Solo traveler,9
Exceptional,No swimming pool and gym,"Very comfortable and exquisite hotel, with artworks and beautiful chairs placed in every corner, even if you don’t go out, you can have a good rest here for a day. The bed in the room is big and comfortable, the lights, TV, and curtains are also controlled by ipad and handphone app.  The free parking lot provided by the hotel is very convenient.  The breakfast is delicious, and I am very satisfied with the hotel",10,May 2023,"June 30, 2023",King Room,1,Family,9
best place to stay in KL,,great stay large comfortable bed excellent breakfast,10,June 2023,"June 30, 2023",King Room,2,Couple,9
Friendly staff and clean room.,,"The location was great with the night markets very close by. The staff were very friendly. The room and hotel was spotlessly clean. I would highly recommend. I loved that they had barista made coffee included in the breakfast (rather than a push button machine).They also had an oat milk option for coffee, for those that can't drink dairy.",10,June 2023,"June 30, 2023",King Room,3,Solo traveler,9
good service. recommend,,friendly staff. nice and modern rooms,10,June 2023,"June 28, 2023",King Room,3,Group,9
Exceptional,None .,"Everything perfect, all the staff are very friendly and helpful. Very easy check in / out process. 
Great location, very centre . Easy access to public transport too . 
Rooms & their technology 10/10.
They served delicious breakfast. 
Thank you for giving excellent customer care .
I’ll definitely come back.",10,June 2023,"June 27, 2023",King Room,1,Solo traveler,9
"very good hotel, clean, fully automated controls in my room. Staffs were helpful too. good value $$","maybe just location wise, as I feel not safe in the surroundings, its dark in the alley and i don't noticed that there's a security etc..","the room are well cleaned, smell good and all controls were automated, very nicely design.
Maybe from outside you don't see much too think it's just opposite with higher/costly hotel Swiss Garden but then im impress will definitely be back...but for leisurely stays..",9.0,June 2023,"June 26, 2023",King Room,1,Solo traveler,9
It’s marvellous and well-located. The staff is top notch,Anything,Extremely cute,10,June 2023,"June 24, 2023",King Room,4,Couple,9
Exceptional,None .,Excellent customer care .. friendly staff and very helpful. Delicious breakfast and nice atmosphere.,10,June 2023,"June 21, 2023",King Room,2,Solo traveler,9
Perfect gateway with BFF!,Erm maybe price. Lol. Always want things cheaper,Everythingggg,10,June 2023,"June 21, 2023",King Room,1,Group,9
Very Good,Nope,Everything very nice,8.0,June 2023,"June 20, 2023",King Room,1,Family,9
"If I travel solo again, I would be happy staying here. Check room sizes if you are not alone.","The room ( Stayed in Room 501) was small. (May be because I was a solo traveler, they would have allotted this room to me.  ). However, it was very clean and nice.",Very artistically maintained. Nice creative décor. Excellent location - especially if you are in Malaysia for business.  Places like food street Jalan Amor and Pavilion shopping mall are at a walkable distance. Very clean and nice rooms. All the controls inside are through iPad placed near the bed.,9.0,June 2023,"June 19, 2023",King Room,2,Solo traveler,9
Wonderful,Prob location. You could use grab but it was kind of scary to walk alone around the hotel as a female solo.,"Atmosphere. The ""nice cafe"" vibes were there. I liked it very much.",9.0,June 2023,"June 17, 2023",King Room,2,Solo traveler,9
Exceptional,Nothing,The atmosphere is cool.,10,June 2023,"June 16, 2023",King Room,1,Family,9
the room was nice and clean and the staff made me feel ver comfortable.,nothing,"I like the location, the Wi-Fi, the clean room and comfortable bed.  And of course the friendly staff.",10,June 2023,"June 15, 2023",King Room,4,Solo traveler,9
Wonderful,The toilet is too small😅,The room is very clean. With a lot of towel,9.0,June 2023,"June 13, 2023",King Room,1,Family,9
"its was very pleasing, i slept like a baby and the breakfast is great!","1. electric water boiler (to boil your water in case we want to make hot tea) is needed
2. room service (cleaning room)","bed, shower, vanity (mirror lights), tv, all of it",10,June 2023,"June 13, 2023",King Room,2,Solo traveler,9
Best place to stay in KL,"nothing, it was a perfect stay!","beautiful hotel, friendly and helpful staff, extremely well designed room with an amazingly comfortable bed, great location, fantastic breakfast with plenty of choice",10,June 2023,"June 12, 2023",King Room,2,Couple,9
Exceptional,,"Very friendly staff! Good located in the heart of Kuala Lumpur, very close to Bukit Bintang!",10,June 2023,"June 12, 2023",King Room,3,Couple,9
Good value,Small room,"Good value, lights and AC are controlled by an iPad which is very convenient",8.0,May 2023,"June 11, 2023",King Room,1,Couple,9
COMFORTABLE ROOMS,None,"friendly staffs, feeling like home, loves the environment.. fantastic living room",10,June 2023,"June 11, 2023",King Room,2,Family,9
I’ll be back!,None,"Smart room concept really worked for me well, in fact I’m designing my own room with your spec😀",10,June 2023,"June 9, 2023",King Room,2,Couple,9
Comfortable and easy access to heart of the city,,Location near Jalan Alor street food.,10,June 2023,"June 9, 2023",King Room,1,Couple,9
good stay will come back,"avoid walk out at midnight, that loc many riders with bike waiting outside. staff is nice n friendly","clean, comfortable,",10,June 2023,"June 9, 2023",King Room,1,Couple,9
Found my go-to hotel in KL!,There's nothing that I didn't like.,"Comfiest bed ever! Loved the whole vibe of the interior, There's also a refill station for water at the lobby. Will be booking this over and over again whenever I'm in Kuala Lumpur! Love CitizenM!",10,June 2023,"June 8, 2023",King Room,1,Family,9
Very Good,,The staff are really friendly and nice 👍👍.. the room is clean and comfortable. I really enjoyed my stay here,8.0,June 2023,"June 7, 2023",King Room,1,Group,9
Very Clean modern good location & affordable,Bathroom a little tight,"Good water pressure great shower, good mattress very modern and serve the purpose well for good night rest and accommodation at a decent price",8.0,June 2023,"June 6, 2023",King Room,2,Family,9
Excellent location and very comfortable rooms,"The breakfast isn't great. For the price, I would expect an option for fresh eggs at your choice.","The beds are extremely comfortable, which is probably the most important thing to me! The rooms are small and the bathrooms a bit weird, but even for a pretty demanding American, I liked everything. The staff is really exceptional though - insanely helpful and very friendly. I would stay again just because I liked them so much.",9.0,May 2023,"June 6, 2023",King Room,5,Group,9
Excellent.,A bit pricey.,Everything. Breakfast was good. Parking is easy and free. Room very clean. Wifi was good. Staff very friendly and helpful. Thank you.,10,June 2023,"June 5, 2023",King Room,2,Couple,9
Great use of technology,,"Friendly staff, cool and cozy lobby, check in and check out was smooth",10,June 2023,"June 4, 2023",King Room,1,Couple,9
Exceptional,Nil,Very comfy to stay there .rppm are very clean .highly recommend,10,June 2023,"June 3, 2023",King Room,1,Family,9
Wonderful,,"Room very neat, friendly staff, and great location",9.0,June 2023,"June 2, 2023",King Room,2,Couple,9
Becoming a Citizen is so worth it!,Not having enough time to stay here for longer!,"The staff where absolutely amazing. Every single one that we had an encounter with was incredibly friendly and very helpful. The room was small, but very well designed and it felt spacious.  The bed was one of the most comfortable I've ever slept on and the city view was nice. The blackout curtains worked fantastic to get the rest we needed and the ipad just rounded off the whole experience to make it an unforgettable stay.",10,May 2023,"May 29, 2023",King Room,1,Couple,9
Wonderful,Don't have indoor slipper.,"Friendly staff, very comfortable bed & pillow. Good location.",9.0,May 2023,"May 29, 2023",King Room,1,Family,9
Exceptional,nothing,All 👍,10,March 2023,"May 27, 2023",King Room,1,Group,9
purely nice,everything,everything top,10,May 2023,"May 25, 2023",King Room,1,Couple,9
Exceptional,The hotel location a bit far from city center.,"My room was at high floor, clean, quiet and very comfortable mattress. Stuff very helpful and professional.",10,April 2023,"May 24, 2023",King Room,8,Solo traveler,9
I wish I found out about citizenM earlier because my 17 nights of stay at a previous hotel nearby did leave me with an u,This is the first time I have no dislikes or bad comments for a hotel. You guys deserve a praise for bringing citizenM to a 4/5 star service and accomodation!,"Everything! I can’t seem to find anything to be picked on from my stay at citizenM such as very friendly staff (and even cleaners are friendly), very beautifully designed room (check it out yourself) to very clean room. 

Something worth thanking the staff: I got an early check in around 12pm as I was moving from another hotel and the staff kindly assisted me to find an available room for early check in without any surcharge. I also got my late checkout extended from 2pm to 3pm without surcharge as I was in a hurry back to the hotel from a haircut.",10,May 2023,"May 22, 2023",King Room,1,Solo traveler,9
amazing!,n/a,"very comfy bed, super friendly staff and very clean and trendy environment",10,May 2023,"May 20, 2023",King Room,4,Solo traveler,9
really enjoyed it,the fact you have to climb over each other to get into bed,"great place to stay, close to everything",10,May 2023,"May 19, 2023",King Room,1,Couple,9
Don't hesitate to book here. It is well worth it.,N/A,"The hotel has a welcoming vibe from the get go,  decor is superb - tastefully done! Plenty of areas that can be used for productivity. Even the furniture is well thought out in terms of comfort and design. The facilities are clean and modern, complete with smart features in each room, and most importantly the staff is extremely pleasant and helpful 
with any concern. Definitely looking forward to my next stay here!",10,May 2023,"May 18, 2023",King Room,2,Family,9
Exceptional,"The washroom is quiet small but I can understand that it allows more space for the changing area. One thing though, because the toilet is right attached to the bathroom, if you are in the toilet, you can't open the door to shower. It's not very bad to us since we are couple of for those who travel solo, but may be inconvenient for friends","Love the artistic design and smart clever working space! Staff are super cool and the hotel is conveniently located next to a 7-11 plus just 3-5min walking distance to a famous night market for street food, which is awesome 👍🏻
The room is smartly designed with curtains, colorful lightening and TV that can be adjusted by the iPad in the room 
Will definitely visit again",10,April 2023,"May 16, 2023",King Room,2,Couple,9
Exceptional,Need to have more space to keep luggage inside the room,"It was great decision living at citizenm, i had very different experience from other 4 and 5 star hotel i lived in during my stay in malaysia.

Excellent  customer service

Like layout of hotel room and lobby

Excellent staff

Like the lighting and smart tv option",10,May 2023,"May 16, 2023",King Room,1,Couple,9
definitely will stay here again.,,"nice staff
clean room
great size for solo traveler",10,May 2023,"May 15, 2023",King Room,1,Solo traveler,9
Perfection,Nothing,"Everything was perfect, from checkin to checkout. Breakfast, bar, everything was super clean, and the staff was the most perfect and amiable.",10,May 2023,"May 15, 2023",King Room,9,Family,9
"Well located hotel in walking distance to  night markets and Chinatown, PETRONAS Towers.",One elevator was broken which was inconvenient.,Food was fabulous. The staff was amazing and the beds were SO comfortable.  I love the mood lighting in the room. The room is tiny but very efficiently laid out.,9.0,February 2023,"May 12, 2023",King Room,3,Solo traveler,9
Very Good,,"Excellent position and rich breakfast, staff was super friendly and caring. At the centre of all the interesting spots in kl",8.0,May 2023,"May 9, 2023",King Room,5,Solo traveler,9
"Great, fun, stylish, super-comfortable, wonderful staff. Highly recommend.",Nothing we didn’t like.,"Great, fun, stylish, super-comfortable, wonderful staff. Highly recommend.",9.0,May 2023,"May 9, 2023",King Room,1,Couple,9
We had an amazing experience in this hotel,Everything was perfect in the hotel,The hotel staff were very helpful and friendly and the room was so clean and modern with high tech( everything operated with touch and location is so close to Jalan Alor ( Food street ) and all the attractions area.,9.0,May 2023,"May 7, 2023",King Room,6,Couple,9
Exceptional,Can't think of any,"The modern design, simplicity is just amazing",10,May 2023,"May 5, 2023",King Room,2,Family,9
Exceptional,,"Everyone is very friendly and helpful! Everything went fine and also the location is good, next to the night market!
The room is maybe a little bit small but good for short stays!",10,April 2023,"May 2, 2023",King Room,3,Family,9
Exceptional,,Everything was very nice at citizenM. The only minor thing that I would change is the shower cabin. The shower door needs to keep the water inside the shower. Other than that everything was perfect.,10,April 2023,"April 30, 2023",King Room,2,Couple,9
Super,"The only remark I can give is that some of the bread at breakfast must have been recycled from the day before as it was rock hard. A beauty flaw, easy to correct.",Super nice staff and great spirit. Like the room set up and the comfy bed.,10,April 2023,"April 29, 2023",King Room,2,Solo traveler,9
Great place to stay and we'll definitely stay here again,Beer could have been cheaper - MYR$30/pint,"Great location
Modern features, tablet control for room functions, e.g lights, climate control, day/night blinds 
Great shower
Very fast wifi
You can choose available rooms on any floor, with either City or Jln Alor views
King sized bed. Best pillows ever. 
Friendly staff
Complimentary car park
10 min walk to/from Imbi Monorail Station and Singapore bound buses.",9.0,April 2023,"April 28, 2023",King Room,3,Couple,9
Exceptional,,"Perfect. Everything works, super confortable",10,April 2023,"April 24, 2023",King Room,4,Solo traveler,9
So far excellent job well done everyone but the air conditioning needs to be on even though you categorise as 4Stars Hot,the air conditioning needs to be on,bed and blind curtain,9.0,April 2023,"April 23, 2023",King Room,1,Solo traveler,9
Highly recommend,,"very near from city center and food street, the room control by Ipad, the shower was awesome, the large window just beside the bed was interesting, and staff were helpful.",10,April 2023,"April 21, 2023",King Room,2,Couple,9
Exceptional,nope. I really like this place.,"I highly recommend their staff and service and the very comfortable bed.
Room is not big but comfy.",10,April 2023,"April 21, 2023",King Room,1,Couple,9
Awesome stay,None,"Great location, stylish interiors and exceptional statfs.",10,April 2023,"April 18, 2023",King Room,2,Solo traveler,9
